,cid,votes,含grandma,含grandma中文翻译
28586,UgxCpRiDGzrwuzVOfl94AaABAg.8yY6-41Td1g9-GDpNBa8-M,8,"@franzpeters3824 she does apparently. like, in her videos, she lives with her grandma and have a big farm. who do you think is gonna take care of it? she did. it takes a lot of hard work, discipline, patience and determination to able to take care of the whole farm which a lot of people nowadays wouldn't have. do you have them?",@franzpeters3824她显然这样做。就像在她的视频中，她与奶奶住在一起，有一个大农场。您认为谁会照顾它？她做过。能够照顾当今许多人没有的整个农场需要很多艰苦的工作，纪律，耐心和决心。你有它们吗？
24035,UgzxAwjl_L_TkTKVGVF4AaABAg,8,"you are wonderful, just like the ladies of the past!!! do everything by themselves , without the help of a man!! i’m glad you have subtitles , so we can understand whatever you are doing!!! unfortunately there are at least 2 bloggers who are showing your videos , i hope you will do something about that, you do the work it’s not fair for someone else to get credit for all your efforts !! good night beautiful miss liz may god bless you and you dear grandma ❤️❤️",你真是太好了，就像过去的女士们一样！！！在没有男人的帮助的情况下自己做一切！！我很高兴您有字幕，所以我们可以理解您在做什么！！！不幸的是，至少有2位博客作者正在展示您的视频，希望您能为此做些事情，您做的工作对于别人的所有努力都不公平！！晚安美丽的丽兹小姐愿上帝保佑你和你亲爱的祖母❤️❤️
19598,UgzGN9p-6c_ywEp5Pjx4AaABAg,7,who else eats the enormous foods she makes? grandma and her can’t finish all that. lucky neighbors?,还有谁吃她制作的巨大食物？奶奶和她无法完成所有这些。幸运的邻居？
32920,UgwfZ5PuQrVeuce4CO14AaABAg,7,"when grandma dies i will be so sad. 
some part of me will die too.","当奶奶去世时，我会很难过。
我的某些部分也会死。"
28590,UgxCpRiDGzrwuzVOfl94AaABAg.8yY6-41Td1g9-NeaBJpk-V,7,"@yreinyvana6214 pork adobong, my favorite.

this franz peters is so stupid in not knowing that our pretty princess also does a lot of work tending to her plants and animals on their farm, and taking care of grandma, besides making beautiful videos for the whole world to see.

hey, franz peters, spare us your negativity.

get out of here. we don't need you here. layas. do you know the word tagalog, franz peters? do you know what is ""tanga"" in english? that is you, franz peters. apologies!","@yreinyvana6214猪肉Adobong，我的最爱。

这个弗朗兹·彼得斯（Franz Peters）是如此愚蠢，因为不知道我们漂亮的公主在农场上也为她的动植物做了很多工作，还照顾奶奶，除了制作美丽的视频以供全世界观看。

嘿，弗朗兹·彼得斯（Franz Peters），让我们的消极情绪避免了我们。

离开这里。我们在这里不需要你。 Layas。你知道塔洛格一词，弗朗兹·彼得斯吗？你知道英语中的“ tanga”是什么？就是你，弗朗兹·彼得斯。抱歉！"
4226,Ugw-UR4AZmbiBRTg7aR4AaABAg,7,"congratulations! your videos remember me of my lovely childhood in the countryside and my grandma's awesome cooking!! furthermore, your videos have an eerie aesthetic. they seem etxtracts from a film! may i ask which camera do you use? by the way, which editing programme do you use?",恭喜！您的视频记得我在乡村和祖母的烹饪烹饪中可爱的童年！此外，您的视频具有令人毛骨悚然的美感。他们似乎是从电影中获得的！请问您使用哪种相机？顺便说一下，您使用哪个编辑程序？
15246,Ugxc08zY_vzozGgnblh4AaABAg,7,"1:13 li: look, grandma, this one is bigger than my head~haha~
grandma: there's nothing to show off~i've got much bigger bamboo shoot than this one in years before, haha~ 
9:43 li：(worried) this is too spicy~ you can try this egg","1:13 li：看，奶奶，这个比我的头大〜哈哈〜
奶奶：没有什么可炫耀的〜几年来我比这比这比这比这比这更大要大得多，哈哈〜
9:43 li：（担心）这太辣〜你可以尝试这个鸡蛋"
23511,UgxY9GVWxnn24wtLVAJ4AaABAg,7,"love from vietnam
best wish for you&grandma","来自越南的爱
祝您和奶奶的最大希望"
19922,UgwwL38TxJvQ6gE1U-d4AaABAg,7,"i love how she is with grandma, so sweet!",我喜欢她和奶奶的样子，真是太好了！
1802,UgzafBF-nlayWxz9jRx4AaABAg.9XjP1lO2n3Y9YBRMKSoiix,6,"the lady living with ms. li is the grandma who (took young liziqi off step-mother's custody), sheltered ms. li from abuse and torture. in 2012, 10 years ago, grandma had a medical emergency, so ms. li quit city life to nurse grandma and then decided to stay in the countryside. at that point ms. li was out of employment and so she started making videos to promote her online store which did not flourish. her only other relatives are her younger brother and wife.",与李女士同住的那位女士是奶奶（将年轻的利兹奇（Liziqi）从继母的拘留所中）避开了李女士免受虐待和酷刑。 10年前，2012年，奶奶遇到了医疗紧急情况，因此李女士辞去了奶奶的生活，然后决定留在乡村。那时，李女士已经失业了，因此她开始制作视频来推广她的在线商店，该商店并非蓬勃发展。她唯一的其他亲戚是她的弟弟和妻子。
457,Ugz0R59LQQNHAl0jpkh4AaABAg,6,"i miss you, ziqi! 
i hope you and your grandma are doing okay! ❤","我想念你，Ziqi！ 
希望您和您的祖母一切都好！ ❤"
4125,Ugy-f6CWMKftlmnuAkZ4AaABAg,6,"grandma eyeing those noodles, grandma steels the noodle. <3",奶奶注视着那些面条，奶奶将面条steel。 <3
1027,UgyrybVQbKssN2IcMux4AaABAg.9bpJQ_Rqdlo9haSwoN00A1,6,"zi yan's filial piety was moving. ziyi's video made bai bai see it. i look forward to seeing her new work as soon as possible, and i wish her and grandma safe and happy",子柒的孝心让人感动，子柒的视频让百看不厌，期待能早日看到她新的做品，也祝愿她和奶奶平安幸福
27824,Ugwh6h_v-OXwQyX-BmN4AaABAg,6,liziqi reminds me so much of my childhood...we had a garden near our home and we used to pick fresh veggies every morning and evening with my grandma. i miss those days.,利兹奇（Liziqi）让我想起了我童年时代的大部分时间...我们家附近有一个花园，我们曾经每天早晨和傍晚和祖母一起挑选新鲜的蔬菜。我怀念那些日子。
15016,UgwYecw1FHL-LzOnq-x4AaABAg,6,good meal cooking with grandma to eat good wisdom and wishes the whole family to be healthy,好美做饭跟奶奶一起吃好贤慧，祝福全家安康
13859,Ugxrvp5SKeSeyu9hL5B4AaABAg,6,"i'm just waiting for the day she will upload ""making my wedding dress out of natural materials"" ...i wish she would find the right guy ang live happily with her husband and grandma",我只是在等待她上传“用天然材料制作我的婚纱”的那一天...我希望她能找到合适的人与丈夫和奶奶一起快乐地生活。
16297,UgwRPsROyKFVcOzv2C94AaABAg,5,"i see great landscapes, a gorgeous girl, great food, a puppy and a grandma. the editing is 1000% great stuff.",我看到了很棒的景观，一个美丽的女孩，美味的食物，一只小狗和祖母。编辑是1000％的好东西。
6080,UgyWRUCvUkUaO3UtSst4AaABAg.9F1lR1g9d4p9FIa-HXvMt3,5,when yu labor hard like liziqi you eat a lot! lol and she has an assistant and videographer that she works with that sometimes join her and her grandma for the meal. we donโ€t always get to see them join her but she has added it in in other videos,当你像liziqi一样努力工作时，你吃了很多！大声笑，她有一位助理和摄影师，有时与她一起工作，有时会加入她和她的祖母。我们并不总是看到他们加入她，但她在其他视频中添加了它
30244,UgxlD7F4LIADR8nw3Xx4AaABAg.8yVezNp8yw38z3VwIoApuW,5,"colin seet it depends on which part of china you are talking about. in much of sichuan where ziqi is from popo means paternal grandma, and waipo refers to maternal grandma.",Colin Seet取决于您正在谈论的中国哪一部分。在Ziqi来自Popo的大多数四川，是父亲的奶奶，Waipo指的是母亲奶奶。
14356,UgyaF2_3GihTBtO00TN4AaABAg,5,i want to be the grandma of this girl! hahaha,我想成为这个女孩的祖母！哈哈哈
4959,Ugy1y5WjXHJu-zCvt2h4AaABAg.9I6XM0n46it9IAj5ZebW7V,5,luckiest grandma on earth,地球上最幸运的祖母
26445,UgzwBVLSCKpYYNQGsyh4AaABAg,4,this grandma is living the dream,这个奶奶正在实现梦想
9437,Ugz1kYWQlRw1T-kH_nB4AaABAg,4,"iโ€m really hoping that she has a significant other that loves her and cherish her a lot. when i see someone that is as talented, kind, and overall a great person like her. i just want someone else to take care of her as she takes care of her grandma. maybe she is better off without the significant other. but for me, i just want that.",我真的希望她有一个重要的其他人爱她并珍惜她。当我看到一个有才华，善良且总体上像她这样的好人时。我只希望别人照顾她，因为她照顾奶奶。如果没有重要的另一个，也许她会更好。但是对我来说，我只想要那个。
22019,UgyNznBkcEkdjIm0MHF4AaABAg,4,"this girl was well taught, and she still carries obedience takes good care of grandma in return too",这个女孩教得很好，她仍然服从奶奶也很照顾好
24633,Ugw7Nia-Mt2VlTmWXbl4AaABAg,4,she is so cute she makeing videos and she caring her grandma,她是如此可爱，她制作视频，她在乎奶奶
19106,UgxftWxnuzeN0jmwjq94AaABAg,4,i love ur grandma she's so sweet and lovely,我爱你的祖母，她是如此可爱又可爱
27183,UgwS6S3YbJhuW75g-Kl4AaABAg,4,"i am a girl like her, and i live there ,this is my hometown.she did everything we do,my mom,my grandma,and every woman.but not every woman enjoy these thing.",我是一个像她这样的女孩，我住在那儿，这是我的家乡。她做了我们所做的一切，妈妈，我的祖母和每个女人。但是，并非每个女人都喜欢这些东西。
27984,UgzHO--yfEhQfebWvtt4AaABAg,4,"liziqi`s grandma, must be the happiest grandma, in the world.",利兹奇的祖母一定是世界上最快乐的祖母。
4518,UgxHWqVbRLZxRc7UoZl4AaABAg,4,grandma is cute,奶奶很可爱
12376,UgxA4-_1-Z8H_bQ6eTR4AaABAg,4,"i came to know this video recently and i am in love in it. the nature ,greenary , village life , way of visuals , grandma and herself everything so pure and soothing to watch",我最近认识了这个视频，我爱上了它。大自然，格林尼，乡村生活，视觉效果，奶奶和她自己如此纯洁而舒缓的一切
935,Ugzj3mOdBOjHgbn6Wr94AaABAg,3,wow! ziyi has a big bamboo shoots so big! grandma's smile is really cute with zi yan!,哇！子柒自己种的山笋好大一颗喔！奶奶的笑容陪伴着子柒真的很可爱喔！
11205,UgwQ0nyh_B62K5Oa0hR4AaABAg,3,she is her grandma's precious jewel,她是奶奶的珍贵珠宝
1640,Ugw1cLd97MqI6VEU9ZB4AaABAg,3,"grandma makes me very happy!
","奶奶让我很开心！
"
30241,UgxlD7F4LIADR8nw3Xx4AaABAg.8yVezNp8yw38z0TT6ZiGq3,3,"just grandma,(nai nai) means grandma in chinese",只是奶奶（Nai Nai），意思是奶奶中的中文
21334,UgwLQKa-JJgAWpMDA054AaABAg,3,grandma clamped a piece of pink cute ❤️,奶奶夹了一条粉 可爱❤️
10661,UgxqSpb3Gk81b3ZvGH54AaABAg.98VupjufjU799ZWtlELJKQ,3,"@xe2893 ur right in some parts , n wrong in some parts also.
liziqi in her younger age actually had followed some trainings to become a chinese ninja
but later after her grandpa has passed away , she chose to go back to her village& grandma... rather than working as a ccps ninja
then after returning home, she started to make vids to sell/commercial her ""natural homemade"" products , to earn some money for living!
surprisingly , its her vids that actually only for commercial purposes, that turns out to be a big success & gives her much money n fame n sponsors 
thus her village has become a nature s friendly company☺️ many people get jealous to her ever since...","@xe2893您在某些地方正确，在某些部分也是错误的。
Liziqi年轻时实际上是经过一些培训，成为CCP的中国忍者...只要看看她的速度+力量，她的刀技巧+攀爬技巧
但是在爷爷去世后的后期，她选择回到她的村庄和祖母……而不是当CCPS忍者嗯，好吧...那对女人来说肯定是一件艰难的工作。她的祖母，她的最后一个家庭
然后回到家后，她开始制作vids出售/商业她的“天然自制”产品，以赚取一些生活！
令人惊讶的是，实际上仅出于商业目的，这是她的视频，事实证明这是一个很大的成功，并给了她很多钱。
因此，她的村庄已成为大自然的友好公司☺️从那以后，许多人嫉妒她..."
28452,UgzNAQTCGQwIwJEqRPF4AaABAg,3,grandma will live forever with li ziqi's cooking,奶奶将永远与李齐（Li Ziqi）的烹饪一起生活
30260,UgxlD7F4LIADR8nw3Xx4AaABAg.8yVezNp8yw38zf6EphkCy-,3,"she was to go back to take care of her grandma, and i started shooting videos by chance",她当时就是为了回去照顾她奶奶，机缘巧合开始拍摄视频
11321,UgwGZhiuJ3ULyIJ7Ckl4AaABAg,3,i love how grandma took a bit out of her bowl to try some. it's sad that when people grow old they can't eat the same stuff they did when they were young. unless you are willing to die faster.,我喜欢奶奶如何从她的碗里尝试一些尝试。令人遗憾的是，当人们变老时，他们不能吃年轻时做的相同的东西。除非您愿意更快地死。
29114,UgyrqQ2CYFCYTsyST2d4AaABAg,3,yes... thank you liziqi..may god bless you and your grandma.. hope you and your grandma in good health and happy always.,是的...谢谢Liziqi ..愿上帝保佑您和您的奶奶..希望您和您的祖母永远健康和快乐。
30883,UgyUyuaqoPurlHDxo_N4AaABAg,3,"we love love love, all the different things you do, the way you take care of your grandma and your beautiful ranch. we hope to meet you one day! much love from texas. may god continue to bless you and your family!!!",我们爱爱爱，您所做的所有不同的事情，照顾奶奶和美丽的牧场的方式。我们希望有一天见到你！得克萨斯州的爱。愿上帝继续祝福你和你的家人！！！
22496,UgwqGhI4f5pSLMt_EfF4AaABAg,3,"seeing her be happy with her grandma...
makes me happy :')
hope my grandma is still healthy and happy, miss you grandma!","看到她对祖母感到满意...
让我开心 ：'）
希望我的祖母仍然健康快乐，想念你奶奶！"
32667,UgydaUEgmgoJlO-tOq54AaABAg,3,"you do so much work alone, during the work always thought in my mind should i help her? i know you have team of three. i love the moment when you serve your grandma and you both are enjoying the food 
please do a conversation video with your grandma.","您一个人做很多工作，在工作中总是想到我应该帮助她吗？我知道你有三个球队。我喜欢您为祖母服务而你们俩都喜欢食物的那一刻
请与您的祖母一起进行对话视频。"
32057,UgxdEhj-cZs-wEm9c4x4AaABAg.8yV0EYhRV0B8yVRguUlk-w,3,"lynne she actually struggled a lot, she’s an orphan with just her grandma. the property is only that beautiful because they tend it. this is all what i gathered from her interview, don’t quote me lol",琳恩（Lynne）实际上挣扎了很多，她只是一个祖母的孤儿。该属性仅是如此美丽，因为它们会趋向于它。这就是我从她的采访中收集的一切，不要引用我
29911,UgzCuEVgsM7ypQt8VRR4AaABAg,3,this grandma does nothing else but eating. she is so damn lucky.,这个奶奶除了吃东西外什么也没做。她真是太幸运了。
11240,Ugz3_DaFjfi64PrOkP54AaABAg,2,everytime they eat together her grandma admires her and is thankful to have such a great granddaughter,每当他们一起吃饭时
11247,Ugy0AAl12LTbx0pRyTp4AaABAg,2,"i love this show because she loves her grandma dearly, you are so sweet, i wish you the best in life from alaska.",我喜欢这个节目，因为她深爱着她的奶奶，你真可爱，祝您从阿拉斯加的生活中表现最好。
15963,UgwLum4C0dnoUEr5Bud4AaABAg,2,"the video of lizhiqi makes me to look back upon the life when i was a child living with my grandma,i miss her so much",Lizhiqi的视频使我回顾我和祖母一起生活的孩子时的生活，我非常想念她
15409,UgxM6M0zpu3k7SD32RR4AaABAg.93FjALA-hss98XaaFmAZ6B,2,"strait arrow it’s a ‘propaganda’ if you wish it. it’s also a high-value production , staged ( for ken rascon) piece of entertainment that teaches simple and good value ( i.e. respect and love for your grandma) if you wish it. no one dies in make this well crafted film. all ( including messieurs arrow and rascon i suspect and hope) are entertained watching this in the time of a pandemic. so i decide to ‘wish’ the latter in this instance.",海峡箭头，如果您愿意，这是一个“宣传”。这也是一部高价值的作品，为肯·拉斯康（Ken Rascon）演出，如果您愿意的话，它教授简单而良好的价值（即尊重和对祖母的爱）。没有人死于制作精良的电影。在大流行时期，所有人（包括Messieurs Arrow和Rascon）都很有趣。因此，我决定在这种情况下“希望”后者。
11355,UgwwZ86h9muDh7Dnm8N4AaABAg,2,that grandma is living the life. i want to spend my time on swing and eat food cooked by liziqi,那个奶奶正在生活。我想花时间在秋千上吃liziqi烹制的食物
11406,Ugx-5d2aAZv1U6QtBMx4AaABAg.97aDyK3ahgD9873WWGVR4_,2,@logicone5667 there are people who live in the village especially older people. it is her grandma and her house,@logicone5667有些人住在村庄，尤其是老年人。这是她的祖母和她的房子
12881,UgywtqAtIXIl7vJP1FB4AaABAg,2,these videos cure my depression i hope she and grandma are safe during corna virus,这些视频可以治愈我的抑郁症，希望她和奶奶在Corna病毒期间安全
30132,UgyWXJ06DKx-LOs2Znt4AaABAg,2,when you’re learning chinese just so you can understand what conversations miss liziqi is having with her grandma,当您学习中文时，您可以了解Liziqi小姐与奶奶的对话
10105,UgzB1QRcM_ne3hs0jk94AaABAg,2,"i love that she can cook and take care of her grandma, i would like to see her show some passion for her dogs and cats too.",我爱她可以做饭并照顾祖母，我也希望她对狗和猫也表现出一些热情。
1502,UgwjZ3nB55COmz2BsNB4AaABAg,2,everytime she uploads im just glad i get to see that grandma is well,每次她上传我都很高兴我看到奶奶很好
3371,UgzcEyG8DzzsWhQjnIV4AaABAg,2,how lovely your grandma ❤,你的祖母多么可爱，看到你的祖母让我想起了我的祖母
25488,UgyQ7V9k4yRRiJ7Ynxd4AaABAg,2,"such a fake and romanticized image of countryside life! grandma, traditional means of cooking, growing all ingredients, always clean and wearing make up... your team is professional!",如此伪造的乡村生活形象！奶奶，烹饪的传统手段，种植所有食材，总是干净且穿着化妆...您的团队是专业的！
22209,UgzhSrR0rIJxXuNhgZN4AaABAg,2,love to you and grandma with well wishes and many many successes. thank you for everything.,爱你和奶奶，并获得了良好的祝愿和许多成功。谢谢你的一切。
24412,UgwntCJ2uJU13ac-h_N4AaABAg,2,"amen... liziqi is amazing and awesome, so beautiful and sexy!!! the best cooking on yt and may god continue to bless you and your grandma!!!",阿们...利兹奇很棒，很棒，如此美丽和性感！！！在YT上最好的烹饪，愿上帝继续祝福您和您的祖母！！！！！！！！！！！！！！！！！！
25891,UgxjhHExRDyALWUw8at4AaABAg,2,everytime she uploads im just glad i get see that grandma is well,每次她上传我很高兴我看到奶奶很好
836,UgxQUuqltU2034jyNcl4AaABAg,2,i love her scenes with the grandma,我喜欢她和奶奶的场景
2280,UgwLuDlEPaMI0JthYj14AaABAg,2,evreytime she uploads im just galad i get to see that grandma is well .spas kcha_shex 5835 plish ad,evreytime她上传我只是galad，我看到奶奶很好。
1893,UgwXJ5E-tUlvNeCvCOp4AaABAg,2,i love seeing grandma chilling out on the shaded swing.great,我喜欢看到奶奶在阴影的秋千上放松。
33817,UgyeamwHSeP40m6sQFd4AaABAg,2,"a while ago, the grandma was the one who was used to do all of this, and now her granddaughter is carrying on. that's so amazing",不久前，奶奶是曾经用来做所有这一切的人，现在她的孙女正在继续。真是太神奇了
12733,UgyoZpsVYJSGAm-a-0d4AaABAg,1,blessed grandma to have grandchildren like you,祝福奶奶有像你这样的孙子
23116,UgyXwbl95V1jxwTru-V4AaABAg,1,"wow, grandma has a big appetite ,they should open up a bed and breakfast.",哇，奶奶的胃口很大，他们应该打开床和早餐。
30275,UgxlD7F4LIADR8nw3Xx4AaABAg.8yVezNp8yw390VQFU_ffv6,1,"@1292liam that's her grandma, ziqi's parents had already passed away when she was little.",@1292liam是她的祖母，Ziqi的父母很小的时候就已经去世了。
12967,Ugxh9V1Y7Pzt6N0PaxR4AaABAg,1,i would like to be that grandma...,我想成为那个奶奶...
132,UgxWaNLsFPcsz4NOPiN4AaABAg,1,"爱! 112, 5, and 14 will think of my mother when i see my grandma! i wish you! happy mother's day? sorry! good health!",柒爱的！ 112、5、14见到了奶奶就会想起我母亲！祝褔！母亲佳节快乐？无忧无虑！身体健康康！
30066,Ugyeo4piL9WmM5dSodZ4AaABAg,1,every time i see a new video i'm just surprised that grandma's still alive,每次我看到一个新视频时，我都会惊讶地发现奶奶还活着
4579,UgxvArpjOWomKZQQhtt4AaABAg,1,"why do you make each dish look better than a professional chef's craftsmanship, which can make your appetite. envy your grandma. she must be very happy.",为什么你做的每道菜看上去比专业厨师的手艺还要好 更能惹得食欲 好羡慕你的奶奶 她一定非常幸福
27110,UgwAkc-5QtbnUdtFMV14AaABAg.8yi9U-P0knl8yiQAUXYWe4,1,"ziqi: this one is bigger than my head.
grandma: no, this one is nothing, .........

they speak chinese sichuan dialects. i can only understand half of grandma said.","Ziqi：这比我的头大。
奶奶：不，这是什么都没有的，.........

他们说中国四川方言。我只能理解一半的奶奶说。"
29917,UgzCuEVgsM7ypQt8VRR4AaABAg.8yVxk9OaMEK8yWeS6uEJry,1,"ziqi became an orphan when she was young, her grandma raised her up, you can imagine the hardship, so, she is not lucky but just deserves it.",Ziqi年轻时成为孤儿，她的奶奶抚养了她，您可以想象这是艰辛的，因此，她并不幸运，但值得。
19787,UgxieOCEvzOD8c6cN2F4AaABAg.91OEBieV7c791WSdY8kP4Y,1,that's her grandma,那是她的祖母
32236,UgxQ0fcTiYsklIejCZF4AaABAg,1,love in lisa n grandma,丽莎n奶奶的爱
28480,UgzrldMlxO_RUPUq2jB4AaABAg,1,so warm 喜欢 i like the feeling of eating with your grandma!,好温馨
17455,UgywG5rOPtLEpKBsjiN4AaABAg.92kJ-6SsX9s92rtPQVJmmv,1,"the team plus four people and grandma, and the other two are photographers xiao gang, and female assistant citizens. you can see them in the latest videos",团队加上子柒和外婆有四个人，另外两个一个是摄影师小刚，和女助理国民，你可以在最新的几个视频里看到他们
2666,UgwvDhw9DWryItY0wIJ4AaABAg,1,reminds me of grandmas pickled bamboo shoot (˶˙ᵕ˙˶),让我想起奶奶腌制的竹芽（˶˶κ˶）
32755,Ugziwp2zj70P32P5HvF4AaABAg,1,i hope grandma lives longer because i swear she will stop making videos if.,我希望奶奶寿命更长，因为我发誓她会停止制作视频。
18571,UgwOUb_hho4h6RuU8Xl4AaABAg,1,"i just got to know her today. i watched a few today. she is so amazing. at first, i have so many questions i cannot believe she can shot a movie like this all by herself!!! it is better than anything i watched before, even from many well funded organizations and commercials. but later i got to hear her story from another sources, i am so admire her! her parents divorced and she lived with her daddy, but her daddy passed away when she was five. she then was raised by her grandparents in countryside. at 14, she had to leave for city to make a living. learned many skills and chose back home to take care of her only grandma. shot the movie by herself alone, very difficult but first few nobody noticed her until one. now she hired camera man shot for her... i have to say her food must be better than any michelin’s restaurant. she is the best chef, artist, farmers, movie director!!",我今天只认识她。我今天看了几个。她真是太神奇了。起初，我有很多问题，我不敢相信她可以自己拍摄这样的电影！！！它比我以前看过的任何东西都要好，甚至来自许多资金丰富的组织和广告。但是后来我听到了她的故事，我很佩服她！她的父母离婚了，她和爸爸住在一起，但爸爸五岁时就去世了。然后，她由祖父母在农村长大。 14岁时，她不得不离开曼城谋生。学习了许多技能，然后选择回到家来照顾她唯一的祖母。独自拍摄电影，非常困难，但前几个人直到一部都没有注意到她。现在，她雇用了摄影师为她开枪...我不得不说她的食物一定比任何米其林的餐厅都要好。她是最好的厨师，艺术家，农民，电影导演！
14927,UgwH9f0TFkCS1ypqfKd4AaABAg,1,your grandma is you lucky to have you!! i wish i could learn how to cook from you!,你的奶奶你很幸运！我希望我可以学习如何向您做饭！
3300,UgyWF3y1VUCW7ZYWblt4AaABAg,1,grandma can only get one line.,奶奶只能得到一条线。
