,cid,votes,含grandma,含grandma中文翻译
33431,Ugy03CkKsPIFS7k_9nV4AaABAg.8yUbaCQrcWw8yUpduIYNdL,1,unfortunately her life is not so peaceful at all. she was being chased by crazy fans and competitors harrassed her with drones hoovering over and people traspasing her property she had to move because her old grandma was not coping with the intruders,不幸的是，她的生活根本不是那么和平。她被疯狂的粉丝追赶，竞争对手骚扰她，无人驾驶飞机徘徊，人们不得不移动她的财产，因为她的老祖母没有应对入侵者
18215,UgzO9RReP89Kg9NVxVF4AaABAg,1,i always wonder... grandma is so so so so so lucky to have such an amazing grandchild.,我总是想知道...奶奶真是如此幸运，能拥有一个如此惊人的孙子。
23416,Ugyg7x2uN_8yWUSrolN4AaABAg,1,your grandmamma is the sweetest one in all of your videos,您的Grandmamma是所有视频中最甜蜜的。
24453,UgxhNQZ20LcdDKayBIp4AaABAg.8zLG2z9ArwG8zLf6NaQjMB,1,you misunderstand that her grandma is too old and no longer can eat spicy things. spicy dongxi is harmful to grandma's healthy grandma.,你误解了，她奶奶岁数太大，不再能吃辣的东西，辣东西对奶奶健康有害，螺蛳粉是很辣的东西
4280,Ugz4ZThxmr5nBN62K5Z4AaABAg.9KAJ7el8M269NdA45idWvu,1,filial grandma,还孝顺奶奶
32716,UgxbluA9fzIQDDv9WZd4AaABAg,1,"somebody ask what she can not do...

leave her grandma alone. that what she can not do","有人问她不能做什么...

让奶奶独自一人。她不能做的"
32662,UgzOlEDNG7x4nitvzb14AaABAg,1,"aside from the skill and beauty that ziqi possess, i really admire her hardwork and the love she has for her grandma. we all say that she's like a princess because of her beauty and the way she connects with nature and her hardworking attitude but really, what makes her the most princess like is the love that she has for her family. and with that, she must be protected at all cost ♡",除了Ziqi拥有的技巧和美丽之外，我还非常佩服她的辛勤工作和对祖母的爱。我们都说她就像一位公主，因为她的美丽以及她与自然和勤奋的态度的联系方式，但实际上，让她最主要的公主是她对家人的爱。因此，她必须不惜一切代价保护她
2834,UgyDRb4LQHyO_kvm5PR4AaABAg,1,"i know the secret liziqi's grandma long life
healthy food & laughs","我知道秘密利兹奇的祖母长寿
健康食品和笑声"
19590,UgwKjZWkmDE3g0QAVod4AaABAg.91m9BSDP5Nv91uigQfI_qu,1,that’s her grandma...,那是她的祖母...
33726,UgyTYggl1o1gqXfOlEd4AaABAg,1,i wish i could understand what liziqi and grandma say to each other. they always look like they are having such a nice conversation.,我希望我能理解利兹奇和奶奶彼此说什么。他们总是看起来像是进行了很好的交谈。
4274,UgwrVd4PJBwpcdf0kip4AaABAg,1,how lucky the grandma is,祖母有多幸运
23008,UgzVD9feKE7GZRW7l-l4AaABAg,1,this reminds me of my grandma's old house.,这让我想起了我奶奶的旧房子。
5909,UgxSyRdk9kjSTDhIzqR4AaABAg,1,"i am from india ,tamilnadu.i am a great great crazy fan of u, i mostly seen all u r videos and daily searching for more and more .please upload more videos .love and u r grandma. take care of her. u r garden and mainly u r roses made me fresh. great work. always praying for u r great future. don ""t feel ,we r so many for u-,u r well wishers .love u .waiting for ur new videos",我来自印度，泰米尔纳德邦。照顾她。花园和主要的玫瑰使我新鲜。做得好。一直为您的美好未来祈祷。 “感觉，我们为U-，u r w and whorders rove u。
20036,UgzR-F5TGJpS4toxfxx4AaABAg,1,"aww, grandma stealing her noodles at the end!",噢，奶奶最后偷了面条！
16685,Ugz_4uZFuDJUEqrt9hR4AaABAg.92sUJPa9LM992vrPOr8awf,1,for her grandma was ill when 2012，so she went back to the countryside to accompany her grandma,因为她的祖母在2012年生病了，所以她回到乡村陪伴奶奶
152,UgxBQhKS4ujR5smNuvN4AaABAg,1,爱! mother is so great! is grandma okay?,柒爱的！母亲真伟大！奶奶还好吗？
10164,UgxxueVH3pHTeGtZ7ht4AaABAg,1,"how fresh=the environment
the climate 
the weather
the food
the land 
the water 
the girl 
the grandma 
the love 
the god","如何新鲜=环境
气候
天气
食物
那片土地
水
那位女孩
奶奶
爱情
上帝"
20514,Ugycb1gQKD2-K9Q5-Ft4AaABAg,1,i love the way you cook for you and your grandma ❤,我喜欢你为你和你的祖母做饭的方式❤
10646,UgxIvQ6D0wxpW0yRxXt4AaABAg,1,i love her videos and it makes me so happy when a new video comes out to see her grandma is ok (:,我喜欢她的视频，当一个新视频出现以看到她的祖母还可以时，这让我感到非常高兴（：
10158,UgzRLLsa6cxzqgisAjp4AaABAg,1,"1:21
this remind me of my lovely grandma and me when we were spending our time together.","1:21
这让我想起了我和我一起度过时光时的可爱奶奶。"
30243,UgxlD7F4LIADR8nw3Xx4AaABAg.8yVezNp8yw38z2YvVXquwL,1,cute grandma,可爱的奶奶
16877,UgyV5WdeGEk-44uM2gl4AaABAg,1,"grandma behind the camera 
just get me a fucking cup ramen!!!!!!!!!","镜子后面的奶奶
只是给我一个他妈的杯拉面！"
34558,UgyKZmhJjnH56Qv_--J4AaABAg.8yUThk2zkz78yUYhQ7htT2,1,"i believe grandma is happy, she is also worth having this happiness","我相信奶奶是幸福的,她也值得拥有这份幸福"
30327,UgxlD7F4LIADR8nw3Xx4AaABAg.8yVezNp8yw394Fg-s9uZcq,1,her grandma is alive cause she is eating the natural food which is of course healthy for our health and not any kinds of chemical fertilizers from the food company,她的祖母还活着，因为她正在吃天然食品，这当然对我们的健康很健康，而不是食品公司的任何化肥
1098,Ugw2z5X-ZTM8FkmM_AV4AaABAg.9bmIGaN7yOB9bmINEK3oo7,1,your grandma's company is so happy!,妳奶奶的陪伴妳好开心喔！
24020,UgzZUnnQ3rPAzP6r9jd4AaABAg,1,she reminds me that my grandma is very lovely person. she raised me from 6 months when my parents couldn't take care of me because of something. o feel i love my grandma then my parents,她提醒我，我的祖母是非常可爱的人。她从6个月开始抚养我，因为我的父母因某件事而无法照顾我。 o觉得我爱我的祖母，然后我的父母
11102,UgwOJB9Gsj9koPkpkSF4AaABAg.98-YYvdL0rO9871pSHMdsB,1,and grandma enjoy it ...,奶奶喜欢它...
26497,Ugy6Wr7UfATh2iZtqe54AaABAg,1,"9:42 lol, grandma is just casually eating stuff she isn't supposed to again. 



i'm not sure if she is not supposed to eat the luoshifen or not but ziqi kinda panicked when grandma took a bite.","9:42大声笑，奶奶只是随便吃她不应该再吃的东西。 



我不确定她是否不应该吃Luoshifen，但是当奶奶咬一口时，Ziqi有点惊慌。"
21356,Ugw6bGalG6GxpFvlT0B4AaABAg.9-zPuOjOPAT90ryDqXxCT0,1,"what you miss is not just rural areas, but those who love you to accompany you to grow up, and when you are a child, he hates to go to the rural grandma's family to celebrate the new year. fantashan runs around, but now more memories are still inexplicable malicious",你怀念的并不是仅仅是农村 而是那些爱护你陪伴你成长的人和事 相反小时候最讨厌去农村奶奶家过年 他老人家重男轻女 我这个独生女简直是她眼中钉肉中刺 虽然堂哥堂妹都会带我满山跑到处玩 但是如今更多回忆起来的还是长辈莫名的恶意
8939,UgwnX0tWzTRal52BbHJ4AaABAg,1,"i was feeling really sad for grandma, always having to wait til after dark to eat, but now i know that sunset is kind of early in mianyang.",我对奶奶感到非常难过，总是必须等到天黑后才吃饭，但是现在我知道日落在米扬的早期。
8495,UgzgnAb3ZmM2VT9Kcw14AaABAg,1,we also have this bambooshot as a vegetable๐it is really my grandma used to go and search this๐ค—,我们也有这个竹子booshot作为蔬菜
25623,UgxHsgRpANCCm8gOQEx4AaABAg.8z01C08josy8zFBYyPrf4f,1,"it may look peaceful, i lived w my grandma in a somewhat similar place like this for 4 days and i just wasn’t very comfortable there, it was a lot of work to do things since they didn’t have electricity.",它看起来可能很宁静，我在像这样的地方住了四天，我在奶奶里住了4天，而我在那里并不舒服，因为他们没有电，这是很多工作要做的事情。
31570,UgxlILdmzbxiV5ym-wd4AaABAg,1,what to say to grandma?,跟奶奶说啥？
23829,UgxkKJgc0R4OjU9ONLN4AaABAg,1,her grandma,她的祖母
26414,Ugw6iDxXdV8-kY3HuuR4AaABAg,1,"this girl is the most beautiful, on earth! she is good looking too! grandma eats pretty good! what a wonderful look at china. thanxz",这个女孩是地球上最美丽的！她看起来也很不错！奶奶吃得很好！对中国真是太好了。 thanxz
22218,UgwF4Ydg2CY8XF25YkB4AaABAg,1,the way they eat grandma is going to live forever,他们吃奶奶的方式将永远活着
8250,UgwTeygZiJSuR5CcPAR4AaABAg,1,she is really a beautiful village girl๐๐๐...nd love u grandma,她真的是一个美丽的乡村女孩
11337,UgwAHUIZRc2DlsOnjpN4AaABAg,1,"haha, grandma sitting in that autumn is so comfortable. ☺️",哈哈，奶奶坐着那个秋千好惬意哦。☺️
23893,UgxeI5gyJ9lo6Limrwp4AaABAg,1,grandma is responsible for giving the divorce?,奶奶就是负责给打分儿的呗？
30567,UgzMLO1WFGb4w5ulxp54AaABAg,1,i love it when grandma sneaks bites.,当奶奶偷偷咬人时，我喜欢它。
18375,UgxPmXnMxuX18jpVmx14AaABAg.92VvW1qBVWT92_8SV1WGGt,1,"zhao hui represented a group of people. grandma did not do it, but the knowledge must be particularly rich!",赵辉 她代表了一群人，奶奶不动手，但知识肯定特别丰富！
24663,UgwCxnuzD-ey74YVouJ4AaABAg,0,so why doesn’t her grandma get noodles? her grandma deserves some noodles!,那为什么她的奶奶不得到面条呢？她的奶奶应该得到一些面条！
24439,UgxJQYSDMnO2EAZeGNJ4AaABAg,0,grandma,奶奶
27904,UgzEMgqMl743_usNZbJ4AaABAg,0,wow another incredible video & all your recipes & ur sweet grandma,哇，另一个令人难以置信的视频
24416,UgwFLnJXusWN6lfQyT94AaABAg,0,just the last moment where grandma almost interrupted taking the noodles from soul bowl and the lady never gave the bowl to her.,只是奶奶几乎打断了从灵魂碗中拿出面条的最后一刻，那位女士从来没有把碗交给她。
27897,UgzM6Euo0Z3QwmZP07x4AaABAg,0,"with you with this, my grandma is so happy",有你这么陪着， 老奶奶好幸福哦
24288,UgwWPdrazAiT8I9ZfCh4AaABAg,0,hi queen liziqi . you still amazing me . how is your grandma ? l hope she is well and you too . i wish to have your address in china if it possible . please accept my best wishes .,嗨，liziqi女王。你仍然很棒。你的祖母怎么样？我希望她也很好，你也是。如果可能的话，我希望在中国有您的地址。请接受我的最良好的祝愿。
24435,UgxhNQZ20LcdDKayBIp4AaABAg,0,"i don’t like the best, i don’t love it instantly. i eat a large pot of powder by myself. grandma eats bamboo shoots.",看到最尾不喜欢了，瞬间没爱，自己吃一大锅粉，奶奶吃笋，真的够损，
26738,Ugwtx3DnNRIRef2Jejx4AaABAg,0,grandma ur soooooo cute,奶奶Ur Sooooo可爱
24743,UgyXFWOj-5xdWo44CDF4AaABAg,0,her grandma and beautiful kiss grandma,她的祖母和美丽的亲吻祖母
25862,Ugw4K9JbqONGlhtcgfl4AaABAg,0,i love grandma ♥️ i love liziqi,我爱奶奶♥️我爱liziqi
26861,Ugy01FkVi0l5RBQBLLF4AaABAg,0,"tch that grandma is quite enjoying the food . she is very lucky to have you.
i hope ur video encourage lazy bugs like us to use and protect our nature for living.","TCH表明奶奶非常喜欢食物。她很幸运能拥有你。
我希望您的视频鼓励像我们这样的懒惰虫子使用并保护我们的天性以生存。"
26871,Ugw73G61_j2BWtVVthF4AaABAg,0,grandma also wants to eat tired lion powder. those savage houses really can't compare with li zi!,奶奶也很想吃累狮粉。那些野人盖房子真的没法跟李子七比！
26728,UgyA1eRhHWh91gJkbJN4AaABAg,0,& am just glad that i am seeing your grandma healthy again & again in your every single video ❤,＆我很高兴我在每一个视频中一次又一次地看到您的奶奶健康
28192,UgyRv7XDXs376Lz4R3Z4AaABAg,0,gosh i miss these bamboo shoots back home in the country side with my grandparents.. my grandma used to cook bamboo shoots with coconut milk and snail ☺️,天哪，我和我的祖父母一起在乡下的家中想念这些竹芽。.我的祖母曾经用椰奶和蜗牛煮竹芽。
26659,Ugyd-xHUcbYklWChnRd4AaABAg,0,"seeing grandma, i miss my grandma too. i hope grandma is healthy and healthy",看到奶奶，我也想念我的奶奶。希望奶奶健健康康快快乐乐
26574,Ugwvt9J-CcO3k0lfqrZ4AaABAg,0,i wish all the grandmas of the world ate as good as your grandma,我希望世界上所有的祖母都和你的祖母一样好
26506,Ugy6Wr7UfATh2iZtqe54AaABAg.8yobiiJQOV48yqh2H-rxTz,0,yes because it might be too spicy for grandma,是的，因为它可能对奶奶太辣
26490,UgxN8zuCFP2PD1bIAOV4AaABAg,0,"i love her grandma so mush she’s so cute, hehe",我爱她的奶奶，如此糊状，她是如此可爱，呵呵
26481,UgztWGtR-SnnoFDI3C14AaABAg,0,i want to live next door to her and grandma so bad...,我想住在她和奶奶的隔壁...
26426,Ugz1lQZNlzLWO-U8NpZ4AaABAg,0,you are so big! just give grandma a little 奶,你自己那么大一碗！就给奶奶那么一点
26219,UgzDW2gj-ycnHitJCV94AaABAg,0,grandma is so cute! can't help holding a chopstick hahahaha,奶奶太可爱了！忍不住夹一筷子哈哈哈哈
26153,Ugzm9YejRJBHNOHUHS94AaABAg,0,i like your grandma... and take care of her ... sister...,我喜欢你的奶奶...并照顾她...姐姐...
25838,UgwzXbFJnWRkvmoEOJB4AaABAg,0,"everything is fresh picked, beautiful presentation, lovely animals too! nice to see your grandma enjoying your cooking, wish her well and happy day ❤️",一切都是新鲜的，美丽的演讲，也是可爱的动物！很高兴看到您的奶奶喜欢做饭，祝她一切顺利，快乐的一天❤️
24771,UgwsxPofgzSZzV4xFO94AaABAg,0,plz tell me anyone she doesn't hv anyone except her grandma,请告诉我，除了祖母以外，她没有任何人
25639,UgwSBymdqBAGZGT5gTV4AaABAg,0,the grandma is lucky... she gets to try all the dishes that looks so delicious!! and the ingredient she used all organic!! lucky u!!,奶奶很幸运...她可以尝试所有看起来如此美味的菜肴！她使用了所有有机的成分！你很幸运！！
26983,UgyhC7uqHYTQ36z1cGt4AaABAg,0,your grandma wants you to marry a good man and be optimistic about marry a good man,你的奶奶希望你嫁个好人 看好了 嫁个好男人
25451,UgytcLUwUWgtJRMo3v14AaABAg,0,"grandma is so cute, i hope you can be healthy!",奶奶太可爱了，希望你们都能健健康康！
25347,UgwiNfRBy8L-PYFtmzp4AaABAg,0,"am curious about only one thing.. 
she make so much food.... i wanted to know do her grandma and herself can eat all those","对只有一件事感到好奇。
她做了很多食物。...我想知道做祖母，她自己可以吃所有这些"
27174,UgyaagjAtfkSXA-zGD54AaABAg,0,love you grandma,爱你奶奶
25181,UgyHV0-7DHbzwzudTth4AaABAg,0,grandma also eaten snail powder hahahahahahahahahaha,奶奶也馋螺蛳粉吃了 哈哈哈哈哈哈
27395,UgyaG2KI62Jt2I9jVKR4AaABAg,0,grandma eats lightly,老奶奶吃清淡一点
25095,UgxuD0ytS0Qk38Ic7wR4AaABAg,0,"this is really amazing& u wanna just let everything behind & go to live there with her & taking care of her mom or grandma i don't know.it makes me feel sorry about losing my life & time without spending more time with my mom 
god bless you girl","这真是太神奇了。这让您感到很开心，您想让一切都在后面，与她住在一起。这让我对失去生活和时间感到难过，而不必花更多的时间与妈妈在一起
上帝保佑你女孩"
24834,UgzyWZV7aDNnIVBviQd4AaABAg,0,i miss home and my grandma every time i watch your videos ❤️,每次观看您的视频时，我都想念家和祖母❤️
27678,UgyN7SurTdGuawsWIDp4AaABAg,0,serve for grandma ❤,为奶奶服务❤
27872,UgxIMw7vkBYoi7yJLtZ4AaABAg,0,her grandma is lucky to have her :) .. very responsible woman,她的奶奶很幸运得到她:) ..非常负责任的女人
27891,Ugz9N4dVJoMm_czV_Lh4AaABAg,0,send my hi to grandma <3,将我的HI发送给奶奶<3
27111,UgwAkc-5QtbnUdtFMV14AaABAg.8yi9U-P0knl8yjTT0OxghB,0,"bin zhu thank you! the way she held it up to her head hinted to it but i didn't figure that it was a saying there but now i know. and that's interesting, i bet her grandma has seen way larger in her life time.",Bin Zhu谢谢！她抬起头暗示的方式，但我并不认为这是一句话，但现在我知道。这很有趣，我敢打赌她的祖母在她的一生中看到了更大的时间。
118,UgxnLdjmnHDoLuAlJyJ4AaABAg,0,"112, 5, 19 11 11 you good morning! i work at the zhongshan construction site in pingtung city, taiwan! think back when you first met you 3 years ago! you come back in the mountains in person! grandma is very happy! laughing haha, watching you peeling, so happy!",112、5、19柒爱的妳好早安！我在台湾屏东市中山工地现场上班！回想3年前刚认识妳的时候！妳在山里亲自采山竹回来！奶奶很高兴！笑哈哈看着妳在剥壳好开心！
28300,Ugwi7LHReFU2eEOR1ul4AaABAg,0,my favorite part of these videos: seeing grandma enjoy the food!,这些视频中我最喜欢的部分：看到奶奶喜欢食物！
31868,Ugwly-HX6hCef7q6eep4AaABAg,0,this multi talented/ gifted woman. every thing that she do is such a masterpiece. resourceful and creative. i guess you've all learned that from your grandma. anyway your grand ma must have a very long life because everything that you cook and eat has no preservatives. all natural.,这个多才华横溢/有天赋的女人。她所做的每一件事都是如此杰作。足智多谋。我想你们都从祖母那里学到了这一点。无论如何，您的大妈妈一定要有很长的寿命，因为您烹饪和吃饭的所有东西都没有防腐剂。全天然。
32366,Ugw0LqRtsXHpWV5O7NJ4AaABAg,0,wow my fave viane u have a lots of menu u can make in this bamboo shoot.thank liziqi for sharing knowledge how to cook bamboo shoot..i luv u grandma mwah!,哇，我最喜欢的viane，你有很多菜单，你可以在这张竹脚射击中做很多菜单。
32355,UgyG4ZR_pjLEgkEyfs94AaABAg,0,her grandma is so lucky to have her ...she would taste all those happily,她的祖母很幸运能拥有她...她会快乐地品尝所有这些
32085,UgzgyqIlcxv42465t214AaABAg,0,i love her grandma. i wish to know their conversations.,我爱她的祖母。我想知道他们的对话。
32070,UgwrjqAR5ukJiW4FuCt4AaABAg,0,"it's great, it's awesome, i'm drooling, no wonder grandma wants to eat",太棒啦太棒啦太棒啦，我跟着流口水，难怪奶奶要吃的
32061,UgxdEhj-cZs-wEm9c4x4AaABAg.8yV0EYhRV0B8yWhxv3h1ql,0,@katelyn252 i'm glad you did! i hadn't seen the news that she got a crew (finally!) i remember she had a condition for a while and was forcing herself through it when her channel had just started. the hate comments were hurting her and her grandma was becoming worried too (poor grandma!) so she had to go on haitus to recruit someone. so so glad she's got a team to help her now!,@katelyn252我很高兴您做到了！我还没有看到她有一名船员的消息（终于！）我记得她有一段时间的状况，并且在频道刚刚开始时就强迫自己通过它。仇恨评论伤害了她，她的祖母也变得很担心（可怜的奶奶！），所以她不得不继续招募某人。非常高兴她有一个团队可以帮助她！
32037,UgygSlYXQ7QjF7c_ZSB4AaABAg,0,do not give grandma a snail powder,不给奶奶吃螺蛳粉
31987,UgxZlX3r9B1C-Y06mzN4AaABAg,0,"you see me is bigger than my brain
grandma: you are a sa. essence essence","你看我这个比我脑壳还大
外婆： 你这个算撒子哦 。。。"
31959,Ugz5SQzSVIB9U4-q1np4AaABAg.8yV2HUWJ-2e94AMaWutVK5,0,"@user-lw1cm7bf2b miss li's popularity is worldwide. ziyi is the highest value of all human beings: filial piety, intelligent, hard-working, good at learning, dedicated, good-neighborly, converged, benefit from the poor to repay the society .. .. who can't get used to her and step on her, i disdain counterattack. ms. li has the lftiest virtues of us human kind: filial piety toward grandma, brilliant, diligent, eager to learn, ultra-dedicated, neighbourly caring, p. erseverant and donate money to help the underprivileged .... as they are not word any efforts.","@user-lw1cm7bf2b Miss Li's popularity is worldwide.子柒在全人类最高价值中，达到不能再高的绝顶：孝亲，聪慧，勤劳，好学，笃敬业，睦邻，有恒，施惠于穷苦报答社会....谁看不惯她而踩她，我不屑反击。 Ms. Li has the loftiest virtues of us human kind: filial piety toward grandma, brilliant, diligent, eager to learn, ultra-dedicated, neighbourly caring, perseverant and donate money to help the underprivileged....I do not refute those attackers as they are not worth any efforts. My family praises her from north America."
31691,UgyN8tFYPQyfKoJgNjl4AaABAg,0,liziqi you are grandma are wonderful in your short videos very much,liziqi你是奶奶在短视频中很棒
32428,UgxzuZyZCiRzRS1O4Wx4AaABAg,0,lucky grandma....,幸运的奶奶....
31525,UgzA7XhtwNxtKgj79394AaABAg,0,when i was about 7 i used to live in the mountain where my grandma sister was a farmer and it was just like that fruitful of everything.,当我7岁左右的时候，我曾经住在祖母姐姐是农民的山上，就像一切富有成果一样。
31411,UgyWGukZU2jM-A2Wrqx4AaABAg,0,"liziqi didi, your grandma is so cute. she is lucky to have hardworking and caring granddaughter like you. bless you both! wish i had the opportunity to taste what you cook, your dishes look so delicious.",利兹奇·迪迪（Liziqi Didi），你的祖母真可爱。她很幸运能像您一样勤奋和关怀孙女。祝福你们俩！希望我有机会品尝您的烹饪，您的菜看起来很美味。
31261,Ugyjb5LTcAYXhVJW9zN4AaABAg,0,shes going to eat that big bowl while grandma gets the little one?,当奶奶得到小碗时，她要吃那个大碗吗？
31254,UgzRK6CmjyFtEi8B2CN4AaABAg,0,"food has no language, its universal but to absorb its taste its temptation flavour and aroma please provide english names of the ingredients you're using! of course we cannot make them here but can actively flavour them with you and grandma! 
crazily waiting for more uploads!!!","食物没有语言，它的普遍性，但要吸收其诱惑风味和香气，请提供您使用的成分的英文名称！当然，我们不能在这里制作它们，但可以与您和奶奶一起积极调味它们！
疯狂地等待更多上传！！！"
31165,Ugxw2oVeJUskGrjWksZ4AaABAg,0,"everything she's cooks always looks tasty. i know her grandma thinks in her her mind, wow i have a really talented granddaughter.",她厨师的一切总是看起来很美味。我知道她的祖母在她的脑海中思考，哇，我有一个很有才华的孙女。
30847,UgzCecJWTYf056wQMC54AaABAg,0,i love how she cooks for her grandma every day.,我喜欢她每天如何为祖母做饭。
30845,UgwwmLZN35BdkinPBOh4AaABAg,0,"grandma is so cute, i also want to eat snail powder! but i think purslane is the best. the action of your tweets is really chic, and my grandpa is surprised!",奶奶好可爱，也想吃螺蛳粉！不过我觉得马齿苋最好吃。你扯马齿苋的动作是真的潇洒，我一老爷们也大吃一惊！
30810,UgzHa-3NACYieb_2vpt4AaABAg,0,can grandma eat spicy?,奶奶能吃辣？
32419,Ugy6ugrgyB1oGMZmkTx4AaABAg,0,it is so comfortable to listen to grandma with laughter,听奶奶笑声好舒服
32509,UgyJlM0Vpj5cd8nwkfV4AaABAg,0,"you're so awesome in everything you do, specially in taking caring of your grandma. god bless you more...",您在所做的每一件事上都很出色，特别是在照顾奶奶。上帝保佑你更多...
30449,UgxlD7F4LIADR8nw3Xx4AaABAg.8yVezNp8yw39R8Or-dwniq,0,"that's her grandma, liziqi called her ""grandma"" in chinese",那是她的祖母，利兹奇用中文称她为“奶奶”
33728,Ugxe-vNV7OkIMt-Bhxh4AaABAg,0,your grandma is very lucky,你的奶奶很幸运
34682,Ugwz_tHmF-fjd6CFFNx4AaABAg,0,why don't you help your grandma and make a bowl,干嘛不帮奶奶也搞一碗
34378,Ugwtn36gliNYrW2qHT94AaABAg,0,ni hao ma liziqi and grandma,ni hao ma liziqi和奶奶
34316,UgxMs55iXh8aawI7rkZ4AaABAg,0,grandma says share your noodles lizqi!,奶奶说分享你的面条lizqi！
34293,UgxPEoeRq4ISAUIOACV4AaABAg,0,you cook very very delicious and a lot of dishes and cook so fast just only you your grandma lucky every day eat yummy from your cook i wishes she very long life live with you happy and healthy,您烹饪非常美味，很多菜肴，烹饪如此之快，只有您每天您的奶奶从厨师那里吃得好吃，我希望她能与您在一起很长一生，幸福快乐
34288,UgyD2hjP3aY7vJRl25B4AaABAg,0,"i'm glad that she doesn't have subtitles but i really want to know what the grandma replied with when when liziqi made a comment while holding up that big shoot, i bet it was something",我很高兴她没有字幕，但我真的很想知道奶奶在举起大拍摄时发表评论时回答了什么，我敢打赌这是
34178,UgwNs8vUyd2W1qT7FRV4AaABAg,0,everything you cook looks delicious and i'll bet taste good.. your grandma is very proud and happy to have you with her..love your graden,你烹饪的一切看起来都很好吃，我会敢打赌好..你的祖母很自豪和高兴地和她在一起。
34160,UgxmsOaTFd85eAREocR4AaABAg,0,i simply adore your grandma. =)❤️,我只是喜欢你的奶奶。 =）❤️
