,cid,votes,含grandma,含grandma中文翻译
30187,UgxlD7F4LIADR8nw3Xx4AaABAg,15000,everytime she uploads im just glad i get to see that grandma is well,每次她上传我都很高兴我看到奶奶很好
19925,Ugy64b8Tc-CR9fv_DdR4AaABAg,807,why are there 10k dislikes ..like people her videos are extremely aesthetic and calming and a lot of effort is required for these videos and she's feeding her grandma and giving us amazing content. why would you dislike this :(,为什么有10k的不喜欢。就像她的视频非常美观和平静，这些视频需要付出很多努力，她正在喂奶，并给我们提供了惊人的内容。你为什么不喜欢这个:(
5586,UgzY48n0KHW0jKBksbh4AaABAg,649,her grandma must be the happiest old lady in the world.,她的祖母一定是世界上最幸福的老太太。
3065,UgxK7tTx9vC9pt59mmJ4AaABAg,634,"as we can see in the videos, the background of the forest, farms, yards, cooking stoves and utensils are real. in the past especially for the chinese people our ancestors work hard on every inch of lands they have. they make use of everything that nature provides to them. generation by generations the land grew flourish. this final generation from baby boomers era (like the grandma) likely the last of their kind, because due to the changes of modern and tech/gadjets world. not many still living up the life just like showed in the video because the generation x,y and z are working and living in cities to find income and mostly leaving the old man/woman at their village. in the end leaving the lands and farms unattended (because grandpa/grandma are already old to work and care the lands).
most end up selling their land and the money the new generation get were invested in businesses, building or renovating house in the cities or in another country, etc. 
as you saw in the video, you can see herbs, clean ponds and rivers, varieties of vegetations, animals like birds, chicken, duck, are well taken care of. these are their daily source of food because there are no supermarket nearby where you can buy from there. thus, why need to buy if you can get it fresh from your own farm? chinese are particular in what they eat (diets and healthy) so they grew herbs, vegetables and live stocks. that is how the baby boomers generation survived along the years away from town or cities. 
the beautiful lady is one of the most impressive grandchild in her family. not just beautiful but also hardworking, diligent, caring and humble because she still carry on her family's tradition and the lands. she learns all sorts of cooking, fermenting, recipes could be mostly from her grandparents which is oustanding. 
i too once lived like hers until i was 19 years old and i loves everything just like hers until my grandma passed away and the land was sold by my uncle that year. 
the memories i had never perish. i still remember the smell in the morning when i'm standing in the middle of the farm, the morning dewdrops on the leaves and grasses, the sounds of birds and water flowing in the small river, the bamboo forests in the evening like golden, chasing gooses, collecting the chicken eggs, collecting the sap from rubber trees, the soothing cold wind on the pepper farm hills, catching grasshoppers among the grasses, catching fireflies at night, the smell of firewood burning while boiling hot water, the food that my grandma used to cooked, my cousin shouting from afar teasing me while plucking potatoes from the ground, etc. i misses all that when i watched the video. 
i did went back to the village a few years ago but it wasnt the same anymore and the place changed alot and the farm wasnt like it used to be like. the peaceful life that i missed.","正如我们在视频中所看到的那样，森林，农场，院子，烹饪炉和餐具的背景是真实的。过去，尤其是对于中国人民，我们祖先在拥有的每一英寸土地上都在努力工作。他们利用自然界提供的一切。几代人的一代人的土地蓬勃发展。来自婴儿潮一代时代（像奶奶一样）的最后一代可能是同类的最后一代，因为由于现代和技术/gadjets世界的变化。 X，Y和Z一代在城市工作并居住在城市中，并大部分将老人/女人留在他们的村庄里，所以并没有多少人像视频中的生活那样过上生活。最后，离开土地和农场无人看管（因为爷爷/祖母已经在工作和照顾土地上已经老了）。
大多数人最终出售了他们的土地，以及新一代获得的资金投资于企业，在城市或另一个国家建造或翻新房屋等。
正如您在视频中看到的那样，您可以看到草药，干净的池塘和河流，各种植被，鸟类，鸡肉，鸭子等动物。这些是他们的日常食物来源，因为附近没有超市可以从那里购买。因此，如果您可以从自己的农场获得新鲜，为什么还需要购买呢？中国人在吃的东西（饮食和健康）中是特别的，因此他们种植了草药，蔬菜和活蛋。这就是婴儿潮一代在远离城镇或城市的几年中生存的方式。
美丽的女士是她家庭中最令人印象深刻的孙子之一。不仅美丽，而且勤奋，勤奋，关怀和谦虚，因为她仍然具有家人的传统和土地。她了解各种烹饪，发酵，食谱可能主要来自她的祖父母，这是罢工的。
我曾经像她一样像她一样生活，直到我19岁，我都喜欢像她这样的一切，直到我的祖母去世，那一年我的叔叔出售了这片土地。
我从未灭亡的记忆。我仍然记得早晨，当我站在农场中间时，早晨的气味，叶子和草地上的碎屑，小河中鸟类和水的声音，傍晚的竹林像金色一样，追逐鸡蛋，收集鸡蛋，从橡胶树中收集树液，在胡椒农场山上舒缓的冷风，在草中捕捉蚱hoppers，在晚上捕获萤火虫，柴火的气味在沸腾的热水时燃烧，食物，我是我的食物。奶奶曾经煮过，我的堂兄从远处大喊大叫，一边从地上摘下土豆，等等。
几年前，我确实回到了村庄，但不再一样，这个地方改变了很多，农场不像以前那样。我错过的和平生活。"
2668,UgyyYChth_3diDSbnRh4AaABAg,598,"she's really an amazing woman, her grandma is lucky to have her by her side.",她真的是一个了不起的女人，她的奶奶很幸运能在她的身边。
30204,UgxlD7F4LIADR8nw3Xx4AaABAg.8yVezNp8yw38yWN4j3oZfk,519,her grandma is the lucky person in the world,她的祖母是世界上幸运的人
30205,UgxlD7F4LIADR8nw3Xx4AaABAg.8yVezNp8yw38yWOhtsP-mP,480,yeah seeing the grandma going strong is a charm in her videos,是的，看到奶奶变得强壮是她的视频中的魅力
30210,UgxlD7F4LIADR8nw3Xx4AaABAg.8yVezNp8yw38yXhSJ6jIK1,458,"grandma is her biological grandma, but her adoptive mother somehow. ziqi lost her mother at very young age and step mother did not treat her well. then ziqi lost her father and her grandparents raised her up. ziqi said in a chinese variety show, she could have died without her grandparents. therefore, she has very strong bond with her grandparents.",奶奶是她的生物奶奶，但她的收养母亲以某种方式。 Ziqi很小的时候就失去了母亲，而继母的母亲并没有很好地对待她。然后Ziqi失去了父亲，她的祖父母抚养了她。 Ziqi在中国综艺节目中说，她本可以在没有祖父母的情况下死亡。因此，她与祖父母有着非常牢固的联系。
11847,Ugxj-NWxRDsYzlG9c1V4AaABAg,327,i love seeing grandma chilling out on the shaded swing. every elderly person should have that opportunity for rest after a long life. and have lovely well prepared meals for them.,我喜欢看到奶奶在阴影的秋千上放松。每个老人都应该在长寿之后有机会休息。并为他们提供可爱的餐点。
12156,UgycBYapKu7TH6vb3Ed4AaABAg,272,"my dream is to one day have a garden where i can grow plants, flowers, herbs and food for my family. her and grandma must be so happy. all that nature around them and the nutritious food to nourish them",我的梦想是有一天有一个花园，我可以在这里为家人种植植物，鲜花，草药和食物。她和奶奶一定很高兴。他们周围的所有大自然以及营养丰富的食物以滋养它们
11099,UgwOJB9Gsj9koPkpkSF4AaABAg,218,the best part is when she’s feeding her grandma with all that cooking!,最好的部分是当她用所有烹饪喂养祖母时！
14882,UgxdzDDvqWYvCwMjbWB4AaABAg,162,the grandma is lucky to have a grandchild like her.,奶奶很幸运能拥有像她这样的孙子。
33384,UgwyyTX_11oSpbqFpYl4AaABAg,139,"3 new videos in a week? 
wow!! i feel like i got a big diamond's ring....
thank you so much for you, grandma and your team's hard work, liziqi....
can't wait for another new video, because your videos always amazed me.
lots of love from indonesia 
❤❤❤","一周内的3个新视频？
哇！！我觉得我有一个大钻石的戒指。
非常感谢您，奶奶和您团队的辛勤工作，Liziqi。
等不及另一个新视频，因为您的视频总是让我惊讶。
来自印度尼西亚的很多爱
❤❤❤"
3950,UgwGF-mfOEwIG9tT5714AaABAg,138,grandma is so lucky! she is eating good food made with lots of love!,奶奶很幸运！她正在吃充满爱的美食！
30209,UgxlD7F4LIADR8nw3Xx4AaABAg.8yVezNp8yw38yXQMMx3Q_a,116,"1292liam no, grandma is her grandma.",1292Liam no，奶奶是她的祖母。
11605,UgzotkfSEk4kAQrin2N4AaABAg,107,i just wish that she would invite me over for lunch some day! she is the master of natural foraging & cooking & always takes care of grandma! gotta love this woman....,我只希望她有一天会邀请我吃午饭！她是自然觅食和烹饪的主人，总是照顾奶奶！要爱这个女人....
10308,UgxPYVVjMCpHV_uEKvJ4AaABAg,96,for this diet grandma is eternal,因为这种饮食奶奶是永恒的
23434,UgzUJFsjexVHtAYIVQp4AaABAg,95,"whoever is married to this woman is one lucky dude!
she is a real artisan. 
this like what my grandma and mother used to do, everything from scratch. wonderful.","与这个女人结婚的人是一个幸运的家伙！
她是一个真正的工匠。
这就像我奶奶和母亲过去所做的一切一样，一切都从头开始。精彩的。"
22322,UgzalH_OucQr_GSfdLx4AaABAg,87,"grandma should get some respect..

somebody had to teach this girl all this stuff.","奶奶应该得到一些尊重。

有人必须教这个女孩所有这些东西。"
28346,Ugw4oagRSrnkZ2PMqUR4AaABAg,81,"love u from northeast india, kuki tribes. everything is similar with my traditional love so much i miss my grandma.",来自印度东北部的爱你，库基部落。一切都与我的传统爱相似，所以我想念我的祖母。
16588,UgwG6EGI9KhD1FkfuKZ4AaABAg.92t3bTvXZ7H92vgvcgb7-B,65,her grandma,她的祖母
30221,UgxlD7F4LIADR8nw3Xx4AaABAg.8yVezNp8yw38yk7WhXnfYj,60,"golden melon grandma was taking care of her when she was young. what she is doing is the gratitude for the love and care received from childhood. this is a part of chinese culture, and it's beautiful.",金瓜奶奶小时候照顾她。她正在做的是对从小就得到的爱与关怀的感谢。这是中国文化的一部分，它很美。
10607,UgxXJJCLlh5MKZVn1xN4AaABAg,58,"when eating, ziyi always prepares a small bowl for grandma. essence essence but recently, grandma is not always suspected.
could it be that ziyi's food has made grandma return to old age!","吃饭时，子柒总是先给奶奶准备一小碗。。。可最近奶奶总嫌不够呢。
难道子柒的美食让奶奶返老还童了！"
30212,UgxlD7F4LIADR8nw3Xx4AaABAg.8yVezNp8yw38yY4qUyATBU,54,"1292liam no, she called the old woman as ‘popo’, ’popo’ in english means grandma.","1292liam No,she called the old woman as ‘婆婆popo’,’婆婆popo’ in English means grandma。"
20621,Ugz0HdTG-Kc9Bd9JOFZ4AaABAg,41,it's really great video! thanks to the girl to show more people's lives to more people! i wish you and your grandma healthy and happy! i do n’t know who has such a good blessing to marry such a daughter -in -law!,真的是很棒的视频啊！感谢姑娘把真实的美好的中国人的生活展现给更多人!祝你和你奶奶健康快乐!不知道谁有这么好福气能够娶到这样的媳妇啊！
32757,UgyYDVEOAlXNCukIO0R4AaABAg,40,"she is the real princess she lives in beautiful paradise she love her grandma &people around her,she loves working,harvesting,cooking and everything there and one they she will find the future prince they will life happy in peace forevr",她是她生活在美丽的天堂中的真正公主
30215,UgxlD7F4LIADR8nw3Xx4AaABAg.8yVezNp8yw38yZiWHNYGRo,40,"yeah, i almost cried everytime the grandma talk and smile",是的，每当奶奶谈话和微笑时，我几乎都在哭
33753,Ugyjm5PYGhjW6KES4AR4AaABAg,39,"i loved it when your grandma was sitting in the swing and talking to you , sweet",当你奶奶坐在秋千上与你交谈时，我喜欢它，甜蜜的
30223,UgxlD7F4LIADR8nw3Xx4AaABAg.8yVezNp8yw38ymFK2iX0Jd,38,"@user-mf6hv8up2w to be exact po po po po po po po po po po po po po po po po po po po po po po po po po po po po po po po po po po po mother-in-law is maternal grandma, nai nai grandma is pattnal grandma. gong gong gong gonggong grandpa grandpa. bo bo is father's elder brother (s ). ). brother (s). jiu ma aunt/ jiu mu's mother is mother's sister in law. maternal male cousins ​​elder than you are your biao ge cousin. younger than you are your bia di cousin. mater. mater. mater. mater. nal female cousins eleder than you are your biao jie cousin. younger than you are your biao mei cousin. paternal male cousins ​​elder than you are your tang ge cousin. younger than you are your tang di cousin. sins elder than you are your tang jie cousin. younger than you are your tang mei cousin.","@user-mf6hv8up2w To be exact po po 婆婆/外婆 is maternal grandma, Nai Nai 奶奶/祖母 is patetnal grandma. Gong gong 公公/外公 is maternal grandpa, ye ye 爷爷 is paternal grandpa. Bo Bo 伯伯 is father's elder brother(s), bo mu 伯母/bo niang 伯娘 is wife of father's elder brothers. Shu shu (叔叔) is father's younger brother(s). Shen Shen 婶婶 is wife of father's younger brother(s). Jiu Fu 舅父/舅舅 is mother's brother(s). Jiu Ma 舅妈/ Jiu Mu 舅母 is mother's sister in law. Maternal male cousins elder than you are your biao ge 表哥. Younger than you are your biao di 表弟. Maternal female cousins elder than you are your biao jie 表姐. Younger than you are your biao mei表妹. Paternal Male Cousins elder than you are your tang ge 堂哥. Younger than you are your tang di 堂弟. Paternal Female Cousins elder than you are your tang jie 堂姐. Younger than you are your tang mei 堂妹。"
18462,Ugx_6yBpjTMVexlpwQ54AaABAg,38,"occasionally speaking, a strong hometown accent, girl, i am proud of you. her grandma looks very happy",偶尔开口说话，浓浓的家乡口音，姑娘，我很为你骄傲。她奶奶过得很开心的样子
19939,Ugy64b8Tc-CR9fv_DdR4AaABAg.91FI0ImISkq91S5fCNXtd0,37,"your name says it all :) but in all seriousness i agree. people say it’s all for money yet how do they know? are they liziqi? no. so they can’t say wether or not it’s fake and anyway she does it for her grandma (whose ill) i’ve seen some people say her products are over priced, but she took several hours of her day to prepare the food. so thank you for your comment.",您的名字说明了一切:)，但我同意，但我同意。人们说这一切都是为了钱，他们怎么知道？他们是liziqi吗？否。 。因此，谢谢您的评论。
34539,UgyKZmhJjnH56Qv_--J4AaABAg,34,"at that time, the grandmother guarded the little girl to grow up safely and happily. now the girl grows up with an excellent glorious family, and she also protects her grandma live in her old age!",当年奶奶守护这位小女孩平安快乐长大，现在女孩长大成人优秀的光耀家族，并也守护奶奶晚年生活！
16594,UgwG6EGI9KhD1FkfuKZ4AaABAg.92t3bTvXZ7H92zbMJJ5M_H,33,"it was a guy, i heard his voice behind the camera in the ""ice cream"" episode, he tried to make sure that grandma doesn't eat too much ice cream.",那是一个家伙，我在“冰淇淋”情节中听到了他的声音，他试图确保奶奶不吃太多冰淇淋。
14192,Ugwkx0y5dxPT2ZboFFx4AaABAg,31,"i’m going to cry for weeks when her grandma dies 
so grandma please please don’t die","当她的祖母去世时，我要哭几个星期
所以奶奶请不要死"
30226,UgxlD7F4LIADR8nw3Xx4AaABAg.8yVezNp8yw38yuAZ98N03M,29,don't you worry her grandma will live for 200 yrs because of the healthy and natural foods she eats,您不担心她的奶奶会因为她吃的健康和天然食品而活了200年
8642,UgwEeceQBwUWUvvNu2p4AaABAg,26,"i used to live at my grandma's house when i was kid, it is located in countryside. watching your video makes me recall my childhood memories. now that my family move to a city, i want to enjoy this kind of nature yet i cant",我小时候曾经住在祖母的房子里，它位于乡村。观看您的视频使我回想起童年的回忆。现在我的家人搬到了一个城市，我想享受这种性质，但是我不能
28370,UgxOYPYXZvNDxsfwveB4AaABAg,24,"i saw grandma’s fan and immediately thought, “liziqi probably made that.”",我看到了奶奶的粉丝，并立即想到：“利兹基可能做到了。”
27603,UgwsjVfm4w2IslSFDSR4AaABAg,23,i could watch you all day long! you do exactly what my mom and grandma used to do. i know that it is a lot of hard work to prepare all those delicious meals but worth it! keep up your good work!,我可以整天看着你！您正是我妈妈和奶奶所做的一切。我知道准备所有这些美味的饭菜是很多艰苦的工作，但值得！继续你出色的工作！
28570,UgxCpRiDGzrwuzVOfl94AaABAg.8yY6-41Td1g8zuRJV4N65A,23,"she can feed herself and her grandma without any english 
","她可以不用任何英语喂养自己和祖母
"
30220,UgxlD7F4LIADR8nw3Xx4AaABAg.8yVezNp8yw38yiKN75zsj7,23,her grandma is lucky to have such hard working woman as her granddaughter.,她的祖母很幸运能拥有如此勤奋的女人，例如她的孙女。
9346,UgzH9zSLw3du2rBNtAx4AaABAg,22,i just think that sheโ€s very well trained from her grandma or sheโ€s just skilled with literally everything.,我只是认为她从祖母那里受过良好的训练，或者她只是熟练的。
16677,Ugz_4uZFuDJUEqrt9hR4AaABAg,21,shes so caring for her grandma,她是如此关心她的祖母
23733,UgxJwbuw51MGFl8jxhZ4AaABAg,20,everytime she uploads im just glad i get to see that grandma is well...,每次她上传时，我很高兴看到奶奶很好...
6336,UgzrOgipSKHwc8hEvCV4AaABAg.9EsO86ldc5x9EzHxqxrolP,19,"study and learn, read, read,read 
blessings from mexico! i too am a fan. i have big piece of property! i need help, i too am a grandma. i love her garden, lots of work.","学习，学习，阅读，阅读，阅读
来自墨西哥的祝福！我也是粉丝。我有很大的财产！我需要帮助，我也是一个奶奶。我爱她的花园，很多工作。"
29622,Ugx9nuZxAHxrBjsjmAx4AaABAg,19,her grandma laughs is everything!,她的祖母笑就是一切！
11397,Ugx-5d2aAZv1U6QtBMx4AaABAg.97aDyK3ahgD97lZBQp7-pX,18,"@logicone5667 she lives there with her grandma, the video is actually filmed at her home in the village of sichuan province. all those crops would die if she only goes there once a month...she does have a team though, but it doesnt mean its just for show. her grandma needs someone to take care of, thats why she moved back to the village to live with her.",@logicone5667她和祖母一起住在那里，该视频实际上是在她在四川省村的家中拍摄的。所有这些农作物每月只去那里一次……但是她确实有一支球队，但这并不意味着这只是为了表演。她的祖母需要一个人来照顾，这就是为什么她回到村庄和她住在一起的原因。
18165,UgyGNOeNj4QVDKZxYJF4AaABAg.92ZeoRX897K92dEf0w_dVQ,18,it’s too spicy for grandma she said,她说，这太辣了
19109,UgxqKGCp80V6zbdnys94AaABAg,17,if i believed in reincarnation i would want to come back as that girls grandma.,如果我相信轮回，我想作为那个女孩奶奶回来。
2790,UgyjokKB5kT-vLggUk54AaABAg.9RPpxXlXsf_9UYfiO3-g3B,16,"@lxixi2105 actually no. she actually used to be a dj but when her mum and dad died she went back to the country to live with her grandma. she then started doing what see is doing now. she decided to put it on youtube and as her channel grew more popularity she hired a filming crew. nothing here is fake, and if you think about it how can someone fake doing something even though they are actually doing it",@lxixi2105实际上没有。她实际上曾经是DJ，但是当她的妈妈和爸爸去世时，她回到乡下和奶奶住在一起。然后，她开始做现在正在做的事情。她决定将其放在YouTube上，随着她的频道越来越受欢迎，她雇用了一名拍摄人员。这里没有什么是假的，如果您考虑一下，即使有人实际上在做
12162,Ugwe2fsKWeEO0_IqqPF4AaABAg,16,"it's reminded me with my grandma, we life in the nature like that ,and now she was passed away and our life gone change ,",这让我想起了我的祖母，我们在那样生活中的生活，现在她去世了，我们的生活变化了，
4804,Ugxb03oJotVFucmefiF4AaABAg,15,grandma is so blessed to have such granddaughter!,奶奶有这样的孙女真是福气！
28215,UgzvUXzlx4Hpc_AfBAB4AaABAg.8yZtNJOZ_7p8yeUguPf7tv,14,i read somewhere she studied media/film in uni. when she finished she moved back home to live with her grandma. the garden we see was planted by her grandma,我读了她在大学学习媒体/电影的地方。当她结束时，她搬回家与祖母住在一起。我们看到的花园是由她的祖母种植的
21698,UgwBRxLOi-ZesieYcjN4AaABAg.9-_KlQ8-Npx905iKCMQnEB,13,"@cammyfeng4066 no, she lives there with her grandma. her grandma is elderly and she takes care of her.",@cammyfeng4066不，她和祖母一起住在那里。她的祖母是老的，她照顾了她。
3185,UgygFI2VfEqnkFgNXqt4AaABAg,13,everytime she uploads im just glad i get to see that grandma is well also,每次她上传我都很高兴我看到奶奶也很好
35039,UgzyXKWhqzaqVCC9PDx4AaABAg,13,"you are very hard working girl
taking care of grandma too
keep it up
lots of love❤","你是非常努力的女孩
也照顾奶奶
继续努力吧
很多爱"
10793,UgxOX1A58bvdzRRQIzB4AaABAg,12,"sister ziyi, grandma zi is good, take care of her body. sister zi, also should be maintained by hand, apply some skin care oil. the show is good, praise, support.",子柒姐，子柒奶奶好，保重身体。子柒姐，手也要保养，涂些护肤油吧。节目好，赞，支持。
16949,UgwGfQu-FPHh_oVQugZ4AaABAg,12,i love to see how she shares with her grandma all the thigs that she cooks,我喜欢看到她如何与祖母分享她做饭的所有thigs
11077,UgxKvyp57EZ5XhPr-B54AaABAg,11,"1:17 the happy grandma here for the first time made me understand what it means to support the year! by the way, congratulations on breaking 10 million fans! intersection",1:17 这里快乐的奶奶第一次让我明白了什么叫颐养天年！顺便一提恭喜你破1千万粉丝了！！
16595,UgwG6EGI9KhD1FkfuKZ4AaABAg.92t3bTvXZ7H92zl9JGBtQT,10,"there’s gotta be another person not her nor grandma, see the end how the camera switches focus",有另一个人不是她和祖母，请看到相机如何切换聚焦
14909,UgxdzDDvqWYvCwMjbWB4AaABAg.93npIg-2HwZ94FgN50icCj,10,"cause maybe her grandma told her about everything how to cook, fetch vegetables, etc when she was young",因为她年轻时也许她的奶奶告诉了她一切如何做饭，取蔬菜等
16703,UgzGVM1UgRUuWYqDMdV4AaABAg,9,"i think of it! i miss the scene of my grandmother cooking when i was a child.
me: ""do you want a big fire? grandma"", after getting a positive answer, i desperately burned the fire ... then some dishes will be burnt ...","看的我想家了！怀念小时候外婆做饭，我烧火的场景。
我：“要不要大火？外婆”，得到肯定的答案后，我就拼命把火烧旺……然后有些菜就会烧焦……"
6293,Ugxf7w-KauhvkVNowK94AaABAg,9,"amazing chef in the world she never ever used the kitchen tools as measure: 1tbl spoons, 1cup bla...blaa... i love you both grandma n zigi love from new york๐’",她从未使用过厨房工具作为措施的惊人厨师：1tbl汤匙，1杯bla ... blaa ...我爱你，纽约奶奶n Zigi love
32226,UgxstXAajpA5Y4329TZ4AaABAg,9,love how she cares and takes care of her grandma. the cameraman is probably drooling just waiting for some grub,喜欢她如何关心和照顾祖母。摄影师可能只是在等待一些g。
27915,UgwdkOuMYJJFFB32TO54AaABAg,8,"hi liziqi, your paradise is always beautiful, your grandma and you enjoyed every thing you make and cooking",嗨，利兹奇（Liziqi），你的天堂总是美丽，你的祖母，你喜欢你做的每一件事
1020,UgyrybVQbKssN2IcMux4AaABAg.9bpJQ_Rqdlo9ejXozsxXQb,8,"@ericamonti6281 she is deceived because she is being deceived. i do n’t know what happened to her and grandma. fortunately, if you do n’t understand, i can reply to you in spanish. and her name is ziqi li, li is her surname",@ericamonti6281 她因为被人骗了 在打官司 不知道现在怎么样了 她和奶奶都还好 如果你看不懂 我可以用西班牙语回复你。还有她叫ziqi li ，li 是她的姓
30233,UgxlD7F4LIADR8nw3Xx4AaABAg.8yVezNp8yw38yxI4lykg2M,8,kastellan i love the swing grandma is on it’s too cute,卡斯特兰（Kastellan）我喜欢摇摆奶奶太可爱
