,cid,votes,time,含talented,含talented中文翻译
35657,UgwRC4ADJQaSLbJMNVl4AaABAg,0,4 years ago,"the girl is very talented, i bet there is nothing she canโ€t do. but the vids are a little bit unrealistic . no one lives like that at a farm. everything is too clean, too tidy. besides there is no actual need to use fire every time you cook. wood-fired oven is better than electric one in many cases, but for frying and boiling you need to be super-expert to use open fire. thus for me it just seems like intentionally making your life harder while not adding any extra-value to the final result. and she never uses neither water lines nor washing machine in the video. this is just absurd: you just can not keep the house as clean without water lines. and animals are so tidy, i bet they are washed and brushed everyday. the vids are very good just as fairytales, but those comments saying about the ยซ real life ยป the girl lives are just killing me",这个女孩很有才华，我敢打赌，她无能为力。但是视频有点不现实。没有人像这样的农场生活。一切都太干净了，太整洁了。此外，每次您做饭时都无需使用火。在许多情况下，燃木烤箱比电动烤箱要好，但是要煎炸和煮沸，您需要超级专家才能使用开火。因此，对我来说，似乎有意使您的生活更加艰难，同时又不为最终结果添加任何额外价值。而且她从未在视频中使用水管也不使用洗衣机。这只是荒谬的：如果没有水管，您就无法保持房屋的干净。动物是如此整洁，我敢打赌它们每天都洗和刷。视频和童话一样很好，但是那些关于“现实生活”的评论是女孩的生活只是在杀死我
35453,UgzjYmuYrur-uwUBvcl4AaABAg,0,4 years ago,what a good content! in my country they should change soap operas for videos like this. what a working and talented girl.,多么好的内容！在我的国家，他们应该为这样的视频更改肥皂剧。真是个工作和才华横溢的女孩。
11214,UgwSgoGkH92RB_d6u9x4AaABAg,0,2 years ago,she is super talented she deserve more,她超级才华，她应该得到更多
35370,Ugxxx5Bb9PYQkSmPq_h4AaABAg,0,4 years ago,"no words , she's strong super supper talented girl .. god bless you always girl .โค๏ธ",没说，她是坚强的超级晚餐才华。上帝保佑你永远是女孩。
31286,Ugw9JM2JXwaSwaLP9ZN4AaABAg,0,3 years ago,very talented,很有天赋
31290,Ugzb1NRRaLARmrj2m-54AaABAg,0,3 years ago,she looks so much like mina from twice in certain angles. such a talented girl.,她看起来非常像Mina，从某些角度开始两次。如此有才华的女孩。
31716,Ugx_fpyn1qWx7rs1cQR4AaABAg,0,4 years ago,sheโ€s so smart and talented and clever and strong. how has she not been wifed up,她是如此聪明，才华横溢，聪明和坚强。她怎么没有被宣告
31966,UgzXiz6-VtqSapazJ4d4AaABAg,0,4 years ago,you are so talented. these videos give me such an escape from daily life,你是如此有才华。这些视频使我摆脱了日常生活
10627,UgwmdP7r6DLPrZ28pMt4AaABAg,0,2 years ago (edited),ccp puppet! she is beautiful and talented...the perfect person to be used by the ccp to brainwash people into believing that communism is good. wake up people. your being brainwashed. communist china isn't good and this does not show real life in china!,CCP木偶！她是美丽而有才华的……由CCP使用的完美人物，以洗脑人们认为共产主义是好的。唤醒人们。您被洗脑了。共产主义中国不好，这在​​中国没有表现出现实生活！
32069,Ugy2U0fgGZKTboGum_14AaABAg,0,4 years ago,iโ€m so speechless.shes so talented and calming and nice.i wish her the best and her grandma,我是如此无言以对。
10229,Ugw2pxGZPWzU6l7ALNJ4AaABAg,0,2 years ago,talented angels,才华横溢的天使
32326,Ugxc6y6_-820Wbjsm8N4AaABAg,0,4 years ago,so talented but uses too much plastic i thought she would make her own bamboo bags or something for the produce,如此有才华，但使用太多塑料，我以为她会自己制作自己的竹袋或产品
9101,UgzYtKXULXvMFF-Aok54AaABAg,0,2 years ago,"she is very talented, really its inspire video",她很有才华，确实是它的启发视频
32863,UgzKqu24fyR0o6X5a_B4AaABAg,0,4 years ago,dis vdo is lik feeding mi soul .mind heart ..out of the world its heaven in tru means ..wata purety simplicity ..im actually speechless wchng ol ds but still hvtu put in wrds somhow a bit wat im feeling wchng ds vdo ..ds grloh mi shez amzing bestiful lik doll n immensely talented hard working ..the place .house .pots .fruits recipez ..vegis .grndma .lucious farms .trees ..wt tu nme wat tu leav ..huhh..im lucky i found ds vdo ..living in mad big cities wth such impure .. polluted.sly pple .ratrace ..is lika living in hell..n mann dis plce . people .. like a dream for me,dis vdo喜欢喂食mi灵魂。 。我发现ds vdo ..在疯狂的大城市中生活如此不纯..污染了。人们..对我的梦想
8797,UgylMjK4aGUpRqJknat4AaABAg,0,2 years ago,what a beautiful cooking l seeing no boring and cooking tips very clinig she is very talented girl,多么美丽的烹饪l看不到无聊和烹饪技巧，非常有才华的女孩
33361,UgxSdEO4_AO8cHnmRPp4AaABAg,0,4 years ago,i wonder how she got the idea to start youtube when she lives in the boonies her life is amazing sheโ€s super talented and beautiful.,我想知道她如何想到YouTube在她生活在巨人中时，她的生活真是太好了，而且很漂亮。
34345,UgxDqFt6HP4JE714ZO14AaABAg,0,4 years ago,this girl is legit the most beautifully talented person iโ€ve ever seen.,这个女孩是我见过的最有才华的人。
34988,UgyAK_6vW3JDRaQlt7l4AaABAg,0,4 years ago,"both beautiful and talented. life looks like a dream, strangely peaceful.",既美丽又有才华。生活看起来像是一个梦，奇怪地和平。
35001,UgznvtPI11mPDgeZgPR4AaABAg,0,4 years ago,she is truly a very talented master chef ๐๐,她确实是一位非常有才华的大师厨师
35166,UgyoQ22FTE7CBFzC4qx4AaABAg.8ukF8x1n6m-94DTWbb5JFB,0,3 years ago,"@therewasnochill8997 if you look at her previous videos, she said she did have access to higher education, but she felt like she was controlled and decided to go back to the country and lived with her grandmother. i don't think she is missing anything in life, she has a lot, she is very successful and talented.",@thenwasnochill8997如果您看她以前的视频，她说她确实可以接受高等教育，但是她觉得自己受到了控制，决定回到该国并与祖母住在一起。我认为她没有缺少生活中的任何东西，她有很多东西，她非常成功和有才华。
35174,UgyoQ22FTE7CBFzC4qx4AaABAg.8ukF8x1n6m-95Mji3fj49x,0,3 years ago,this girl is grate i really zealous of her can one pearson so talented,这个女孩是勇敢的，我真的很热心她能有才华的皮尔森
650,UgwlZpQCULLw7svcfth4AaABAg,0,5 months ago,this video i seen 50tyms i love this video. she is so great n very talented brillient girl,这段视频我看过50tym，我喜欢这个视频。她是如此伟大的N非常有才华的女孩
