,cid,votes,含watch,含watch中文翻译
13066,UgzglbdL6bB5GbP2Kad4AaABAg.9CLO_5Ur0fQ9CLRyuFHUpo,0,karma ever 17 https://www.youtube.com/watch?v=numacfgcg74,Karma Ever 17 https://www.youtube.com/watch?v=numacfgcg74
13078,Ugy3MOKJmAYJ41CNFDx4AaABAg,0,"advise you to see/i advise you to see/我 建议 你 看看 https://m.youtube.com/watch?v=dxeuees2hkpc&t=629s
[","建议您查看/我建议您查看/我我看看https://m.youtube.com/watch?v=dxeuees2hkpc&t=629SS
["
25841,UgwxKQh1rqDU8LKKPaN4AaABAg,0,"watching her, smiling, following happiness everywhere.",看着她，微笑，到处都有幸福。
13083,UgykaRXak4lJmJ4qJcF4AaABAg,0,"must watch excellent 
https://www.youtube.com/watch?v=hufhjoewabs&feature=youtu.be","必须观看优秀
https://www.youtube.com/watch?v=hufhjoewabs&feature=youtu.be"
25806,Ugy27nrG6k79OdZIRFV4AaABAg,0,i have no idea about how many times i watched this video๐,我不知道我看过这段视频
25798,UgzR8o6t_5EFB1zqF4F4AaABAg,0,no one will watch this channel :))). making a video must be ntn,没有人会观看此频道:)）））。制作视频必须是ntn
13218,Ugx7jt6YUPjipjgdN5t4AaABAg,0,"this clip is so cool, inspiring, fantastic. 
https://www.youtube.com/watch?v=e4vngtjpdru&t=8s","这个剪辑是如此酷，鼓舞人心，很棒。
https://www.youtube.com/watch?v=e4vngtjpdru&t=8s"
13219,UgwjPQp1z4PphoxvhIR4AaABAg,0,my only arabic form is to watch,我唯一的阿拉伯语形式是观看
25711,UgxJ2yof1N0E_CtYl2p4AaABAg.9-4Tcm-zPzx9-N1H5W1mov,0,calm patience youโ€re clearly the ignorant one. gordon is one of the most down to earth people iโ€ve ever seen as a celebrity. heโ€s his famous rude self to those who claim to be professionals and on his level but consistently fail to achieve what they claim they are capable of. go watch videos of his mentor. 100x worse. stay butthurt if you want but heโ€s a world class chef as well. heโ€s got credentials to back up his attitude.,平静的耐心你显然是无知的人。戈登是我看过是名人的最脚踏实地的人之一。他是那些自称是专业人士并在他的水平上，但始终无法实现自己声称自己有能力的人的著名粗鲁自我。去看他的导师的视频。 100倍更糟。如果您愿意，请留下Butthurt，但他也是世界一流的厨师。他拥有支持他的态度的证书。
14203,UgyQ2xuHQLytQU0vdAR4AaABAg,0,"after watching, it is very comfortable",看完之后，这很舒服
13263,UgwAzPCS84QZ88Pzp_h4AaABAg,0,"this video is perfect, not only because i have made a lot of snacks, it is rich in content, as well as soundtracks, pictures, and even makeup. another point may be because this video is preparing for new year's goods. when i watch it, my heart will be full of stability and expectations.",这个视频就很完美，不仅是因为做了很多小零食显得内容丰富，还有配乐，画面，甚至连妆容都是我喜欢的。还有一点可能是因为这个视频是在准备年货嘛，看的时候我的心里也会充满安定满足与期待。
13265,UgytZQg8fhR7tsC3aHd4AaABAg,0,indonesian who watched august 2020 like,观看2020年8月的印度尼西亚人像
25615,Ugxn0vEDy4OiV2-JZVJ4AaABAg,0,i love to watch when china cook food๐๐๐๐๐๐๐๐๐๐๐๐๐๐๐๐๐๐๐๐๐๐๐๐๐๐๐๐๐๐๐๐๐๐๐๐๐๐๐๐๐๐๐๐๐๐๐๐๐๐๐๐๐๐๐๐๐๐๐๐๐๐๐๐๐๐๐๐๐๐๐๐๐๐๐๐๐๐๐๐๐๐๐๐๐๐๐๐๐๐๐๐๐๐๐๐๐๐๐๐๐๐๐๐๐๐๐๐๐๐๐๐๐๐๐๐๐๐๐๐๐๐๐๐๐๐๐๐๐๐๐๐๐๐๐๐๐๐๐๐๐๐๐๐๐๐๐๐๐๐๐,我喜欢看中国烹饪食品
25585,Ugw3JGpnoCrCVM5zmiB4AaABAg,0,i'm watching this video 10 times,我看这段视频10次
25582,Ugzo1GwMDFe0t6pI8XF4AaABAg,0,i love watching this woman. cook well. not much to say. the video quality is very good. not boring watching video videos. continued success.,我喜欢看这个女人。煮好。没什么可说的。视频质量非常好。观看视频视频不会无聊。继续成功。
25551,Ugxe6Md9pOhlI5_r6wt4AaABAg,0,"this is my first time watching her video. iโ€m so amazed of all the things she did ๐ฒ everything looks so good ๐ how lucky to have that much land filled with fruits and vegetables โบ๏ธ 

sorry, does she sells the foods she made? or is it for the family?","这是我第一次观看她的视频。我对她所做的所有事情感到非常惊讶。一切看起来都很好。

抱歉，她出售自己制作的食物吗？还是为家庭？"
13277,UgybcIPu7X86O8PODDd4AaABAg,0,"i keep watching your videos.
they are interesting.
hello! my channel is an eating show because i love foods too. let's interact with each other.
good luck!","我一直在看你的视频。
他们有趣。
你好！我的频道是一个饮食表演，因为我也喜欢食物。让我们相互互动。
祝你好运！"
13281,UgwfU2jDqs2p3N57Sw54AaABAg,0,https://m.youtube.com/watch?feature=share&v=9wxryrkcsyw,https://m.youtube.com/watch?feature=share&v=9wxryrkcsyw
25480,UgzXLpT3Wq5gdYN0xd14AaABAg,0,"i want to share this with as many people as i can so maybe some of the naysayers can understand better who she is. you'll gain even more respect for who li ziqi is by watching this wonderful interview!
https://youtu.be/yvggquw0g7w","我想与尽可能多的人分享这一点，因此也许有些反对者可以更好地理解她的身份。通过观看这次出色的采访，您将更加尊重李Ziqi是谁！
https://youtu.be/yvggquw0g7w"
25906,UgyPFUp1lNAi4RY79bJ4AaABAg,0,i didn't know i was watching this video.,我不知道我在看这个视频。
13004,UgwcbgECnovACeF3dcx4AaABAg.9CScUzae3DP9H5QYTX4CoV,0,support this humble family have talent! https://www.youtube.com/watch?v=e19lg2cwmts&t=484s greetings from peru,支持这个谦虚的家庭有才华！ https://www.youtube.com/watch?v=e19lg2cwmts&t=484s问候
25918,Ugx6Cs9IZoWIOrW0vUd4AaABAg,0,what in the world am i watching ? ugghhhhhh,我在看什么？ ugghhhhh
25932,Ugxl-kmnCJjfAUuzbGJ4AaABAg,0,i love your videos so much that i keep watching it many times. you are the most beautiful i have ever seen.,我非常喜欢您的视频，以至于我一直在观看很多次。你是我见过的最美丽的。
73,UgwrKfZ-clGIDGanKyV4AaABAg,0,what a beautiful your videoiam watching your video,您的视频多么美丽
12331,UgxrGV9drPsqwoNl-6l4AaABAg,0,it is so relaxing to watch,观看真是太放松了
12377,UgwzPmdekj62lqcIfZx4AaABAg,0,she is amazing to watch.,她很棒。
12529,UgwoktSsVX_IYwI_drZ4AaABAg,0,"watch the clip of nsyf vomiting too old, although older",观看Nsyf呕吐的剪辑太大了，尽管年龄较大
12534,UgyfQQY8Xom8kjNMLBh4AaABAg,0,you are mesmerising and beautiful to watch. you inspire and amaze me and i love you and your videos. you are so strong and thoughtful. thank you.,你令人着迷，而且很漂亮。您激发了我的灵感，我爱您和您的视频。你是如此坚强和体贴。谢谢。
26258,Ugz4x9jZf79qtb1MNMB4AaABAg.8zkpfxZ3kEy8zvjSO8G50N,0,atlas. all the preparation made to prepare to masturbate in peace while watching this video.,地图集。所有的准备工作都准备在观看此视频时进行和平自慰。
12815,UgwUnEN-Go-FgGLcTM94AaABAg,0,i love to watch your videos and got encourage to cook some special chinese dish.,我喜欢看您的视频，并鼓励烹饪一些特殊的中国菜。
12889,UgxFWm-44G4PmDY3zNx4AaABAg.9CdwK7sIXZo9H5QytBAwSm,0,support this humble family have talent! https://www.youtube.com/watch?v=e19lg2cwmts&t=484s greetings from peru,支持这个谦虚的家庭有才华！ https://www.youtube.com/watch?v=e19lg2cwmts&t=484s问候
12903,UgyHPCQ_Sr6fu-Qgy5h4AaABAg,0,is there a way to get the recipes? my daughter and i watched these videos together and really want to try making the dishes.,有没有办法获取食谱？我和我的女儿一起观看了这些视频，真的想尝试做菜肴。
12942,UgxqDmmfsZQCN_5mpgR4AaABAg,0,"you are so lucky when have a place so beutiful
i want to have a place like that so i can get up in the morning and watch the sun shine or something’s better
but i can do it on youtube :)
such a beautiful life","当有一个如此美丽的地方时，你真幸运
我想拥有一个这样的地方
但是我可以在YouTube上做到:)
如此美丽的生活"
26149,UgwQdehRp_7a7Gz3Xz94AaABAg.8zoNNAQmde-9-TOMF7SYno,0,"่ฐขๆ— ่จ€ i've subscribed to this channel two months ago, and i was randomly scrolling through my feed and decided to rewatch couple of her videos in her channel.
before this, i watched two long video documentaries about how chinese life in rural areas are. most of them are about children living alone, taking care of their siblings and managing livestock/farm while parents work in the city to earn money since opportunities are not enough in the countryside.
i do get your point about the whole production/business part and that there's a so-called ugliness behind the camera. though i admit, her videos about cooking inspire me and gives me comfort.
i grew up and live alone in an apartment in the city, i have always desired to live someplace like what she's showing us in her videos. i guess my whole point is yes, it may be ugly as you say behind the scenes, (hardships and all) but then again, living is full of challenges. still, i respect your opinion.","谢无言我两个月前订阅了此频道，我正在随机滚动我的供稿，并决定在她的频道中重新观看她的视频。
在此之前，我观看了两张有关中国在农村地区生活的漫长视频纪录片。他们中的大多数是关于一个独自生活的孩子，照顾兄弟姐妹和管理牲畜/农场，而父母在城市工作以赚钱，因为在农村的机会还不够。
我确实明白了您对整个生产/业务部分的观点，并且相机背后有一个所谓的丑陋。尽管我承认，她的烹饪视频激发了我的灵感，并给了我安慰。
我长大，独自生活在城市的公寓里，我一直希望住在某个地方，就像她在视频中向我们展示的那样。我想我的全部要点是，正如您在幕后所说的那样，这可能很丑陋（艰辛和所有），但再说一次，生活充满了挑战。不过，我尊重您的意见。"
12967,UgxtZQp9EvjmikfHKpl4AaABAg,0,"who are you and where did you get all that know how..you work like a full grow man...for a small lady,,you have the power of three woman maybe five...you flow in to your work like water..you my dear are awesome and one of a kind...watching you work is like a well planed play with one actor..wow!",你是谁，你从哪里得到的一切知道你的工作。 ..您亲爱的，真是太棒了，也是一种...看着您的工作就像是与一位演员一起计划精良的戏。
26124,UgwQdehRp_7a7Gz3Xz94AaABAg.8zoNNAQmde-8zzNOCGwAPW,0,maple wang it is good feeling by watching her video until you find all the unnecessary disgusting misleading lies behind it.,Maple Wang观看她的视频，直到您发现其背后的所有不必要的令人讨厌的误导性，这是很好的感觉。
26108,UgwsqXCBZyE0RDSXjEB4AaABAg,0,i feel like watching harvest moon,我想看收获月亮
12979,UgzqYxbjoDKlReAwE7B4AaABAg,0,liziqi is now part of the ccp. this is no longer a safe channel to watch or to give a thumps up . if i where you i would unsubscribe from this channel and help get it banned from youtube. the ccp will use this channel as a soft weapon. this channel is banned from up loading videos in china. this channel has now became political .,Liziqi现在是CCP的一部分。这不再是一个安全的渠道，可以观看或进行重击。如果我在哪里，我会退订此频道，并帮助将其从YouTube中禁止。 CCP将使用此通道作为软武器。该频道被禁止在中国加载视频。该渠道现在已经成为政治。
26088,UgwbcBgUdIfXWeQE-SZ4AaABAg.8zpxgw6y6kQ9H5QqMi_rTz,0,support this humble family have talent! https://www.youtube.com/watch?v=e19lg2cwmts&t=484s greetings from peru,支持这个谦虚的家庭有才华！ https://www.youtube.com/watch?v=e19lg2cwmts&t=484s问候
26037,UgzjvR1MonPZfxapOAh4AaABAg,0,"i really like to see this channel ,, almost everything i keep watching ๐๐",我真的很喜欢看到这个频道，几乎所有我一直在观看的一切
12985,UgxQPbiYEkE93d2Ap7N4AaABAg,0,"hey liziki,
this is ahmed from egypt and i watched your videos and your simple life ...
i don't know if you receive a request like what i request you ...
to be honest, i want to share you that life ... yes i really want to do it ... i get? finish ... i get bored from work that i do when my set to live a live like your ... i really want to live a

maybe you find this message strange or you find me that am idiot but i really live this simplicity
wish you receive a positive reply from your side
ahmed from egypt

hey lizhi,
this is egypt's ahmed, i watched your video and your simple life ...
i don't know if you received the requirements similar to my requirements ...
honestly, i want to share my life with you ... yes, i really want to do it ... i am bored with egyptian life ... i am bored with a doctorate degree. i don't think this will be completed ... i feel bored with work, i can't see myself ... i really want to live a life like you ...

maybe you find that the news is strange, or you find that i am an idiot, but i really hope that life is so simple
i hope you can receive your positive reply
ahamede from egypt","Hey Liziki,
This is Ahmed from Egypt and I watched your videos and your simple life ...
I don't know if you received a request like what I request you ...
To be honest, I want to share you that life ... Yes I really want to do it ... I got bored from life here in Egypt ... I got bored from my Ph.D that I feel that it will not finish ... I got bored from work that I don't see myself in ... I really want to live a life like yours ... 

Maybe you find this message strange or you find me that am idiot BUT I really wish live this simplicity
Wish you receive a positive reply from your side
Ahmed from Egypt

嘿利齐基， 
这是埃及的艾哈迈德（Ahmed），我看了您的视频和您的简单生活... 
我不知道您是否收到类似我要求的要求... 
老实说，我想与您分享生活...是的，我真的很想做... ...我对埃及的生活感到无聊...我对博士学位感到无聊，我觉得这不会完成...我对工作感到无聊，我看不到自己...我真的很想过上像你这样的生活... 

也许您发现此消息很奇怪，或者您发现我是个白痴，但我真的希望生活如此简单 
希望您能收到您的肯定答复 
来自埃及的艾哈迈德"
26012,UgwnagEuzJFKg4rW0Dx4AaABAg,0,does anyone vietnamese watch this video,有人看这个视频吗
25470,UgwslNMw1Lce6M0nLIp4AaABAg,0,u know what? whay i am always watching ur videos.. not because u showing fantastic nature... bt because it's not less than any ferrytel world๐๐๐,你知道什么吗？我一直在看你的视频..不是因为你表现出奇妙的自然... bt，因为它不低于任何渡轮世界
13282,UgwfGs812EPtsJsG5O54AaABAg,0,i am sick and i watched your video...it was so calm and peaceful,我病了，看过你的视频...太镇定和宁静了
25456,UgymvjWhT3-wZRMWjT14AaABAg,0,i just love watching you make all that wonderful food how it looks you are such an inspiration you take care of your grandmother and i am so amazed of all the different things that you make and also do love love watching your videos๐ธ,我只是喜欢看着你做所有这些美妙的食物，你真是一个灵感，你照顾你的祖母，我对你所做的所有不同事物感到非常惊讶，也喜欢喜欢看你的视频
24947,Ugxk6DC6K2EjXc--VJN4AaABAg,0,i am using a ladder to watch the oil pipe 1080p smooth and unlimited. come here to register: https://www.zionladderc.com/register/wqpcpckjw5fdjmk8hwoxcptcjskfw4xxccqlcqmwqdcc h8kxw4bckcoqcsknwqtcnsk_wrtcmskk/,"我正在使用一款梯子，看油管1080p流畅还不限流量, 来这里注册吧: https://www.zionladderc.com/register/wqPCpcKjw5fDjMK8f8OHwoXCpHDDlMKqwpTCjsKFw4XCucKawqLCqMKmwqDCh8Kxw4bCkcOQcsKnwqTCnsK_wrTCmsKK/"
13751,UgyAkeRhx6YiQtEBEjp4AaABAg,0,who's watching this during quarantine?,谁在隔离期间观看这个？
13756,Ugyr7pKohw4lBbYlj194AaABAg,0,we watch all your videos it's amazing places it's your own place,我们观看所有视频，这是您自己的地方很棒的地方
24852,UgyiDDa6tlz69ZPD3u94AaABAg.90BWA-ivq-79H5UkXlSvZ-,0,support this humble family have talent! https://www.youtube.com/watch?v=e19lg2cwmts&t=484s greetings from peru,支持这个谦虚的家庭有才华！ https://www.youtube.com/watch?v=e19lg2cwmts&t=484s问候
13766,UgxaGv0Qt7wzf7eIe6F4AaABAg,0,"every video of her i watch makes me hungry wants to eat something , i always ended up open up the fridge and grab whatever",我看着她的每一个视频都让我饿想吃东西，我总是打开冰箱，抓住任何东西
13863,Ugw7LCLPqqfjcWVUwv94AaABAg,0,"super, cool video, i watch your vidos",超级，很酷的视频，我看你的视频
24833,Ugznzla7aMx2qBtw-fd4AaABAg,0,"delicious faint ahuhu, watching the chieu dieu finished looking at the candy, the candy is so craving ๐ฐ๐",美味的淡淡的ahuhu，看着chieu dieu看着糖果，糖果是如此渴望
13894,UgxuC3yOOUo0qvxHbLR4AaABAg,0,"you all know this is chinese propaganda your,watching",你们都知道这是中国的宣传，看着
24780,Ugz5CAr4fZbq_MT9n_t4AaABAg,0,iโ€ve watched this video like 10 times but one thing i still donโ€t get... why did she put those peanuts in dirt ๐ค” does it โ€cleanโ€ them?,我看了10次视频，但是我仍然没有得到的一件事...为什么她把这些花生放在泥土中
24761,Ugy_4rEaA9oDnj9-fEV4AaABAg,0,where do this woman watched her word๐,这个女人在哪里看她的话
24739,UgzoZuIlKEcgbp9p_0R4AaABAg,0,"i feel at peace with myself while watching ur all vg videos , feeling just awesome ,,great cool environment, so much peaceful weather, i just speechless , i love mountain area,",我在观看所有VG视频时与自己保持和平，感觉很棒，凉爽的环境，如此宁静的天气，我只是无语，我爱山区，
24702,UgzyZuW467tpHsfZeel4AaABAg,0,i can always watch you without bored.,我总是可以看着你而不会无聊。
13939,UgxHekdslWFm_3rCtbF4AaABAg,0,"i just found your channel and this is the 3rd i've watched so far. what i would give to be able to live wherever you are, it looks like paradise! you're truly an inspiration. 
much love to you and your gramdma","我刚刚找到了您的频道，这是我到目前为止观看的第三次。我会奉献的东西，无论您身在何处，它看起来都像天堂！您确实是一个灵感。
非常爱你和你的革命"
24568,Ugx0lon6WF1X_kJBvJl4AaABAg,0,it is this vidos to watch unpleasant. some kind of falsehood oozes in everything. terrible.,这是看不愉快的Vidos。某种虚假的事物在所有事物中都散发出来。糟糕的。
24565,Ugzp6oU11dJU9x7x5S14AaABAg,0,"i think, i watched all of your videos. i keep repeating them. i watch other peoples' videos sometimes, but yours is the best liziqi !",我想，我看了您所有的视频。我不断重复它们。我有时会观看其他人的视频，但您的视频是最好的Liziqi！
13979,UgwFJizHrlY5wEHKGlt4AaABAg,0,i watched her videos because i miss my grandma so much. seeing her grandma makes me so happy.,我看了她的视频，因为我非常想念祖母。看到她的祖母让我很高兴。
14013,UgzpJtZ5Fc8j8jJPOLN4AaABAg,0,i always watched your videos and that cute baby sheep joined too!!,我总是看你的视频，那个可爱的婴儿绵羊也加入了！
14052,Ugy1BoLREgDnic_ECd54AaABAg,0,whats so unusual is to watch her cook and she does the same reciepes that we do and it being a different country it's amazing and i absolutely love the animal involvenent. this is just a dream vacation ( in the mind),看到她的厨师和我们做的相同的收获，这是一个不寻常的事，而且它是一个不同的国家，这真是太神奇了，我绝对喜欢动物所涉及的动物。这只是一个梦想的假期（在脑海中）
14074,UgzbjMPs2WaOmm6lSgB4AaABAg,0,hi am pranathi i started my new cooking channel on youtube yum tummy please watch it once and do subscribe if you like it /https://youtu.be/5zj5_xshplm,嗨，我是pranathi，我在youtube yum tummy上启动了新的烹饪频道，请观看一次，如果您喜欢的话，请订阅/https://youtu.be/5zj5_xshplm
24335,UgxPUVyt3KI7F4eC_H14AaABAg,0,"i love watching your videos, the music and sound helps me relax and just what youโ€re doing is awesome. iโ€m glad i found your channel last year",我喜欢观看您的视频，音乐和声音可以帮助我放松，而您的工作真是太棒了。我很高兴去年找到了您的频道
24923,UgwP7FIXZY_N8vdPpJ54AaABAg,0,watching you cook is so relaxing. i cant explain it but your videos are so therapeutic,看着你做饭真是太放松了。我无法解释，但是您的视频是如此的治疗性
24991,Ugw04Uimwmp5r-6XhsZ4AaABAg.9-yq5NvA-dW91cogatR0kP,0,"@oc-cpa since you have been in china couple of times but you are still saying western media is way more honest? then the conclusion definitely is either you are blind or you don't really live in china but just a tourist who did not pay attention to the affects what western media said to compare to the real. i suggest you to go watch a youtuber called nathan rich--an american who seriously settled down in china and worked as an software engineer in china. he have posted lots of videos to confront the western media by using his real chinese life experience. i didn't watch a lot of the western videos that nathan mentioned, but what he had explained about the chinese facts, being a chinese i had to say they were real. then you will know how the western media cheat you and how your words snapped your face.",@oc-cpa既然您曾在中国几次去过，但是您仍然说西方媒体更诚实吗？这样的结论肯定是您是盲人，或者您并不是您真正住在中国，而只是一个不关注西方媒体所说的与真实所说的影响的游客。我建议您去看一个名为Nathan Rich的YouTuber，他是一个在中国认真定居并在中国担任软件工程师的美国人。他发表了许多视频，以利用他真正的中国生活经验来面对西方媒体。我没有看过内森（Nathan）提到的很多西方视频，但是他对中国事实的解释，是中国人，我不得不说它们是真实的。然后，您将知道西方媒体如何欺骗您以及您的话如何张开您的脸。
13302,UgzpfjVVa3ZkeK9W9bF4AaABAg,0,"new village style cooking channel... must watch...
https://youtu.be/jdjtpdtq7_0","新的乡村风格烹饪频道...必须观看...
https://youtu.be/jdjtpdtq7_0"
25039,Ugy9ZJ5qGRNHWsLZvlx4AaABAg,0,i have come to love your videos! i have never experienced life the way you do. it is fascinating to watch and to learn of your customs. thank you for all you do.,我来爱你的视频！我从未像你那样经历过生活。观看和了解您的习俗是令人着迷的。谢谢你所做的事。
25392,Ugz8-Y_A-pHZsm64ndt4AaABAg,0,feel watching movies,感觉看电影
13327,Ugx65c2VAs9N02WkhFR4AaABAg,0,"god crazy, watch five hours.",上帝疯了，看五个小时。
13381,Ugwz_8z7medIzeBd2r14AaABAg.9BtUVuTpIUe9CPsk00ngmN,0,"seeing your speech, i feel that your teeth are sore. you do n’t have this opportunity to attract tens of millions of fans to watch. if you have the opportunity, do n’t say to lie to foreigners, deceive yourself, and even dare to lie to your mother.",看你这发言，感觉你的牙都酸掉了。你是没这机会吸引上千万粉丝观看，你要是有机会，别说骗外国人，骗自己人，连自己老妈都敢骗。
13397,Ugx8CWsa5Gi4YkNFv0J4AaABAg,0,"very large money for you and peeling the mask of the billionaire demon (reading all the content written in vietnamese attached under the video and watching the video will find money for you).

gift of big money for you and unmask the evil billionaire in vietnam
https://www.youtube.com/watch?v=redp-vcwx6i","给您的钱很大，剥去了亿万富翁恶魔的面具（阅读录像带上附有越南语和观看视频的所有内容将为您找到钱）。

给您的大笔礼物，揭露越南邪恶的亿万富翁
https://www.youtube.com/watch?v=Redp-vcwx6i"
25207,UgwxyYhfBh2RDoqo08V4AaABAg.9-cyi9msPXs9-iZAzWzEMt,0,no who is watching on october comments. people just appreciating her true talent,不，谁在看十月的评论。人们只是欣赏她的真正才能
