,cid,votes,含watch,含watch中文翻译
35999,UgyhyXflybsr2hUCb_B4AaABAg.8uYsqKM0ju78uiXH6QAMZ6,0,"thomas byfield yes in lots of cases but just watch the video & you can see that the puppies are very hungry so obviously not overfed in any way, which is a big difference, itโ€s cruel!",托马斯·比菲尔德（Thomas Byfield）在很多情况下是的，但是只需观看视频，您就可以看到幼犬很饥饿，因此显然不会以任何方式过分，这是一个很大的不同，这是残酷的！
5961,UgwjlnP3486XOBXq4ux4AaABAg.9NH1qn1K_tS9QKqxL8dtS0,0,"1, 
https://ok.me/qhil?nanoko official service


#thank you for pointing out everyone am!
thank you for the reorganization of the live distribution! the live distribution on this day was quite ridiculous! more than 10,000 people were watching (laughs). it was also exciting that i forgot to cut the camera and did one! i have to be careful in the future ...

! 
it is! #live distribution on this day was#very ridiculous! #more than 10,000 people were watching (#laughs)#after all the ginseng is the best! #it was exciting to have forgotten to cut the camera,#in the history of the person,#strong,#strong, #shinjin japanese ingredients 具 具 具 氏 氏 氏 氏 氏 氏 氏 氏 氏 氏 氏 族 氏mid -vulnerable, #less `'#morawa poverty. #shinsei, #survanity of human beings, a trivial refusal,#deprivation, a basic basic demand 們 們 種 種 種 種 種 種.#說 food, #stiflers, so refusal people. #contrary, #asshikai kai -kai, a quick -sighted meat, a nuakenhiro 找 找 找 找 找 找#other 們 kokai ryo, #cuts,#seasoning wako -puy -like vegetable japanese meat, #sdatistic food market for home -based households 蔬 蔬 蔬 蔬 蔬 蔬 蔬 蔬 會 會 會 會 且 且 且 且 且#malph peach powdering shiroki #shinical food stewed weather","1，
https://ok.me/qhil?nanoko正式服务


＃感谢您指出所有人！
感谢您对现场发行的重组！这一天的现场演出非常荒谬！有10,000多人在看（笑）。我忘了切开相机并做一台相机也很令人兴奋！我将来必须小心...

！
这是！ ＃这一天的活力分布非常荒谬！ ＃超过10,000人正在观看（#laughs）＃在所有人之后，所有人参是最好的！ ＃在人的历史上忘记剪相机非常令人兴奋， #less`'#Morawa贫困。 #shinsei，#survanity of humans，一个琐碎的拒绝，＃剥夺，基本的基本需求们们种种种种。 #contrary，#asshikai kai -kai，快速壮观的肉，nuakenhiro找找找找找找＃其他们kokai ryo，＃剪切，＃调味wako -puy -puy -like菜日本肉，#Sdatistic Food Market for Home -Bate -Bate -Bate -Bate -Bate -Bate -Bate Highths蔬蔬蔬蔬蔬蔬蔬蔬蔬蔬蔬蔬Shiroki #shinical Food炖天气"
40913,UgzB8xl3FKlySReTglN4AaABAg,0,where's the brazilians who also watch here,也在这里看的巴西人在哪里
40873,Ugw6I2v9ANaeVGoT6I54AaABAg,0,when u say i don’t want a wife then watch this,当你说我不要妻子时，请看这个
4549,UgxYWBIs8cJtqDuPUlR4AaABAg,0,i watched this while i ate a burrito that i heated-up in the microwave. i thought i was fairly clever because i sprinkled shredded cheese on it. but then i saw the most advanced popcorn maker ever invented...has elon seen this thing?,当我吃了一个墨西哥卷饼时，我在微波炉中添加了墨西哥卷饼。我以为我很聪明，因为我在上面撒了切碎的奶酪。但是后来我看到了有史以来最先进的爆米花制造商...埃隆看过这件事了吗？
40854,UgwmzKiKzLOvz7b-Zb94AaABAg,0,nice video for watch!,不错的观看视频！
4578,Ugzdlqd2X-jwtt68GoZ4AaABAg,0,i used to watch with someone. rmb this relaxing sound and peaceful view,我曾经和某人一起看。 rmb这种轻松的声音和和​​平的景色
40839,UgwzGrh0NUavG9WtWhx4AaABAg.8s6GsnCI1AM8sFnb932d2R,0,"i also laughed at huangdi, and ziyi also posted a clarified video. the comment did not know if her face had pain. the problem of constantly focusing on copyrights in china is obviously because vietnamese people think that we do not use oil pipes and the possibility of being reported very small, so i dare to be so bold. commenting this spiritual vietnamese, i still have to say that i will control china. do i be the general administration of radio, film and television. watching a video, i have to control whether the domestic plagiarism is placed.",黄帝 我也是笑了，子柒也发了澄清的视频，那位评论不知道脸有没有打痛。国内也在不断抓版权的问题，说真很明显的是因为越南人觉得我们不太用油管，被举报的可能性很小，才敢这样子明目张胆。评论这位精神越南人，还要怼我说管好中国自己，难道我是广电总局吗，看个视频，我还得管国内是不是抄袭。
40825,UgxEzmqmVPfilaHBxid4AaABAg,0,i m pure vegetarian but watch all vedios because of beautiful views of nature. really she leaves in heaven...i love the background music and of course of her she is beautiful hardworking and cute...,我纯粹是素食主义者，但由于自然的美丽景色，请观看所有的Vedios。她真的留在天堂里...我喜欢背景音乐，当然她是美丽的勤奋和可爱的...
40813,UgygiPblsNc1d-o436Z4AaABAg,0,https://www.youtube.com/watch?v=p3ihxw2c0io,https://www.youtube.com/watch?v=p3ihxw2c0io
40916,UgzBvM1PEPGR-Y4CNBJ4AaABAg,0,after watching your videos my love towards mother nature has become even stronger .... love you,观看了您的视频后，我对大自然的爱变得更加强大。...爱你
40808,Ugw-EW2_V443R6ul_9N4AaABAg,0,"i love the animals ..so innocent
the sound of the leaves
it seems like i am watching studio ghibli","我爱动物。
叶子的声音
好像我正在看吉卜力工作室"
40779,UgzpAGNaxo9ITE1NNb94AaABAg,0,i watched all your videos and they're so amazing....,我看了你所有的视频，它们真是太神奇了。
36154,Ugxt3ITMr9yTS46twch4AaABAg,0,you work so hard! i really enjoyed this video! can't wait to watch more!,你这么努力！我真的很喜欢这个视频！等不及要看更多！
4873,UgynS23BsBEpfK25JPB4AaABAg,0,"your video is great, i want to watch more",你的视频太棒了，我想看更多
40767,Ugy_YN-D2mcSNB_kkJJ4AaABAg,0,"this year's preparation makes the population water, and watch your video stomach in the middle of the night.",这年货备的让人口水直流，深夜看这你的视频肚子会叫。
34766,UgyJ--dXaTp5kdRYc3p4AaABAg,0,soooo nice to watch :) but its so cute when the young woman really shocked,太好了
40756,UgwfWMPgSWRM-sl-q9N4AaABAg,0,watch out in the middle of the night (• ˍ • ̀ू),半夜看好饿( •̥́ ˍ •̀ू )
36043,UgyLP5tnAgn2PmNE6nB4AaABAg,0,i would watch such culinary shows,我会看这样的烹饪表演
34709,Ugz6DnEo6Cro_VOHBg14AaABAg,0,i watched all your videos in one day. very nice and there is a lot of effort๐‘๐ผ๐‘๐ผ๐‘๐ผโค๏ธ๐‘๐ผ,我一天之内观看了您所有的视频。非常好，有很多努力
34598,UgwsmwvcLDkPPQyKcIB4AaABAg.8uzOrtFqjkV9H5Qr75BHXX,0,support this humble family have talent! https://www.youtube.com/watch?v=e19lg2cwmts&t=484s greetings from peru,支持这个谦虚的家庭有才华！ https://www.youtube.com/watch?v=e19lg2cwmts&t=484s问候
41083,UgxL7zHQ-lWqBkFpYEh4AaABAg,0,all of your snacks are lovely it was a complete privilege to watch this video much apreciated!!!,您所有的小吃都很可爱，观看这部视频的完全荣幸！！！
41273,UgxDEjQkdhC793I3bI14AaABAg,0,this video has been in my recommendation for weeks now and i finally watched it. totally subscribing,该视频已经在我的推荐中已有数周了，我终于观看了它。完全订阅
6323,Ugzedd4O0AZRS7TRvQh4AaABAg.9MNhHWy29tp9P3919E5DMR,0,https://www.youtube.com/watch?v=9s31nnbflwi,https://www.youtube.com/watch?v=9S31NNBFLWI
34621,UgzFVnsBM89-lsuM0LJ4AaABAg,0,how good video does not have vietnamese people watching,好视频如何没有越南人观看
41210,UgwtlZoiJomipHYNJ3B4AaABAg,0,i like that type of girl...whenever i watch her video i could see the true behaviour n personality of a girl...,我喜欢那种女孩...每当我看她的视频时，我都会看到一个女孩的真实行为n ...
4486,Ugwz5m5IuQNV1IqtCf14AaABAg,0,"the most favorite of this ly tu that, after watching this reason, she likes to skillfully talented so much that they can do it",李李（Li）最喜欢的是，李李（Li Li）喜欢巧妙的才华，但也可以做到这一点
4502,UgyKJopNxsi71Mhm9a94AaABAg,0,i have just came across this and after watching it all i can say what a wonder world i hope you live forever.,我刚刚遇到了这一点，看完了一切，我可以说一个奇迹世界，希望您永远活着。
41132,UgyC4sYUvimfeAaT4Ll4AaABAg,0,holy cow. what in the world did i just watch? it was absolutely amazing!!!!!,天啊。我刚刚看过世界什么？绝对太神奇了！
41080,Ugy2nvkO2kxzKBpZFF94AaABAg,0,peaceful to watch after a long day,漫长的一天之后观看
40989,UgzBDr7-Hs15wNz-S3x4AaABAg,0,the shooting style is perfect and unique. the craftsmanship is in place. i feel watching the promotional video,拍摄风格完美，眼光独到。手艺利落到位。 感觉在看宣传片
34626,UgziqIwHUIudOuFyYj94AaABAg,0,honestly....i dont know y i am here๐....but i just love watching dis videos,老实说....我不知道你在这里
41072,UgwWlz7JOyqLszNxbCJ4AaABAg,0,"i quit eating meat, probably before you were born, but this was still so nice to watch. and i love that your oven looks like a cat! :¬)",我可能在你出生之前就戒掉吃肉，但这仍然很高兴。我喜欢你的烤箱看起来像猫！ ：¬）
41035,Ugzbx3Cd3fHYwa1oSvB4AaABAg,0,"i was watching miniature food videos; how did i get here x'd?
similarly, fantastic material","我正在看微型食品视频；我是怎么到达这里x的？
同样，奇妙的材料"
34643,Ugzh7Wrl08aKQIOJHpx4AaABAg,0,"foreigners feel novel when watching this, we look at this feeling, this is what we canโ€t return",外国人看这个感觉新奇，我们看这个感觉怀念，这是我们回不到的曾经
41030,UgxXVV1X66B41yFBS8Z4AaABAg,0,oh hoho... i feel so satisfy when i watch it,哦，hoho ...当我看着它时，我感到非常满意
34659,UgyAioG4T94Ib3ToW8l4AaABAg,0,12 years of study and then i watch this woman and i just wana end it all. like wasted.,学习了12年，然后我看着这个女人，然后我才结束了这一切。像浪费。
40993,UgwUJFZLoX5C9c-BJ_B4AaABAg,0,"i don't think i'll ever get bored watching your videos. the food you make just looks too good, and the music is very calming.",我认为我不会无聊地观看您的视频。您制作的食物看起来太好了，音乐也很平静。
35173,UgyoQ22FTE7CBFzC4qx4AaABAg.8ukF8x1n6m-95HVQ9_6Lqo,0,i'm also cooking chinese food๏ผwelcome to watch,我也在烹饪中国菜，欢迎观看
6100,UgyXC4IhQ3PJ0Z12Pcx4AaABAg.9MtsT6vjAlc9P39hWHvy8b,0,https://www.youtube.com/watch?v=9s31nnbflwi&list=uupona_ismmsxzbexkrnivyg&index=2,https://www.youtube.com/watch?v=9S31NNBFLWI＆list = uupona_ismmsxzbexkrnivyg&index=2
36375,Ugx6AwUN4-E8M-y8IgF4AaABAg,0,i love your videos so much ! i feel free while watching it and i started to see my life in a new perspective,我非常喜欢你的视频！我在观看时感到自由，我开始从新的角度看自己的生活
35939,Ugxy7FWYfYuT9JVoPXd4AaABAg,0,where does she live?! why is this place so beautiful?! just watching one video making me feel at peace!! <3,她住在哪里？！为什么这个地方这么美丽？只是看一个视频让我感到和平！ <3
36284,UgxhVVilyM3gpTQ7JdB4AaABAg,0,anyone just binge watching her or is it just me ๐,任何只是狂暴看着她还是我只是我
36307,UgwDS80cmMG_MC8FRUN4AaABAg,0,"watch this clip is over. fall in love with you. very good. can do many things. in addition, the atmosphere is good.
when i had watched this video clip, i was fallen in love you, sis. so amazing, you're versaile. nice atmosphere.","观看此剪辑已经结束。爱上你。很好。可以做很多事情。此外，气氛很好。
当我观看这个视频剪辑时，我陷入了爱你，姐姐。太神奇了，你是Versaile。气氛很好。"
36313,UgwdblEVDuJ8IY7Hpkl4AaABAg.8uWWAQqRoLM9H5UcSky7YU,0,support this humble family have talent! https://www.youtube.com/watch?v=e19lg2cwmts&t=484s greetings from peru,支持这个谦虚的家庭有才华！ https://www.youtube.com/watch?v=e19lg2cwmts&t=484s问候
35638,Ugy5Ts1F8Y165wzFfTZ4AaABAg,0,dont watch high,不要看高
35643,Ugzpsr4gRiYVmbkAFX54AaABAg,0,"biggest mangoes i've ever seen!!! its so funny how your fruit is on such a different schedule than american fruit. this is so cute and sweet and calming. those little animals love her so much, you can tell she's a kind person. i could watch her do random chores all day.",我见过的最大芒果！！！您的水果与美国水果的时间不同，真是太有趣了。这是如此可爱又甜美。那些小动物非常爱她，你可以告诉她她是一个善良的人。我可以看着她整天做家务。
37157,UgxAcnyYFgvVZavwteB4AaABAg.8uIPcIzIf0y8uWMkTk5kju,0,@neadowaa what is the problem that peace feels watching a video,@neadowaa和平看视频有什么问题
37130,UgwA-4glOyOblf3Vlat4AaABAg.8uJNdG3PRmb9H5UdEFLzrn,0,support this humble family have talent! https://www.youtube.com/watch?v=e19lg2cwmts&t=484s greetings from peru,支持这个谦虚的家庭有才华！ https://www.youtube.com/watch?v=e19lg2cwmts&t=484s问候
5700,UgwFofQEUR1ml_w4_Td4AaABAg.9NvuSdYzuEJ9P39v5SiSNk,0,https://www.youtube.com/watch?v=9s31nnbflwi&list=uupona_ismmsxzbexkrnivyg&index=2,https://www.youtube.com/watch?v=9S31NNBFLWI＆list = uupona_ismmsxzbexkrnivyg&index=2
37197,Ugy45CqO2t-yR-Z3CG54AaABAg,0,i admire this girl. i watch and fill it with life.,我很欣赏这个女孩。我看着并充满了生活。
37095,UgyEGa7S8OEs6vHDGF14AaABAg.8uKAG1ThWGP9H5QaQEfuy7,0,support this humble family have talent! https://www.youtube.com/watch?v=e19lg2cwmts&t=484s greetings from peru,支持这个谦虚的家庭有才华！ https://www.youtube.com/watch?v=e19lg2cwmts&t=484s问候
5722,UgwXlWieKBbG6nl6fU14AaABAg.9NtRlr4ulxW9P399TQn9pA,0,https://www.youtube.com/watch?v=9s31nnbflwi,https://www.youtube.com/watch?v=9S31NNBFLWI
5724,Ugx4BIN-0lZqai7ihW54AaABAg.9NqWgfy0N6h9P38vrv-bRv,0,https://www.youtube.com/watch?v=9s31nnbflwi,https://www.youtube.com/watch?v=9S31NNBFLWI
5754,UgwSXErNG6WxdIQ7qHF4AaABAg.9NpXR-tB8y19P39qJnqQl1,0,https://www.youtube.com/watch?v=9s31nnbflwi&list=uupona_ismmsxzbexkrnivyg&index=2,https://www.youtube.com/watch?v=9S31NNBFLWI＆list = uupona_ismmsxzbexkrnivyg&index=2
36984,UgwFYQu0ZjqOQGWD12d4AaABAg.8uLfY_QL-Tn9Y_pyx8bTxe,0,"hello, i invite you to watch a very beautiful and attractive video of cooking sour meat and playing in the snow and building an eskimo house in the jewel of ramsar in northern iran: https://youtu.be/wwqwqqybzkm",您好，我邀请您观看一个非常美丽而有吸引力的视频，烹饪酸肉，在雪地里玩耍，在伊朗北部拉姆萨尔（Ramsar）的珠宝中建造一所爱斯基摩人的房子：https：//youtu.be/wwqwqqybzkm
35674,UgzALFf8MWcL-XGo0vl4AaABAg,0,i'm going to base one of my characters off of you. this is so peaceful to watch.,我将把我的角色之一源自您。这真是太平了。
6002,UgwG-0fTYl3Nd0zN2Cd4AaABAg,0,watched the same video for 14 times,观看了14次的同一视频
37167,Ugx53ikOozuft6vEb5d4AaABAg,0,i don't know how i came here but i'm so happy watching this. it is the life i want to live. i would like to see the dogs eating too!!,我不知道我是怎么来这里的，但我很高兴看着这个。这是我想过的生活。我也希望看到狗在吃东西！
6038,UgyQRQ4VAky5pELJw7Z4AaABAg.9N2Fx4D9RUC9P38z7drPrZ,0,https://www.youtube.com/watch?v=9s31nnbflwi,https://www.youtube.com/watch?v=9S31NNBFLWI
36965,UgwFYQu0ZjqOQGWD12d4AaABAg.8uLfY_QL-Tn9AH75bU4wwi,0,"when watching these videos, i feel calm in my heart",看这些视频时，我感到内心平静
37333,Ugzk99N67kzfjuFT4sN4AaABAg,0,"my sister just showed me one of her videos from her cellphone a few days ago. and now its on my recommendations on my cellphone. i dont even watch cooking show videos. so weird. but then again, thank you, youtube. this is absolutely relaxing to watch. i dont mind having it on my recommendarions. ๐",几天前，我姐姐刚刚给我看了她手机上的一部视频。现在，这是我在手机上的建议。我什至不看烹饪表演视频。太奇怪了。但是话又说回来，谢谢，YouTube。这绝对是放松的。我不介意在推荐方面拥有它。
35575,Ugwf9fyp6MccjJF29s54AaABAg,0,i almost fell asleep while watching her doing stuff flawlessly,看着她完美地做事时，我几乎睡着了
37476,Ugyndh60NIzjCRSMCKh4AaABAg,0,thanks for sharing your life. i can watch it all day long,感谢您分享您的生活。我可以整天看
5654,Ugyl0Pz_U8gUSx2ApO94AaABAg.9O3yme2awde9P39sP25LLV,0,https://www.youtube.com/watch?v=9s31nnbflwi&list=uupona_ismmsxzbexkrnivyg&index=2,https://www.youtube.com/watch?v=9S31NNBFLWI＆list = uupona_ismmsxzbexkrnivyg&index=2
37463,UgzYv3P33EcNOrSFcIF4AaABAg,0,"i love the place even i haven't visit it yet (': and how beautiful is the girl with her abilities. idk, but i'm very speechless everytime i watch her video. please keep share your video cz i enjoy it soo much.",我喜欢这个地方，即使我还没有访问它（'：'：这个女孩的能力有多美丽。 。
37413,UgxitGSzrxqvzrwjQ6t4AaABAg,0,"https://www.youtube.com/watch?v=tcv7lvapzdi&feature=share
please visit your home vegetable garden in vietnam and support your channel. thank you m.n","https://www.youtube.com/watch?v=tcv7lvapzdi&feature=share
请访问您的越南家庭菜园，并支持您的频道。谢谢你"
5679,UgzuMXRkJq3I41oX24t4AaABAg.9O-1iClvfCW9P39eTlDJmf,0,https://www.youtube.com/watch?v=9s31nnbflwi&list=uupona_ismmsxzbexkrnivyg&index=2,https://www.youtube.com/watch?v=9S31NNBFLWI＆list = uupona_ismmsxzbexkrnivyg&index=2
37343,UgyFfz0CpWN3G_5BZtR4AaABAg,0,itโ€s worth to watch this all day,整天都值得看
37301,UgzozkkvECbGckNn9mN4AaABAg,0,"watch your video in insomnia, very good",失眠来看你视频，很不错
37280,UgzsOJw5oLPhjWGBUuR4AaABAg.8uCns5ObPCa9H5Qiguvbfs,0,support this humble family have talent! https://www.youtube.com/watch?v=e19lg2cwmts&t=484s greetings from peru,支持这个谦虚的家庭有才华！ https://www.youtube.com/watch?v=e19lg2cwmts&t=484s问候
37293,UgzsOJw5oLPhjWGBUuR4AaABAg.8uCns5ObPCa9Y_pi-5lLjE,0,"hello, i invite you to watch a very beautiful and attractive video of cooking sour meat and playing in the snow and building an eskimo house in the jewel of ramsar in northern iran: https://youtu.be/wwqwqqybzkm",您好，我邀请您观看一个非常美丽而有吸引力的视频，烹饪酸肉，在雪地里玩耍，在伊朗北部拉姆萨尔（Ramsar）的珠宝中建造一所爱斯基摩人的房子：https：//youtu.be/wwqwqqybzkm
37292,UgzsOJw5oLPhjWGBUuR4AaABAg.8uCns5ObPCa9XjGWyqHHOf,0,there is all about liziqihttps://m.youtube.com/watch?v=otorjoc0gym,关于liziqihttps：//m.youtube.com/watch？v = otorjoc0gym
36246,Ugw3qr-9--BZV3PyiBJ4AaABAg.8uWwTpNqXib9H5QuEg9XqS,0,support this humble family have talent! https://www.youtube.com/watch?v=e19lg2cwmts&t=484s greetings from peru,支持这个谦虚的家庭有才华！ https://www.youtube.com/watch?v=e19lg2cwmts&t=484s问候
37291,UgzsOJw5oLPhjWGBUuR4AaABAg.8uCns5ObPCa9XZ27H6OFMQ,0,https://www.youtube.com/watch?v=otorjoc0gym,https://www.youtube.com/watch?v=OtorJoc0gym
35591,Ugze0tW2KFOUJTl5c7R4AaABAg,0,i could see her in a studio ghibli film. also this is like watching a documentary so i wonder who's filming,我可以在吉卜力录音室电影中看到她。这也就像看纪录片，所以我想知道谁在拍摄
36283,UgwLOtJ-9Nt8WmsF45N4AaABAg,0,i love watching these videos,我喜欢看这些视频
37284,UgzsOJw5oLPhjWGBUuR4AaABAg.8uCns5ObPCa9O-eVgNBGHU,0,https://www.youtube.com/watch?v=ol9u0sjp6qi,https://www.youtube.com/watch?v=ol9u0sjp6qi
36974,UgwFYQu0ZjqOQGWD12d4AaABAg.8uLfY_QL-Tn9H5QVhwXa_Q,0,support this humble family have talent! https://www.youtube.com/watch?v=e19lg2cwmts&t=484s greetings from peru,支持这个谦虚的家庭有才华！ https://www.youtube.com/watch?v=e19lg2cwmts&t=484s问候
36958,UgwFYQu0ZjqOQGWD12d4AaABAg.8uLfY_QL-Tn96hqJA_R6Xn,0,im feel also peace when om watching too โบ,我也看着我也感到和平☺
35543,UgwkL_th2Wv6XdD0HS94AaABAg,0,"omg everytime i see her use the cat oven, i get excited, that was one of her first videos and i watched it when she first posted it, she's come a long way from then",天哪，每当我看到她使用猫烤箱时，我都会感到兴奋，那是她的第一个视频之一，当她第一次发布时，我就看了看它，从那时起，她走了很长一段路
36511,UgzkAYWIuw6zTALizVh4AaABAg,0,her videos looks so natural...like before we had gas stoves and such this is how things made and cooked traditionally its so soothing to watch๐’“,她的视频看起来很自然...就像我们有燃气炉之前一样，这就是事物传统上制作和烹饪的方式，它是如此舒缓的观看
36596,Ugz4ucYZI6N-r4WcsId4AaABAg,0,"why is all this food being prepared? it's beautifull, incredible to watch, makes you really wonder at all the work that went into feeding a family trhough winter before convenience stores and refrigerators, but still, is she prepararing all this food for her family, for video, for sale?",为什么准备所有这些食物？这是美丽的，令人难以置信的观看，让您真的很想知道在便利店和冰箱之前喂养一个家庭的所有工作，但是她是否还是为家人准备所有这些食物，以供视频出售？
5812,UgyK-XA_36ouU70ty6l4AaABAg.9NbbQknz5L99QKqw5HeEjN,0,"1, 
https://ok.me/qhil?nanoko official service


#thank you for pointing out everyone am!
thank you for the reorganization of the live distribution! the live distribution on this day was quite ridiculous! more than 10,000 people were watching (laughs). it was also exciting that i forgot to cut the camera and did one! i have to be careful in the future ...

! 
it is! #live distribution on this day was#very ridiculous! #more than 10,000 people were watching (#laughs)#after all the ginseng is the best! #it was exciting to have forgotten to cut the camera,#in the history of the person,#strong,#strong, #shinjin japanese ingredients 具 具 具 氏 氏 氏 氏 氏 氏 氏 氏 氏 氏 氏 族 氏mid -vulnerable, #less `'#morawa poverty. #shinsei, #survanity of human beings, a trivial refusal,#deprivation, a basic basic demand 們 們 種 種 種 種 種 種.#說 food, #stiflers, so refusal people. #contrary, #asshikai kai -kai, a quick -sighted meat, a nuakenhiro 找 找 找 找 找 找#other 們 kokai ryo, #cuts,#seasoning wako -puy -like vegetable japanese meat, #sdatistic food market for home -based households 蔬 蔬 蔬 蔬 蔬 蔬 蔬 蔬 會 會 會 會 且 且 且 且 且#malph peach powdering shiroki #shinical food stewed weather","1，
https://ok.me/qhil?nanoko正式服务


＃感谢您指出所有人！
感谢您对现场发行的重组！这一天的现场演出非常荒谬！有10,000多人在看（笑）。我忘了切开相机并做一台相机也很令人兴奋！我将来必须小心...

！
这是！ ＃这一天的活力分布非常荒谬！ ＃超过10,000人正在观看（#laughs）＃在所有人之后，所有人参是最好的！ ＃在人的历史上忘记剪相机非常令人兴奋， #less`'#Morawa贫困。 #shinsei，#survanity of humans，一个琐碎的拒绝，＃剥夺，基本的基本需求们们种种种种。 #contrary，#asshikai kai -kai，快速壮观的肉，nuakenhiro找找找找找找＃其他们kokai ryo，＃剪切，＃调味wako -puy -puy -like菜日本肉，#Sdatistic Food Market for Home -Bate -Bate -Bate -Bate -Bate -Bate -Bate Highths蔬蔬蔬蔬蔬蔬蔬蔬蔬蔬蔬蔬Shiroki #shinical Food炖天气"
5838,UgwYguB2IxuCXlyNvUd4AaABAg.9NZtbI5REye9P38zevDg9D,0,https://www.youtube.com/watch?v=9s31nnbflwi,https://www.youtube.com/watch?v=9S31NNBFLWI
5840,Ugxy--x-Q8O-MBRmENF4AaABAg.9NZ1zuB0EYM9P394A-S05x,0,https://www.youtube.com/watch?v=9s31nnbflwi,https://www.youtube.com/watch?v=9S31NNBFLWI
5842,UgzTFSLGgoLJwWrZZzN4AaABAg.9NXvJmo6rCK9P38xIB7ozY,0,https://www.youtube.com/watch?v=9s31nnbflwi,https://www.youtube.com/watch?v=9S31NNBFLWI
36525,Ugw9xkrDZ5NcNtbukKV4AaABAg,0,the top of beauty and a very picturesque nature. enjoy watching your channel a lot. i hope that i live with you for a week to share with you what you are doing ๐,美丽的山顶和风景如画的天性。喜欢看很多。我希望我和你一起生活一个星期，与你分享你在做什么
5843,UgzTFSLGgoLJwWrZZzN4AaABAg.9NXvJmo6rCK9P39gfzQYRe,0,https://www.youtube.com/watch?v=9s31nnbflwi&list=uupona_ismmsxzbexkrnivyg&index=2,https://www.youtube.com/watch?v=9S31NNBFLWI＆list = uupona_ismmsxzbexkrnivyg&index=2
36486,UgzRoGS8_2Jr-4SuPrJ4AaABAg,0,i will watch everyday before food ๐คฃ๐คฃ๐คฃ๐คฃ,我每天都会看食物
36605,Ugz45VoENGPeUMRpOtF4AaABAg,0,i feel like iโ€m watching a ghibli movie itโ€s so intriguing:3,我觉得我正在看吉卜力电影，这很有趣：3
5976,UgxoEEsfv-s9K_EX9yR4AaABAg,0,"the videos are very peaceful, i always watch. very hardworking and beautiful girl.",视频非常和平，我总是看。非常勤奋和美丽的女孩。
36453,UgzUfX2QjSOsIev1h2R4AaABAg,0,so calming i can watch these all day ๐,所以平静我可以整天观看这些
5847,UgzyavPjUynsE9U9rAl4AaABAg,0,anyone else watching to sleep?,还有其他人看着睡觉吗？
