,cid,votes,含watch,含watch中文翻译
39148,Ugxusw9kTf3tT2823TV4AaABAg,2,"it is not easy to edit this peaceful program. it needs to be close to a gas field to achieve it. each category is just right.
very good, thank you for sharing :) calm, quiet, gentle and comfortable, wisdom, i also see the wisdom of quaint folk, praise !!!! very healing the injuries brought by the city!

i prefer the temperament of the heroine when i don't deliberately dress up with light makeup! very clip! like! ^^
really done ... can stay away from the hustle and bustle for a while,
specific display ... it can be lived, simple, simple and natural, but also live neat and comfortable (although it is not easy)
being able to surround the mountains of gaoli water every day, the air is fresh, the mountains are full of flowers and precious medicinal materials, and the mountains are used to tell the mountains.
you can also choose intermittently .... contacted with today's scientific and technological life ...
if there is a harmonious companion, chun went to qiulai to support the old, this kind of life ... no demand !!!
looking ... watching .... live in the taiji gas field health ... this film is indeed ... rare soul health soup! thank you for sharing :)","编一辑这宁心的节目, 真不容易, 需要有接近的气场走在一起才能成就, 每一范畴每一个配合刚刚好, 
很好佷好, 多谢分享:) 从容, 恬静, 轻柔舒服, 智慧, 还见识到古朴民间的智慧, 赞!!!! 很治愈都市带来的伤!

较喜欢女主角不刻意装扮淡妆时的气质! 很夹! 赞!^^ 
真的做到了...可远离尘嚣一会, 
具体展现了...可以活得既古朴简单自然的同时, 又能整洁舒适不匮乏地生活着 (虽不太易) 
能每天环抱高山高丽水而居, 空气清新, 山峦满是鲜花鲜果及珍贵药材, 用画面诉说了靠山食山, 
又能间歇地选择....与现今科技生活联系着.....看日出观日落, 看银河晚星,! 依四时阴阳作息! 还何求!! 
若有位和谐伴侣春去秋来恩爱扶持到老, 这种生活...无求矣!!! 
看着...看着....活像进入了太极气场养生里...这片的确是...难得心灵养生汤! Thank you for sharing :)"
29263,Ugzgbu78Oe3wkNMSiaN4AaABAg,2,"when the popcorn flowers, the mother -in -law would be too loud to be scared and intimately to help her mother -in -law cover her ears. as a result, she jumped up! i watched it repeatedly several times and fixed it, it was so cute!",爆米花时怕太大声婆婆会吓到、贴心的赶快去帮婆婆捂住耳朵，结果反而自己吓的跳了起来！我反覆看了好几遍、还定格看，真是太可爱了！
19915,UgzaBfgu3T6fjrfPftd4AaABAg,2,watching her is so relaxing. what a beautiful life ❤,看着她是如此放松。多么美好的生活❤
5523,UgxdKQ-ERMIpDKBaupZ4AaABAg,2,i feel so refreshing after watching this,看完这个后，我感到非常清爽
16447,UgzShS_TdCNk4AaiYZJ4AaABAg.98g2_m4a6ks99-bkEpb_vN,2,"i watched it now, what kind of video is this?",我现在看了看，这是什么样的视频？
5716,UgxBvyx2ZRh6iUf5yZ54AaABAg,2,"more than turkey's population, people watched the video. whoa!!",人们观看了视频，而不是土耳其的人口。哇！
36931,UgwFYQu0ZjqOQGWD12d4AaABAg.8uLfY_QL-Tn8udLgoFn7Bh,2,i agree everything is done with grace and order very relaxing to watch,我同意一切都用恩典和秩序来看，非常放松
36912,UgxpA159fDl9K_EzTex4AaABAg,2,"this life is so peaceful and beautiful. i know iโ€m not cut out for it though, i could never survive. but watching this makes me feel at peace and itโ€s wonderful.",这种生活是如此和平与美丽。我知道我没有为此削减，我永远无法生存。但是看着这让我感到和平，这很棒。
36520,UgyfmxUqcg2NALkaT9Z4AaABAg,2,great content! so satisfying to watch โคโค can anyone tell me her channel name english romanised? sorry i can't read chinese,很棒的内容！如此满意的观看❤❤有人能告诉我她的频道名称英语罗马人吗？对不起，我看不到中文
45254,UgwSmhixtbmWusmaFWV4AaABAg.8r6oeZAmFa-8rDj0w8H1pF,2,finding forest you are watching one! this is a very sweet channel but it's not real.,找到森林，你在看一个！这是一个非常甜蜜的频道，但不是真实的。
18849,UgwbibGMiyzwPEpnF_94AaABAg.96UIVx8UAMx97JOXmLOx12,2,"i think the dislikes come from an article which stated this girl's life is fake and it's a show. that she doesn't do everything on her own but there's a lot of props, people helping behind the scenes and camera crew. many people felt disenchanted her life wasn't accurate. i personally feel they were trying to portray a beautiful rural living of china. i don't see it the same way after i read the article but still enjoy watching because it's something we can all strive to have: our own land with food, resources.",我认为不喜欢的是一篇文章，说这个女孩的生活是假的，这是一场演出。她没有自己做所有事情，但是有很多道具，人们在幕后和摄制组中提供帮助。许多人感到自己的生活不准确。我个人觉得他们试图描绘中国美丽的乡村生活。在阅读文章后，我看不到相同的方式，但仍然喜欢观看，因为这是我们所有人都可以努力拥有的东西：我们自己的土地，带有食物，资源。
35937,Ugz2FSqN-qUlR_ocPFl4AaABAg,2,i am not sure if watching these videos is runing my self confidence or incouraging me to do and try new things,我不确定观看这些视频是否在运转我的自信心或矛盾我去做新事物
17102,UgxIm2cLMq9lziWb_wZ4AaABAg,2,the music in this video makes me feel like watching asian drama when the main female lead is a girl like that working hard in life lol,这段视频中的音乐使我感觉就像看亚洲戏剧时，当主要女主角是一个像这样努力工作的女孩大声笑
225,UgyIigIwllPgus_m7K94AaABAg,2,i love watching this over and over,我喜欢一遍又一遍地看
17922,UgzDvK01DKLdUHKPc-54AaABAg.97SFFb4Mpvv97uU6zBOi0n,2,https://youtu.be/1dfifxo4ndm watch this link guy's pres bell icon great ideas https://youtu.be/1dfifxo4ndm,https://youtu.be/1dfifxo4ndm观看此链接的人的贝尔图标很棒的想法https://youtu.be/1dfifxo4ndm
52517,Ugw-pcRNxuoZHyLXwup4AaABAg,2,anyone is watching as i do not like to see vietnam,任何人都在看，因为我不喜欢看越南
328,UgyS-kZoiAgsON0b1ut4AaABAg,2,"so cute, dear! long time no video i have to watch the old one",好可爱，亲爱的！长时间没有视频，我必须观看旧视频
52469,UgwBrYYsdOi8CVjxMq14AaABAg,2,i really love watching your videos. when im tired suddenly people wants to get rest but me not. cause before i sleep i watch your video first,我真的很喜欢看你的视频。当我疲倦的时候突然想休息，但我不是。因为我睡觉前我先看你的视频
52317,UgwVOJ3oBIuzUP109x94AaABAg,2,hope your video is longer. i watched your video every time ...,希望每次你的视频都加长时间。你的视频我每次看N遍……
51257,UgzT7VY6u4XXsyQrn4V4AaABAg,2,"beautiful goddess and beautiful world of wonderland after watching the mood and happy, bless xiaoyi new year's happy pig new year's day.",美丽的女神美丽的人间仙境 看完心情舒畅愉悦 祝福小柒新年快乐 猪年行大运。
500,Ugwtv3KGvqjt0h4LxPB4AaABAg,2,i think 2/3years back am watching this women.... i feel she's in heaven of nature like all fruits veggies raw flesh i envy her's leàding it's so healthy it never look like she's one among us...... with all so much stuff around her.,我认为2/3年的回头看着这个女人。...我觉得她像所有水果一样在大自然中，就像所有的蔬菜生肉一样，我羡慕我的肉，但她的生活真是太健康了，看起来永远不会像我们中间一样。 .....周围有很多东西。
17330,Ugw_6AAkgbhCP0j1MFN4AaABAg,2,"i'm hangry i want to eat your food lijiqi 
so funny when the cooking popcorn bomm
watching from philippines 
4/28/2020","我很饥饿，我想吃你的食物lijiqi
当烹饪爆米花bomm
从菲律宾观看
4/28/2020"
543,Ugx4BSW-L6l8XM0F1iR4AaABAg,2,wow i cannot get enough of watching this sweet gourgous lil lady cooking up a storm and as always it looks goooood what ever she's making,哇，我看不到这个甜美的美味的小女士在烹饪暴风雨，一如既往地看着她在做什么
50901,UgwgdxkzLocvnrsCmMF4AaABAg.8qlbwQdOZYk8qnKmCCvEsN,2,@user-bb2pc3ri3k welcome. will keep watching ur channel for new feeds,@user-bb2pc3ri3k欢迎。将继续观看您的频道以获取新供稿
50241,UgyWsJFiQUuKNRJI_3N4AaABAg,2,i m watching the puppies doing when they show up haha,我看着小狗出现时在做哈哈
50048,Ugw7sUI4Ei2iC9Xi9l94AaABAg,2,"i like watching your video, very beautiful
bleak","我喜欢看你的视频，很漂亮
"
18102,UgxXTFhFB99yrxAhwsp4AaABAg,2,most of the ingredients are unknown to me..still i am watching it as it's so relaxing,大多数成分对我来说是不知道的。
18131,UgyKHjqneOsrmSLbbht4AaABAg,2,"i love watching her ,it's so relaxing after a hard days work; cleaning",我喜欢看着她，经过辛苦的工作，真是太放松了。清洁
18195,UgyEBdXCouT8JdFwq0d4AaABAg,2,even rich people will think less of themselves by watching liziqi's videos.❤,即使是有钱人也会通过观看Liziqi的视频来思考自己。
49279,UgwL3iAA3s5UTgVNi_N4AaABAg.8qm8_CFNxiT9FFPR0f0l66,2,https://www.youtube.com/watch?v=uwtoib3sxhs&t=3s,https://www.youtube.com/watch?v=uwtoib3sxhs&t=3s
49034,UgxySbdnyXE_npjGwrB4AaABAg.8qmFWkv7I5U8qn0AgFHist,2,"live @dl5066
i also know that the sunflower is dry, and the sunflower seeds are removed.
but i also watched the video before i knew ... oh ~~~ it turned out to be like this. xd","附议 @dl5066 
我也知道是花瓣干了的向日葵，所取下的葵花子。
但也是看了影片，才知道... 喔~~~ 原来是长这样。 XD"
1216,Ugw4REe-8LdTl72Sd_B4AaABAg,2,up to this day i still love this video and i watch it a lot,直到今天，我仍然喜欢这个视频，并且我看了很多
48327,Ugym60kdcy5X3hciLL54AaABAg,2,she cooks like a pro....nice to watch her vid. and i always craving for food to eat....love from philippines,她像专业人士一样做饭。...很高兴看她的vid。而且我总是渴望吃食物。...来自菲律宾的爱
48139,Ugxjf3QC2uwh6O8FX1p4AaABAg,2,so satisfying to watch!!!!,如此令人满意的看！！！
47146,Ugy8LkcwvaYFW8SIi094AaABAg,2,"background music
1.karma from ever17 https://www.youtube.com/watch?v=lczqkqam_kw
2.shouri zen no theme (digimon) https://www.youtube.com/watch?v=150xu2bhwqy","背景音乐
1. ever17 https://www.youtube.com/watch?v=lczqkqam_kw
2. Shouri Zen No主题（Digimon）https://www.youtube.com/watch?v=150xU2bhwqy"
2193,UgxMKNK6i30tmWgCITR4AaABAg,2,"love watching ur video....
and also ur cooking skills...
❤️❤️❤️❤️❤️","喜欢看你的视频...
还有你的烹饪技巧...
❤️❤️❤️❤️❤️❤️"
36390,Ugw7P9cnzsebEVezHBN4AaABAg,2,watching this before bed.. so relaxing and peaceful ๐,睡前看这个..如此放松和宁静
39125,UgzQRl-Ctl87WxIyEzp4AaABAg,2,"i know this is the second comment i've made today, but i think your videos are very nice. they're very relaxing to watch, and the food in this one looks very good. your dogs (and your lamb) are cute too!",我知道这是我今天发表的第二个评论，但我认为您的视频非常好。他们非常放松，而且食物看起来非常好。您的狗（和羊羔）也很可爱！
24847,UgyiDDa6tlz69ZPD3u94AaABAg.90BWA-ivq-7928ajKYMz3N,2,"there is a saying in china that you have to work very hard to look effortless. we watch videos to relax, but it's really hard to do.",在中国有一个俗话说，您必须非常努力地工作才能轻松。我们观看视频放松，但这真的很难做。
22966,UgxU9Sbakj1FojVvuXp4AaABAg.92dBGmfuAR-92jLn0fEm-q,2,"how can it be. essence hua nong is true, ziyi is like making movies. if you want to watch beauty, there are many documentary. hua nong's affinity, ziyi can not bring us.ๆฏ i have been firing recently because foreigners like it. the chinese feel strange. then come to see why foreigners like it. of course, ziyi is also very powerful, but most chinese people feel that it is not very interesting. especially rural people feel the deepest, just like you are selling phone, hundreds of calls every day, you have to die, the salary is only more than 3,000. as a result, some people took a video of the phone sales. the protagonist was very handsome and cozy. with erlang's legs, a beautiful and elegant life, you know it is unreal at a glance, and then subconsciously criticize, because you think your real life has been consumed by these vested interests, but it is beautiful. the truth, you will not imagine, just like li xuan attacking those who want to pasto the pastoral shepherd, the hua nong fire is mainly because of the fierce excuses to kill the bamboo rat, and then it is more real, not installed, very natural, the hair is not of the hair, the hair is not none of the hair. washing, funny, so affinity.",怎么可能。。华农好歹真实，子柒就像是拍电影的感觉，要想看美的，各种纪录片多得是，华农那种亲和力，子柒是不能带给我们的，只有不了解中国的外国人喜欢，子柒最近会火，多是因为外国人喜欢，中国人觉得奇怪，然后来看看老外为什么会喜欢，子柒当然也很厉害了，但大多数中国人觉得不是很有趣，觉得子柒很装，特别是农村人感受最深，就像你是电话销售，每天几百个电话，累的要死，工资才3000多，结果有人拍了个电话销售的视频，主角很帅很惬意的打着电话，翘着二郎腿，衣着靓丽优雅的生活，你一看就知道不真实，然后下意识的去抨击，因为你觉得你真实的生活被这些既得利益者消费了，其实就是距离产生美，很多东西你看到过真相，你就不会在去想象，就像李诞抨击那些想田园牧歌的人一样，华农火主要是因为凶残的找借口杀竹鼠，然后也比较真实，不装，很自然，头发都不洗，滑稽搞笑，所以有亲和力。
15600,UgxtDPg0tz8qdQ4IedV4AaABAg,2,"watch the video again and move again.
a pair of clever hands, operating in all things, a brain is unlimited free • how much bitter you can eat can only swallow the belly.
be happy and happier.","再重覆看一次视频，再次感动。
一双巧手，凡事亲自操作，一个脑子无限空闲•吃了多少苦只能往肚里咽下。
要幸福，更要快乐。"
21551,Ugyr4zuLISz-RrVpzHJ4AaABAg,2,i watched the video of the prince and found that it was very interesting,我看了王子的录像带，发现它很有趣
8969,UgznKwWUvlJqV0DUkU54AaABAg,2,"sometimes i feel like watching this is a waste of my time
my diet, actually","有时我觉得看这是我的时间
我的饮食实际上"
30914,UgyWX3rX4u8bymKqaPZ4AaABAg,2,hi liziqi! keep watching your old videos over and over again... ๐’—๐,嗨，liziqi！一遍又一遍地观看旧视频...
32751,UgyXwsAeYegCw1UAMqd4AaABAg,2,"la, and to eat the sabachki? she herself only dates to throw everything into his mouth, poor dogs. only tears! i look there a closet clogged with food to the ceiling. here you have japan, people are of course insanely smart. even the girl is able to collect a bed of non -hijah! and what i like they live with nature, some kind of roots, bast shoes are edible. i watch a few videos, the first thing that she cares about her mother or grandmother is not important. it is just what kind of upbringing! and the second, how hardworking they are, now i understand why they are in such a small country, an order of magnitude higher than other countries live, their head works like a good swiss watch. surprised their work, and especially the mind",洛杉矶，吃萨巴奇（Sabachki）吗？我看着一个壁橱，上面堵塞了天花板上的食物。在这里，您有日本，人们当然是疯狂的。我喜欢他们与大自然生活在一起，根源，冰棍可以食用。我看了一些视频，她关心的母亲或祖母的第一件事并不重要。这就是什么样的成长！第二，他们的勤奋程度，现在我明白了为什么他们在如此小的国家，比其他国家生活高的数量级，他们的头部像一只好瑞士手表一样工作。使他们的工作感到惊讶，尤其是头脑
22717,Ugy0tXJzu1KxBKeHH6l4AaABAg,2,watching this while shoving takis in my mouth,在我的嘴里推着塔卡时看着这一点
7676,UgyvC6gnqRugxFNtwl94AaABAg,2,it feels is calm when i watch this,当我看这个时感觉很平静
32674,UgxUbOdX9Jrf1Yry8Rd4AaABAg,2,"i always feel comfortable whenever i watch your videos, sis! thank you for making such amazing videos <3",每当我观看您的视频时，我总是会感到舒适！感谢您制作如此惊人的视频<3
22152,UgwSWFEg6MtU7NJ88UN4AaABAg.933fknFXf2E93CHEZUx9WS,2,omg i saw ur comment while watching that part ๐ and we have the same mind lol ๐คฃ,天哪，我在看那部分
15121,UgwtZY9TNcFW-b5fm-54AaABAg,2,am so happy to see 53 million views for this . this proves world is such a good place. i wish if everyone in the world could watch & worship content like this,很高兴看到5300万观看次数。这证明世界是一个好地方。我希望如果世界上的每个人都能像这样观看和崇拜内容
31993,UgxPeIw_nKY0Olf5L0V4AaABAg,2,"someday, can i come to your home town? this is so beautiful ๐ญ watching your videos always makes me feeling cozy and relax ~(and also hungry)~ ๐",总有一天，我可以来你的家乡吗？这太漂亮了
31549,Ugy0Soktz65AvEab7Oh4AaABAg,2,"normal human being watching this video: very satisfying and warming.



13 year old girls: she made edible slime with marshmillows.","正常的人观看这段视频：非常令人满意和变暖。



13岁的女孩：她用棉花糖制作了可食用的史莱姆。"
22461,Ugzk2hZzSJPMNCq5HPR4AaABAg.92v_huHNonN93dSshvGTE-,2,"@sourbitters glad to know it. it's an organic living style, providing high quality videos freely and in the same make money to support her and her family, producing more videos and helps make a peaceful world. i will watch the ads on her videos to the end to let her getting more sharing of ads proceeds.",@sourbitters很高兴知道。这是一种有机的生活方式，可以自由地提供高质量的视频，并以同样的赚钱来支持她和她的家人，制作更多的视频并帮助创造一个和平的世界。我将在她的视频中观看广告，以便让她获得更多的广告收益分享。
31843,UgxRlXHXU-vA1fzbK_J4AaABAg,2,beware guys...!!!! this channel is addictive.๐๐๐... i came across this channel randomly & i m watching it continuously last 3 hours....,当心家伙... !!!!这个频道令人上瘾。
31836,UgwcRJWIzWK1xh-ej-l4AaABAg,2,"sat here watching her cook things and thinking, she probably made her own pans.",坐在这里看着她的厨师，思考，她可能自己做了自己的锅。
8468,UgziV_dwKhTpEXfFRkV4AaABAg,2,who’s watching in jan 2021?,谁在2021年1月看？
31760,Ugzkj2Yx4hcL_hNPJrF4AaABAg,2,i feel like iโ€m watching someone play harvest moon. โค๏ธ,我觉得我在看着有人在玩收获月。 ❤️
21550,UgxJnZEYpxrAe4bU7p14AaABAg,2,i watched the video of the prince who found it interesting,我看了王子的视频，发现它很有趣
21772,Ugxhknag0litIL-n8Gd4AaABAg.93L7zOCdC9f93Yax1LWKWq,2,i am moroccan and i discovered this channel a few days ago. i feel comfortable when watching the atmosphere of nature and a different culture from us,我是摩洛哥，几天前我发现了这个频道。看着自然气氛和与我们不同的文化时，我感到很自在
6532,Ugysep0UAKCEBkEPxNh4AaABAg.9Ljc_oPbs6V9Nefg78D1yh,2,"i believe she composed those music by herself. remembering i once watched a video describing how did she manage to use her computer to do everything from recording, music and editing, by herself during the early stage.",我相信她自己创作了这些音乐。记住我曾经看过一个视频，描述了她如何使用计算机在早期阶段独自完成录制，音乐和编辑。
23058,Ugw1aTCq5J-VCzg6dBV4AaABAg,2,"i used to work in rural areas for seven and a half years, so i have a special understanding of rural areas and understanding the hard work of chinese farmers. some villages in china are still messy today, and the garbage has become angry.

these do not become a reason for the video of li ziyi. we all understand that living in the depths of sichuan in dashan is not a simple pastoral scenery and carefree.

li ziyi is not doing great announcements.

she just wants to earn a family -to -family income through her labor creation. i don't believe that she would expect to be popular in the world because of this. return to doujin.

a little exaggerated here [smiling]

li ziyi has experienced a few years of hard work and tried various tasks. her success is by no means accidental.

ten thousand people watch her videos with 10,000 different feelings.

i read that the most direct help to me was that i suddenly realized that the level of cooking was too far away. need to work harder and learn carefully.

of course, as countless fans say, watching li ziyi's video can make people's hearts calm down.

many foreigners leave a message saying that it is hypnosis, treating insomnia [crazy] [crazy] [crazy]

more people admire her omnipipary.

the most exaggerated statement is that ziyi can create a earth [crazy] [crazy] [crazy]","曾经在农村劳动七年半，所以特别了解农村，了解中国农民的勤劳俭朴，贫穷苦难。今日中国有些村庄依然脏乱不堪，垃圾成堆令人愤怒。

这些不成为否定李子柒视频的理由。我们都明白生活在大山深处四川农村不是简单的田园风光，无忧无虑。

李子柒不是在做大外宣。

她只是想通过自己的劳动创作，挣一份养家糊口的收入而已。我不相信她当初会料到因此大红大紫名扬世界。日进斗金。

有点夸张啊此处[偷笑]

李子柒经历了个人苦苦奋斗若干年，尝试过各种不同工作。她的成功，绝非偶然。

一万个人看她的视频会有一万个不同感受。

我看了，对我最直接的帮助就是突然意识到，自己做菜的水平差的太远。需要更加努力，用心学习。

当然，如同无数粉丝所言，看李子柒的视频，能让人的心，静下来。

很多老外留言说是催眠，治疗失眠症[抓狂][抓狂][抓狂]

更多人赞叹她无所不能。

最夸张的说法是，子柒可以再造一个地球[抓狂][抓狂][抓狂]"
6759,UgyPAWGwE7k8hHZ5t7Z4AaABAg,2,i love how clean she about the food ! had to stop watching got really hungry!,我喜欢她对食物的干净！不得不停止观看真的很饿！
10170,UgyaTcZx2PFlv1cbjeV4AaABAg,2,li-we need to ask government leaders to watch your video when there is differences.,李-我们需要要求各地的政府领导人在出现分歧时观看您的视频。
35292,UgzR9shg188GePmMLE94AaABAg,2,these are the kinds of videos youโ€d never get tired of watching,这些是您永远不会厌倦观看的视频
29637,UgwfmAbyoIDDGERSMH14AaABAg,2,are there any hong kong people watching this video?,有香港人在看这个video吗？
6181,Ugxuh2pQl_VnBRtqiQ94AaABAg,2,this is my first ever video that i have watched without skipping,这是我没有跳过的第一个视频
6534,Ugysep0UAKCEBkEPxNh4AaABAg.9Ljc_oPbs6V9NwN-95Y2i3,2,https://www.youtube.com/watch?v=2ohlnmnhj80,https://www.youtube.com/watch?v=2Ohlnmnhj80
23066,UgzLndEc6jsE3-E9naB4AaABAg,2,i feel like i just watched a live monster hunter kitchen tutorial xd,我觉得我只是看着现场怪物猎人厨房教程XD
24873,UgxjBQy_oV2GRmpdQtJ4AaABAg,2,watching her makes me love being chinese,看着她让我爱当中国
21236,UgzVimc1Ym2OEbLgNmd4AaABAg,2,"about! this is my favorite video! everything is so beautiful and tasty, i donโ€t remember how many times i watched it!",关于！这是我最喜欢的视频！一切都是如此美丽，美味，我不记得我看过多少次了！
23613,Ugy1P-5wjBirlyJDFBh4AaABAg.92G5ZWE39tj92KAq6BjxPT,1,"yes, i have watched this video",是的，我看过这个视频
17684,UgwcU9PCMVmc_ZXBZHF4AaABAg.97fWS-XV_rv98J_drP0Yc0,1,mayoumi song is the easiest to watch her video. bleak,mayoumi song 看她的视频最容易饿了。
24397,Ugy6exX5WAuM9Ac9e3F4AaABAg,1,i started gardening after watching your videos... and i feel happy while doing gardening.. ๐’“,观看了您的视频后，我开始园艺...我在做园艺时感到很高兴。
23286,Ugx01h6giGwIhfxYoi14AaABAg,1,isn't she tired? i'm tired only by watching this.,她不是累吗？我只看这个累了。
23270,UgwOTSSiYnHXZ3GtMsd4AaABAg,1,why watch this on the evening of fat reduction. alas.,为什么在减脂的晚上看这个。
22971,Ugxf-r6kRAdTxD3BWX54AaABAg.92cdmOeTdI492gJ9ow1UCb,1,"there are too many domestic black reviews, and the viewing comments are not smooth, affecting the mood of watching the video. if you want to refute too much.",国内黑评太多，看点评论都不顺心，影响看视频的心情。想反驳可太多。
22605,UgwO5DQK8Z6EWFwp0sJ4AaABAg,1,"fire tong ... uh ... liu ming ...
i'm not late ... i watched more than 40 million.","火钳…呃…刘明……
对不起来晚了……都特么四千多万观看了。"
18030,Ugy3LMgRRuVFh81SUkR4AaABAg.97OctMRyFnB97cE1yCgHeo,1,https://youtu.be/d8jrr-e5xw4 great ideas watch this video https://youtu.be/d8jrr-e5xw4,https://youtu.be/d8jrr-e5xw4好主意观看此视频https://youtu.be/d8jrr-e5xw4
