,cid,votes,time,含like,含like中文翻译
28851,UgxCpRiDGzrwuzVOfl94AaABAg.8yY6-41Td1g99ZMYzZ1_tK,0,3 years ago,"franz peters you have nothing to do but to criticize a girl who had a tough childhood, working as hard as she can to help her grandma, a girl despite her own difficulty, donated countless stuff to help combat covid19, who inspired so many people. what did you do to help other people? be a man, bro, don't do coward stuff like this anymore. i can speak more than three languages fluently. you don't see me mocking you for not being able to speak a language do you? you don't see me mocking you for being a coward do you? you don't see me mocking you because you are a racist do you? you don't see me mocking you because you sit on your ass all day just to insult people online do you? you don't see me telling you the truth that you are a oxygen waster and a disgrace do you? what kind of vile devil throw insults at nice people just so they could shoot their juice?",弗朗兹·彼得斯（Franz Peters）除了批评一个童年艰难的女孩，尽可能地帮助她的奶奶，一个女孩，尽管她自己的困难，但捐赠了无数的东西来帮助与启发这么多人的Covid19打击Covid19。您做了什么来帮助他人？做个男人，兄弟，不要再做这样的胆小鬼。我可以说流利的三种语言。您没有看到我嘲笑您无法说一种语言吗？你看不到我嘲笑你是胆小鬼吗？你看不到我嘲笑你，因为你是种族主义者吗？您看不到我嘲笑您，因为您整天坐在屁股上只是为了侮辱人们在线吗？您没有看到我告诉您您是浪费氧气，是耻辱吗？什么样的邪恶的魔鬼侮辱了好人，以便他们可以拍摄果汁？
28852,UgxCpRiDGzrwuzVOfl94AaABAg.8yY6-41Td1g99ZNK1vZ5Bj,0,3 years ago,"franz peters yeah, my reply also goes to those who upvoted franz peters. why do you oxgen wasting meat even come in here if you don't like it. she may not be able to speak english fluently. she can speak mandarin, and the local dialect, which one can you cowards speak? or, you wanna challange me, too. because i am also a chinese? how about latin, i as a chinese can speak latin fluently, can you? i can speak english, your language, fluently, can you speak mine, or any other? don't be a coward.",弗朗兹·彼得斯（Franz Peters）是的，我的答复也向那些投票给弗朗兹·彼得斯（Franz Peters）的人。如果您不喜欢的话，为什么浪费牛甚至来这里。她可能无法说流利的英语。她可以说普通话和当地的方言，你可以说哪一个说话？或者，你也想挑战我。因为我也是中国人？拉丁语呢，我作为中国人会流利地说拉丁语，可以吗？我可以说英语，您的语言，流利的，您会说我的还是其他人？不要成为胆小鬼。
28690,UgxCpRiDGzrwuzVOfl94AaABAg.8yY6-41Td1g92tYyg6AQur,0,3 years ago,then start using a note pad app like google keep,然后开始使用Note Pad应用程序，例如Google Keep
28141,UgzCfTz8UhZH_9gNc_V4AaABAg,0,3 years ago,what is that green string? is it like a bend?,那绿色的弦是什么？就像弯道吗？
27873,Ugxfoa6DkOT4GuNTxaJ4AaABAg,0,3 years ago,m from india. i am not eating like your reciepe but i like to watch your channel it is beautiful your farm and your garden and the way you have to prepare food i like to watch,M来自印度。我不像您的收获那样吃饭，但我喜欢看您的频道，这是您的农场和花园的美丽，以及您想要观看的食物的方式
28309,UgzWzyQ1LyGP3KB8TC54AaABAg,0,3 years ago,i like this lady she doesn't need a man to take care her,我喜欢这位女士，她不需要男人照顾她
28270,UgwzgqU8lIB7CaYeOz14AaABAg,0,3 years ago,hello . my name is trung. i come from vietnam. i like what you do and the scenery in your country. you are both good and diligent. i like you,你好 。我叫Trung。我来自越南。我喜欢您所做的事情和您国家的风景。你既好又勤奋。我喜欢你
28285,UgyhCEpnkk7uOYrJs_94AaABAg,0,3 years ago,"i'd like to live in a place like this, so peaceful and full of nature. learning all the things she does wouldn't be so bad either :d",我想住在这样的地方，如此宁静和充满大自然。学习她所做的所有事情也不会那么糟糕：D
28293,Ugw0ng88auBqj2KZ3dt4AaABAg,0,3 years ago,"you too need to cover up a little bit more. and please just don't eat pork. it is forbidden meat.. like a forbidden fruit... when you take it, you will be out from the heaven.",您也需要掩盖更多。而且请不要吃猪肉。它是禁忌的肉..就像禁止的果实...当您拿走它时，您将从天堂出来。
28299,Ugx2dYusixoefq3q95d4AaABAg,0,3 years ago,"hy.. im from indonesia, like this your contens",hy ..我来自印度尼西亚，像这样
28442,Ugxl74Sveje7pyB4Ie54AaABAg,0,3 years ago,like to watch almost every beautiful,喜欢看几乎每个美丽
28434,UgwG7Dn9W9JLhCX-ddp4AaABAg.8yYYJScyg3c8yeVshiLRaA,0,3 years ago,"yeah i love what she's doing , i love her garden .i want to live my life like her",是的，我爱她在做什么，我爱她的花园。我想像她一样生活
28315,Ugw8oHiyLHrwjC3tmGt4AaABAg,0,3 years ago,i like it,我喜欢它
28142,UgxT1dnAkn-PDv_-ZlZ4AaABAg,0,3 years ago,i like this simple life.,我喜欢这种简单的生活。
28424,Ugy9FZTNho70WiwstmJ4AaABAg,0,3 years ago,love her sm... but i’m american... (even though i’m also half chinese)... and i like visibly flinched when she salted those poor snail. is this a culture thing lol?,爱她的SM ...但是我是美国人...（即使我也是一半中文）...而且当她腌制那些可怜的蜗牛时，我很喜欢很畏缩。这是文化的东西吗？
28412,Ugzm3ch-XXY--emYa9N4AaABAg,0,3 years ago,i like your videos thank you,我喜欢你的视频，谢谢
28404,UgwyTHfh_wYr0Wo8hJ14AaABAg,0,3 years ago,i was deeply impressed by your channel and i want to live like your country life. i love your life in your life.,您对您的频道印象深刻，我想像您的乡村生活一样生活。我爱你的生活。
28401,UgyCdQe763oMxvI-ENV4AaABAg,0,3 years ago,she like pocahontas to me thats how i see her amazing girl,她喜欢我的Pocahontas，这就是我如何看待她的惊人女孩
28347,UgztV0aNypCobTba6kZ4AaABAg,0,3 years ago,please use spanish subtitles. i like your videos very much. greetings from mexico 哥,请用西班牙语字幕。我非常喜欢你的视频。来自墨西哥的问候
28350,Ugz0_3ohziGVG0lwiQ14AaABAg,0,3 years ago,like,喜欢
28448,UgyG_cSFQ3N8etYrFu54AaABAg,0,3 years ago,why so many dislikes,为什么这么多不喜欢
28266,Ugy7xUHtjCJq_k3hUgt4AaABAg,0,3 years ago,"i was inspired to make videos like liziqi, but my videos are not as beautiful as her, would you guys like to see my cooking videos too?",我的启发是制作像Liziqi这样的视频，但是我的视频不像她那么美丽，你们也想看我的烹饪视频吗？
28262,Ugxt1acllmCdtP5HFd14AaABAg,0,3 years ago,"fellow 李子柒 liziqi viewers, there is 1 channel spamming in the comments of all the recent videos of 李子柒 liziqi, asking viewers to subscribe to its channel. this is unprofessional and unethical. you don't spam and snipe a fellow youtuber's viewers. how do you like it if someone else does that to your channel. fellow viewers, if you see that spam comment, please report the comment as spam to youtube. thank you.",liziqi的观众同胞，在所有最近的liziqi的评论中有1个频道垃圾邮件，要求观众订阅其频道。这是不专业和不道德的。您不会向YouTuber的观众发送垃圾邮件和狙击。如果其他人对您的频道这样做，您会如何看待它。其他观众，如果您看到垃圾邮件评论，请向YouTube报告该评论。谢谢。
28261,Ugyuql088t3mlawySPp4AaABAg,0,3 years ago,can you make ramen like in naruto,你能像火影忍者一样做拉面吗？
28258,UgwAYcUpULE3bAAofZx4AaABAg,0,3 years ago,are the people who disliked her videos jealous about her views and subscribers? because i don't understand their reasons to press the dislike button.,那些不喜欢她的视频嫉妒她的观点和订户的人吗？因为我不明白他们按下不喜欢按钮的原因。
28481,UgzilT3aySZfZ7IXvR14AaABAg,0,3 years ago,like mina twice,像Mina两次
28244,Ugzpak2xq2lg9YykXTh4AaABAg,0,3 years ago (edited),we used get those bamboo roots with my aunt and cousins and we cook it pair it up with sardines. it's kinda hard getting those stuff cause we need to cross over the river wherein the current is really strong but it's fun though i really don't like the taste of it,我们用我的姑姑和堂兄弟拿着那些竹根，然后将其与沙丁鱼搭配。有点困难的东西，因为我们需要越过河流，那里的电流真的很强，但是很有趣，尽管我真的不喜欢它的味道
28243,UgwUQCj2ur9SSTliafh4AaABAg,0,3 years ago,surely her grandmother is very happy to have a grandchild like her,她的祖母肯定很高兴有一个像她这样的孙子
28204,Ugwqh3TmxjfY1iBd0FZ4AaABAg,0,3 years ago,i don't know which you have sub for vietnamese. but i hope you don't know chinese or leave it. k need to be inserted into related customers and losing the emotions of the viewer like that. :),我不知道您有哪个越南人。但是我希望您不要知道中文或离开它。 K需要插入相关客户，并失去观众的情绪。 :)
28648,UgxCpRiDGzrwuzVOfl94AaABAg.8yY6-41Td1g924L1hGiIjT,0,3 years ago,@sarahhou1147 that's why he can only be a villain who likes to be jealous of others.,@sarahhou1147这就是为什么他只能成为一个喜欢嫉妒别人的小人。
28203,UgxHUHc8GQbqe-Na0_d4AaABAg,0,3 years ago,wow i like it,哇〜我喜欢
28180,UgyhWngjgRV6qrajOPp4AaABAg,0,3 years ago,i feel like ennimation ~,我觉得自己陷入困境〜
28171,UgzIDQq83n3rAlzN6B14AaABAg,0,3 years ago,l love you ❤️ like,我爱你❤️
28168,Ugw1Z2k3A2zkh7Up8AF4AaABAg,0,3 years ago,how i would like to lead life like you guys is wonderful i get here dreaming of this way of living amoooooo d+ your videos,我想像你们一样过上生活，真是太好了，我在这里梦见这种生活方式amoooooo d+你的视频
28166,UgyEj2oQTEUTy7F74_l4AaABAg,0,3 years ago,looks very enjoyable. cooking is delicious. i like it.,看起来很有趣。烹饪很美味。我喜欢。
28161,UgxSrGFIvy5niDZIhgB4AaABAg,0,3 years ago,like your garden a lot!! can people visit and take a look at it and may b pick few berries??,非常喜欢你的花园！人们可以参观并看一下它，并且可能会选择几个浆果吗？
28144,Ugzg-1XAUChLswGZLN14AaABAg,0,3 years ago,"@yundengogo it would be nice if the people doing subtitles could only translate what is being said or the words shown on screen in the video.. any additional information or cooking tips (like ""careful when trying this at home, we don't want fermented finger tips or nails"") might be funny but they should be said in the comments and not the subtitles.. otherwise it's just going to be confusing to figure out which words come from liziqi and which ones were added by a random person who has nothing to do with the channel",@yundengogo，如果执行字幕的人只能翻译所说的话或视频中显示的单词。发酵的手指秘诀或指甲”）可能很有趣，但应该在评论而不是字幕中说。与频道无关
27882,Ugz358FikwJWLLJbT4Z4AaABAg,0,3 years ago,hi how are you?i like to meet you,嗨，你好吗？我喜欢见你
27865,UgxDhZmtTybXCOLt0Q54AaABAg,0,3 years ago,people like it really,人们真的很喜欢它
27489,UgyRvPRd2qjWonUzrE94AaABAg,0,3 years ago,"hi, li ziqi, i want to know who is the person in vietnamese for your editing? how many people are in your ekip. your sincerity!

hi liziqi, i'm like to know who is the person who subtitle vietnamese for your clips? how many person are there in your ekip. yours sincerly fan!","嗨，李子琪，我想知道谁是为你的剪辑加字越南语的人？你的ekip中有多少人。你的真诚范！

Hi Liziqi, I'd like to know who is the person who subtitle Vietnamese for your clips? How many person are there in your ekip. yours sincerely Fan!"
27698,Ugz6H9kTNPNXUZu2IJN4AaABAg,0,3 years ago,there are any bengali people who like me like me like koren?,有孟加拉人喜欢我喜欢我的孟加拉人吗？
27658,UgzfFkP_0q61_xdLc9R4AaABAg,0,3 years ago,"i love all your videos, you invite me when ...? i would like to discover your beautiful country, as well as the way of life., .... big kisses from france ...",我喜欢你所有的视频，你邀请我...吗？我想发现你美丽的国家以及生活方式。
29176,Ugywt5OpgeuqcHxi9d94AaABAg,0,3 years ago,i like it,我喜欢
27666,Ugxo4fQFBlM7MtAsOz14AaABAg,0,3 years ago,"the traffic is limited. essence like one, i will leave 就 就 就 就",流量有限。。 赞一个我就走了
27681,Ugyj12gOQyXY1WyP2LV4AaABAg,0,3 years ago,like feeding pigs,喜欢喂猪
29168,Ugzuhhqzsi99OZ3oVUR4AaABAg,0,3 years ago,yeah i like it very much,呀我很喜欢
29161,UgwFM0BvxGkKIW1MUSt4AaABAg,0,3 years ago,"whether there is a girl like that, what j also knows how to do it really good to do 1 more of her must be very blessed.",是否有这样的女孩，J也知道该怎么做真正好1必须非常幸运。
27705,Ugy8AXaYfFQsM5gRDVZ4AaABAg,0,3 years ago,happy life with beautiful nature i like that so much !!,幸福的生活与美丽的自然，我非常喜欢！
27726,UgwCYj1YWcB12t0Fkfx4AaABAg,0,3 years ago,there are still people who don't like such a good video. they are probably black powder. there are also few chinese comments! bleak,子柒这么好的视频居然还有人点不喜欢的，他们这些人大概都是黑粉吧。还有中文评论的也好少呀！
29157,Ugx6PIn9lltTdy2ilgR4AaABAg,0,3 years ago,"1,9 k dislikes ? how ? why ?","1,9 K不喜欢？如何 ？为什么 ？"
29147,UgzEqa0KKaieFshF5tx4AaABAg,0,3 years ago,"you guys always keep on admiring this girl, like she has everything, but i don't! there's one thing she's missing in her life - a husband.",你们总是继续欣赏这个女孩，就像她拥有的一切一样，但我没有！她一生中有一件事 - 丈夫。
27709,UgzpLppDDI5bTFwHYzJ4AaABAg,0,3 years ago,wow she's adorable i really like her videos,哇，她很可爱，我真的很喜欢她的视频
29141,Ugzfv31GJ5CCuhThJ3d4AaABAg.8yXi_avIzB_8yY4cgOZSEc,0,3 years ago,"you won't really think that they usually eat like this, right?",摆拍 你不会真的以为他们平时吃饭都是这么吃的吧
29130,UgzaesjeqeE9bSglm-14AaABAg,0,3 years ago,this is like garden goals! everything just grows so abundantly!!!,这就像花园目标！一切都变得如此丰富！！！
27719,UgxpkF5MM63ErIb3Tdx4AaABAg,0,3 years ago,"if you like seafood, you’ll like snail. it’s very good",如果您喜欢海鲜，您会喜欢蜗牛。这很好
29178,Ugw_A6HUq7JY8Nry4Nx4AaABAg,0,3 years ago,"i love watching her work. she is very industrious. most americans these days are lazy , fat, and drink or claim they're disabled. they wouldn't work like this if they had to. they'd rather starve to death.",我喜欢看她的工作。她很勤奋。如今，大多数美国人都是懒惰，胖和饮料，或者声称自己是残疾人。如果必须这样做，他们就不会这样。他们宁愿饿死。
29185,UgyvbuYIGxreoEvJr6t4AaABAg.8yX_kztPWR88yY8HIrDm40,0,3 years ago,like this beautiful sister :))),像这个美丽的姐姐:)））
29196,UgwfXL9ecwUjSJqPm9N4AaABAg,0,3 years ago,"those who translate vietnamese subtitles like cc, you would rather not to translate subtitles to see if it is more comfortable. if you do it, you can do it properly, so that the clip is valuable.",那些翻译越南字幕（如CC）的人，您不想翻译字幕，以查看它是否更舒适。如果这样做，则可以正确执行此操作，以使剪辑很有价值。
27648,Ugw7ELr8s9-jBJQO1M94AaABAg.8ycfTYOAfYs92Z08E3GU4k,0,3 years ago,glad you like it,很高兴你喜欢
29203,Ugz7k3nw10LwcAeLnb54AaABAg,0,3 years ago,any grandmother who do sub like a strange comedy,任何像奇怪喜剧一样替代的祖母
27593,UgznvxtzrBsGczr25_94AaABAg,0,3 years ago,"wow, this must be what heaven looks like.... #sweetserenity",哇，这一定是天堂的样子.... #sweetserenity
27590,UgzQ3Wj0Av_KW3j6kjB4AaABAg,0,3 years ago,"i also want a woman who cooks me like this <3, good video.",我还想要一个像这个<3一样烹饪我的女人，很好的视频。
29208,UgzeUwISbeh8Ho6AMeV4AaABAg,0,3 years ago,"do you not eat snail powder? but also, since grandma can't stand the durian, it is estimated that the smell of snail powder will not like",奶奶不吃螺蛳粉吗？不过也是，奶奶既然受不了榴莲，估计也不会喜欢螺蛳粉的臭味
27548,UgzAZjJKw_o8AI7YzX94AaABAg.8ydt4Y210zF8yqZrbchnhK,0,3 years ago,"@melissabrownapt215 her place is clean because she just shows us the clean part. everything behind those beautiful videos is a lot of hard work, like growing those vegetables. her video is a poetic display of rural life, we can't just relate it directly to real life.",@Melissabrownapt215她的位置很干净，因为她只是向我们展示了干净的部分。那些美丽的视频背后的一切都是艰苦的工作，例如种植这些蔬菜。她的视频是乡村生活的诗意展示，我们不能将其直接与现实生活联系起来。
29212,UgyEeAS5-uNMfYvfUp14AaABAg,0,3 years ago,i like don't,我喜欢不
29216,UgxmyjY5NAcxGytaWFB4AaABAg,0,3 years ago,"i like this (most seem to obvs), however i wonder how contrived/ set up this all is ..she is clearly going for the mysterious lady/ harry potter (in asia) 'school of cooking' vibe. i hope the dog isn't eaten - thats what they do in china (+ a few other parts of the world) - torture and kill dogs, to eat them (an insult to the intelligent reason why humans bred them in the first place, for companions, as hunting dogs and now as guide dogs for the blind and to sniff out drugs and bombs at airports).",我喜欢这个（大多数人似乎很明显），但是我想知道这一切的人为/设置是多么的。我希望那只狗不要吃掉 - 那就是它们在中国（+世界其他一些地方）所做的事情 - 酷刑和杀死狗（侮辱他们的聪明原因，为什么人类首先将它们繁殖了，对于同伴，作为狩猎狗，现在是盲人的导犬，在机场嗅出毒品和炸弹）。
29244,UgwcFlqsBh8gJy-UR414AaABAg,0,3 years ago,does anyone see the sub and inhibit me like me? read it in time,有人看到潜艇并像我一样抑制我吗？
27525,UgxH8XreQHko5weD5D54AaABAg,0,3 years ago,"wow, i like to live here",哇，我喜欢住在这里
27521,UgymPE4cLg0Zr97-O6Z4AaABAg,0,3 years ago,"my sister likes her very much, and i know what i cook well, i love you very much, beautiful scenery, where are you ...","我妹妹很喜欢她,而且煮好菜的东西都知道,我非常爱你,美丽的风景,你在哪里..."
29248,Ugx-eOfgF4-zsxgUxPh4AaABAg,0,3 years ago,how can i live like you? fall in love with your live style,我怎么能像你一样生活？爱上了您的现场风格
27502,UgyXs4OuwnxVRxzMpX54AaABAg.8yeCOG-VY7z8ygtfwrB1Yi,0,3 years ago,"they must envy her or thinks her life is boring.. but for me, i'd give anything for a life like that",他们必须羡慕她或认为她的生活很无聊。但是对我来说，我会为像那样的生活做任何事情
27497,UgxcnVr3GV2D7nCc-vp4AaABAg,0,3 years ago,i like the most. follow every clip.,我最喜欢。遵循每个剪辑。
27724,UgyPmcMWPwVr1tamadx4AaABAg,0,3 years ago,i really like watching videos,我真的很喜欢看视频
27738,Ugw-L63J_o6FbA4lILJ4AaABAg.8yc0dkPxEcm8yoAvtVOUtC,0,3 years ago,"liu jiawei
taiwanese like to watch the type of three characters in taiwan's first net red museum.","刘嘉伟 
台湾人喜欢看如台湾第一网红馆长张嘴就骂三字经那种类型的。"
27862,UgzNSxVhgFJo0qk5yO94AaABAg.8ybG2I-eTqu8ybGtUpeeAU,0,3 years ago,i think those dislikes from pandas,我认为那些不喜欢潘达斯
28884,UgxCpRiDGzrwuzVOfl94AaABAg.8yY6-41Td1g9AaUQolYogS,0,2 years ago,@bhatkahuabalak3778 what the fuck! what is wrong with you! being rude to strangers who had nothing to do with you? did your mom teach you how to behave like a human being?,@bhatkahuabalak3778他妈的！你怎么了！对与您无关的陌生人无礼？您的妈妈教您如何表现得像人吗？
29004,UgxCpRiDGzrwuzVOfl94AaABAg.8yY6-41Td1g9Jd9LuKCnlX,0,2 years ago,@franzpeters3824 excuse me!! who are you to judge someone....what is your talent?? she can't speak english properly right? can you speak chinese?? no one is perfect in this world... it's easy to judge someone but it's harder to understand....if you don't like her video than please don't watch but at least don't spread hate to her here....,@franzpeters3824对不起！你是谁评判某人。...你的才华是什么？她说英语不能正确吗？你能说中文吗？在这个世界上，没有人是完美的...判断某人很容易，但是很难理解。...如果您不喜欢她的视频，请不要看，但至少不要在这里向她传播仇恨。 ...
28995,UgxCpRiDGzrwuzVOfl94AaABAg.8yY6-41Td1g9F-ebVd5z0O,0,2 years ago,@franzpeters3824 sounds like you have nothing to do but comment on her video spreading negativity,@franzpeters3824听起来您除了评论她的视频传播否定性之外别无他法
28973,UgxCpRiDGzrwuzVOfl94AaABAg.8yY6-41Td1g9DQmidyIYfM,0,2 years ago,"@franzpeters3824 what you got if you won an arguement with people here over liziqi speaking proper english or mandarin??? nothing. you got nothing but hates, depression, negative thoughts in your mind that create selfishness on how you see the world. maybe you can start to plant something like what liziqi's been doing, i think it helps you to understand the purpose of her videos.",@franzpeters3824如果您赢得了与Liziqi的人说话适当的英语或普通话的人的争论，您会得到什么？？？没有什么。除了讨厌，沮丧，负面思想，您什么都没有，这会使您对世界的看法产生自私。也许您可以开始种植Liziqi所做的事情，我认为这可以帮助您了解她的视频的目的。
27795,UgxfbyPzUJ9F0ZdX-Od4AaABAg,0,3 years ago,"there are people like this e, it will be very good, sweet and sweet soup",有这样的人，它将非常好，甜和甜汤
28941,UgxCpRiDGzrwuzVOfl94AaABAg.8yY6-41Td1g9CQXzKqiUkp,0,2 years ago,she is soo cute like a small girl,她像一个小女孩一样可爱
28885,UgxCpRiDGzrwuzVOfl94AaABAg.8yY6-41Td1g9AagrKkYFjR,0,2 years ago,@cathyliu8694 situation made me like this,@cathyliu8694的情况使我这样
28878,UgxCpRiDGzrwuzVOfl94AaABAg.8yY6-41Td1g9ANTVxRsU_o,0,2 years ago,@fafa-rd4wx i like chinese culture but i don't know if they live like that,@fafa-rd4wx我喜欢中国文化，但我不知道他们是否这样生活
27752,UgzHqmZpKLFmsoE1Aix4AaABAg,0,3 years ago,i want to have a wife like her,我想有一个像她这样的妻子
27802,UgyhyEhLpAbMDEfCJ0h4AaABAg,0,3 years ago,she looks like mina of twice kpop girlband,她看起来像是两次Kpop Girlband的Mina
27806,UgxWRZ4216K-pZR_Ggt4AaABAg,0,3 years ago,life is truly peaceful. few places are like that.,生活是真正的和平。那样的地方很少。
27809,UgxDFk-A99zrW8NpR2J4AaABAg,0,3 years ago (edited),"long beans (豇豆稀饭）porridge and spicy salard with long beans is very porpular in the sichuan province ,every family in the countryside of sichuan province like cooking at the summer day. wtach ziqis film, mmmm,let me recall those good memory of childhood time .",长豆（（（（port）和长豆的辣味和辛辣的沙拉酱在四川省，四川省的每个家庭都像夏日一样做饭。WtachZiqis电影，mmmm，让我回想起那些良好的童年记忆时间 。
27836,UgwOVkgDO0GGYtYpzBd4AaABAg,0,3 years ago,what a bamboo shoot for a panda cat like this?,这么抢熊猫猫的竹笋好嘛
27848,UgzNSxVhgFJo0qk5yO94AaABAg,0,3 years ago,2400 bamboo dislike,2400竹不喜欢
27854,UgzpJrZs8Mj5fCxYeJF4AaABAg,0,3 years ago,"im from vietnam
i really like your videos that are so beautiful and peaceful in the end i wish you a happy and peaceful life","我来自越南
我真的很喜欢您的视频，最终是如此美丽与和平，我祝您生活快乐，和平"
29031,Ugyn9HTcc7uFv4tyJzh4AaABAg,0,3 years ago,two thousand people did not like it! is it true? really good video to press not like?,两千人不喜欢它！是真的吗？真的很好的视频不喜欢吗？
