,cid,votes,time,含like,含like中文翻译
29234,UgzVsSl4jQx0KdsYHlB4AaABAg,2,3 years ago,looks like vietnam is the only representative ...,看起来越南是唯一的代表...
11153,UgyHeBvhdkOMoUCt4y54AaABAg,2,3 years ago,like if you are seeing this in the pandemic,就像您在大流行中看到这一点
10805,UgzQIlArdM3-I71mRb54AaABAg,2,3 years ago,"tbh im addicted to watching her video, like it motivates me to be productive and do household choirs. and damn she so beautiful!",TBH我沉迷于观看她的视频，就像它激励着我变得富有成效并做家务合唱团。该死的她真漂亮！
8686,UgwyWev60O0SIJzZgpd4AaABAg,2,2 years ago,"i am a chinese in malaysia, and my ancestral home was quanzhou, fujian. i like the rural environment in this video. i feel very comfortable in my heart.",我是马来西亚华人，祖籍福建泉州，很喜欢这视频中农村的环境，心里觉得很舒服
14757,Ugx1GnDcN21WHq6q5lh4AaABAg,2,3 years ago,"i like calmness 
another thing ..
all plants and planting, and everything around you make something strange from it 
as for the cooking issue, this is another research

my question is reasonable in the year 2020
ako hig shi

can i ask for resorting to you","我喜欢平静
另一件事 ..
所有的植物和种植，周​​围的一切都使它变得很奇怪
至于烹饪问题，这是另一项研究

我的问题在2020年是合理的
ako hig shi

我可以要求你求你吗"
8593,Ugyz9-aMQGGZUd4TjNt4AaABAg,2,2 years ago,"i think this young lady is beautiful,from her face,her body, her heart and her mind.
this world needs more like her. :-)","我认为这位小姐从她的脸，她的身体，她的心和思想上很漂亮。
这个世界需要像她一样。 :-)"
5946,UgwU66laJlR65br34pB4AaABAg,2,2 years ago,i would like to start with a friendship and maybe develop into a long term relationship in the future. you're also interested and looking for the same thing as me. i would like a happy family with someone who is ready to build a future together.,我想从友谊开始，也许将来发展成为长期的关系。您也有兴趣，并且与我一起寻找同一件事。我希望一个幸福的家庭和一个准备共同建立未来的人。
3629,UgxiQxf_OTTSmzGqhHh4AaABAg,2,2 years ago,i always see you i like it more than everything to see how the herbs eat that i didn't even know that blessings are eaten,我总是看到你，我比一切都更喜欢它，看看我什至不知道吃的草药吃了
17132,Ugzuv8lYxfc3ztCxVH94AaABAg,2,3 years ago,my bowl of kd looks like crap,我的KD碗看起来像废话
5929,UgwJcwx-JzLheCCtaDF4AaABAg,2,2 years ago,i would like to start with a friendship and maybe develop into a long term relationship in the future. you're also interested and looking for the same thing as me. i would like a happy family with someone who is ready to build a future together.,我想从友谊开始，也许将来发展成为长期的关系。您也有兴趣，并且与我一起寻找同一件事。我希望一个幸福的家庭和一个准备共同建立未来的人。
16980,UgwVz01figG9pcPUCHB4AaABAg,2,3 years ago,i wish we can go back and live like this kind of healthy and peaceful life.,我希望我们能像这种健康与和平的生活一样回去生活。
31259,Ugx78K0oMU1q8muwLyR4AaABAg,2,3 years ago,this is a taste of taste. but i like it,这是一则有味道的视频。但是我喜欢
10774,UgxZe4PjIqgWUpxVHEN4AaABAg,2,3 years ago,"i wanna be with her and to learn 
when i see her videos i like to work together with her","我想和她在一起并学习
当我看到她的视频时，我喜欢和她一起工作"
22645,UgxS9qH-s7dLvlE-GY94AaABAg,2,3 years ago,"who will find a talented woman? her value is superior to pearl. the heart of a husband trusts in her, he will not lack benefit. all of her life makes her husband gain benefits, do not hurt. she looked for sheep's wool and thorns, lac-italy took her hand to do the work. she was like a merchant ship, she came back from afar. she woke up when it was still dark, gave food to her family members, and cut jobs for her servants. when she thought of a field, she could buy it; thanks to the fruit of her hands, she planted a vineyard. she strapped with force, and made her arms strong. she felt that her work was being beneficial; her lights did not go out at night. she put her hand on the spinning top, and her fingers held him down. she extended her hand to help the needy, raised her hand to meet the poor and needy. she was not afraid of her family being frozen in snow, because all the families were dressed in deep red fur. she took the blankets; her t-shirt made of fine red linen. at the gate of the city of her husband is known to them, when they sit with the elders of the land. she made a bra and sold it; also gave belts to traders. she put on strength and imposing, and when she thought of the next day, she laughed. she opened her mouth wisely, the merciful principle at her tongue. she takes care of the way of her house, and doesn't eat the bread of idleness. her children rise up, wish her blessed; her husband also rose, and praised her, saying, 
proverbs 31: 10-28 vb1925 
https://bible.com/bible/193/pro.31.10-28.vb1925","谁会找到一个才华横溢的女人？她的价值优于珍珠。丈夫的心信任她，他不会缺乏利益。她的一生都会使丈夫受益，不要伤害。她寻找绵羊的羊毛和刺，Lac-titary握住她的手做这项工作。她就像一艘商船，从远处回来。当天黑时，她醒了，给家人吃了食物，并为她的仆人裁员。当她想到一个领域时，她可以买到。多亏了她的手的果实，她种了一个葡萄园。她用武力束缚，使自己的手臂坚强。她觉得自己的工作是有益的。她的灯在晚上没有熄灭。她把手放在旋转的顶部，手指将他压低。她伸出手来帮助有需要的人，举起手来遇到穷人和有需要的人。她不怕家人在雪中冻结，因为所有家庭都穿着深红色的皮毛。她拿了毯子。她的T恤由精美的红色亚麻制成。当他们与土地长老坐在她的丈夫城市的大门上。她制作了胸罩并卖掉了。也给贸易商带来了腰带。她发挥了力量和强烈的态度，当她想到第二天时，她笑了。她明智地张开嘴，舌头上的仁慈原则。她照顾房子的方式，不吃闲散的面包。她的孩子起床，祝她祝福。她的丈夫也升起，称赞她，说，
谚语31：10-28 VB1925
https://bible.com/bible/193/pro.31.10-28.vb1925"
3885,Ugwrx_loLps72uxOE9x4AaABAg,2,2 years ago,thirty-one thousand racists did not like this video,三万一千种种族主义者不喜欢这个视频
23657,UgzuK8p2uyWhMBSKJnd4AaABAg.8zeGo5ApctX9-5hT4SPLdT,2,3 years ago,@nomanmiaji3904 the white veg. in the vedio is bamboo shoots. panda also likes that. also it is called one of the four decent flowers in chinese literature. 花中四君子—竹,@nomanmiaji3904白蔬菜。在吠陀中是竹芽。熊猫也喜欢。它也被称为中国文学中四种体面的花之一。花中四 - 竹
4010,UgxXBp3XgfEphnwtnF54AaABAg,2,2 years ago,"what a warm picture, like you",好温馨的画面，为你点赞
4025,UgxUu2vUljYc52z7A_d4AaABAg,2,2 years ago,waoo i am amazed ladies like her are none existent in the us. simplicity goes a long way. love here lifestyle,waoo我很惊讶像她这样的女士们，在美国没有。简单性走很长一段路。爱在这里的生活方式
31356,Ugw7MNb27zetpcWvmxp4AaABAg,2,3 years ago,i really like your garden!,我真的很喜欢你的花园！
4051,UgzNhfet_Ik5yVGbspN4AaABAg,2,2 years ago (edited),"01:20 such a beautiful shot! 
being surrounded by plants, how fresh the oxygen can be? 

i wonder about these people who disliked, she doesn't even say anything to the camera. just leave her alone. lol","01:20如此美丽的镜头！
被植物包围，氧气有多新鲜？

我想知道这些不喜欢的人，她甚至都不对相机说什么。只是别管她。哈哈"
29268,Ugz1eBU-9y3MvqPMc_N4AaABAg,2,3 years ago,who else dreamed to have garden like hers?,还有谁梦想着拥有像她一样的花园？
4026,UgyGXFz2hcbNz_dv0h54AaABAg,2,2 years ago,"in nepal, we call that bamboo root as tama. it is sour plus has a very good fragrance. here is a superstition that tama shouldn't be cut by the people having children as it is said that cutting the tama is like killing your son or daughter. so, only people who doesn't have child could cut them!",在尼泊尔，我们将那个竹根称为多摩。它是酸味加的香水非常好。这是一种迷信，认为生孩子的人不应该削减多摩，因为据说割草就像杀死您的儿子或女儿一样。因此，只有没有孩子的人才能割伤他们！
4034,Ugw3lPr4ca-ek-0Fmwt4AaABAg.9LNZfg91zko9LuXqctS7Gw,2,2 years ago,@amlesh8638 chinese love her and adore her like a national treasure. sure sour ppl are from every where i believe many are really jealous cuz they are not makers but haters,@amlesh8638中国人爱她，像国宝一样崇拜她。当然，我相信许多人真的很嫉妒，因为他们不是制造者，而是仇恨者
27661,UgzIiFrv0EtJbXUgxnt4AaABAg,1,3 years ago,"i like it. it's great to do dexterity, and it's really cool to cook and harvest ingredients.
natural sounds and music are also hearted. make it comfortable ...
everything is a meaningful process. i always see it well","我喜欢。敏捷非常好，烹饪和收获成分真的很酷​​。
自然的声音和音乐也令人心动。让它舒适...
一切都是有意义的过程。我总是看得很好"
26941,UgxQtg7P9g471iTWs_l4AaABAg,1,3 years ago,"just came to see the first time.
like to follow and wait to see other clips again","刚来看看第一次。
喜欢跟随并等待再次查看其他剪辑"
9786,UgxeIMVvFVL7jgkG2294AaABAg,1,3 years ago,"sister, i like you very much",姐姐，我非常喜欢你
9944,Ugx0L-ifQduxJcvhbtB4AaABAg,1,3 years ago,i am from indonesia ... i really like bamboo shoots very much,我来自印度尼西亚...我真的很喜欢笋
27697,Ugz-6a4GDSoAkUPujYF4AaABAg,1,3 years ago,"great fan of yours , i love all your videos give us more videos like these love from usa",您的出色粉丝，我喜欢您的所有视频，给我们更多的视频，例如美国的爱
11273,UgzI4V-5Hrwr9rAc-AF4AaABAg,1,3 years ago,halaldi cooox men's blinds looked very much i looked like a man bele came to be,alaldi coooox男性百叶窗看上去很像我看起来像男人的贝尔来了
9897,Ugyc6nnOZqUJJabn4yh4AaABAg,1,3 years ago,"surely, asking to eat, sister
very likely ask for a meal too, sister","当然，要吃饭，姐姐
姐姐也很可能也要吃饭"
27656,UgxQQYwfEt28RxK0LVx4AaABAg,1,3 years ago,"ako arabs, the arab comments, like like",阿拉伯人，阿拉伯人的评论，就像
11306,UgxzgcqW7sYpzRPbgch4AaABAg,1,3 years ago,"her: i'll just go ahead and add everything in this forest as an ingredient, including some things that aren't actually food like bamboo, fungus, and snails. me: okay!",她：我只是继续，将所有东西都作为一种成分加入，包括一些实际上不是竹子，真菌和蜗牛等食物的东西。我：好吧！
11923,Ugw1skOYPpd-OyzMCZ94AaABAg,1,3 years ago,are there any friends like me like me?,有像我这样的朋友吗？
27477,UgyZ3AfyOCl5IgGc-cp4AaABAg.8yeOjhy9Yee8ypg_JaVrFQ,1,3 years ago,"i would like to visit and study under her - the whole domestic wonder goddess thing. she makes martha stewart look lazy. of course, stewart must be around 80 by now.",我想拜访和研究她 - 整个家庭奇迹女神的事情。她让玛莎·斯图尔特（Martha Stewart）看起来很懒惰。当然，斯图尔特现在必须年满80岁。
28251,UgzFSH_E5j37KtyOwAJ4AaABAg.8yZgGzUAKfx906mUVEcJdP,1,3 years ago,"@watercolourferns 
our development has done a lot to our healthy. people in developed countries live longer than other people and their children are far more likely to survive. 
and natural is meaningless. that word is empty.","@WaterColourerferns
我们的发展对我们的健康做了很多事情。发达国家的人们的寿命比其他人更长，他们的孩子更有可能生存。
自然是毫无意义的。这个词是空的。"
9930,Ugz7nqMl2Z4akpECoAh4AaABAg.99M9Z9YChfd9AMXIqB61W7,1,2 years ago,"iโ€m so sorry if anyone feels offended. i think iโ€ve chosen the wrong emoji. what i meant was โ€wow sheโ€s tough and amazing ๐คฉโ€ 
while the 2nd line means i am not used being barefoot like that i donโ€t know what i step on iโ€m afraid of worms or something like that and it would feel a little uncomfortable at first.","如果有人感到生气，我很抱歉。我认为我选择了错误的表情符号。我的意思是“哇，她坚强而令人惊叹
虽然第二行意味着我不像那样赤脚，但我不知道自己踩什么，但我害怕蠕虫或类似的东西，一开始会感到有些不舒服。"
11974,Ugwfey99Wio1mZdIcmF4AaABAg,1,3 years ago,"i also like bamboo shoots, but taste",我也喜欢竹芽，但是品尝
27025,Ugza87ku7GqUv1Q3Mjt4AaABAg,1,3 years ago,i wanna die in a place like this,我想在这样的地方死
11165,UgzY_jApRVAGWm8c0YB4AaABAg,1,3 years ago,i really like your home.,我真的很喜欢你的家。
10342,UgxTYDrlBJU5md9ZDJ54AaABAg,1,3 years ago,i really liked,我非常喜欢
9979,UgwBuvN0Y2fTQFxrM6x4AaABAg,1,3 years ago,indonesians like it,印尼人喜欢它
10820,UgwIu--0J_THpbwoXX94AaABAg,1,3 years ago,"why can't western women be like this. 
now this is a real woman.","为什么西方妇女不能这样。
现在这是一个真正的女人。"
10523,UgxwY9icCpDh5F1gDMB4AaABAg,1,3 years ago,i really like watching,我真的很喜欢看
27842,UgzJ7iVrDDsQxcKIYAZ4AaABAg,1,3 years ago,"calculating your bowl of snail powder from time to make 't like snail powder, i still have to like you.",从时间上计算你这碗螺蛳粉用去半个月以上时间制作
11692,Ugzqd9-NE5VL3lQb6WV4AaABAg,1,3 years ago,"it's like living in poetry, so envious",就像活在诗里一样，好羡慕
11633,UgypyyP6ZXW4PZpAsY14AaABAg,1,3 years ago,destiny. i like you,心室死亡。我喜欢你
11612,UgxJi1v_nL9dEFAq5ed4AaABAg,1,3 years ago,i like c so much,我非常喜欢C
11593,UgxNpznBnrlFmbtIzJx4AaABAg,1,3 years ago (edited),the dislikes clicks must be coming from a shithole place like a hell.,不喜欢的点击一定是从地狱般的shithole地方出现的。
11490,UgzPozA0oahCsZqz54l4AaABAg,1,3 years ago,"that life is enviable !!
(in the best sense of the word)
i would like to live there 
i love that woman!!
it is admirable!!
he is my favorite person in the world !!
i'm impressed!
i have spent hours seeing and i don't feel the time","这种生活令人羡慕！
（从最佳意义上讲）
我想住在那里
我爱那个女人！
这是令人钦佩的！
他是我最喜欢的人！
我留下了深刻的印象！
我花了几个小时的时间看，我没有时间"
11513,Ugx1rETbvpN5vnEwgul4AaABAg,1,3 years ago,i wish there was a garden like a billion,我希望有一个像十亿个花园
27711,UgzX9ow_xBdXZ26fYb54AaABAg,1,3 years ago,wow it is my dream to live a simple life just like her,哇，我的梦想是像她一样过上简单的生活。
10690,UgxqSpb3Gk81b3ZvGH54AaABAg.98VupjufjU799pneizUXb6,1,3 years ago,so true ..hw i wish to be like her life .so peaceful and full of love ..shes such a good example of a loving and contented fine lady ...,如此真实。
10769,UgzEBA3j3N3CZYKgL0R4AaABAg,1,3 years ago,sometimes her side profile looks like mina from twice,有时她的侧面轮廓看起来像是两次的Mina
10735,UgwRARf6l0C1lMx_FlN4AaABAg,1,3 years ago,i'm pretty sure this is what feeling smitten is like. i'm absolutely in love and i want to live there and help her with all the things she does <3,我很确定这就是感觉的感觉。我绝对恋爱了，我想住在那里，并帮助她做她所做的所有事情<3
11523,Ugzhd8U0Kq9xrs3ErpV4AaABAg,1,3 years ago,the video is like a movie.,视频就像电影。
10720,UgyzH2qissrUvtCCdnx4AaABAg,1,3 years ago,seriously.... the edit room time alone for something like this is insane... you're never going to get me to believe this is anything but a south china propaganda psy-op,说真的...。
10723,UgxR9du_dy9e6fsNeLF4AaABAg.98Udn6-ocYs98X7KSfQ5Lr,1,3 years ago,"@user-ce5xg9ko6m i'm sorry. it is a mistake only with the same surname.
i also like naka -san's ""flowers"".","@user-ce5xg9ko6M对不起。这只是一个错误，只有相同的姓氏。
我也喜欢Naka -San的“花”。"
11516,UgzMt6-DfBmTzT8OQix4AaABAg,1,3 years ago,only vietnamese people will be happy like this. thank you for seeing video works like this,只有越南人会这样快乐。谢谢您看到这样的视频作品
27766,UgxIa1ukI5Wf3KheS_Z4AaABAg,1,3 years ago,like the feeling of such peace,像这样的和平的感觉
11710,Ugzv9G_DHbA6FpU72l54AaABAg,1,3 years ago,the snail powder is really delicious. i like this to eat this most.,螺蛳粉真的是很好吃，中国粉我最喜欢吃这个。
10518,UgyH98IEJlwazVr76PN4AaABAg,1,3 years ago (edited),"beautiful aunt people don't like chinese cook e why do you welly bound the fields of jungle cooked fucking cooking all the free people to do not get dwet for blonjo
- greetings to jowo, indonesia","美丽的姨妈人们不喜欢中国厨师e e为什么你为什么要束缚丛林烹饪的田野，煮熟的所有自由人都不会为布隆霍
- 给印度尼西亚乔沃的问候"
11485,UgziAM1zLsoTbW8dFVh4AaABAg,1,3 years ago,"seeing this beauty is like a fairy, life is bitter, but very beautiful",看到这位美女，就如仙女，生活很苦，但很美
10102,Ugzno4EjJOAN41yCT-54AaABAg,1,3 years ago,like in indonesia specifically rural areas. bamboo shoots and long beans,像印度尼西亚特别是农村地区。 bamboo
27094,Ugz9OchHkIeQzUmsSpB4AaABAg,1,3 years ago,"hi, i like your video, if you continue to play traditional instruments, i want to know. i really want to see a video tullo played instrument.
hāi, wǒ xǐhuān nǐ de shìpín, rúguǒ nǐ jìxù yǎnzòu chuántǒng yurèqì, wǒ xiǎng zhīdào. wǒ hěn xiǎng kàn dào yīgè shìpín tullo bòfàng yuèqì.","嗨，我喜欢你的视频，如果你继续演奏传统乐器，我想知道。我很想看到一个视频tullo播放乐器。
Hāi, wǒ xǐhuān nǐ de shìpín, rúguǒ nǐ jìxù yǎnzòu chuántǒng yuèqì, wǒ xiǎng zhīdào. Wǒ hěn xiǎng kàn dào yīgè shìpín tullo bòfàng yuèqì."
28104,UgzQcs09dVWjTG4QDBF4AaABAg.8y_QqzYH1K78ydv8Z1tkRO,1,3 years ago,"i’m an indian too, love her channel, it’s beautiful just like our lovely north east. happy independence day!",我也是印度人，喜欢她的频道，就像我们可爱的东北一样美丽。独立日快乐！
10928,UgytbYMjaczRuwwNgYh4AaABAg,1,3 years ago,"if there is mureungdowon in the human world
it's like here.","如果人类世界中有Mureungdowon
就像在这里。"
28064,UgzL1w5c8PVL6z1N3mp4AaABAg,1,3 years ago,"sometimes i just see dislikes on such good videos
which forces me to think that what could be the serious reason for the dislike
like what i atleast want to know one reason..","有时我只是在如此好的视频上看到不喜欢
这迫使我认为可能是不喜欢的严重原因
就像我至少想知道一个原因。"
10313,Ugxvib1ZN4qQm84FF8B4AaABAg,1,3 years ago,"when viewed from the side, you look like korean idol wendy red velvet",从侧面看时，您看起来像韩国偶像Wendy RedVelvet
27335,Ugx271Jg2Au4PhRR5Vl4AaABAg,1,3 years ago,"i like eating liuzhou ""luosifen"" very much. it tastes great.",我非常喜欢吃liuzhou“ luosifen”。味道很好。
27388,UgxeAMVLVTMSJVHyP2R4AaABAg,1,3 years ago,she's like having a restaurant. so many dishes,她就像有一家餐厅。这么多菜
27161,UgwEJ_vY8mCIJRKDBjx4AaABAg.8yhYI5XP_G38yoAd-12L25,1,3 years ago,taiwanese like to watch the type of internet celebrity of the museum of san jing. the gap between the two sides of the strait is obvious.,台湾人喜欢看馆长骂三字经那种类型的网红。两岸差距明显。
27929,UgysJ_cPf7t25pqESKt4AaABAg.8yaqWdnSul68ygmRINvSN7,1,3 years ago,"in the past, vietnam also lived this life like china, but unfortunately abandoned it",以前越南也和中国一样过这种生活，可惜都抛弃了
27162,UgwEJ_vY8mCIJRKDBjx4AaABAg.8yhYI5XP_G38yoERugaEdN,1,3 years ago,@user-yi9hv2tg8j isn't every taiwanese like this?,@user-yi9hv2tg8j 不是每个台湾人都这样好吗
27166,UgyRv5uEXzE0WSsa04x4AaABAg.8yhVtwY-4oB8yoSZBpGfv5,1,3 years ago,"when i was a kid, i grew up like this, but the dishes i made are not as good as her. bleak",我小时候就这么长大的，只不过做的菜没有她的好看好吃而已。
10444,UgysR6M_ntogGsZdm954AaABAg,1,3 years ago,granny în the swing like a boss,奶奶像老板一样挥杆
27886,Ugyx6xPhSbzLaqFPnwh4AaABAg.8yazwkuX_r-8yb88Ys8q-I,1,3 years ago,them thi nau di roi upload len youtube. me like cho.,他们thi nau di roi上传len youtube。我喜欢Cho。
12116,UgxQR4-VyTnG6u7IqnJ4AaABAg,1,3 years ago,"how many vietnamese people love this day !!!!!
diem bang cach like!","这一天有多少越南人爱！
Diem Bang Cach喜欢！"
26915,UgyhSYP6jQ-IxzhcwTx4AaABAg,1,3 years ago,i like this life.,我喜欢这一生。
35430,UgyZLCQq6ogyRsRPZQh4AaABAg.8yURaQp1zUJ8yURfbJe0Kk,1,3 years ago,like -like,像 - 一样
26889,UgzQ4OBGGGIyUq7xGMV4AaABAg.8ykJlulry208yrPjhMcCjt,1,3 years ago,"i know in rural areas it is, but aren't most people in china located in urban or suburban areas? i guess i'm wondering if it costs a lot of money to live in an area like this.",我知道在农村地区，但不是中国的大多数人都位于城市或郊区吗？我想我想知道住在这样的地区是否需要花费很多钱。
17618,Ugy8_drWdVCcrpXhotR4AaABAg.92iOjyLRCpT92mL5X_YvXp,1,3 years ago,"how long can this kind of bamboo shoots like yu shun can grow so big, and so far, i haven't eaten such a fresh and large bamboo shoots. i am very envious!",虞舜 这种笋子要长多久才能长这么大，到现在都还没吃过这么新鲜大个的笋子，羡慕极了！
22428,Ugxf0U_unXMMBm4_65F4AaABAg.9-44izPIuzi9UiqkqbuYcp,1,1 year ago,"@jake89083 yeah i know i'm not fxcking stupid i know what it's like. i lived in the countryside before. liziqi pretties up and romanticizes her life in the mountains, and ofc in real life she gets a lot of help and dont do all that alone, but that doesn't mean the hard work and manual labor is not her lifestyle.",@jake89083是的，我知道我不是愚蠢的，我知道这是什么样的。我以前住在乡村。利兹奇（Liziqi）的美观化，使她在山区的生活浪漫，在现实生活中，她得到了很多帮助，并且不独自完成这一切，但这并不意味着艰苦的工作和体力劳动不是她的生活方式。
17414,UgwV-uzw6206Qx2IoKZ4AaABAg.92kaKG0I8dO92oQUfrR_7b,1,3 years ago,@kichayagarichaitanya8165 why are u so rude... i commented what i liked.,@kichayagarichaitanya8165你为什么这么粗鲁...我评论了我喜欢的东西。
22342,UgzH9hofplzcc4TwV_V4AaABAg,1,3 years ago,i really like to watch the video of sister qi! intersection,真的超喜欢看柒姐的视频！！
17486,UgzYg9lV4WPYoS1mPOd4AaABAg.92jkWAaeg_e92tt5t0Yd03,1,3 years ago,it is impossible to live like this and look like her。。。。。 all those hard labour will make you look like 50 when you are in your 30s,像这样的生活是不可能的，看起来像她。。。。。所有这些辛勤工作会让你看起来像50岁
69,UgyZ7HV3q9sJgpJPF9x4AaABAg,1,2 weeks ago,"it is very natural life, i like it❤",这是非常自然的生活，我喜欢它
22234,Ugw8Y395YVWjvr3CsSF4AaABAg,1,3 years ago,i like survival,我喜欢生存
17577,Ugwys5uGYJng3aj99o94AaABAg,1,3 years ago,im indonesian...i have been cooking like this 20 years ago....nice..,我的印度尼西亚人...我20年前一直在做饭。
22201,UgwYtipLXCL7qTZ8MQJ4AaABAg,1,3 years ago,those who are watching from india like here.....,那些像这里像印度一样观看的人.....
22186,Ugzt5VGHr6znPhq6-k14AaABAg.9-AalxXxrkw9-x4SOW_Y57,1,3 years ago,"@user-wq2gg3nu6m's life, self-sufficient, self-sufficient, sunrise and sunset, is the reflection of modern people in the color of the five lights. i like your rural days.",@user-wq2gg3nu6m 反璞归真、自给自足、日出而作日落而息的生活是现代人处在五光十色中的省思。我喜欢你的农村日子。
22140,UgwL3WuB1LgDY1DupRZ4AaABAg,1,3 years ago,"he already hungry, has his like and subscription, greetings from mexico.",他已经饿了，有他的喜欢和订阅，来自墨西哥的问候。
17218,Ugwg82kUQipIpmMTD094AaABAg,1,3 years ago (edited),"i really like watching this video like this ... i think enal just wants to cook anything, just pick it in the garden ... so i want to garden",我真的很喜欢这样观看这样的视频...我认为Enal只是想烹饪任何东西，只是在花园里挑选它...所以我想花园
17738,Ugzb212ptN337o72i_t4AaABAg.92h_lG60ZLF92k_4I-jc9B,1,3 years ago (edited),what kind of human being(?) would leave disgusting comment like this?,什么样的人（？）会留下令人恶心的评论？
21994,UgxEB2KePnN9dUBsMlR4AaABAg.9-Jt-hgmGVe9-T5NZ08FFN,1,3 years ago,"just like we hate the vietnamese government, the vietnamese government is the devil",就像我们讨厌越南政府一样，越南政府就是魔鬼
18027,UgzsqkvV7MNbhoE53Al4AaABAg,1,3 years ago (edited),to be fraank....a malayali does not eat this kind of foods....bt i like her way of cooking..i love ziqi,成为弗劳克（Fraank）....马来亚人不吃这种食物。...bt我喜欢她的烹饪方式。
