,cid,votes,time,含like,含like中文翻译
1268,Ugyz0WXD5drcJ61UryZ4AaABAg,0,1 year ago,i like you,我喜欢你
1105,UgxdbqNq0SjCbYBX6e14AaABAg,0,1 year ago,i really like you,我真的很喜欢你
1138,Ugybr4RRt4JEyUaLFUZ4AaABAg,0,1 year ago,"i only have one question, why in my home, herbs and plants get all kind of bugs and plagues,but her plants all look so healthy? is it like that naturally in her country or what?",我只有一个问题，为什么在我的家中，草药和植物会得到各种虫子和瘟疫，但是她的植物看起来都很健康？在她的国家自然而然吗？
1141,Ugybr4RRt4JEyUaLFUZ4AaABAg.9bO9uJ_Ki4I9cl15FDKa59,0,11 months ago,"it's most likely things like very healthy soil (which makes the plants very healthy and able to resist disease and predation, as well as being more nutritious), as well as companion planting and natural methods of dealing with whatever pest there may be an issue with.",这很可能是非常健康的土壤（这使植物非常健康，能够抵抗疾病和捕食，并且更有营养），以及伴侣种植和自然方法处理任何害虫。
1158,UgzujwZJfy4YnWv9P4B4AaABAg,0,1 year ago,i like this,我喜欢这个
1183,UgyhSt6XFfu_OUcwUB94AaABAg,0,1 year ago,i like it.,我喜欢。
1214,UgzH3r9YQmYHKyNogvV4AaABAg,0,1 year ago,ako arabs here if only if i would like to like,Ako阿拉伯人在这里只有我想喜欢
1223,Ugykg_GclGsO8d_T1PJ4AaABAg,0,1 year ago,"i like! bamboo! editor back basket! for the first time, i saw ziyi aizi who taught the very cute video in person!",我喜欢！竹子！编著背篮子！我第一次看到子柒爱子亲自传授真的很可爱的视频喔！
1241,UgyZzVty6rc-8TZgbjx4AaABAg,0,1 year ago,"in fact, many people in china don't like others to live happier than him",其实中国有很多人不喜欢别人过得比他幸福
1288,UgxWBwnCJ3mpmnU5ybp4AaABAg,0,1 year ago,"married a wife like this, the whole life does not worry about family meals ... you are great",与这样的妻子结婚，一生都不担心家庭用餐...你很棒
1441,Ugza-c0hiYhvKaEy9cJ4AaABAg,0,1 year ago,like ❤️,喜欢❤️
1309,UgxkRNBgl0zQ6CvwVRp4AaABAg,0,1 year ago,really like to eat that,真的很喜欢吃
1310,Ugzh6Rsw4tKAnwxBzqB4AaABAg,0,1 year ago,she look like wonder woman .,她看起来像神奇女子。
1317,Ugx701ShccFi0XbLGIZ4AaABAg,0,1 year ago,"i just made a channel, subscribed to support me 1 like and 1 share",我刚刚制作了一个频道，订阅以支持我1和1股
1336,UgxT_u02QknRQszhBiF4AaABAg,0,1 year ago,i really like your lifestyle.,我好喜欢妳们的生活方式 真是闭关好地方 愿真神爱妳们全家。
1387,UgwN2k32K8MU7LWlNkd4AaABAg,0,1 year ago,"appreciate her eyes, fast, and like her food, food, housing, and transportation",欣赏她的眼明手快，喜欢她的衣食住行
1394,UgwoTIvL5XaHXQ__Fc14AaABAg,0,1 year ago,i like its is work cookbook,我喜欢它是工作食谱
1398,UgxQ4d90WbYMFiWe56B4AaABAg,0,1 year ago,"wow, something, nostalgia.
looking at jackie, it feels like it came out!","哇，有些怀旧。
看着杰基，感觉好像出来了！"
1421,UgwIoP0mY8CF9aJ0Vyt4AaABAg,0,1 year ago,so much like my hometown in countryside vietnam!! love these videos zi qi!,非常喜欢我在越南乡村的家乡！喜欢这些视频Zi Qi！
3047,UgwZznZ9k6mnAxWC5kV4AaABAg,0,1 year ago,like you,喜欢你
3074,UgzSbCUgBGZDzIAKWcN4AaABAg,0,1 year ago,i like it. keep following.,我喜欢它。继续关注。
6124,UgxHh-p4TX8Fm2KQ9OF4AaABAg.9F-KVAYlq8k9F2lezLVrXi,0,2 years ago,you go to the highlands to live like that.,你去高地那样生活。
5103,UgxwPSwHzjHJQHveggN4AaABAg,0,2 years ago,"indonesian people like
๐‘","印尼人喜欢
"
5119,UgzJnB6FuY5Y_QfYIo54AaABAg,0,2 years ago (edited),"please check this travel video(richest temple's of the world), please watch and support our channel. also like, subscribe and share: https://youtu.be/ebgeaahq1uc=22s%3fsub_confirmation%3d1",请检查此旅行视频（世界上最富有的寺庙），请观看和支持我们的频道。也喜欢，订阅和共享：https：//youtu.be/ebgeaahq1uc = 22s%3fsub_confirmation%3d1
5134,UgwZxsfpjSvKhOcD3AF4AaABAg,0,2 years ago,iam from india tamil nadu i like theway of your cooking,来自印度泰米尔纳德邦的Iam我喜欢你的烹饪方式
5150,Ugxpw-yw0U29DxklcUZ4AaABAg,0,2 years ago,i didnโ€t expect that there were a lot of people who like rural china,没想到喜欢中国农村的还挺多
5172,UgzH44JeqN2DyBMETop4AaABAg,0,2 years ago,the video you share is awesome...like,您分享的视频很棒...喜欢
5194,UgxRt8noXIBnJP99Gud4AaABAg,0,2 years ago,hope one day i will be able to revive a life like such a childhood,希望有一天我能够恢复像童年这样的生活
5202,Ugyrxc0gcJ3SQBkRfLx4AaABAg,0,2 years ago,"to be honest, i like all the food except for the pork and the chicken. everything else looks absolutely delicious",老实说，除了猪肉和鸡肉外，我喜欢所有食物。其他一切看起来绝对美味
5222,UgwhZS_G4o2gguM5k6R4AaABAg,0,2 years ago,"im from indonesia,i like this vidio",我来自印度尼西亚，我喜欢这个vidio
5241,Ugw-ubzQqgUGieV50xl4AaABAg.9H2FAnCVsvW9HA6N5FslwA,0,2 years ago,"usually using the contents of risoles and the like or not, miss?",通常使用里孔的内容等，错过吗？
5271,UgxYV4qVJNYvXqvETcp4AaABAg,0,2 years ago,"this woman is special if plants and cosina cone with her, there is no cholesterol as natural, nothing monsant
too bad is not a like","如果与她一起植物和cosine锥，这个女人很特别，没有天然的胆固醇，没有任何东西
太糟糕了"
5274,Ugzp1DHIDKpR3FG43W14AaABAg,0,2 years ago,"i love independent women
i think my sister like this vidio
https://youtu.be/ppgwauys7b0","我爱独立的女人
我想我的姐姐像这个vidio
https://youtu.be/ppgwauys7b0"
5280,UgxEQhC7UDxqPK7t7qh4AaABAg,0,2 years ago,watch it like jiangjiang,咋看都像江
5297,Ugw8yFTWB1JOROt-JWd4AaABAg,0,2 years ago,"๏ดฟ and i created gin and mankind except to redeem them [al -dhariyat: 56]
and i did not cover
- saheeh international

๏ดฟ what i want of livelihood and what i want to be used is [al -dhariyat: 57]
i do not want from one product, nor do i whats them to feed me.
- saheeh international

๏ดฟ god is the sustenance of the two powerful power ๏ดพ[al -dhariyat: 58]
indeed, it is allh who is the [continual] provider, the firm posssor of strength.
- saheeh international

๏ดฟ for those who wronged sins, such as the sins of their owners, do not hurry ๏ดพ[al -dhariyat: 59]
and indeed, for those who have been worked is a portion [of punishment] like the job
- saheeh international

๏ดฟ woe to those who disbelieved from the day they promise ๏ดพ[al -dhariyat: 60]
and woe to share who have displayed from their day which they are promised.
- saheeh international","我和我创造了杜松子酒和人类，除了赎回它们[al -dhariyat：56]
我没有掩盖
-Saheeh International

）我想要生计和想要使用的是[al -dhariyat：57]
我不想从一种产品中，也不想让它们喂我什么。
-Saheeh International

）上帝是两个强大的力量的维持
的确，是[持续]提供者，是实力的可能者。
-Saheeh International

）对于那些犯了罪的人，例如主人的罪过，不要着急（[al -dhariyat：59]
的确，对于那些工作的人来说，是像工作这样的一部分（惩罚）
-Saheeh International

）对那些自从他们承诺的那一天不相信的人的祸患（[al -dhariyat：60]
和分享他们承诺的那一天的人。
-Saheeh International"
5298,UgznyXN_TJglRMqndWB4AaABAg,0,2 years ago,cute girl with lovey nature when i see like that feel so fresh,当我看到那样新鲜的可爱女孩，​​有爱的天性
5335,Ugxg_AgRj66lqRsoMqJ4AaABAg,0,2 years ago,"i am new in here i don't know that where is she from i am so curious. she is so hardworking girl. sometimes i think when my life would be like that peace full, relaxing and calming.",我是新来的，我不知道她从哪里我好奇。她是如此勤奋的女孩。有时，我认为当我的生活就像和平一样，放松和平静。
5348,Ugwk0RqrnT8fwg-Qra54AaABAg,0,2 years ago,"where do gordon ramsey and alikes fit into all this????
๐๐๐๐๐๐คฃ๐คฃ๐คฃ๐คฃ๐๐๐๐","戈登·拉姆西（Gordon Ramsey）和雅利克（Alikes）在哪里适合所有这些？？？？
"
5370,UgwN0fl1TOUGVULVuH14AaABAg,0,2 years ago,"we all need to go back to living like this...this is living...

https://m.youtube.com/channel/ucmjq-bq66vk9-qq8wy0fvlg","我们都需要像这样回到生活...这是活的...

https://m.youtube.com/channel/ucmjq-bq66vk9-qq8wy0fvlg"
5372,UgyeI7mUk3QF36Z3eVl4AaABAg,0,2 years ago,here he called bambungโค๏ธโค๏ธ like so .. especially in stir -fry using small anchovies and chillies,在这里，他称之为bambung❤️❤️就像这样..尤其是用小凤尾鱼和辣椒的搅拌
5383,Ugyq6VuL9Qs60ear4DB4AaABAg,0,2 years ago,"i look for hours ... i like to look so much. after work i lie rest and look .. it soothes so, looking at how they work and prepare something very tasty and beautiful. there is no translation, i try to understand so. i find a useful one for myself .. i am also interested in the garden and landing ... i really want to learn something to cook something else .. the girl is very cute and beautiful, hardworking .. it is very nice to look at her labors . everything is very beautiful, and i really like that they love my grandmother so .. i donโ€t even know .. i wonโ€t be young with a young one .. but i would like at least a little, such care in old age .. thank you! your videos let your soul enjoy and rest.",我看几个小时...我喜欢看很多。下班后，我躺在休息和看。没有翻译，我试图理解。我为自己找到了一个有用的。我也对花园和着陆感兴趣...我真的很想学习一些东西来烹饪其他东西。美丽，勤奋..看着她的劳动真是太好了。一切都很漂亮，我真的很喜欢他们爱我的祖母，所以..我什至不知道..我不会和一个年轻的人在一起..但是，我至少想要一点点，这样的照顾。.谢谢！您的视频让您的灵魂享受和休息。
5411,Ugx-Znh6aAnl1JqOs6d4AaABAg,0,2 years ago,wow... beantiful farmers.... i like it..,哇...美丽的农民....我喜欢..
5107,UgzPXhVCoLokA-Ax9op4AaABAg,0,2 years ago,this is just branding. making money off of gullible people who believe she lives her daily life like this lol.,这只是品牌。用可骗的人赚钱，他们相信她像这样的日常生活。
5000,Ugw8GikZR9epxfarqTN4AaABAg,0,2 years ago,"encourage me for more nature videos like, share, subscribe to my channel friends .. natural bird sounds https://youtu.be/ezfmbkjcevy",鼓励我制作更多自然视频，例如，分享，订阅我的频道朋友。。。。。。。。。。。。。。。。。。。。。。。。。。。。。。。。。。
5428,Ugyl-_tCi8E0nvnaU6J4AaABAg,0,2 years ago,applause!! it is a channel. muuuy interesting. i would like spanish translated to learn more,掌声！！这是一个频道。 Muuuy有趣。我希望西班牙语翻译以了解更多
4955,Ugzq012xgfTMhrQwdJ14AaABAg,0,2 years ago,"encourage me for more nature videos like, share, subscribe to my channel friends .. natural therapy https://youtu.be/ivk5dbx4hz0",鼓励我进行更多的自然视频，例如，分享，订阅我的频道朋友。。。。。。。。。
4696,UgwOHcwBsLgHjkszsbh4AaABAg,0,2 years ago,"if life is so comfortable, where is there a migrant worker? like jin yongwu's novels, the effect is really good. six million people like it, 300,000 people are flat, hahaha",生活真有她那么惬意的话，哪里还有农民工啊？跟金庸武侠小说一样，拍出来的效果确实不错。六十万人赞，三十万人扁，哈哈哈
4701,UgxbQN2mdaHo_eAgoNF4AaABAg,0,2 years ago,i which to have a life like that,我有这样的生活
4704,UgwHmrGyLFUw_urFvpJ4AaABAg,0,2 years ago,"how wonderful, i would really like to enjoy these dishes",多么美妙，我真的很想享用这些菜
4720,UgxmEkLIdVO-izOCyUZ4AaABAg,0,2 years ago,fczccccccl every webbed about liked so much from vent from,fczcccccccl每个织布机都喜欢从
4725,UgwmVOUfipE1A7oLXpB4AaABAg,0,2 years ago,i love how kitchens i would like them to put it in spanish,我喜欢我希望他们把它放在西班牙的厨房
4754,UgwClbzROh2MrDv33nJ4AaABAg,0,2 years ago,her grandmother looks like a queen,她的祖母看起来像个女王
4759,UgzeAliRHFdFB7tlmtV4AaABAg.9IgQj_sbQSt9JViQQdoW3p,0,2 years ago,classic kid hi .... definitely like gardening .. he,经典的孩子嗨....绝对喜欢园艺..他
4793,Ugz-9AfuXVyzFJJ4yi54AaABAg.9IcflViauGt9OF2urcIFlv,0,2 years ago (edited),"@user-bz5iy9oy2q do you agree if americans insist, ""pasta is our traditional food, not italian food!""? likewise, the chinese claim that kimchi is their own food. it's crazy. that sounds like 3*7=28 :^)",@user-bz5iy9oy2q您是否同意美国人坚持说：“面食是我们的传统食物，而不是意大利美食！”？同样，中国人声称泡菜是他们自己的食物。这很疯狂。这听起来像3*7 = 28：^）
4797,Ugyi37AFYfM-rcwWUVJ4AaABAg,0,2 years ago,i like it.,我喜欢。
4800,Ugxqx4rvd1ENDU1yJot4AaABAg,0,2 years ago,i saw other ladiesctry to copy your but no one can like yours ..you are best,我看到其他女士要复制你的，但没人能喜欢你的..你是最好的
4815,UgxQJ5255F03_KOQGa14AaABAg,0,2 years ago,would you like to hit it with kimchi like this,你想这样用泡菜吗
4825,UgwVXopwrI1CibhUsgp4AaABAg,0,2 years ago,it turns out that outside eating like this too,事实证明，外面也这样吃
4833,Ugw1ASE-s0hW__yZ7Tl4AaABAg,0,2 years ago,i like this carry,我喜欢这个随身携带
4841,UgxXcbs9jfqMZBxEjed4AaABAg,0,2 years ago,i like to see you happy happy your happiness is transmitted you are very beautiful and very special apart too intelligent you have to thank god for every day my beautiful lady gives you,我喜欢看到你快乐的幸福，你的幸福传播了你非常美丽，非常特别的聪明，你每天都要感谢上帝，我美丽的女士给你
4868,Ugzc_3SVEgz5TTtYTSN4AaABAg,0,2 years ago,"if i had girl like her as girlfriend, i will smile even when i am sleeping",如果我有像她一样女友的女孩，即使我睡觉时，我也会微笑
4877,UgyE7F3ZiJBaUsHnq9V4AaABAg,0,2 years ago,"this noodles smell like shit, but taste good",这个面条闻起来像狗屎，但是品尝好
4879,UgxEiO5DRLUE-7tV88h4AaABAg,0,2 years ago (edited),i love this girl....more than everyone in this world..❤❤ she is living in the peace world...❤❤.even i am also a nature lover....love u as always...❤❤❤ and she even shows that money cant buy happiness....❤❤ i wish your grandma may live like a mortal life❤,我爱这个女孩....比这个世界上的每个人都多....❤❤她生活在和平世界中...❤❤。即使我也是自然情人。...一如既往地爱你...❤ ❤❤她甚至表明金钱不能买幸福。
4880,UgxTiQYgnPdoaWxYWI14AaABAg,0,2 years ago,i never knew purple mushrooms grew like that lol,我从来不知道紫色蘑菇会像那样长大
4911,UgxD0L0_8VPfK8zOpUx4AaABAg,0,2 years ago,"encourage me for more nature videos like, share, subscribe to my channel friends..cute snail https://youtu.be/l9bsx7vfcdo",鼓励我进行更多的自然视频，例如，分享，订阅我的频道朋友。
5416,UgxXxAJmCYuMhAYURct4AaABAg,0,2 years ago (edited),"luosifin wuji series fantasy related my i ask, i almost finished the entire series for good moral reasons, you are that, the speed of time is like, time waits nobody by freddie mercury",我问的luosifin wuji系列幻想与我问，我几乎完成了整个系列的良好原因，您就是，时间的速度就像，时间等待着Freddie Mercury的时间
5471,UgyvC0zdox_RcDJUAUh4AaABAg.9GOFskXFXco9GoPEo7QIRc,0,2 years ago,white li yes i like tha corian people very much.......๐ฅฐ๐๐,白李是的，我非常喜欢tha corian人.......
3100,UgxK7tTx9vC9pt59mmJ4AaABAg.9Pk50gyAGkX9Y6Xof-vcLM,0,1 year ago,"haha, if you lived like you would know that grandma would have scolded her for putting her hand in the pickling brine!",哈哈，如果您像您一样生活，就知道奶奶会因为将她的手放在腌制的盐水中而责骂她！
5758,UgzUGwJPqEBYqjXiWGh4AaABAg,0,2 years ago,like,喜欢
5818,UgxTd16sGdFobhqPc6Z4AaABAg,0,2 years ago,u use more water in cooking food than oil i like and love u talent,您在烹饪食物中使用的水比我喜欢的油多，爱你的才华
5857,UgxyEkY0hU9z20y9WaV4AaABAg,0,2 years ago,i noticed she painted the kitchen dark blue or black so she and her food looks like an oil painting,我注意到她为厨房涂了深蓝色或黑色，所以她和她的食物看起来像是一幅油画
5867,UgzlhAyktodWiOeVsKF4AaABAg,0,2 years ago,i also like to be like this because the green garden is soo good nature to survive,我也喜欢这样，因为绿色花园是如此的天性，可以生存
5910,UgwDQPS9dniMHyTXkbV4AaABAg,0,2 years ago,looks like all she cook are very delicious! she's an expert cook too. god bless you young lady.โคโคโคโคโคโค๐,看起来她煮的所有东西都很美味！她也是专家厨师。上帝保佑你的小姐。
5912,Ugw15dtT8pewlHfM-Yp4AaABAg,0,2 years ago,"https://youtu.be/laep28f9mlu.
guys also watch my recipe i hope you like it my videos n pls don't forget subscribe also. thanku","https://youtu.be/laep28f9mlu。
伙计们也观看我的食谱，希望您喜欢我的视频，请不要忘记订阅。感谢你"
5943,Ugwruoo5kyusmhmTD_p4AaABAg,0,2 years ago,"some are complaining about their own lives and how cities are bad and so on and on. but you can also live at least a bit like that. maybe you can stile your room differently, buy new kitchen pottery similar to the one she uses (of course do not throw away the old stuf, but give it to someone that needs it or sell it or...) you can also learn how to cook and sew (there are plenty tutorials on youtube and i believe that if you set your mind to it, you can learn. maybe not as fast as some, but practise makes perfect and besides, even she had to learn things. no one is born with skills, some are just a bit more talented, but that does not mean that you can not learn it.) and do it in your free time instead of watching tv and youtube. you can also try and plant some vegetables in your apartment, at least some herbs. there is a thousant things you can do to live a bit more like her and reduce stress. it is true that she inspires people, but if they do nothing but watch her videos, then what purpose does it have? yes, even watching her videos calms you and makes you feel beter, but imagine how much better you would feel if you lived a bit differently? or at least if you try to make your home look better, so that you would be able to admire it every day you return exsausted from work/school. (believe me, even the dullest room can look perfect with a bit of imagination and/or some tips/diys from internet.) but the most important thing is that you try to admire your own soroundings. follow her lead, she admires every flower and raindrop. so can you. at first it will be hard, but in time, you will notice small, but precious pearls even in the busiest city and this little surprises will make you smile.",有些人抱怨自己的生活以及城市如何不好等等。但是您也至少可以这样生活。也许您可以以不同的方式静止，购买类似于她使用的厨房陶器（当然不要扔掉旧的STUF，而要丢给需要它或出售的人或...）您也可以学习如何学习要烹饪和缝制（YouTube上有很多教程，我相信，如果您确定它，就可以学习。也许不像某些人那样快，但是练习是完美的，而且她不得不学习东西。没有人天生具有技能，有些人的才华更加有才华，但这并不意味着您无法学习。）在业余时间进行，而不是看电视和YouTube。您也可以尝试在您的公寓中种植一些蔬菜，至少一些草药。您可以做一些事情要做的事情可以像她一样生活并减轻压力。的确，她启发了人们，但是如果他们除了观看视频外什么都不做，那么它有什么目的？是的，即使看着她的视频使您平静下来，让您感到沮丧，但是想象一下，如果您的生活有所不同，您会感觉好多？或至少如果您试图使房屋看起来更好，以便您每天都可以欣赏它在工作/学校中遭到屠杀。 （相信我，即使是最沉闷的房间也可以通过一些想象力和/或互联网上的一些提示/Diys看起来很完美。）但是最重要的是，您尝试欣赏自己的sor脚。跟随她的领导，她欣赏每朵花和雨滴。你可以。起初很难，但是随着时间的流逝，您会注意到很小的，但是即使在最繁忙的城市中，珍贵的珍珠也会让您微笑。
5950,Ugy_43VmM3TLgWlkxWt4AaABAg,0,2 years ago,"fans (liziqi), can i help me? ..

i am from sabah, just a month open youtube channel cover, please support me? .. please subscribe to my youtube channel, don't forget to watch my video cover guys

~ may all the people see my comment, i wish you a cheap sustenance and a long life, amen

i want to be like a successful youtuber2, hmmp๐”๐” .. hope you can help ๐‘๐‘
#accept_kasih_admin_channel_ini๐","粉丝（Liziqi），我可以帮我吗？

我来自沙巴，只有一个月的打开YouTube频道封面，请支持我？

〜也许所有人都看到我的评论，祝您廉价的寄托和长寿，阿们

我想成为一个成功的youtuber2，hmmp
＃ACCEPT_KASIH_ADMIN_CHANNEL_INI"
5960,Ugz6F4fTg63dy83Wpd54AaABAg,0,2 years ago,like her so much,像她一样多
5972,UgwRwwxe31pJjZZaUTh4AaABAg.9FERNfXhq2g9GGN5SdPwlh,0,2 years ago (edited),"if you do nโ€t like it, do nโ€t look at it. please do nโ€t deny the channel where others operate with your heart. when your achievement is greater than others, you are qualified to criticize others.",不喜欢可以别看，请不要否定别人用心经营的频道，当有一天你的成就大于别人的时候，你才有资格批评别人，不要心胸这么狭隘，格局大一点，尊重自己也重别人
5974,UgzgFG-gLYdSp-yOScl4AaABAg,0,2 years ago,"pakapk language na tobis
like indonesia","pakapk语言na tobis
像印度尼西亚"
5979,UgwcJF3LXuDWr1FgQsp4AaABAg,0,2 years ago (edited),is pritty place i like.,我喜欢的地方是Pritty的地方。
