,cid,votes,time,含like,含like中文翻译
11532,UgwOKaIWeB3nIXK7cUJ4AaABAg,1800,3 years ago,"i would like to say one thing, you have a best cameraman. one like to cameraman ❤",我想说一件事，你有一个最好的摄影师。一个喜欢摄影师❤
15368,UgxM6M0zpu3k7SD32RR4AaABAg,1700,3 years ago (edited),the whole thing just looks like a fairytale.... isn't it?,整个事情看起来像个童话。...不是吗？
28516,UgxCpRiDGzrwuzVOfl94AaABAg.8yY6-41Td1g8yaXBjP5kIe,1400,3 years ago,@franzpeters3824 you have a problem with people not speaking english? what's your problem? don't watch it if you dislike her....,@franzpeters3824您对不说英语的人有问题吗？你怎么了？如果您不喜欢她，请不要看。
19925,Ugy64b8Tc-CR9fv_DdR4AaABAg,807,3 years ago,why are there 10k dislikes ..like people her videos are extremely aesthetic and calming and a lot of effort is required for these videos and she's feeding her grandma and giving us amazing content. why would you dislike this :(,为什么有10k的不喜欢。就像她的视频非常美观和平静，这些视频需要付出很多努力，她正在喂奶，并给我们提供了惊人的内容。你为什么不喜欢这个:(
16114,UgwQmwt3bLXwye3i6Xp4AaABAg,784,3 years ago,"i think every kid should have a relative that has a ranch or farm something like that, and experience life and joy that’s entirely different from the fast pace city life, and that you need to put effort to learn and grow something of your own",我认为每个孩子都应该有一个牧场或耕种类似的亲戚，并且体验与快速速度城市生活完全不同的生活和喜悦，并且您需要付出努力来学习和成长自己的东西
10632,UgxqSpb3Gk81b3ZvGH54AaABAg,765,3 years ago,"in a world obsessed with money, violence, drugs, sex... she is like a light in a dark forest, a breath of fresh air amidst all the pollution of modern life.",在一个痴迷于金钱，暴力，毒品，性爱的世界中……她就像一片黑暗的森林中的光明，在现代生活的所有污染中呼吸新鲜空气。
3940,UgzddFErU7M5OM42IZ94AaABAg,728,2 years ago,i feel like everything i know about life is wrong. this is what life supposed to look like!,我觉得我对生活的一切都错了。这就是生活应该的样子！
3065,UgxK7tTx9vC9pt59mmJ4AaABAg,634,1 year ago (edited),"as we can see in the videos, the background of the forest, farms, yards, cooking stoves and utensils are real. in the past especially for the chinese people our ancestors work hard on every inch of lands they have. they make use of everything that nature provides to them. generation by generations the land grew flourish. this final generation from baby boomers era (like the grandma) likely the last of their kind, because due to the changes of modern and tech/gadjets world. not many still living up the life just like showed in the video because the generation x,y and z are working and living in cities to find income and mostly leaving the old man/woman at their village. in the end leaving the lands and farms unattended (because grandpa/grandma are already old to work and care the lands).
most end up selling their land and the money the new generation get were invested in businesses, building or renovating house in the cities or in another country, etc. 
as you saw in the video, you can see herbs, clean ponds and rivers, varieties of vegetations, animals like birds, chicken, duck, are well taken care of. these are their daily source of food because there are no supermarket nearby where you can buy from there. thus, why need to buy if you can get it fresh from your own farm? chinese are particular in what they eat (diets and healthy) so they grew herbs, vegetables and live stocks. that is how the baby boomers generation survived along the years away from town or cities. 
the beautiful lady is one of the most impressive grandchild in her family. not just beautiful but also hardworking, diligent, caring and humble because she still carry on her family's tradition and the lands. she learns all sorts of cooking, fermenting, recipes could be mostly from her grandparents which is oustanding. 
i too once lived like hers until i was 19 years old and i loves everything just like hers until my grandma passed away and the land was sold by my uncle that year. 
the memories i had never perish. i still remember the smell in the morning when i'm standing in the middle of the farm, the morning dewdrops on the leaves and grasses, the sounds of birds and water flowing in the small river, the bamboo forests in the evening like golden, chasing gooses, collecting the chicken eggs, collecting the sap from rubber trees, the soothing cold wind on the pepper farm hills, catching grasshoppers among the grasses, catching fireflies at night, the smell of firewood burning while boiling hot water, the food that my grandma used to cooked, my cousin shouting from afar teasing me while plucking potatoes from the ground, etc. i misses all that when i watched the video. 
i did went back to the village a few years ago but it wasnt the same anymore and the place changed alot and the farm wasnt like it used to be like. the peaceful life that i missed.","正如我们在视频中所看到的那样，森林，农场，院子，烹饪炉和餐具的背景是真实的。过去，尤其是对于中国人民，我们祖先在拥有的每一英寸土地上都在努力工作。他们利用自然界提供的一切。几代人的一代人的土地蓬勃发展。来自婴儿潮一代时代（像奶奶一样）的最后一代可能是同类的最后一代，因为由于现代和技术/gadjets世界的变化。 X，Y和Z一代在城市工作并居住在城市中，并大部分将老人/女人留在他们的村庄里，所以并没有多少人像视频中的生活那样过上生活。最后，离开土地和农场无人看管（因为爷爷/祖母已经在工作和照顾土地上已经老了）。
大多数人最终出售了他们的土地，以及新一代获得的资金投资于企业，在城市或另一个国家建造或翻新房屋等。
正如您在视频中看到的那样，您可以看到草药，干净的池塘和河流，各种植被，鸟类，鸡肉，鸭子等动物。这些是他们的日常食物来源，因为附近没有超市可以从那里购买。因此，如果您可以从自己的农场获得新鲜，为什么还需要购买呢？中国人在吃的东西（饮食和健康）中是特别的，因此他们种植了草药，蔬菜和活蛋。这就是婴儿潮一代在远离城镇或城市的几年中生存的方式。
美丽的女士是她家庭中最令人印象深刻的孙子之一。不仅美丽，而且勤奋，勤奋，关怀和谦虚，因为她仍然具有家人的传统和土地。她了解各种烹饪，发酵，食谱可能主要来自她的祖父母，这是罢工的。
我曾经像她一样像她一样生活，直到我19岁，我都喜欢像她这样的一切，直到我的祖母去世，那一年我的叔叔出售了这片土地。
我从未灭亡的记忆。我仍然记得早晨，当我站在农场中间时，早晨的气味，叶子和草地上的碎屑，小河中鸟类和水的声音，傍晚的竹林像金色一样，追逐鸡蛋，收集鸡蛋，从橡胶树中收集树液，在胡椒农场山上舒缓的冷风，在草中捕捉蚱hoppers，在晚上捕获萤火虫，柴火的气味在沸腾的热水时燃烧，食物，我是我的食物。奶奶曾经煮过，我的堂兄从远处大喊大叫，一边从地上摘下土豆，等等。
几年前，我确实回到了村庄，但不再一样，这个地方改变了很多，农场不像以前那样。我错过的和平生活。"
32865,UgxN7NFGjJrEc7efRWd4AaABAg,621,3 years ago,i don't know why but when i get notification of her vedio automatically i feel relax myself all my tensions get away for a while . any one else feels like me then hit like,我不知道为什么，但是当我自动收到她的吠陀通知时，我感到放松自己的所有紧张局势暂时摆脱了一段时间。任何其他人都喜欢我，然后像我一样击中
8439,UgziVro46SrJlBxVm494AaABAg,528,2 years ago,who is addicted to liziqi's videos like me,谁沉迷于像我这样的liziqi的视频
14446,UgwC1BG8OG690PtX4iB4AaABAg,482,3 years ago,its like watching those studio ghibli movies. its very nostalgic.,就像看那些吉卜力录音室电影一样。它非常怀旧。
6320,UgzrOgipSKHwc8hEvCV4AaABAg,428,2 years ago,"my name is hrithika from kerala ,india.iam only 8 years old.my sister is typing this for me. iam your great fan ๐.i wish to make a land like yours",我叫来自印度喀拉拉邦的Hrithika。我的姐姐只有8岁。 iam你的忠实粉丝
29433,UgzV5SRrEU2-VIvbK7h4AaABAg,417,3 years ago,"panda a: that girl comes again, who cut our bamboo last time to make her furniture! this time she evens eats it!
panda b: damn! let’s go dislike her on youtube!
hence the dislikes.","熊猫A：那个女孩又来了，她上次砍了我们的竹子来制作家具！这次她逃避了！
熊猫B：该死！让我们在YouTube上不喜欢她！
因此，不喜欢。"
12993,Ugwl6sRonzHw35234nV4AaABAg,406,3 years ago,"imagine a world like this, no plastic no msg no adulteration full of green and nature providing everything for us",想象一个这样的世界，没有塑料没有味精，没有充满绿色的掺假，自然为我们提供了一切
31717,UgzXGcQUxZHhzvFjDeR4AaABAg,400,3 years ago (edited),"i accidently pressed this video 
and.....



it was my best mistake everrr 


edit:jezzz 300+ likes?!
by the way i'm new here","我不小心按下了这个视频
和.....



这是我最好的错误


编辑：jezzz 300+喜欢？
顺便说一句，我在这里新来"
5612,UgwpUI0m8Mk-QT1ICNl4AaABAg,388,2 years ago,"if you don't like this, there's something wrong with you.",如果您不喜欢这个，那么您有问题。
11115,UgxS3m6P5-5nxlPHYY94AaABAg,380,3 years ago,every time i think she’s done she does like ten more things,每次我认为她已经完成了，她都会喜欢十件事
18207,UgzsHZsR0J2sPs3rcJV4AaABAg,317,3 years ago,she made gordon ramsey looks like a complete donkey,她让戈登·拉姆齐看起来像个完整的驴子
16775,UgxjySQyWB6VBun_lLt4AaABAg,312,3 years ago,why would someone dislike this? i literally can’t think of any reason,为什么有人会不喜欢这个？我从字面上想到任何原因
20124,Ugy2JIei5Rk0MEDBhgF4AaABAg,277,3 years ago (edited),imagine the world started to live like this with high buildings inside woods.,想象一下，世界开始像树林内的高建筑物一样生活。
9124,UgxfZGWrlWvdO6E-l814AaABAg,232,2 years ago,it just looks like she lives in a historical chinese drama hahaha,看起来她生活在一部历史悠久的中国戏剧《哈哈哈》中
23985,Ugyh4EPC6sE1Uziou7R4AaABAg,219,3 years ago,i like how all the utensils she uses are eco friendy as well as her ingredients!,我喜欢她使用的所有餐具既友善又是她的食材！
31913,Ugz5SQzSVIB9U4-q1np4AaABAg,211,3 years ago (edited),"after observing for a period of time, i found that there are the following characteristics of the ziqi channel:
the first is that the fan base is wide and thick. as a oil pipe channel that is not managed by myself,
and there is no interaction with the fans on the oil pipe, and it is not easy to achieve the current scale.
after all, the channel originally started from the help of fans, and it felt a bit ""inadvertently inserted willow and willow"";
secondly, the video praise rate is high, which is nearly 10 times higher than the general channel. this is amazing.
explain that the quality of the video is high, unlike the channels that have a lot of subscriptions on the oil pipe are the same as scum.
after all, there are too many channels on the channels that scam money every day after they are named.
the last is that the channel is highly popular, and the number of comments itself explains everything.
and i dare to ensure that there are few big channels such as such a harmonious channel on the entire oil pipe.
ziyi here is one of them, like a world of integration in the world.","观察了一段时间，发现子柒频道有以下几个特点：
首先是粉丝群又广又厚，做为一个不是自己亲自管理的油管频道，
而且在油管上和粉丝毫无互动，能做到目前这样子的规模很不容易，
毕竟频道最初是从粉丝帮忙搬运起家，多少有点“无心插柳柳成荫”的感觉；
其次是视频点赞率高，比一般频道高出近10倍的点赞率，这点很了不起，
说明视频质量高，不像油管上好多千万订阅的频道都是渣一样的点赞率，
毕竟出了名之后每天发点烂片混日子骗钱的频道油管上太多太多了；
最后就是频道人气高，评论数量自身就说明了一切，
而且我敢保证整个油管上这么和谐的大频道根本就没几家，
子柒这里就是其中一家，俨然一副世界大融合的景象。"
9013,UgzhzWVbJJOaHS4REKt4AaABAg,208,2 years ago,"an interesting observation: many western families grow beautiful flowers in their gardens, but in a chinese garden you are much more likely to see a great variety of vegetables such as peppers, tomatoes, eggplants, etc: just enough to supply a small family. they are as colorful and pretty. i believe such style reflects certain aspects of chinese culture and philosophy of life. grown up in china, i have always been pursuing a quiet, peaceful and self-sufficient life. and i found it in this film.",一个有趣的观察：许多西方家庭在花园里种美丽的花朵，但是在中国花园里，您更有可能看到各种各样的蔬菜，例如辣椒，西红柿，茄子等：足以提供一个小家庭。他们是丰富多彩的。我相信这种风格反映了中国文化和生活哲学的某些方面。在中国长大，我一直在追求安静，和平和自给自足的生活。我在这部电影中找到了它。
9493,Ugz3g7bqRt3Us-xx7mN4AaABAg,205,2 years ago,"@,hello! i am from indonesia (indonesia). i have lived in guangxi, china for 8 years. snailing powder is my favorite food. i can eat two or three times a week, hahaha. when i have time, i often travel, especially to see the beauty of china, as well as the life of the countryside. i have been paying attention to the works you make, and i feel that you are particularly creative. seeing your video, i feel very relaxed, safe, and can decompress. i just want to write a comment this time i just want to tell you thank you. thank you for sharing your life with us. i also want a life like you. life is for life, not for survival. i wish you a good health and happiness every day.",@，你好！我是来自印尼的（印度尼西亚）。我在中国广西生活了8年。螺蛳粉是我最爱吃的东西，我一周能吃两三次，哈哈哈。有空的时候，我经常去旅游，特别是去看中国的美景，还有乡下的生活。我一直在关注你做的作品，我感觉你特别有创意。看到你的视频，我感到很轻松，很平安，能解压。这一次给你写评论只想跟你说一声谢谢。谢谢你跟我们分享了你的生活。我也想要像你这样的生活。生活是为了生活，不是为了生存而已。祝你全家人身体健康，天天幸福。
18676,UgztIKf9gD2-a_dVV6N4AaABAg,203,3 years ago,"when she put the chilies in the fire,i just like go back my childhood. i cried.",当她将辣椒放在火中时，我就像回去童年一样。我哭了。
25479,Ugxkaczi3rRY4eft6Y54AaABAg,198,3 years ago (edited),who else would like to have liziqi’s life ?,还有谁愿意拥有利兹奇的生活？
17533,Ugz7qOySXHjdxny0QiZ4AaABAg,190,3 years ago,"i think this is what we call ""inner peace"" - all of us, literally, are desperately pursuing some kind of life like this. it is escapism but not 100 percent, as it is more positive. really really nice, heart-warming video. thank you.",我认为这就是我们所说的“内在和平” - 从字面上看，我们所有人都在拼命追求像这样的生活。它是逃避现实的，但不是100％，因为它更积极。真的很好，令人心动的视频。谢谢。
20675,UgzalNXFdzz5HngVF9V4AaABAg,183,3 years ago,"my father always taught me
work like a slave
eat like a monster
and sleep like a king","父亲总是教我
像奴隶一样工作
像怪物一样吃
像国王一样睡觉"
18791,Ugws-cr34RVZokUlHr14AaABAg,182,3 years ago,what kind of losers would dislike such video? cant figure out.,什么样的失败者会不喜欢这种视频？无法弄清楚。
14882,UgxdzDDvqWYvCwMjbWB4AaABAg,162,3 years ago,the grandma is lucky to have a grandchild like her.,奶奶很幸运能拥有像她这样的孙子。
15086,UgzYaG8q1xN2uXktZBp4AaABAg,156,3 years ago,i don't understand why would someone unlike this video...,我不明白为什么有人会和这个视频不同...
4136,Ugx2Bn8O1FroGaCiTYp4AaABAg,151,2 years ago,"in a time where everything is fast and noisy, it's good to get these relaxed vibes and natural sounds, like drops of water, birds :)",在一切快速而嘈杂的时候，最好获得这些放松的氛围和自然的声音，例如水，鸟类，鸟:)
33384,UgwyyTX_11oSpbqFpYl4AaABAg,139,3 years ago,"3 new videos in a week? 
wow!! i feel like i got a big diamond's ring....
thank you so much for you, grandma and your team's hard work, liziqi....
can't wait for another new video, because your videos always amazed me.
lots of love from indonesia 
❤❤❤","一周内的3个新视频？
哇！！我觉得我有一个大钻石的戒指。
非常感谢您，奶奶和您团队的辛勤工作，Liziqi。
等不及另一个新视频，因为您的视频总是让我惊讶。
来自印度尼西亚的很多爱
❤❤❤"
15849,UgzXqMmiTZGBoG3lg7x4AaABAg,135,3 years ago,"as a european, i have never had the tangent with the specific food to the area you are from, what you cook, i call healthy food, all kinds of nutrients and vitamins etc, exactly what the body needs. i really like your lifestyle, even if you do not show it all, but seeing from the big perspective you lead a healthy life, we should take an example from you. greetings from romania :)",作为欧洲人，我从来没有与您来自该地区的特定食物，您烹饪的东西，我称之为健康食品，各种营养素和维生素等，这是身体所需的。我真的很喜欢您的生活方式，即使您不展示所有的生活方式，但是从大的角度来看，您过着健康的生活，我们应该以您的榜样为例。罗马尼亚的问候:)
10864,UgwXeLq3XW31NNJo_fR4AaABAg,134,3 years ago,"i like her, because is strong woman.",我喜欢她，因为是坚强的女人。
23642,UgzuK8p2uyWhMBSKJnd4AaABAg.8zeGo5ApctX8zi6iZAiprB,132,3 years ago,"lmao same tho. in my head i was like-
""now a handful of sand, mix it well""","同一lmao。在我的脑海中
“现在几个沙子，将其混合得很好”"
23135,UgyEjxiRcAoQo1Ge5NJ4AaABAg,130,3 years ago,honestly that big wok looks like a dream to cook with,老实说，大炒锅看起来像是一个梦的梦想
24279,Ugw6-Fyh1Ixq0BuXkIZ4AaABAg,125,3 years ago,"everytime i watch your video, feels like i'm on the fairytale. the water sound, the animal sound, even the tree when the wind blow it feels so real in my beside",每次我观看您的视频时，都会感觉就像我在童话中。水的声音，动物的声音，甚至在风吹时，在我旁边感觉如此真实
21324,Ugw6bGalG6GxpFvlT0B4AaABAg,122,3 years ago,"i am from rural china. many of the pictures in the video remind me of my life, but the clothes i wear when i was young were not so clean.
i am very fortunate to be born in rural china. although there are houses and cars in shenzhen now, i still like and miss the life in rural areas when i was a kid. ... especially in the summer, the air is cool, there are many wild fruits, and you can swim to catch fish in the clear river.
my wife always complains to me why i have to return to the remote countryside every long vacation. where did she understand that only when i returned to the countryside i was familiar with, i could enjoy the peaceful peace of mind.","我来自中国农村，视频里面的很多画面让我想起小时候的生活，只不过我小时候穿的衣服可没这么干净。
我很庆幸出生自中国农村，虽然现在在深圳有房有车了，但我还是喜欢也很怀念小时候在农村的生活。.....尤其是夏天的时候，空气凉爽，野果又多，还可以到清澈的河里游泳抓鱼。
老婆老是向我抱怨，为什么每次长假都要回到边远的农村。她哪里明白，只有回到我熟悉的农村，我才能享受几天心的安宁。"
14163,UgxhOUXbZAJ0PtM19IF4AaABAg,121,3 years ago,the snails are like: aww a nice bath. boom salt,蜗牛就像：一个不错的浴缸。繁荣盐
28489,UgzIlPfMgT8UA49gInF4AaABAg,116,3 years ago (edited),"what i like so bad and it is so impressive she never uses"" plastic"" no harming nature
terribly wish i could join that bliss for only one day !","我如此糟糕的东西，令人印象深刻，她从不使用“塑料”没有伤害自然
非常希望我只能加入那个幸福！"
17966,Ugy9Dzd0HKEAe92QJqh4AaABAg,111,3 years ago,am i only one feel cooking a real chinese traditional food is complicated like alchemy. lol,我只有一个人觉得烹饪真正的中国传统食物像炼金术一样复杂。哈哈
6585,Ugy3xkTYxlTAID94IdJ4AaABAg,107,2 years ago,"i wish one day could live in place like this,so calming,relaxing,quiet place",我希望有一天能像这样生活，如此平静，放松，安静
29079,Ugy_rv69BA1VHfhSQsR4AaABAg,107,3 years ago,"hello,i'm from vietnam,my grandfather often watch your videos and he very like it. he said : "" you very beautiful and you cook very well"" .he wishes he had a peaceful life like you . love you",您好，我来自越南，我的祖父经常观看您的视频，他非常喜欢。他说：“你很漂亮，你做得很好。”他希望他过着像你一样和平的生活。爱你
25356,UgwC52e0s2699PTinJ54AaABAg,105,3 years ago,your garden looks like an island of all ingredients...big sis,您的花园看起来像是所有成分的岛...大sis
12921,UgytWROnurt7fOcPZJp4AaABAg,104,3 years ago,"in every episode i watch, it looks like she's creating a cure for cancer in all her wonderful recipes.",在我观看的每一集中，看起来她都在所有美妙的食谱中都在为癌症创造一种治疗方法。
11914,UgxOPdfkgxROJLP3RcJ4AaABAg,103,3 years ago,"in order to write the college entrance examination composition to watch my sister's video ... i really envy my sister's life like this. after reading it, i was so moved. i was very happy to see foreign netizens' messages! intersection thank you sister for the help of spreading chinese culture, and thank you for your dreams for so many people. this may be your dream ~ i'm happy for you. thanks a lot! intersection",为了写高考作文来看姐姐的视频……真的好羡慕姐姐这样的生活啊TAT看了之后好感动，看到外国网友的留言也很开心！！谢谢姐姐为传播中国文化助力，谢谢姐姐替那么多人活出了大家梦想中的样子。这也许是你的梦想吧~为你感到高兴。辛苦你了！！
26988,UgyDSnKCZSbwdV2pXO14AaABAg,102,3 years ago (edited),"if you're getting lazy and don't know how to start the day, just watch liziqi's and you'll be energized too js like her",如果您变得懒惰并且不知道该如何开始一天，只需观看Liziqi的工作，您也会像HER
23434,UgzUJFsjexVHtAYIVQp4AaABAg,95,3 years ago,"whoever is married to this woman is one lucky dude!
she is a real artisan. 
this like what my grandma and mother used to do, everything from scratch. wonderful.","与这个女人结婚的人是一个幸运的家伙！
她是一个真正的工匠。
这就像我奶奶和母亲过去所做的一切一样，一切都从头开始。精彩的。"
5405,UgzopX7Yr44Dc0Gv2cZ4AaABAg,93,2 years ago,the most impressed is her knife. it appears in every video. it looks like made in qin density (2000 years ago).,印象最深刻的是她的刀。它出现在每个视频中。它看起来像是在秦密度（2000年前）制造的。
9680,UgxeDjXMOCo9vlzxzEZ4AaABAg,92,3 years ago (edited),"i canโ€t get enough of her. she lives the most beautiful, simple, productive life. itโ€s like watching a fairytale",我不能得到她的足够。她过着最美丽，最简单，富有成效的生活。就像看童话
31539,Ugzonvb4zsPJxUzVih54AaABAg,91,3 years ago,"hello 
i am from manipur,a north eastern state of india 
i would like to say that we have similar kind of lifestyle and food habits 
we also eat this kind of food
love from manipur,india","你好
我来自印度东北部的曼尼普尔
我想说我们有类似的生活方式和饮食习惯
我们也吃这种食物
来自印度曼尼普尔的爱"
4005,UgxHOAVJx2g8zJLuxXJ4AaABAg,90,2 years ago,she’s like an evolved pokémon and we’re all snorlaxes,她就像一个进化的神奇宝贝，我们都是鼻子
18509,Ugz7vX27tY0R8YBBwyB4AaABAg,89,3 years ago,i love how some of her music sounds like you're entering some sleepy little village in a jrpg from the 90's.,我喜欢她的一些音乐听起来好像您正在90年代进入JRPG的一个困倦的小村庄。
21751,UgyO_mDCJri5jGOIWnp4AaABAg,85,3 years ago,"i may not be able to live just like her but she inspires me to do more myself and rely on stores just a bit less. raised garden beds, fix things, use natural items, etc.",我可能无法像她一样生活，但她启发了我做更多的事情，并依靠商店少一些。凸起的花园床，修理东西，使用自然物品等。
