,cid,votes,含happy,含happy中文翻译
5632,Ugzq-X5wSgmcH_joJLN4AaABAg.9OANbG-gke99OGIKkQC9_X,0,"her practical ability and learning ability is very amazing，she can make ovens quickly after learning online，she grew up in a very unhappy family, her parents were gone, she went to work early，she even worked in restaurants and bars,she returned to her hometown to take care of her grandmother because she was in poor health. then she posted some small videos, which got a lot of attention on the internet。",她的实践能力和学习能力非常了不起，在网上学习后，她可以迅速制作烤箱，她在一个非常不快乐的家庭中长大，父母走了，她早点上班，甚至在餐馆和酒吧工作，她回到了她的家乡要照顾祖母，因为她身体状况不佳。然后她发布了一些小视频，这些视频引起了互联网上的很多关注。
50864,UgzHZjweAsDlJw-1K-J4AaABAg,0,happy chinese new year,春节快乐
7745,UgwNFU-6JDkc0cu58fN4AaABAg,0,now it is another new year. happy to watch the video again.,现在是新的一年。很高兴再次观看视频。
50786,Ugxp7TPC397-fzUy7wR4AaABAg,0,"it turns out that the snacks we have eaten from childhood have been made! you are so amazing! thank you for letting us see this video, physically and mentally happy!",原来我们从小到大爱吃的零食都是这么做出来的！你太神奇了！谢谢你让我们看到这个视频，身心愉悦！
7494,UgyvOqpJP5KCt7kLO1x4AaABAg,0,happy chinese new year !,农历新年快乐！
50798,UgzL2o4__dbstWrlFOR4AaABAg.8qldSLM3jXF8qluxMeMpFq,0,"happy new year this year, i wish you all the best of this year",新年快乐 今年本命年 祝大家本命年都一切顺利
7452,UgxTRKLN-RpJWG7J6Ll4AaABAg,0,"can't be willing to watch your video anymore ...



cannot be more happy to watch you videos ...","不能再乐意观看您的视频...



Cannot be more happy to watch you videos..."
50820,Ugy5o0jYOzQI2MkaTWF4AaABAg,0,happy year of the pig!,猪年快乐！
7430,UgwEKuLVnYGyBfR4LvR4AaABAg,0,she must be called as wonder women for real.❤️❤️...i ask god to make my heart to think like her and to act like her...i hd been depressed for 6 six yrs till now...i pray to god to make my life beautiful n happy like her..,她必须被称为真实的神奇女人。上帝使我的生活像她一样幸福。
6794,Ugw6851I7TzlQdyJ0ax4AaABAg,0,"i want to thank you miss li ziqui , for share your family life, i'm so happy and relax seeing your videos . thank you",我要感谢李Ziqui小姐，分享您的家庭生活，我很高兴看到您的视频。谢谢你
50858,UgxfO0FZF1MPixTmZFx4AaABAg,0,happy chinese new year!!! ur really the best even for holidays!!,农历新年快乐！！！您真的是最好的假期！
50867,UgxEiKVgphy2lKe2ukh4AaABAg,0,happy chinese new year,春节快乐
5879,Ugwd1PnzDOSBAzJ16A54AaABAg,0,i am happy to find my heart.,我很高兴找到自己的心。
6580,UgzzFJgYHpDpAyMNimd4AaABAg,0,see feel peaceful and happy :),看到和平与快乐:)
6261,UgyqiOMLlnipdJawbJh4AaABAg,0,"i could not sleep, hahaha, your morning is happy",我无法入睡，哈哈哈，你的早晨很高兴
6140,Ugxc2PV29i4jHAj76pd4AaABAg,0,you and her are so happy,你和她很高兴
50906,UgxmG2wdFYPjiTnHSth4AaABAg.8qlbtwK52oe8qm2xQSQLcG,0,"@viovio4256 ok, well, happy new year to you all, janelle and minh
....amazing how long these things that she prepares will last.
i wonder, is it traditional to have a party at probably her grandmothers house? that is where all this will be used, you think?","@viovio4256好吧，好吧，祝大家新年快乐，珍妮尔和明尼
....令人惊讶的是，她准备的这些事情将持续多久。
我想知道，在她的祖母之家举行聚会是传统的吗？您认为这就是所有这些都将被使用的地方吗？"
50913,UgzQXZYZDt2_SE_NSUt4AaABAg.8qlbmCpa11x8qly5Sz9_Z5,0,badgal grim happy chinese new year,童年快乐中国快乐
50916,UgzKYaYA63gKoUHUaU14AaABAg,0,happy chines year sistur....,Chines Year Sistur Happy ....
50932,UgxyDj__lno7dWa92Ml4AaABAg,0,happy cny ❤❤❤,快乐的CNY❤❤❤
50946,UgwKouGR9JC-ciNY5XF4AaABAg,0,"you are a wonder lady..happy new year dear to you,your grandma and little cute puppies",你是个奇怪的女士。
50949,Ugxc-8owLj4eT2sibAR4AaABAg,0,happy new year everyone,大家新年快乐
48967,Ugwg5myuB1bHCQFYdnB4AaABAg,0,"happy chinese new year. love you , be safe and have a great new year. thank you so very much.",农历新年快乐。爱你，安全，新年快乐。非常感谢你。
48310,Ugxim39Hs9DQOiZm1WJ4AaABAg,0,happy new year! intersection i really want to eat it 想 想 想 想 想,新年快乐！！看得我好想吃
48938,UgzVYSdFED4uVo5WMwh4AaABAg,0,"happy chinese new year! wish everyone a good health, joy, happiness and luck in the new year!!
love from serbia :)","农历新年快乐！祝大家在新的一年中健康，快乐，幸福和运气！！
塞尔维亚的爱:)"
41168,UgwTY7gX9OS6w4mgCIJ4AaABAg,0,"so peacfull video , thank you for sharing , thats so hopefull 
than the big cities life
i feel shy , you look so happy in your life with out tecknology or modern house ! 
i hope i feel like you ❤","如此peacfull视频，谢谢您的分享，这是如此希望的声音，水果和食物，大自然，您的房子.....更好
比大城市的生活
我感到害羞，您的生活或现代房屋看起来很幸福！
我希望我觉得你❤"
43975,Ugy_HVtexmrXKbmX8yh4AaABAg,0,i am wondering if she is happy and contented. i want to live with her and learn her way of living.,我想知道她是否快乐和满足。我想和她一起生活，学习她的生活方式。
44080,Ugyh_nMoPlgemJhbvC54AaABAg,0,i want u to always be happy and pure and continue being who u are. i will die protecting these girls ya hear,我希望你永远快乐，纯洁，继续成为你的身份。我会死于保护这些女孩
44169,Ugwwrl5kedA0jQE4OI54AaABAg,0,"food! monthly girl, i wish you and family, always happy!","美食!万能的小姑娘,祝你与家人,永远幸褔快乐!"
44250,UgyKuX62ghP-NP-ylUN4AaABAg,0,sometimes life just needs to be very happy,有时候生活只需要非常快乐
44261,UgzvceUjAdTV0N0Tes54AaABAg,0,"insanely talented,a perfectionist, cleanliness is in her blood ,doesn't waste any thing ,everything she makes is so admirable.she stole the heart of millions and will so on...she will be a very kind hearted down to earth person ,so visible.the guy she marry will be happy (life changer)",疯狂才华横溢，一个完美主义者，清洁，没有浪费任何东西，她所做的一切都令人钦佩。 ，如此可见。她嫁给的那个家伙会很高兴（改变生活）
44460,UgxIy_oDKDAnSyK4fKR4AaABAg,0,happy new year :),新年快乐 ：）
26545,Ugz4x9jZf79qtb1MNMB4AaABAg.8zkpfxZ3kEy9C9hTyGDdhi,0,i'm so happy for you!,我为你很高兴！
44725,UgwmMM5jCjZBbP14M8x4AaABAg,0,wow ilove all you did happy new year and always be happy,哇，你们所有新年快乐，永远快乐
44804,UgyF1A7Gr_zqUqIQkGB4AaABAg,0,"real life harvestmoon girl!

i'd always dream having a life like harvestmoon
so happy to found you","现实生活中的Harvestmoon女孩！

我总是梦想过像Harvestmoon这样的生活
很高兴找到你"
44880,Ugw2W8yUJ0S1Y7sdAI54AaABAg,0,happy new year,新年快乐
44918,Ugz-cx1WqrUPwDiEEIB4AaABAg,0,"assalam alaykoum, i'm so glad today sending you these words, i'm from an other culture, morocco, i like absolutely everything you do, you work too much, you live in an incredible environement, you're really a great woman..
big respect for you madam..
i'll be very glad if you contact me, and more happy if you decide someday to visit my country, you'll be my gest. thank you for everything.","Assalam Alaykoum，我很高兴今天向您发送这些话，我来自其他文化，摩洛哥，我绝对喜欢您所做的一切，您的工作太多了，您生活在一个令人难以置信的环境中，您真的是一个很棒的女人..
对你夫人的极大尊重..
如果您与我联系，我会非常高兴的，如果您有一天决定访问我的国家，您会很高兴，您将成为我的最新信息。谢谢你为我做的一切。"
44951,Ugz2yJbcdbi_6qz2lvt4AaABAg,0,this makes me feel so happy,这让我感到很高兴
44997,UgykAF7A9ZDYxwesJCN4AaABAg,0,happy new year!!!,新年快乐！！！
45071,UgyHoBZjSFqMM9cFTAJ4AaABAg,0,happy ter as others never have,快乐因为别人从来没有
45073,UgyQrUY2CRZ4-0iTzt94AaABAg,0,thank you! happy chinese new year!,谢谢！农历新年快乐！
45097,Ugy3mQJcc9RXAHk06vN4AaABAg,0,grandma is so happy,奶奶好幸福
45177,UgwX6WU7_NtspM5YQvh4AaABAg,0,shoooo happy after finished this video,完成此视频后，Shoooo快乐
45271,UgxMX2u0gP-fyfN0jyB4AaABAg,0,i feel so happy that so many people love your videos,我很高兴，有很多人喜欢你的视频
45288,UgwOR8k0FeyS9FbKRol4AaABAg,0,"i feel happy, just see it",我感到很高兴，只是看到它
45306,Ugz6CP37Hw4fUKfj43l4AaABAg,0,"your videos are divine! i love this!!
happy chinese new year","您的视频是神圣的！我喜欢这个！！
农历新年快乐"
45308,UgxJJ8MvNjOigiZLfeB4AaABAg,0,happy chinese new year from malaysia,马来西亚的农历新年快乐
45315,Ugyd_Ki8sTaSkze3UDV4AaABAg,0,i am very happy . if u don't mind pls i will stay with u .yes,我很高兴 。如果你不介意，我会和你在一起
45359,Ugy_cmHiAiVd-9yWxcF4AaABAg,0,"happy new year, i wish you a good luck!",新年快乐，祝你好运！
43870,UgxI5XGdo-efBzbvVRh4AaABAg,0,"people are beautiful and cooking food and cooking.
the food that can be eaten by li ziyi must be very happy (´ω`) (´ω`) (´ω`)","人美又会煮菜做饭样样难不倒
能吃到李子柒做的饭菜一定很幸福(´ω`)(´ω`)(´ω`)"
43867,UgwChRqtrQUApktwWpZ4AaABAg,0,"i wish i lived here , so happy and cổmtable . lunar new year",我希望我住在这里，如此快乐和可观。农历新年
43837,Ugys83aD0ruCGcrac-V4AaABAg,0,"almost all woman from east cooks food for husband and her family everyday.. sometime, it is very tired but.. happy when realizing our husband n children back to home and eat the foods together happily..",东部几乎所有女人每天都为丈夫和她的家人做饭。
42425,UgwY8pk14z1FvGqAFdp4AaABAg,0,that's so happier that is happy,那太快乐了，很高兴
41519,UgxMZCtyqtbvd8DK73B4AaABAg,0,happy is how i fell. :),快乐是我跌倒的方式。 :)
41551,Ugz_NA97VnrBhWtfMEd4AaABAg,0,just nice. lazy fat boy would be very happy to take her as a wife. :))),刚好。懒惰的胖男孩很高兴带她作为妻子。 :)）））
41629,Ugw-BdglCNjch48Rqp94AaABAg,0,i am happy watching you doing beautiful creative loving work with nature all around you. you are beautiful too,我很高兴看到您与周围的大自然一起做美丽的创意爱情。你也很漂亮
41692,UgxcWhxNmtECA6NTBGp4AaABAg,0,dream girl.you are very lucky. i wish you will be always happy. god bless you.,梦想中的女孩。你很幸运。我希望你永远快乐。上帝祝福你。
41736,Ugx_CCIVg6MYCcTYGRB4AaABAg,0,so happy watching this,很高兴看这个
42180,UgwCEGTdFr83IH0c0X54AaABAg,0,what a beautiful video with happy background music ! can we have a short video from chinese spring festival !!! what a fantastic place ! :),带有快乐的背景音乐的美丽视频！我们可以在中国春节有一个简短的视频！！！真是一个很棒的地方！ :)
42196,UgxQXPB_RXTa3nTaX-l4AaABAg,0,extremely happy when having a wife like ya,有像YA这样的妻子时非常高兴
42311,UgymfVlyFh1GhIQ_sbF4AaABAg,0,"your life it is very simple and happy i want to a life like you 


love you","你的生活很简单和快乐，我想要像你这样的生活


爱你"
42365,UgxAesVSrCH9N9xbc_Z4AaABAg,0,i'm in love! happy! li ziyi (::,I'm in love! 快乐吧！李子柒 (:
42392,Ugw3CPa5XLKOQp10JiV4AaABAg,0,looks very happy.,看起来很高兴。
42506,UgzzdK4taCbJkUXiJx14AaABAg,0,"when i see you cook, i am very happy to watch. i love and like to watch very much.",当我看到您做饭时，我很高兴观看。我喜欢并且喜欢看很多。
43771,Ugy8MA-yMpJCIe137UR4AaABAg,0,"happy new year, from vietnam :)",新年快乐，来自越南:)
26647,Ugz4x9jZf79qtb1MNMB4AaABAg.8zkpfxZ3kEy9MLjDBwYdw_,0,liziqi was depressed too when she worked at a dead end job in a big polluted noisy city then moved to the country and now she seems to be too be to busy being happy and working hard to be depressed,利兹奇（Liziqi）在一个大污染的嘈杂城市的死胡同工作中工作时也感到沮丧，然后搬到了乡下
26597,Ugz4x9jZf79qtb1MNMB4AaABAg.8zkpfxZ3kEy9Hm9dukuprP,0,i'm so happy for you.,我为你很高兴。
43086,UgybPGf-nxdFQQUWNAJ4AaABAg,0,"i want to live like this..peaceful, happy and contented. ❤️ i love to watch this kind of videos.",我想这样生活..和平，快乐和满足。 ❤️我喜欢看这种视频。
43156,Ugy070YcUUnupoi_Ofd4AaABAg,0,"the grandma is so cutee, she must be very lucky and happy to have you.",奶奶是如此的幽灵，她一定很幸运，很高兴有你。
43303,UgwS5ahiefsd7vdIl5R4AaABAg,0,very happy life everything there,非常幸福的生活
43365,Ugz3A3bHOy0nRdSO61V4AaABAg,0,looks so happy miss grandparents missing a simple life in the country,看起来很高兴祖父母小姐错过了该国的简单生活
43398,UgwL3DJ7dk08ACKjfNt4AaABAg,0,"like this way of life, feeling peaceful, not busy, happy, fresh, independent, in the midst of abundant nature",就像这种生活方式一样，在丰富的大自然中感到和平，不忙，快乐，新鲜，独立
26595,Ugz4x9jZf79qtb1MNMB4AaABAg.8zkpfxZ3kEy9HeC19zX0Ch,0,happy christmas bug bug x,圣诞快乐错误x
43521,UgwTuDVWDBgPmC4ouFF4AaABAg,0,happy new year ms li!,新年快乐李女士！
26578,Ugz4x9jZf79qtb1MNMB4AaABAg.8zkpfxZ3kEy9EBWqVh8OTB,0,"be happy.really proud you made some effort.please practice yoga.
it is good for deppression.","快乐。真正骄傲您付出一些努力。请练习瑜伽。
这是对屈服的好方法。"
45406,UgzBP5VF64TfEvlF1M14AaABAg,0,"so cute , happy life. thanks .",如此可爱，幸福的生活。谢谢 。
45429,UgwdSuE5oEN7CMyXehB4AaABAg,0,"i m not happy about the animals so i will move on , look after them lord",我对动物不满意，所以我会继续前进，照顾他们主
45432,UgyaxPcs1FFVlWsVqX94AaABAg,0,"mjk is very happy to see this one is a peaceful place but warm, anyone sees v k",MJK很高兴看到这个地方是一个宁静的地方，但温暖，任何人都看到V K
46240,UgzYxOikXBfZeT8w2I14AaABAg,0,"happy new year, ms li!","新年快乐, Ms Li!"
46019,UgzD6qM6qiG0hSdfnXl4AaABAg,0,"myanmar love you too 
happy chinese new year","缅甸也爱你
农历新年快乐"
46044,Ugwqj2gGGhJ3hygim4x4AaABAg,0,happy chinese new year li ziqi,春节快乐李Ziqi
46081,UgyVQ7q-rszOy-q1xdJ4AaABAg,0,looks happy,看起来很高兴
46086,UgxaV_tvATYczEvxgyJ4AaABAg,0,"happy new year, guys",新年快乐，小伙子们
46087,UgzbVTzDs8imRybaP0F4AaABAg,0,"happy new year, guys",新年快乐，小伙子们
46118,UgzxVOPy5Kz-HEXWiEN4AaABAg,0,happy new year!!!!,新年快乐！！！！
46148,UgyRoXx5nlliVFSFpqF4AaABAg,0,"today, in the market, the ministry has signs with a music, which says: your silence corrode me! and i was worried about you. i mean that if you have been disturbed by the ministry, because of me; i want you to become neutral, society, make signs good, but it is to cause the impression that there are a lot of good people, but things never appease. stay neutral in the future we can be happy just. if it doesn't work; i want you to know, that life in the countryside, is a wonderful life that many wanted to have. you are already happy and do not know, the nausea of ​​this monotony, makes you not realize so much happiness, you can realize this happiness, watching the needy or hell in my life. and even if i had a good financial life, my life, it was going to be almost the same as yours, the difference is that i would have money to buy things, kkkkk. glad you like me, i like you too. it gets neutral, i'm over, just watch, knowing that only god, you know tomorrow. keep reflecting good things. a hug, dear.",今天，在市场上，该部的迹象带有音乐，上面写着：您的沉默腐蚀了我！我担心你。我的意思是，如果您因我而受到事工的干扰；我希望您变得中立，社会，使迹象变得良好，但这是因为有很多好人的印象，但是事情永远不会安抚。将来保持中立，我们可以快乐。如果它不起作用；我想让您知道，乡村生活是许多人想要的美好生活。您已经快乐，不知道这种单调的恶心，使您没有意识到这么多幸福，您可以意识到这种幸福，看着我生活中有需要的人或地狱。即使我过着良好的财务生活，我的生活，也将与您的生活几乎相同，不同的是，我将有钱买东西，kkkkk。很高兴你喜欢我，我也喜欢你。它变得中立，我已经结束了，只是看着，知道只有上帝，你明天就知道。继续反映美好的事物。拥抱，亲爱的。
46156,UgyZcTXJj12AfF0fraN4AaABAg,0,"happy new year, new year,","新年快乐, 新年"
46174,UgxGUGDyfqDTmln2EI54AaABAg,0,happy lunar new year 2019,2019年愉快的农历新年
46187,Ugx8_J43VWbSl-uoJLh4AaABAg,0,happy new year,新年快乐
26208,Ugy25fMyy6KqbKKBCVR4AaABAg,0,"i love this video!
very beautiful. this is like a utopia.
by the way, i heard the music used in this video. is that digimon music?
i like digimon. so if you know and like digimon, i'm so happy.","我喜欢这个视频！
很漂亮。这就像一个乌托邦。
顺便说一句，我听到了此视频中使用的音乐。那是Digimon音乐吗？
我喜欢Digimon。因此，如果您知道并且喜欢Digimon，我会很高兴。"
46000,UgzknUCy4nQEV-L5COp4AaABAg.8qyuPZ-KDt68r-S_9EsfMH,0,"@oriquackquack1396 
happy new year！","@oriquackquack1396
新年快乐！"
46253,Ugxih3Ge35L5r4HZ8jp4AaABAg,0,gong xi fa chai ..happy chinese new year li zi qi,Gong xi fa chai ..happy chinese new year li zi qi
46260,Ugz3JXn8BIxQcBMUJZl4AaABAg,0,happy new year,过年好
46277,Ugw1f59sGAENrjv5pQN4AaABAg,0,"happy chinese new year! first time watching this video it was so interesting, beautiful place and food. i wish i can get a girl like you onr day it so inspiringly. absolutely gonna like, subs. good video.",农历新年快乐！第一次观看此视频是如此有趣，美丽的地方和食物。我希望我能在一天中能得到一个像你这样的女孩。绝对会喜欢，潜艇。好视频。
46281,Ugxjo5KsvWHHEUqyhaB4AaABAg,0,hello from vietnam. happy new year for all :),来自越南的您好。祝所有人新年快乐 ：）
46295,UgxxfyX4GnoYPOeHtlB4AaABAg,0,my fav episode! amazing and delicious! happy new year!,My fav episode! Amazing and delicious! 新年快乐！
46316,Ugz1Y0L4KYdfJt5xXA94AaABAg,0,"happy chinese new year! is there videos exclusively during the chinese new year? i hope li ziyi can have new works to watch her video, i can't control me, i can't remember how much i remember",Happy Chinese New Year！ 过年期间有视频发吗？希望李子柒能有新的作品 看她的视频我控制不住我记几啊
46317,UgzcmBOzkn6vbcj71rF4AaABAg,0,new year! happy new year!,过年啦！新年快乐！
26109,UgwXVJOhJV6eTxLI2dN4AaABAg,0,"rock sugar gourds, melon seeds, all i like the most, i really want to eat those snacks! the popcorn banged was so frightened that the cute and cute grandma was so happy, hoping that the longevity and ziyi would always be accompanied!",冰糖葫芦，香瓜子，都是我最喜欢吃的，好想吃那些小吃！ 爆米花砰的一声吓得挑起来的好可爱
46409,UgxDf0-6Ss8EBBDPEiN4AaABAg,0,your videos make me happy,你的视频让我开心
46439,UgxX88vN4OAffCc9kGN4AaABAg,0,"6:51 it not fried melon seed, it sunflower seed, fried melon seed is smaller and red colour, colour of happy and good year",6:51它不是油炸的瓜子，它是葵花籽，炸瓜种子较小且红色，颜色快乐，美好的一年
46004,Ugy2nwrD1Cb1N33dqWJ4AaABAg,0,hi from bali..love ur video so much.. happy chinesse new year xx,嗨，来自巴厘岛..爱你的视频。
45999,UgzknUCy4nQEV-L5COp4AaABAg.8qyuPZ-KDt68r-Qc_IeA0p,0,@almalee5476 thank you very much! you are very nice person. have a good day and happy new year:),@almalee5476非常感谢！你是一个很好的人。祝您有美好的一天和新年快乐:)
45436,Ugwr5VARrHZPzykJzLV4AaABAg,0,happy propos day. i love you .i am a girl,提案日快乐。我爱你。我是一个女孩
45721,Ugw1k1j13hwbGY54FU54AaABAg,0,happy new year!!!,新年快乐!!!
45502,UgwDCG77zTj5jfBlaId4AaABAg,0,happy new year,新年快乐
45513,UgzDbOU7SXy0q7sD4Q54AaABAg,0,happy chinese new year,春节快乐
45548,UgwDF-JsHjaXVnxvZSt4AaABAg,0,the sounds of hard work taste delicious. happy chinese new year to granny and li zi qi from philippines with love.,努力工作的声音味道很好。与菲律宾的奶奶和李Zi齐的新年快乐。
45590,UgyPMWJp3Ue2EgEHLmx4AaABAg,0,happy new year. i verry like your video. thanks of that,新年快乐。我喜欢你的视频。谢谢
45608,Ugw_i9LW4F40IIFXHcV4AaABAg,0,happy chinese new year! lovely video.,农历新年快乐！可爱的视频。
45610,UgwZCyCgHcxkPzo-U_N4AaABAg,0,everything looks delicious! happy chinese new year!,一切看起来都很好吃！农历新年快乐！
45627,Ugz-ZLgMEDfTNt_muZZ4AaABAg,0,this sister is so good. anyone who takes you is very happy.,这个姐姐太好了。任何带你的人都很高兴。
45679,UgylG3_h0jSeehK7Fg14AaABAg,0,ur hard work make me feel so relax and happy that one day im ready to spend the rest of my life near mother nature,您的辛勤工作使我感到如此放松和快乐，有一天我准备在大自然母亲身边度过余生
45716,UgzyEsbEYuvZJSSaHZt4AaABAg,0,"happy chinese new year... i from chile
nice video","农历新年快乐...我来自智利
不错的视频"
45718,UgznPNSrZX3MdFw8Ljp4AaABAg,0,happy new year ly tu that that,那个新年快乐
45725,UgwHBbQ5YFxm_k49D-h4AaABAg,0,great video..happy spring festival,很棒的视频..快乐的春节
45974,UgxubRkRIXHCLXER_xp4AaABAg,0,happy chinese new year. hope i can eat your food someday.,农历新年快乐。希望我有一天可以吃你的食物。
45734,Ugx2kbvXBnWvTHsaDbt4AaABAg,0,happy new year beautiful,新年快乐
45742,Ugx3zbLpFHV3QAAwszh4AaABAg,0,happy chinese new year !!! happy new year !!!,Happy Chinese New Year!!!新年快乐!!!
45782,UgzCd0_LTKn-A20tV4F4AaABAg,0,rich colours and flavours . this makes me happy,丰富的色彩和口味。这让我开心
45812,Ugy5qNBg6obR_Vs3gOV4AaABAg,0,happy lunar new year gong xie fat choi love from bali indonesia,来自印度尼西亚巴厘岛的Lunar新年锣Xie Fat Choi Love
45859,UgyRhIJo_GcguKpAMAp4AaABAg,0,happy chinese new year ！,农历新年快乐！
45871,UgwZrgz6p-qvNRA9wZ14AaABAg,0,"2
0
1
9
happy new year","2
0
1
9
新年快乐"
45918,Ugysznq3zzNDajmDCf94AaABAg,0,happy new year! i wish li ziyi and his family good health and all the best,新年快乐! 祝李子柒和家人身体健康，万事如意
45940,Ugz_6fG4_7QCLI3i8Kp4AaABAg,0,happy new year !!!,新年快乐！！！
45957,UgwNhWMzGZ_qPsIpq9J4AaABAg,0,"happy new year
happy chinese new year","新年快乐呀
Happy Chinese new year"
45961,UgyPhyJ72N3X16atQC54AaABAg,0,happy china new year,中国新年快乐
41433,Ugypv_BiucSEoxgtOfl4AaABAg,0,i don't know how i got here but i'm so happy i did. now i'm a subscriber,我不知道我是怎么来这里的，但我很高兴做到了。现在我是订户
41161,UgwKBjiPhklEF4YziQt4AaABAg,0,"really i feel shy , you did alooot of hard work ! hard house works by hard ways! without any tecknology! how that! and how you can live happy like that lifestyle! i cook the lunch and feel so tired and hate my life! i hope be like u and feel like you",我真的很害羞，你做了艰苦的工作！硬屋用艰难的方式工作！没有任何tecknology！那怎么了！以及如何像这种生活方式一样幸福！我煮午餐，感到非常疲倦，讨厌我的生活！我希望你像你一样，感觉就像你一样，让你很高兴
46468,Ugwoj2mz2njKuPqKuyZ4AaABAg,0,"really nice video and such a calming song, could somebody tell me the name or link it. thanks in advance and happy chinese new year :d",真的很不错的视频和如此平静的歌曲，有人可以告诉我这个名字或链接它。预先感谢和春节快乐：D
41086,Ugxvs5ewXtJr12nS-rd4AaABAg,0,this channel makes me feel really warm and happy. thanks!,这个频道使我感到非常温暖和快乐。谢谢！
33680,UgzWryCQFQ33mSnstzt4AaABAg,0,i cry happy tears when watching this channel ...,看着这个频道时，我哭着流泪...
33710,UgyNzSCaJEouq-Bid7J4AaABAg,0,these videos have to be the loveliest things i've ever watched. they make me way too happy.,这些视频必须是我看过的最可爱的东西。他们让我太高兴了。
27787,Ugx0gRGOj9dva5BRI2R4AaABAg,0,happy life in the village,村里的幸福生活
27745,UgzhF7CqEUFtXFLOUR14AaABAg,0,happy is this simple,快乐这很简单
33937,UgxQ4obKp7Mzrv-Mbi54AaABAg.8vAAkm2tSd499Hp8r1vioV,0,@jadjad4666 happy to help.,@jadjad4666很高兴提供帮助。
33980,UgxQ4obKp7Mzrv-Mbi54AaABAg.8vAAkm2tSd49Dmf6iFnog3,0,yes.... i hope everyone takes care of nature and lives a happy life,是的....我希望每个人都照顾自然，过着幸福的生活
34060,UgxQ4obKp7Mzrv-Mbi54AaABAg.8vAAkm2tSd49PcyjrnZe02,0,"healing is spontaneous every time i see it
happy ~~
thank you","每次我看到它都是自发的
快乐~~
谢谢"
