,cid,votes,含happy,含happy中文翻译
49115,Ugw6XAj85jmCblNqQyt4AaABAg,4,happy chinese new year. love from bangladesh.,农历新年快乐。来自孟加拉国的爱。
23751,UgwSg9XtY71QKKJ6bsB4AaABAg,4,"ziyi, you are great. your ingenuity makes you omnipotent. i admire you so much. i hope you want to be a good thing, find ruyi langjun earlier, and always be happy!",子柒你太棒了，你的聪明才智让你无所不能，我太佩服你了，希望你心想事成万事如意，早点找到如意郎君，永远幸福！
7470,Ugwc2EAmYRZhq2kUdLt4AaABAg,4,"happy chinese new year 
xin nian kuai le

gong xi fa cai ❤️❤️❤️ ❤️","Happy Chinese New Year 
Xin Nian Kuai Le

Gong Xi Fa Cai ❤️❤️❤️"
7468,Ugx7mEKfSmgc1eAzr-t4AaABAg,4,"happy chinese new year 
xin nian kuai le

❤️ gong xi fa cai ❤️","Happy Chinese New Year 
Xin Nian Kuai Le

❤️ Gong Xi Fa Cai ❤️"
19166,Ugz7GfDlR4YeU4t_6r14AaABAg.967vXqxs2yP96VqhQbcrFO,4,"please don't use her video as an excuse to push your ""all natural"" agenda, the reason she does this for her grandmother is because most store bought food has a high chance of being life threatening. you don't wanna live a life where you have to grow everything because the government won't do shit about the high chance of getting extremely sick after eating from a street vendor. just be happy with the fact that you can go to a restaurant and be able to eat without the looming threat of getting deathly sick.",请不要以她的视频为借口来推动您的“全自然”议程，她为祖母这样做的原因是，大多数商店购买的食物都有很大的威胁生命的机会。您不想过上必须成长一切的生活，因为政府不会在从街头供应商那里吃饭后会使生病的很高的可能性做出困难。只要对您可以去餐厅并能够吃饭而不会有迫在眉睫的威胁死亡的事实。
50890,UgzQXZYZDt2_SE_NSUt4AaABAg,4,hello ms. lizi i love all of your videos. hope to see you soon. happy chinese new year. love from philippines.,您好MS。 Lizi我喜欢您所有的视频。希望很快能见到你。农历新年快乐。来自菲律宾的爱。
51188,UgzMAjAbeNrP7isNqRx4AaABAg,4,happy chinese new year! for you and grandma.. ❤❤❤❤,农历新年快乐！为你和奶奶..❤❤❤❤
50327,UgxZqJRu9m9MizjmKhB4AaABAg,4,"i love you so much. happy chinese new year,",我真的很爱你。农历新年快乐，
51953,UgyRqoq4BU372cgEWup4AaABAg.8qlQU8d8dtk8qlYc1r7CtQ,4,happy new year ~,新春快乐~
53017,UgzwTG6LcIrab-_SP954AaABAg,4,happy chinese new year! love lots,农历新年快乐！爱很多来自菲律宾的
51926,UgwxLN5XBWkgkivIwhZ4AaABAg,4,happy chinese year li zi qi,李齐中国年快乐
52173,Ugz5-rBtOo2kNF4biMh4AaABAg,4,"i'm so happy to see you (again), and thanks for uploading a long video <3",我很高兴再次见到您，并感谢您上传长视频<3
2433,Ugxj1gd4bngAB7kl1PF4AaABAg,4,someday i will move from a noisy and dusty metropolis to the village and i will be happy,总有一天，我将从一个嘈杂而尘土飞扬的大都市搬到村庄，我会很高兴
50533,Ugy97wmfNQ6qcGlXh0R4AaABAg,3,"wish you happy new year 
to lovely girl","祝你新年快乐
对可爱的女孩"
52778,UgxDQw63FkoJc0G3tp54AaABAg.8qlKBKCNurb8qlS4ycTZfm,3,"happy new year, l come from hongkong, i'm chinese。",新年快乐，我来自香港，我是中国人。
45978,UgxQ6NzGBMWclSWcB2l4AaABAg,3,happy chinese new year,春节快乐
1716,UgzwrKoErd3s6e0nAwN4AaABAg,3,thanks you liziqi i wil always love u big vriend happy,谢谢你liziqi我将永远爱你
29825,UgzSRncshZZOwN__3lp4AaABAg,3,"amazing.dont remember how many times saw this video.she is an angel.for her age she is extraordinary. a real gifted person.i wish her and her grandmother to live long happy n healthy life.
.","令人惊讶。不要记得看过这段视频有多少次。她是一个天使。对于她的年龄而言，她非常非凡。一个真正有天赋的人。我希望她和她的祖母过着幸福的健康生活。
。"
50527,UgxJoig7rabsjrkYN1Z4AaABAg,3,a nice video...happy new year,一个不错的视频...新年快乐
4058,UgyiO6vdkdjCbaQ8FHR4AaABAg,3,i wonder if she has help with the animals. i want to see the dogs get fed!'re healthy and happy. they look beautiful!,我想知道她是否对动物有帮助。我想看到狗被喂食了！
27903,Ugz5tzEEZiv4YyU4RyJ4AaABAg,3,"this music made me cry
even tho the video was like about 3 happy people cooking","这种音乐让我哭泣
甚至视频都像3个快乐的人做饭"
50694,Ugyr4OXfDXEd3u83p_l4AaABAg,3,i love the way u make everything look so yummy n easy and all from scratch. happy chinese new year,我喜欢您使一切看起来如此美味的方式，从头开始。春节快乐
45720,UgxDoNYWfGb_JnABqfZ4AaABAg,3,i always wanted to grow up doing cool stuff like that! i love nature and whatnot. i hope you and your grandmother (and uncle) are blessed this year!!happy chinese new year!!,我一直想长大，这样的很酷的事情！我爱大自然等。希望您和您的祖母（和叔叔）今年有福！
50720,UgxRnpFl689hBAbfU7p4AaABAg,3,happy chinese new year sis,春节快乐sis
50740,Ugz2_q0YfX8Wb5wW0Pl4AaABAg,3,"happy lunar new year , wishes from canada.",新年快乐，来自加拿大的祝福。
51930,UgyGgPTEn6ni6pQOjFJ4AaABAg,3,happy chinese new year from malaysia,马来西亚的农历新年快乐
32613,UgzB8g7xi9aMF1JVfs94AaABAg.8vj7Fl_oJ-U8wEaqR7MyMn,3,the dogs are so happy. they reminde me of little kids frolicking when they think that the adults are busy.,狗很高兴。当他们认为成年人很忙时，他们让我想起了小孩子嬉戏。
26301,Ugz4x9jZf79qtb1MNMB4AaABAg.8zkpfxZ3kEy9-pukyeSmJd,3,"good very good!! so change everything travel, get away !live and please be happy maybe you need to be in a place like this",好，很好！！因此，更改一切旅行，逃脱！生活，请快乐，也许您需要在这样的地方
37433,UgzK2Z2S3AtZEe1giix4AaABAg,3,i love the way those puppy running around and they look so happy.,我喜欢那些小狗跑来跑去的方式，它们看起来很高兴。
47396,Ugz-nOnIvznU0flFJth4AaABAg,3,did anyone else look at that and think that the slab of meat was that poor little lamb? until it said beef jerky in the subtitles.. but was it beef? the lamb didn't come back after that scene! happy chinese new year!,还有其他人看过那个，并认为肉的平板是那个可怜的小羔羊吗？直到它在字幕上说牛肉干性..但是是牛肉吗？羔羊之后没有回来！农历新年快乐！
45878,Ugxqs8nWwq84eoXV0Ah4AaABAg,3,wishing you and your grandma good health. happy new year!,祝你和你奶奶健康。新年快乐！
48584,Ugz15IPOsf6ZsMTf43R4AaABAg,3,"happy new year ! the taste of the year is getting lighter now. after watching this film, i feel that there is an atmosphere of the new year.",新年快乐 ！现在的年味愈来愈淡了，看了这影片，就觉得年节有气氛了
46732,UgyOUssndE0VZgxNk6B4AaABAg.8qrt3VhOP998qxmqa0BPJy,3,"steven universe do you realise that there are people in this world that have a severe medical condition which causes them to be that way? my mother for instance is one of those people. she is a truck driver that has bad knees and a bad back from driving the truck but you probably do not care about that case either. oh well i am not one of those people i am 6'4"" 245lbs and i exercise every day. i would love to see you say something like to my mother in front of me. probably never happen though you are probably just an internet tough guy. i doubt very seriously you would say that to someones face. just my thought.what do you think. oh i am sorry you probably do not have a brain. i on the other hand will be happy to buy you a plane ticket to come here and see if you have the nerve to say that to someone i know.",史蒂文宇宙，您是否意识到这个世界上有些人患有严重的医疗状况，导致他们这样做？例如，我的母亲就是其中之一。她是一名卡车司机，膝盖不好，驾驶卡车的后背不好，但您也可能不在乎这种情况。哦，好吧，我不是我6'4“ 245磅的人，我每天都在运动。我很想看到你对我面前的母亲说的话。尽管您可能只是一个互联网，但可能永远不会发生伙计。我非常怀疑你会对某人说的。只是我的想法。你想什么。哦，对不起，你可能没有大脑。另一方面，我很乐意为您买一张机票来这里，看看您是否有胆量对我认识的人说。
23277,UgzZchpFtSfARn34wt54AaABAg,3,it's so happy to see this video!,看到这个视频真的太幸福了！
47799,UgxSOYwNbzpl1wzQazh4AaABAg.8qnvFUES1y48qowbEC_38H,3,"happy new year of the world, the year of the pig",全球华人新年快乐，猪年大吉
25004,UgwoFYJP-TGl8OMTXQR4AaABAg,3,i feel so happy to see my sister so happy ๐’๐ฅฐ,看着姐姐这么开心 我也觉得好幸福
22125,UgwOMZDQOiNSH7fjV1Z4AaABAg,3,i'm surprised this woman is not married. she wold make any man happy and proud to have her,我很惊讶这个女人没有结婚。她让任何男人都高兴和自豪地拥有她
47948,UgzqwvJrBtg7qUag16V4AaABAg,3,"happy chinese new year ms. li, year of the pig so many beautiful snacks .... (thanks to mrs. annastacia fang translation)",李的一年李女士​​李女士，这么多美丽的零食。
48090,UgxWyK1yHjVr1pkBsSR4AaABAg,3,happy lunar new year. my country is going to celebrate and i am so busy in this moment,农历新年快乐。我的国家要庆祝，这一刻我很忙
48338,UgyKfv9p15HxAKmhSNR4AaABAg,3,happy new year,新年快乐
25491,UgyoyBEQB5Jqd1G5LwR4AaABAg,3,your videos are like beautiful dreams come to life. i'm so happy youtube recommended your channel!,您的视频就像美丽的梦想成真。我很高兴YouTube推荐您的频道！
25537,UgxrDMlBGgzy-37UyrF4AaABAg,3,"it's delicious, he needs food, just take from the crops and not buy, then he uploaded it to yutub, can be billions of money, because the subscribe is from all over the world, his life is really happy, happiness that is essential, he is also good with his grandmother, wow alhamdulillah, hopefully the business will continue to be smooth and his grandmother is always healthy, aamiin",它很美味，他需要食物，只是从农作物中拿走而不是购买，然后他将其上传到Yutub，可能是数十亿美元，因为订阅来自世界各地，他的生活真的很幸福，幸福，必不可少，是必不可少的，是必不可少的，是必不可少的，是必不可少的他也与祖母Wow Alhamdulillah保持良好
26287,Ugz4x9jZf79qtb1MNMB4AaABAg.8zkpfxZ3kEy9-UxSmfj_dz,3,i'm so happy for you!,我为你很高兴！
46844,UgypAbv7l1IGSkj6aS14AaABAg,3,"happy chinese new year to you and your grandma. you do so many things yourself it is truly amazing and inspiring. my favourite part was the popcorn one and specially the end. your reaction during the popcorn machine was opened was too cute, it is the first time i saw popcorn being made like that. and grandma looked absolutely adorable. and thank you for the english subtitles. me and my mother simply love watching your videos.",春节快乐，祝您和您的祖母。您自己做很多事情，真是太神奇和鼓舞人心。我最喜欢的部分是爆米花，尤其是结尾。您在爆米花机上打开的反应太可爱了，这是我第一次看到爆米花是这样做的。奶奶看起来绝对可爱。并感谢您的英文字幕。我和我的母亲只是喜欢看你的视频。
46879,Ugx3fqElq-zVJv_OBNt4AaABAg,3,"happy chinese new year to you miss .. 
greetings from the philippines","春节快乐，你想念你。
菲律宾的问候。"
50088,UgzBJF3JXP0efB359St4AaABAg,3,it's easy to calm down and watch the whole film. i really like this movie you made. i wish you a happy new year.,很容易静下心来把整部影片观赏完，很喜欢妳拍的这支影片也祝妳新年快乐事事顺心
14619,UgyL8ZC4sr-CLXxfCap4AaABAg.9AVBpd2l1cF9Anh2m4FpL0,3,"@user-ce5xg9ko6m's vegetable fresh grand view garden is open 24h, and you can enjoy the solution at any time. how happy the officials are!
the small red pepper is spicy, and the spicy food will let you enjoy it, ha! try to taste all kinds of delicious cakes, and often eat ... persimmons, moon cakes, flower cakes, purple potato rice cakes, and recent egg yolk crisps are also wrapped in a layer of thin ravioli. taro is moisturizing with pink lips, which is good -looking !!
happy afternoon! 7 brothers, after the afternoon of the ziqi family, after the afternoon, i have a variety of fruit wine, the kiln grilled noodles with various jams, and then a few balls of fruit mix and match ice cream, start the","@user-ce5xg9ko6m 子柒的蔬鲜大观园子24H开放，随时都能尽情光顾解馋，看官们多幸福啊！
小的大约半根小红椒就辣残了，那辣食就全让您享用啰，哈！喜尝各种美味糕点，时常视吃…柿饼、月饼、花饼、紫薯米糕、、、近期的蛋黄酥中还包入一层薄糍粑，她跟奶奶分食后一口咬下拉开…那紫薯芋头润着粉唇，煞是好看哪!!
午后愉快呀！ 7兄，啰嗦完来去子柒家下午茶了"
50251,UgxcaDPdWjWLH7X-jTB4AaABAg.8qlm_KBwbfa8qlonc7YUtx,3,happy lunar new year from china!,来自中国新年快乐！
50466,UgyWAARkaZEMCDHs8CB4AaABAg.8qliwMpUBxQ8qlyU5x2cgj,2,xiaoyi0178 happy chinese new year,xiaoyi0178农历新年快乐
46387,Ugx7Oy44DyG2Qzy-TKB4AaABAg,2,happy new year to all! intersection,大家新年快乐！！
49637,Ugz7x8hbQl6A1ARCkFJ4AaABAg,2,wish you a happy new year love from tamil nadu,祝您泰米尔纳德邦的新年快乐
51447,UgwJK90Q7o1CEkNSZYF4AaABAg,2,"no one in the same year in taiwan can be so versatile, congratulations to happy new year",台湾同年的女生没人可以如此多才多艺，祝贺新年快乐
51702,UgxYasu9FDqzWgUHqsl4AaABAg.8qlSxysCabu8qlYrPK8_ak,2,happy new year,新年快乐
32198,Ugw98zMUT5-2W4KP6xF4AaABAg.8vxydkDtngx8yRLw3Wstdc,2,joaquin de oliveira .. do it .. life is too short not to be completely happy and content ๐,华金·德·奥利维拉（Joaquin de Oliveira ..
51862,UgzsGdmE5xRhRytz8mJ4AaABAg,2,"all is naturel .....like your life style 
but we need translation.....
wish u happy chinese year from algeria.....","一切都是自然的.....就像你的生活方式一样
但是我们需要翻译.....
祝您从阿尔及利亚获得中国的一年快乐....."
47802,UgxSOYwNbzpl1wzQazh4AaABAg.8qnvFUES1y48qplzst4FeO,2,"chan simon is 28th today, i wish you early, happy new year, peace and joy. blessings of jingzhou, hubei.",Chan Simon 今天腊月28了，提前预祝，新年快乐，平安喜乐。湖北荆州的祝福。
49114,UgwItSGRaA8kgDImZS94AaABAg,2,happy chinese new year! love from mexico!,农历新年快乐！来自墨西哥的爱！
33803,UgxQ4obKp7Mzrv-Mbi54AaABAg.8vAAkm2tSd48xpZbJdg_zx,2,"when u live to fulfill someone elseโ€s dream instead of ur own




when ur dream is to just live happy","当你活着实现别人的梦想而不是你自己的梦




当你的梦想就是快乐"
47801,UgxSOYwNbzpl1wzQazh4AaABAg.8qnvFUES1y48qpE0xXHxBm,2,happy new year,新年快乐
47800,UgxSOYwNbzpl1wzQazh4AaABAg.8qnvFUES1y48qozrXwxtbC,2,happy new year! intersection,新年快乐！ ！
47798,UgxSOYwNbzpl1wzQazh4AaABAg.8qnvFUES1y48qoiphtzO8g,2,happy new year!,新年快乐！
52337,UgyXY00bdu8Z3KpM2ZN4AaABAg.8qlNLvBppSx8qlXmlvjglP,2,happy new year,新年快乐耶
47737,UgxYwMgaBLxtNteW4hJ4AaABAg,2,"call for the goddess, happy new year",给女神打call，新年快乐
52889,UgwtJBeVs29lYuG7rbd4AaABAg,2,"new year new film, happy new year, everyone",新年新片，大家新年快乐
50286,UgwoOQWXAmTjE5xZY654AaABAg,2,happy chinese new year ☘,农历新年快乐☘
29412,UgzwJq1AkeIhARyURBF4AaABAg,2,grandma is so happy!,奶奶好幸福！
51257,UgzT7VY6u4XXsyQrn4V4AaABAg,2,"beautiful goddess and beautiful world of wonderland after watching the mood and happy, bless xiaoyi new year's happy pig new year's day.",美丽的女神美丽的人间仙境 看完心情舒畅愉悦 祝福小柒新年快乐 猪年行大运。
33821,UgxQ4obKp7Mzrv-Mbi54AaABAg.8vAAkm2tSd48yU4xRTBlBG,2,"sahara dessert - hi , thank you for sharing your story with me. your goals are admirable and i am sure both your mother and father are extremely proud of both you and your sister. it is nice to hear that young people care about the elderly and those who do not have as many advantages in life as they did . it makes me very happy and i canโ€t help smiling because of how you are willing to share the rewards you have worked for with others that work hard and suffer for so little pay and no relief from the harsh realities of life. you are a blessing in a world where kindness and goodness is harder and harder to find at times. you are so sweet and i will never forget what you took the time to write me.",撒哈拉甜点 - 嗨，谢谢您与我分享您的故事。您的目标令人钦佩，我敢肯定，您的母亲和父亲都为您和您的姐姐都感到自豪。很高兴听到年轻人关心老年人和那些在生活中没有那么多优势的人。这让我感到非常高兴，我不禁微笑，因为您愿意与其他努力工作，付出这么小的薪水且无法摆脱生活中严峻的现实的苦难和苦难的人分享您的回报。在这个世界中，您是一个祝福，在这个世界中，善良和善良有时越来越难以找到。你真可爱，我永远不会忘记你花时间给我写信。
46467,Ugw6SgWeDOav9oDVqGN4AaABAg,2,happy chinese new year!,农历新年快乐！
48489,UgxXXIbNChtL-954PKl4AaABAg,2,"the lovely ziyi is really exquisite in craftsmanship and unique taste. i wish you a happy new year, prosperous year of the pig, good luck ~",可爱的子柒真的手艺精湛，而且独具品味，祝福妳新年快乐，猪年旺旺，好运连连～
45598,UgzFRxwShokkqfCeuDF4AaABAg,2,happy chinese new year!your videos are so beautiful and inspiring,农历新年快乐！您的视频是如此美丽而鼓舞人心
50736,UgzgO1V2VSJif0kWmS54AaABAg,2,happy chinese new year,春节快乐
50739,Ugws2obhl9t6BAfjvXN4AaABAg,2,"happy chinese new year
","春节快乐
"
49029,UgxVsa5gou5txICRk5B4AaABAg,2,"love all the new year treats, how i wish i could go back to china for the new year celebration. happy chinese new year to you and your popo",热爱所有新的一年零食，我希望我能回到中国参加新的一年庆祝活动。在春节快乐，祝您和您的popo
50788,UgyWUZU-aSjGUZ82w154AaABAg,2,i love your videos. happy lunar new year❤,我爱你的视频。快乐的农历新年❤
50793,UgyhoMbM5B-LcrTMRMd4AaABAg,2,first time knowing how tanghulu was made. happy chinese new year supergirl!,第一次知道坦格鲁是如何制作的。中国新年快乐超级女孩！
49011,UgxEsk6FRnKVRFLQgc54AaABAg,2,"happy chinese new year from the florida keys!!!!'m a rooster...lol...you are a superwoman, preparing all that!!!",佛罗里达钥匙的农历新年快乐！！！！！！！！！！！！！！！！！！！！！！！！！！！！！！！！！！！！！！！！！！！！！！！！！！！！！！！！！！！！！！！！！！！！！！！！！！！！！！！！！！！！！！！！！！！！！！！！！！！！！！！！！！！！！！！！！！！！！！！！！！！！！！！！！！！！！！！！！！！！！！！！！！！！！！！！！！！！！！！！！！！！！！！！！！！！！！！！！！！！！！！！！！！！！！！！！！！！！！！！！！！！！！！！！！！！！！！！！！！！！！！！！！！！！！！！！！！！！！！！！！！！！！！！！！！！！！！！！！！！！！！！！！！！！！候）
42650,Ugyvi_lcKie9ZfG5b954AaABAg,2,it's a very happy life and want to be like this,是一个非常幸福的生活想要像这样
40312,UgxceaugYytbh4yXFll4AaABAg,2,"awesome video ever i see about chinese snacks, so happy to watch it,",很棒的视频，我都会看到中文小吃，很高兴观看它，
50795,UgzL2o4__dbstWrlFOR4AaABAg.8qldSLM3jXF8qlqeEvJAIg,2,"i also wish the original poster a happy new year ~~
the year of the pig!","也祝楼主新年快乐~~
猪年行大运！"
48904,UgwRaOvzBHMlGMyzKqd4AaABAg,2,happy chinese year! all my best wishes!,中国年快乐！我所有的祝福！
50828,Ugw3AEsxWVPCmjsPBY94AaABAg,2,happy chinese new year ☺,农历新年快乐☺
45870,UgygI5JDA9cUsMR_Z_h4AaABAg,2,happy spring festival!,春节快乐！
50683,UgwPbyBZxzeGVc1x5TR4AaABAg,2,i like in your video’s♥️. good luck and happy chinese new year. i from indonesia,我喜欢您的视频♥️。祝你好运和春节快乐。我来自印度尼西亚
50871,Ugxk7Tr2ABeYCHcVdTt4AaABAg.8qlcLA7JNVW8qlm_M3NTHJ,2,may you be happy and prosperous!,恭喜发财！
46388,Ugzrs25J5fu-ni_WyNF4AaABAg,2,happy chinese new year！,农历新年快乐！
50952,UgzSdhKxqk-pKXvbHlt4AaABAg,2,happy lunar new year darling!! love & huggs from sri lanka.,月球快乐新年亲爱的！斯里兰卡的爱与拥抱。
51004,UgxIFrlWBcWBgmqSQ4Z4AaABAg,2,happy new year!!!,新年快乐！！！
50550,UgxhfJC7DX2SE3WQqht4AaABAg,2,the gifts look great! happy new year!,礼物看起来很棒！新年快乐！
50262,UgwFaXeJyQOvlfBabY54AaABAg,2,"bless everyone, happy new year ，",祝福大家，新年快乐
53041,Ugw0nRtPV2JZB2Hayed4AaABAg.8qlJOW-Y_X-8qlQLOZNic8,2,chuc mung nam moi ky-hoi .chao ban viet-nam. welcome to china to have a happy new year.,Chuc mung nam moi Ky-Hoi .Chao Ban Viet-Nam。欢迎来中国过一个欢乐己亥新年。
29079,UgzJtfYrIHTcPcoI0xx4AaABAg,2,"i enjoy watching this video. the atmosphere is very beautiful and living there seems calm, far from the pollution of a big city. i also like gardening, i have a small garden on two balconies, the limited place is not an obstacle for gardening. liziqi videos really inspired me. happy gardening form germany ๐๐๐๐๐๐ .",我喜欢看这个视频。气氛非常美丽，住在那里似乎很平静，远非大城市的污染。我也喜欢园艺，我在两个阳台上有一个小花园，有限的地方不是园艺的障碍。 Liziqi视频确实启发了我。园艺快乐的德国形式。
25583,UgzB-txb2XBhyckLNWd4AaABAg,2,"liziqi, your channel is just wonderful i truly love it the way you work and create such beauty with food and all almighty gods abundance just in awe of you praying blessings upon you n your family and animals so happy i found your channel",liziqi，您的频道真是太好了，我真的很喜欢您的工作方式，并用食物和所有全能的众神创造如此美丽的方式，只是您敬畏您向您的家人和动物祈祷祝福，所以我很高兴我找到了您的频道
26310,Ugz4x9jZf79qtb1MNMB4AaABAg.8zkpfxZ3kEy90UgU1mSLv2,2,im happy for you. keep going my friend โค๏ธโค๏ธโค๏ธ,我为你高兴。继续前进我的朋友❤️❤️❤️
14633,UgyL8ZC4sr-CLXxfCap4AaABAg.9AVBpd2l1cF9B7zmWXOIBO,2,"@rich64 hello, just be happy!",@rich64你好，开心！
21230,Ugxv8oJFAlGLo7yATB14AaABAg,2,this us the life i want to have is so simple and happy,我想拥有的生活是如此简单和快乐
5040,Ugxa9hXZCRMY1B0m2zR4AaABAg,2,"it is healed just by looking at it
i'm happy","它只是通过看就可以治愈
我很高兴"
15121,UgwtZY9TNcFW-b5fm-54AaABAg,2,am so happy to see 53 million views for this . this proves world is such a good place. i wish if everyone in the world could watch & worship content like this,很高兴看到5300万观看次数。这证明世界是一个好地方。我希望如果世界上的每个人都能像这样观看和崇拜内容
22819,UgwwEIlmX5XSSoN_9_N4AaABAg.92hGkhVVsnr930B80XcG8P,2,then you are happy,那你很幸福
15506,Ugydb_vbaefxZmhO61V4AaABAg,2,a wife like this should make any man happy for life. she is 10 times the woman that i have dreamed of.,这样的妻子应该使任何男人对生活感到高兴。她是我梦dream以求的女人的10倍。
15600,UgxtDPg0tz8qdQ4IedV4AaABAg,2,"watch the video again and move again.
a pair of clever hands, operating in all things, a brain is unlimited free • how much bitter you can eat can only swallow the belly.
be happy and happier.","再重覆看一次视频，再次感动。
一双巧手，凡事亲自操作，一个脑子无限空闲•吃了多少苦只能往肚里咽下。
要幸福，更要快乐。"
28265,UgxwOQqpkeX3F4zaFH54AaABAg,2,"dear lizigi, i have been watching your video, i appreciate your respect for nature, because it brings you healthy food, and i will not speak chinese, i will focus on preparing your recipes to prepare your recipes above, whether food or food embroidery. although we all have problems, i think they are very happy. congratulations to your care and care for grandma. god bless you. by the way, i am from brazil. except for living in the uk for several years, i only know some countries from europe. forgive my chinese writing, it is my first time","亲爱的Lizigi，我一直在看你的视频，我很欣赏你对大自然的尊重，因为它为你带来健康的食物，而且我不会说中文，我会把注意力集中在准备你的食谱上，无论食物还是美食 刺绣。虽然我们都有问题，但我认为他们住的地方很开心。恭喜您对奶奶的关心和照顾。上帝保佑你。顺便说一句，我来自巴西，除了在英国生活了几年之外，我只认识一些来自欧洲的国家。 Forgive my chinese writing, it is my first time"
22391,UgzRlZRJCxQY48VVls94AaABAg.92x-KfW5LfN92zYMlG4LJo,2,"@user-jy5cf7vo6e, just be happy.",@user-jy5cf7vo6e 喺呀，睇着开心就好啦。
