,cid,votes,含happy,含happy中文翻译
35531,UgwTLlE8U_kZgYsDvkl4AaABAg,1,i am from india. real this girl is a super girl. i want to marry you. you will marry me .i will keep you very happy.,我来自印度。这个女孩是一个超级女孩。我想和你结婚。你会嫁给我。我会让你感到非常高兴。
48692,UgwfR-8XXg2vnDU4RTd4AaABAg.8qmcCn4Yd-S8qq0XBIe1Oe,1,happy chinese new year!!!,农历新年快乐！！！
28038,Ugy365BEQ6uM_jA81jt4AaABAg,1,i hope you have someone who makes me as happy as you make me when i watch these videos๐,我希望你有一个让我像你看这些视频时让我一样快乐的人
19910,Ugzsu3HjsJdDh4OmlKh4AaABAg,1,"simple and simple and happy, isn't this something that everyone is expected and can not reach.",简单纯朴幸福，这不是每个忙碌的人所期望而又不可及的事情吗。
21178,UgzAKSpnhIUI9E3VkgV4AaABAg.93wCSUJRgM994VwyzvmC-2,1,hope we can also find our own beautiful life and feel happy and be healthy,希望我们也能找到自己美丽的生活，感到快乐和健康
31481,UgyZXtFH2-CJikCWc4V4AaABAg,1,"wow im happy 
my from moroco โค","哇，我很高兴
我来自摩洛哥❤"
38181,UgwSit0PDbvMnU3tayJ4AaABAg.8tdcARzaCn08ttNOKnnxfh,1,it makes me happy ๐,这让我开心
21384,UgwEcqsqu9uimfd7eEp4AaABAg,1,i love this video and i like her so much. she seems happy in her simple life and she can do everything !!!๐‘๐‘๐‘๐‘๐‘๐‘๐๐๐๐’—๐’—๐’—,我喜欢这个视频，我非常喜欢她。她在简单的生活中似乎很高兴，并且可以做所有的事情！！
49577,UgyiFZ029RrZn7E5VS14AaABAg.8qm32sz6wAQ8uSZ9vitfeQ,1,"finally found a chinese message! happy! there are too many foreign fans of ziyi, almost all of them are english messages ~ haha ​​",终于找到了中文留言！开心
3473,UgzSOqKWziluutGAXHt4AaABAg,1,4.00 it was squash (ishkus) in nepali. i don't know why but i was super happy,4.00是尼泊尔的南瓜（Ishkus）。我不知道为什么，但是我很高兴btw这里有尼泊尔人吗？
30189,UgxhxpSWLZ_lfIa0CPR4AaABAg,1,"life happy without religion

life without purpose without religion","没有宗教的生活幸福

没有目的的生活"
30749,Ugxq2Ub_tlP7dRVTApl4AaABAg,1,enjoy it really you and your fufa and your pupy all are so happy and you are so amezing work i salute @liziqi,真正享受您和您的fufa和您的pupy都很高兴，而您的工作很令人愉悦，我致敬@liziqi
38546,UgySOR4dvdfi9CvW7nJ4AaABAg,1,wow i wanna live in a countryside ๐ such a happy peaceful life.,哇，我想住在一个乡村
38514,Ugz4yyqA9vZW5FfQPfJ4AaABAg,1,"this is all my birthday i feel so happy, you are very intelligent,",这是我的生日，我感到很高兴，你很聪明，
30347,UgyAEkAE9dRSZdi_Qa54AaABAg,1,"happy 5m subscribers, ziqi ๐“ฃ",幸福的5m订户，ziqi
48010,UgwLW4o1hqOj1Kt0IX14AaABAg.8qnbAHkubv08qpmLm1JEgc,1,may you be happy and prosperous,恭喜发财
28441,UgwqQHTiRvnC-FE8eJJ4AaABAg,1,"such a calm, amazing simple and happy life of her",她如此平静，惊人的简单和幸福的生活
49003,UgxGDZccxsCYoz0YTex4AaABAg,1,"happy chinese new year. 
","农历新年快乐。
"
392,Ugw1gdzGJsjA-hnQRFl4AaABAg,1,"me and my grandmother used to watch her and then somehow we stopped. now we wanted to find her here on yt but we couldn't and i searched ""chinese girl cooking with old grandma"" and this video appeared. i was so happy",我和我的祖母曾经看着她，然后我们以某种方式停了下来。现在，我们想在YT上找到她，但我们无法找到她，我搜索了“中国女孩用老奶奶做饭”，这段视频出现了。我很高兴
21235,UgwWfW014qWEYya-lT54AaABAg,1,"https://youtu.be/b30ekxesabo follow me, make me happy a new channel for the holy quran",https://youtu.be/b30ekxesabo关注我，让我开心一个新的古兰经的新渠道
29770,UgyjovD0dzxSceDTHIx4AaABAg,1,"i'm so happy ๐
your are self-made true nature lover๐’","我很高兴
你是自我自然的自然情人"
16614,UgwezxJfMk-BuwPUhZh4AaABAg,1,all delicacies ♡♡ wish ci always happy,所有美食♡♡祝愿CI永远快乐
51806,UgxenhWCdz17XKJFvrR4AaABAg,1,finally saw your video again ... i wish you a happy chinese new year with your grandma and your grandmother,终于又看到妳的视频…祝~妳与妳的老奶奶新春愉快，万事顺意
2990,Ugz0RVgYruRtgvc4MVF4AaABAg.9VNHZNd8ALL9XSVQwiww3x,1,i am happy to see liziqi wkwk,我很高兴看到liziqi wkwk
18396,UgzABL9lRALgwTeiaBd4AaABAg,0,i am grateful her channel (and she herself ofc) exist!! make me feel warm and happy watching! not to mention i learn a lot too haha,我很感激她的频道（她自己的频道）已经存在！让我感到温暖和快乐的观看！更不用说我也学到了很多哈哈
12555,UgwVOMyniDoxLh-AAil4AaABAg,0,i cannot describe how happy and warm inisde this videos make me u.u,我无法描述这段视频使我有多快乐和温暖
12310,Ugyv-TOcxMv1jyQOGjJ4AaABAg,0,the lamb puppy must be happy because you have you,小羊 小狗一定是快乐的 因为有你
50089,Ugw4L0w87phYkCXSxml4AaABAg,0,happy lunar year. from: india,农历年快乐。来自印度
14455,UgzNThmplAtZKA6uIgJ4AaABAg,0,"her grandma is really a happy old man. in his later years, such a capable and filial granddaughter took care of her.",她奶奶真是个幸福的老人，晚年有这样一个能干又孝顺的孙女照顾她。
50013,UgyA8tANVymSolETS2l4AaABAg,0,happy new year in ziyi 年❤️,子柒 新年快乐
49106,UgxCXABDdEtHfz7KD6V4AaABAg,0,happy chinese new year,春节快乐
50083,Ugx_11qCE__GaPJ3bjB4AaABAg,0,"i love your videos, happy new year gong hay phat choy",我爱你的视频，新年快乐锣hay phat choy
50028,UgzOxRqR-ZNk3CEvzt14AaABAg,0,happy newyear baby,宝贝新年快乐
14540,UgwAz_gO0fKm8I8sPGp4AaABAg,0,im happy that i can undertsand the words,我很高兴我能说出这些话
49048,Ugyc_ddvdkG69Hr7w7B4AaABAg,0,"blue curtain wing local resisting resources idin, warm, warm gear, love beautiful in all fields, lights, and sounds shady and comfortable falling beautiful rice, beautiful lotus flowers, fragrant, old -fashioned beautiful cold wind, dew, dripping, love phu san yod, wave, wave phu san, beautiful fog, petals, clouds beautiful stripes scoop the weaving, wealth, wealth, happy, love, love, grow as you wish. the scent of idin suk rueang hundreds of water, good perfume, beautiful perfume tulip ngamakura, bua lotus surrounded by bueng chu spear, beautiful love everyone is pretty good, hahahaha.",蓝色窗帘翼当地的抵制资源idin，温暖，温暖的装备，爱在所有领域，灯光和声音中美丽阴暗和舒适跌落美丽的米饭，美丽的莲花花，香，老式美丽的冷风，露水，滴水，爱Phu San Yod，Wave，Wave phu san，美丽的雾，花瓣，云美丽的条纹铲起编织，财富，财富，幸福，爱，爱，根据您的意愿成长。 Idin Suk Rueang的气味数百种水，优质的香水，美丽的香水郁金香ngamakura，bua莲花，被布伦楚矛包围着美丽的爱每个人都很好，哈哈哈哈。
50033,UgwwR039zjsoeMKEz_p4AaABAg,0,"happy new year! wish your grandma, you and your pets health and happiness.",新年快乐！祝您奶奶，您和您的宠物健康和幸福。
14861,UgwG5QJ1PIkD82HJfuV4AaABAg,0,"i also like this idyllic life, full of energy, sunshine, love, magnetic, attractive, i hope my life is as happy as li ziqi, so i like cute animals, do you like small animals? ?",我也喜欢这种充满活力，阳光，爱，磁性，吸引力的田园诗般的生活，我希望我的生活和李Ziqi一样幸福，所以我喜欢可爱的动物，你喜欢小动物吗？ ？
49067,UgyDHOsnl1AaHXIa3IV4AaABAg,0,happy chinese new year,春节快乐
12418,UgzBEtlNfPw0dgLSmHV4AaABAg,0,"you are really good, your life a lot of people dream. and i also wish to have life like you, simple and happy.",您真的很好，您的生活很多人都梦想着。我也希望像您一样过着简单而快乐的生活。
49068,UgxeKw0YfAlN3mOIumt4AaABAg,0,happy new year,新年快乐
49069,UgyHz6yPgMyb-OUfRV14AaABAg,0,happy new year,新年快乐
18460,Ugw_r7lqrpuhRcor8_h4AaABAg,0,being happy with beautiful nature,对美丽的自然感到满意
50058,Ugzth39ya6pGPbUbBNR4AaABAg,0,happy chinese new year to everything!,春节快乐，一切！
49044,UgyA4-n4OVe56PjrqXp4AaABAg,0,"happy chinese new year !!!! from thailand, you make me happy",Happy Chinese New Year!!!! From Thailand 你让我开心
50316,Ugz-3TCEVWgpBQCjHBJ4AaABAg,0,"glad i found you. your videos make me calm, happy, hungry and amazed all at the same time. if you ever ran a 7 day tour to just hang out with you doing your daily activities i would sign up no doubt! ❤",很高兴我找到了你。您的视频使我同时冷静，快乐，饥饿和惊讶。如果您曾经进行为期7天的巡回演出，只是与您一起进行日常活动，我将毫无疑问！ ❤
49098,UgwXwsJz4DFKqjQBh1V4AaABAg,0,happy chinese new year,春节快乐
49070,UgwND1eN5RSJoTcID1B4AaABAg,0,happy new year ilove,新年快乐
12452,Ugylz8gcv2IC1w19hF94AaABAg,0,really good i'm happy to see it,真的很好，我很高兴看到它
12466,Ugws3N66huVpHBtgi3p4AaABAg,0,congratulations li ziqui you're wonderful with your grandma... god see you and he's very happy with you!!!,恭喜李Ziqui，你和你的奶奶很棒...上帝见到你，他对你很高兴！！！
50270,Ugxj4cw1_qNRSDWOQsd4AaABAg,0,"thank you so much for showing traditional new year treats! in the united states, we only see a fraction of what you made. happy new year!",非常感谢您展示传统的新年美食！在美国，我们只看到您所做的一小部分。新年快乐！
50108,UgyrIPA8dgIwj2nFvTR4AaABAg,0,"happy chinese new year to you. im so amazed with your videos, pls upload more",春节快乐给你。我对您的视频感到惊讶，请上传更多
48987,Ugxhd6UKtgZD0WZ9Mfx4AaABAg.8qmH7QN7yh38qnhBWwpsZG,0,maybe say happy chinese year will be better hahahaha，although lunar year is another name of chinese year，but for chinese，“happy chinese year” will be more kind,也许说中国年快乐的一年会更好，哈哈哈哈哈，尽管农历年是中文的另一个名字，但对于中文来说，“中文快乐”会更友善
17754,UgxeebIRdTNXg_CsWRx4AaABAg,0,"wao! i was happy to listen to the old music , it was wonderful",哇！我很高兴听旧音乐，真是太好了
49006,UgxFxiF3A6WdYtVjqth4AaABAg,0,"happy new year li ziqi & to ur grandmother &happiness ❤❤❤❤❤ ur are 1 in a million unique talented kindhearted young lady 
thank u very much for sharing all your beautiful awesome videos .... iam learning alot from your talent & creative healthy cooking & handicraft & ur grandmother","新年快乐李Ziqi＆tor ur祖母
非常感谢您分享您所有美丽的令人敬畏的视频。...我从您的才华和创意健康烹饪和手工艺品中学习了很多❤"
13251,Ugw-9UDNZCtEFMkvEc54AaABAg,0,"ziyi, you are great! don't care about those ""don't like"". not because these people don't like you, they don't like themselves deep inside. i hope that one day they can start learning to appreciate beauty, and then you can experience happiness. make sure yourself!
(you are! please ignore this who give your video ""dislike"". it's not before the people are not happy with you, deep double because the thes y are not happy with themselves. hopefully one day, they will start learning to enjoy beauty , they will start enjoying happiness!)","子柒，你很棒！不要在意那些“不喜欢”。不是因为这些人不喜欢你，内心深处他们是不喜欢他们自己。希望有一天他们能够开始学着欣赏美丽，然后就可以体会到幸福。保重自己! 
(you are great! Please ignore those who give your video ""dislike"". It's not because these people are not happy with you, deep down it's all because they are not happy with themselves. Hopefully one day, they will start learning to enjoy beauty, then they will start enjoying happiness! )"
50249,Ugxontbs8HaHaRhWg854AaABAg,0,happy new year,新年快乐
49019,UgxrtSV_vHNurvEUgAl4AaABAg,0,happy chinese new year love!!!,春节快乐爱！！！
50203,UgwsqcVuQm41GZNDh7N4AaABAg,0,happy new year,新年快乐
13341,UgxPCGP8DQzEOQYP-cB4AaABAg,0,i will be sooo happyy to be like i just want that life,像我只想要生活一样，我会很高兴
13591,UgxHqMt4DClbM1bTV294AaABAg,0,"looking at her, happy. imagine you are the person i love very much.",看着她，开心一点。想象你是我非常爱的人。
50178,Ugwoq-vlqwKQazKQYTt4AaABAg,0,i am happy to watch you. thank you.,我很高兴看着你。谢谢。
13094,Ugy_AmVgjPndCsFDzTV4AaABAg.9CIZLjwUrg_9CKZZGNEc1r,0,@merinjosey5857 oahhhh really..then i'm happy in india ......to dangerous country china.......!!!!!!,@merinjosey5857 oahhhh真的..然后我在印度很高兴……到危险的国家中国........ !!!!!!!
13979,UgwFJizHrlY5wEHKGlt4AaABAg,0,i watched her videos because i miss my grandma so much. seeing her grandma makes me so happy.,我看了她的视频，因为我非常想念祖母。看到她的祖母让我很高兴。
50165,UgxmvIyBY-oq5_wKciZ4AaABAg,0,happy lunar new year li ziyi,Happy Lunar new year 李子柒
50164,UgwqmpWpjn5ucQDtz-l4AaABAg,0,happy lunar year xiao titi,幸福的农历一年小蒂蒂
50161,UgzDJ602AR3TZXK6CZx4AaABAg,0,happy spring festival 乐,春节快乐
48994,UgwsaD4UBfyWy7nfAcV4AaABAg,0,your videos are amazing! this planet needs more people like you. happy chinese new year!,您的视频很棒！这个星球需要更多像您这样的人。农历新年快乐！
16809,UgwzJsXeRmMPu7SBFSJ4AaABAg,0,wow!!!! so happy to see lots of sweets and dishes.,哇！！！！很高兴看到很多糖果和菜肴。
50158,UgyWchAknudpFsJSTlh4AaABAg,0,happy lunar new year,农历新年快乐
50155,UgzIXUsCrRcNMIZAaiB4AaABAg,0,happy lunar new year!!,农历新年快乐！！
17389,Ugx50NuKZEHuLy5KCe94AaABAg,0,"all ways love your videos, makes me very happy.",所有的方式都喜欢您的视频，使我非常高兴。
50135,UgzIOzvHu_nUQJIyBYJ4AaABAg,0,happy new year. she is awesome.,新年快乐。她真好棒。
49000,UgxZA-7OcS3u_vRlJk94AaABAg,0,happy vietnamese and chinese new year,越南和农历新年快乐
50133,UgxzzYVDoafPIAl0UIJ4AaABAg,0,even if i don't understand chinese i will stil watch your videos! it is just so relaxing and i feel so peaceful thank you! happy lunar new year!,即使我不了解中文，我也会观看您的视频！真是太放松了，我感到非常宁静，谢谢！农历新年快乐！
50132,UgyGSVnXkTQC5-yTArx4AaABAg,0,"witam wszystkie filmy, które oglądałdałem są wspaniałe jested wielkim wrażeniem wszystkiego co robisz od dań po budowędzystkich urzą do domu a teen i okolica jest pi kna nawet w zimie są owoce na drzewach. ciekawy jestem jaki to rejon chin?. pozdrawiam iż yyczę szczęśliwei nowegogogo roku ksioycowego :))))) hello, all the movies i have watched are very exciting. i am very impressed by all you made. from dishes to all electrical home buildings, there are fruits on the trees even in winter. i want to know what is china's area? greetings, happy lunar new year :)))))).
nǐ hǎo wǒ guānkà innkuò de suǒu diànyǐng dū hěn jīngcǎi, wǒ duì nǐ suǒ zuò de yìnxiàng fēicháng shēnkè, cóng càiyáo diànqì jiājū di. e jiànshè, jíshǐ zài dōngtiān, shùmù shàng yěyǒu shuǐguǒ. wǒ xiǎng zhōngguó dìqū shénhòu? wènhòu , zhù nǐ nónglì xīnnián kuàilè :)))))).","Witam wszystkie filmy , które oglądałem są wspaniałe jestem pod wielkim wrażeniem wszystkiego co robisz od dań po budowę wszystkich urządzeń do domu a teren i okolica jest piękna nawet w zimie są owoce na drzewach. Ciekawy jestem jaki to rejon Chin ?. Pozdrawiam i życzę Szczęśliwego Nowego Roku Księżycowego :))) . 你好我观看过的所有电影都很精彩，我对你所做的一切印象非常深刻，从菜肴到所有电器家居的建设，即使在冬天，树木上也有水果。我想知道中国的地区是什么？问候，祝你农历新年快乐:)））。
Nǐ hǎo wǒ guānkànguò de suǒyǒu diànyǐng dū hěn jīngcǎi, wǒ duì nǐ suǒ zuò de yīqiè yìnxiàng fēicháng shēnkè, cóng càiyáo dào suǒyǒu diànqì jiājū de jiànshè, jíshǐ zài dōngtiān, shùmù shàng yěyǒu shuǐguǒ. Wǒ xiǎng zhīdào zhōngguó dì dìqū shì shénme? Wènhòu, zhù nǐ nónglì xīnnián kuàilè:)))."
50127,UgysgogskphQps22aVx4AaABAg,0,happy chinese new year,农历新年快乐
50122,UgxW0tysuZSCMUcrKVh4AaABAg,0,happy chinese new year！,农历新年快乐！！
50115,Ugz5a-RXlB2bkoZEx994AaABAg,0,happy chinese new year,春节快乐
50101,UgwR5D4Xcli4hmQHl4V4AaABAg,0,"happy happy lunar new year to you ziqi, popo, n you all guys. gong xi fa choi.",祝您Ziqi，popo，n你们所有人快乐。锣Xi fa choi。
50009,Ugw1rmWAHngBT9StGot4AaABAg,0,i wish you a happy new year. from vietnam,祝你新年快乐
49616,Ugw7yxxyvFCtcyeRarF4AaABAg,0,"happy chinese new year
#love #from #malaysia","农历新年快乐
#love #from #malaysia"
49998,UgxmIxbzqmE4g8W1ZdF4AaABAg,0,happy new year,新年快乐
49777,UgxOmrV2tlLy_P4YcTp4AaABAg,0,happy chinise new year..i like follow your video..so great your life,Chinise新年快乐..我喜欢关注您的视频..太好了
15473,Ugzu-rFgwZeQKQkcXJF4AaABAg,0,"i want to live like this, so happy.",我想这样生活，很高兴。
49515,UgwXFYRqMOsvKPuJPYN4AaABAg,0,happy new year 2019 china,新年快乐2019年中国
49514,Ugyj5Yp88tA89GDrCaV4AaABAg,0,"i like your life and i like you.
happy new year.","我喜欢你的生活，我喜欢你。
新年快乐。"
49511,UgzhkzdxoQsc84yXsCF4AaABAg,0,happy new chinese year lovely girl,新中国新年快乐的女孩
49740,Ugwgp3ajMZZw_2evFhF4AaABAg,0,happy new year beauty,新年快乐美女
49501,UgxCiJWaZMDG4f18zZ14AaABAg,0,happy chinese new year! amazing gorgeous as always :),农历新年快乐！一如既往的惊人华丽:)
49761,UgzFrsbdeH3pfDV2Ibx4AaABAg,0,"well, give everyone a early years: happy new year, promotion and salary! intersection intersection intersection intersection intersection intersection intersection intersection intersection intersection",呦，在这给大伙拜个早年：祝新年快乐，升职加薪！！！！！！！！！！！
49762,UgwHjN7EatoudP547eh4AaABAg,0,happy new year.... delicious sweets..,新年快乐....美味的糖果..
49787,UgylisVsR-0xTLBHdsB4AaABAg,0,you are officially my happy pills! what a cutie 5:56,您正式是我的快乐药！多么可爱的5:56
49824,UgzIBsj1oBY1fIF5EQp4AaABAg,0,happy new year from armenia,亚美尼亚的新年快乐
49493,Ugxpb7XDJBHTBMy3Hfl4AaABAg,0,happy chinese new year,春节快乐
49799,UgyvnPBcf7dg88C6Kdx4AaABAg,0,happy new year!,新年快乐!
49473,Ugxi8iSlXuHN-NeJhFN4AaABAg,0,happy new year. thank you for these best video!,新年快乐。谢谢您的最佳视频！
49811,Ugyyh6RHI13kBLo_Z7l4AaABAg,0,"the dog retreats, the pig, you are happy",犬身而退，猪你幸福
49467,Ugz78Z3m-zm3ppWBSDF4AaABAg,0,omg.. wonderful life.. happy new year,天哪..美好的生活..新年快乐
49465,Ugw8QCVnSIdcIkuAAjF4AaABAg,0,"happy chinese new year, from malaysia",来自马来西亚的农历新年快乐
49461,UgwGb09hWvDTZUQtkNF4AaABAg,0,happy new year,新年快乐
49459,Ugze7doeLtbucw_Vuyt4AaABAg,0,happy new year. popcorn manufacturing machine is amazing.,新年快乐。爆米花制造机很棒。
16495,UgzO7Q9LG_oAD2wUg3p4AaABAg.98fdQ3AeW6l99c6j82ggPK,0,"@kobriks1 its better then wasting ur life time for sitting in the phone and being obsessed she's enjoying doing all this and u don't have lot of stress wasting ur brilliant life time for beautyful and fun life isn't that long but respect ur opinion i wish u a happy, long and healthy life❤️",@kobriks1更好，然后浪费您的终生坐在电话中并着迷于她喜欢做所有这一切，并且您没有太多的压力浪费您的美好生活时光，享受美好而有趣的生活并不长，但要尊重您的意见祝您幸福，漫长而健康的生活❤️
15493,UgwJYeUGSr596Cxbv8B4AaABAg,0,"so happy, four masters and apprentices, the little guy in the back is the same as relatives. ziyi himself is also happy.",好幸福，师徒四人，后面的小家伙跟亲人一样，子柒本人也乐在其中
15505,UgzZcBrWu5IDJhTAONV4AaABAg,0,"may you always be healthy, live in harmony with your family, and visit a happy place, where there is paradise -like vegetation, silent and nutritious recipes, and smart and smart people",愿您一直健康，与家人和睦相处，并参观一个幸福的地方，那里是天堂般的植被，静默着美味又有营养的食谱，还有聪明又聪明的人
49550,UgwBa0AandNcrI8JuPN4AaABAg,0,happy life for u dear......,亲爱的你的幸福生活……
49619,Ugy2kFFuAxt2cPZCM3F4AaABAg,0,happy new year! intersection,新年快乐！ ！
49632,Ugw4lqdL4U5fwt2GhuV4AaABAg,0,"so much work, but it all looks so good!
happy new years. i hope you are taking care of yourself as well.","这么多工作，但一切看起来都很好！
新年快乐。希望您也照顾好自己。"
49602,UgxASedpjNkZP0KVDYN4AaABAg,0,"happynewyear ♥ ️ this time, it's really cute. ? ?",Happynewyear♥♥这次，真的很可爱。 ？ ？
49600,UgxGs_ulVVFSgs7eqVJ4AaABAg,0,happy chines new year.......,Chines新年快乐.......
49652,Ugw7W7Ypu6-3BLhoefZ4AaABAg,0,happy spring festival!,春节快乐哟！
49596,UgzPrMIr-IOHlYM3iMh4AaABAg,0,i love it it was so peaceful and relaxing. happy chinese nee year everyone,我喜欢它是如此的和平和放松。大家
49666,UgyKhz_uVqMP2uiSocZ4AaABAg,0,happy new year!!!♡,新年快乐！！！
15602,UgzsxoZEcm7KOfbQrOp4AaABAg,0,"好 食 see you to be happy to make food, you are a good girl with a clever spirit.",柒柒看你做美食好幸福，你是个心灵手巧的好姑娘。
49595,Ugy5nzKDbFndzKt9_H14AaABAg,0,absolutely love these amazing treats! happy lunar new year! bonne année!,绝对喜欢这些惊人的零食！农历新年快乐！ BonneAnnée！
49676,UgzPZ1w0Puq3PxRPtgd4AaABAg,0,happy new year! greetings from italy!,新年快乐！来自意大利的问候！
16066,UgyRrJGIc09pBJgG8v14AaABAg,0,holy shittttt this is almost a 1m likes... wow i’m so happy.,神圣的shitttt这几乎是100万的喜欢...哇，我很高兴。
49695,Ugw9xMIg9p_Zzw7V-9R4AaABAg,0,happy chinese new year!,农历新年快乐！
16211,UgyGkfci-vd0Xg6uzFN4AaABAg,0,"watching her channel from only 1.2 million sub. only 2 years, now 10 million sub. i really like watching the beautiful idyllic in her videos. she is a wonderful girl. wishing you and her always healthy and happy ❤️❤️❤️❤️❤️",看着她的频道只有120万个子。仅2年，现在1000万个子。我真的很喜欢在她的视频中观看美丽的田园风光。她是一个很棒的女孩。祝你和她永远健康快乐❤️❤️❤️❤️❤️❤️
49704,UgyY_zC3w4Y7jjwimed4AaABAg,0,happy chinese new year！,农历新年快乐！
49706,UgycCd32IW9hMoqtZCd4AaABAg,0,happy new year,新年快乐
49561,Ugy6UV-YdSNIcw2NnCx4AaABAg,0,"kongsi fat choi ,, ni hao li ziqi ,,, happy chinese new year ... congratulations chinese new year ,,, i always look forward to the latest video with your grandmother ... greetings and love from indonesia",Kongsi Fat Choi，Ni Hao Li Ziqi，在农场新年快乐...恭喜农历新年
16287,Ugx5BJn9gC8Tc3rjZhx4AaABAg,0,wow their life is wonderful . i also like a life like her . she is so happy . i love nature a lot . but the modern technology is a very bad thing . may be there are good effect also . but the nature is wonderful amazing . there is no words to discribe that .,哇，他们的生活很棒。我也喜欢像她一样的生活。她很高兴。我非常爱大自然。但是现代技术是一件非常糟糕的事情。可能也有很好的效果。但是大自然真是太神奇了。没有话可以归因于此。
49816,UgxVTn9pevW9_HZSyZ54AaABAg,0,"you are amazing girl ..
happy new year..","你是很棒的女孩..
新年快乐.."
49447,Ugzu9abYlXYARcRd3Ol4AaABAg.8qm6ZkSKEFR8qn7KK3MqZR,0,yueming wu happy chinese new year ..,Yueming Wu春节快乐..
16660,UgxCabZErCzYKTyT_5J4AaABAg,0,"1 multi -technological multi -talented girl
wish you always happy and happy","1个多技术多重女孩
希望你永远快乐"
49172,Ugw_zhQvf3oMZ6r_fph4AaABAg,0,happy chinese new year! thank you so much for sharing your life with us. i just adore your videos. lots of love from alaska!,农历新年快乐！非常感谢您与我们分享生活。我只是喜欢你的视频。来自阿拉斯加的很多爱！
49941,UgwxYLhzKMVWn6hSWgZ4AaABAg,0,"happy new year!!
i like your channel very much","新年快乐!!
我很喜欢你的channel"
49953,Ugz0myWDvNGFYJ4UiO94AaABAg,0,happy new year.u r so devoted to ur work.cooking is ur passion.i love all ur videos.,新年快乐。
49964,UgzK9EU0Ya9s5bgYu0J4AaABAg,0,happy new year. sister bay! ☺,新年快乐。姐妹湾！☺
49975,Ugz2w212hLYfqrlSH-p4AaABAg,0,"fantastic as always ♡ 
n happy chinese new year ^-^","一如既往的奇妙♡
n春节快乐 ^ - ^"
49180,UgyszUO1pM_pvVHLVEd4AaABAg,0,happy new year!,新年快乐！
49976,UgzHauVWmmIVcQN6eSJ4AaABAg,0,happy newyear,快乐的纽约
49176,UgyY8B7LuE9pBNKdNRl4AaABAg,0,"happy new year, everyone!",祝大家新年快乐！
49173,UgytdnTm0ziC5TuuHuZ4AaABAg,0,"wow, what a feast! thanks and happy chinese new year li zi qi!",哇，真是个盛宴！谢谢，农历新年快乐李Zi Qi！
49993,Ugw2Cl9RtCnjSXyDnOB4AaABAg,0,"happy chinese new year.

","农历新年快乐。

"
15451,UgwsvYjHlnbpMPMMdj14AaABAg,0,i'm just happy there is still rural life like this out there in the world. it is beautiful,我很高兴仍然有世界上这样的乡村生活。它很美
