,cid,votes,含respect,含respect中文翻译
46665,UgznRayRv0aCLiZInI54AaABAg.8qs_TK17Zu78qsckUcmDJN,3,"for those who say li ziqi fake at the little brother channel of western yunnan, i want to add a few words. first of all, starting from a large level, they made excellent videos to share with people who love food culture around the world, so that more people understand the beauty of chinese culture. do you have done it? just vomit the sputum of other people's works in a casual sentence, and feel that some cooperation with the merchant defile your eyes? then, take a step back to talk about video production. which one should not take care of the mirror editing in the later stage? critics, do you spend money to watch the video? no. did you participate in the video production? no. you respect the efforts and choices of others. not only are there no, but you are also whispering, yin and yang weird, where can people do not do well, go to weibo to give opinions! didn't you change your opinion? take your own business! have nothing to do? brother, so many traitors around them, hurt the world, care about them! intersection intersection take a step back, these critics have not criticized the ideas at all, many of them are still catching the wind, and the clouds are also cloudy. when you make a criticism next time, you ask yourself a word. what do i make in my own criticism? i said in this way, what does it mean for others? did i have a negative impact on the perception experience of others (those who want to be calm and cured)? it's all adults, so mature, please! intersection intersection intersection intersection",针对在滇西小哥频道底下说李子柒假的人我想特别补充几句。首先，从大的层面开始讲，她们做出了优秀的视频与全世界热爱美食文化的人们分享，让更多的人了解了中华文化的美好。批评者们你们做到了吗？随随便便一句话就吐别人作品一口痰，觉得和商家的一些合作玷污你们的眼了？然后，退一步说视频制作，讲究值得赞叹的分镜剪辑后期哪个不要花心思？批评者们你们花钱看视频了吗？没有吧。你们参与视频制作了吗？没有吧。你们尊重别人的努力和选择了，不仅没有，还窃窃私语，阴阳怪气，人家哪里有做的不好的，去weibo提意见啊！提意见了没改？取关做自己的事去啊！没事情做？大哥，周围那么多作奸犯科的，伤天害理的，管他们去呀！！！再退一步说，这些批评者完全就没批评到点子上，很多还是捕风捉影，人云亦云，你们下次再提出批评的时候问自己一句话，我在批评的过程中我自己做出的贡献是啥？我这样在下面说别人的不是意义何在？我有没有给别人（那些希望得到平静与治愈的人们）的观感体验带来负面影响？都是大人了，成熟一点拜托了！！！！！
871,UgzUbBhuVy5emo55GfN4AaABAg,2,we miss your new videos. can you again start giving videos? your content are really worthy of appreciation. respect you for being soo hard working. such a talented soul i have ever came across in my life. words are not enough to praise your talents and creativity.,我们想念您的新视频。您可以再次开始给视频吗？您的内容真的值得赞赏。尊重您的努力工作。我一生中遇到过的一个才华横溢的灵魂。言语不足以赞美您的才能和创造力。
19769,UgzmQ-ENkjs0c6wmtyh4AaABAg.95Jnp0OjZJ095R7GBH7pyV,2,"@dantechersi6056 i agree. i am not vegan or vegetarian, but i do have animals of my own. also a garden/farm. it will be hard the day i will have to kill my chickens or ducks for our own meal. just as liziqi does, i would pay my respects to that animal for giving me it's life to continue my own.",@dantechersi6056我同意。我不是素食主义者或素食主义者，但我确实有自己的动物。也是花园/农场。我将不得不杀死自己的鸡或鸭子来做自己的饭菜会很难。就像利兹奇所做的那样，我会尊重那只动物，因为它给了我自己的生命。
20728,UgwwfTBnNim6ToHmCql4AaABAg,2,something i really respect and love about her is how she treats her grandmother with love and care. thats something a i am terrible at (treating others well),我真正尊重她的东西是她如何用爱与关怀对待祖母。那是我很糟糕的事情（很好地对待他人）
31812,UgzcDGmwt1euCQoVgAx4AaABAg,2,huge respect for this woman. when will the western feminism learned?,对这个女人的极大尊重。西方女权主义什么时候才能学会？
31485,Ugx45WaUplnOKtWmMUt4AaABAg,2,"this woman is hard working.
#respect","这个女人很努力。
＃尊重"
28265,UgxwOQqpkeX3F4zaFH54AaABAg,2,"dear lizigi, i have been watching your video, i appreciate your respect for nature, because it brings you healthy food, and i will not speak chinese, i will focus on preparing your recipes to prepare your recipes above, whether food or food embroidery. although we all have problems, i think they are very happy. congratulations to your care and care for grandma. god bless you. by the way, i am from brazil. except for living in the uk for several years, i only know some countries from europe. forgive my chinese writing, it is my first time","亲爱的Lizigi，我一直在看你的视频，我很欣赏你对大自然的尊重，因为它为你带来健康的食物，而且我不会说中文，我会把注意力集中在准备你的食谱上，无论食物还是美食 刺绣。虽然我们都有问题，但我认为他们住的地方很开心。恭喜您对奶奶的关心和照顾。上帝保佑你。顺便说一句，我来自巴西，除了在英国生活了几年之外，我只认识一些来自欧洲的国家。 Forgive my chinese writing, it is my first time"
31172,Ugya7qXwjL47BST99bx4AaABAg,2,"how lovely you are and your works โคโค i really feel lucky to see youโคโคโค
love and respect form bangladesh ๐","你有多可爱，你的作品我真的很幸运见到你❤❤❤
爱与尊重形式孟加拉国"
22917,Ugy4QKtD9cbzrOoUVFd4AaABAg.92dymxS8pg192tgLO8PJmq,2,"jongson ho sure, its not right to try and refrain these people from eating the dogs if they desire, but it doesnโ€t mean i have to respect it internally or condone it. i can accept that they do it, itโ€s their life not mine, but i have the choice of hating them for it. do you think that people who kill each other or do something ridiculous too have the deserve for respect? maybe in some situations, but that doesnโ€t stop the judgement.",Jongson Ho确定，如果他们愿意的话，试图避免吃这些狗的人是不合适的，但这并不意味着我必须在内部尊重它或宽容它。我可以接受他们这样做，而是他们的生活不是我的，但是我可以选择讨厌他们。您是否认为彼此杀害或做可笑的人也应得的尊重？也许在某些情况下，但这并不能阻止判断。
32517,Ugw_2R-ouQ3OH2y104F4AaABAg,2,"you chinese people are so smart and you guys create awesome things. i respect that ๐๐๐’–๐’–. not only that but you guys are simple, i love it ๐คฃ๐คฃ๐’•. my life and environment is nothing compared to this, here it is ugly but where you life so vibrant and beautiful ๐๐",你们中国人是如此聪明，你们创造了很棒的东西。我尊重那个。不仅如此，你们很简单，我喜欢它。与此相比，我的生活和环境没有什么，这里很丑陋，但是您生活如此充满活力和美丽的地方
25543,Ugz-VvtvGJWZUTGH8RF4AaABAg,2,"she is the most talented woman ๐‘ฉ 
i respect you and i hope you would be happy forever!!
sorry for my easy english because i am japanese","她是最有才华的女人
我尊重你，希望你永远幸福！
对不起，我的英语简单，因为我是日本人"
12677,UgwT1gDAxj3u5Py3Xn14AaABAg.9Cu4gC8q40r9EMBDPJu9MW,2,natural vibes i respect them...(actually i respect almost everyone),自然的共鸣，我尊重他们...（实际上我尊重几乎每个人）
12676,UgwT1gDAxj3u5Py3Xn14AaABAg.9Cu4gC8q40r9EHYNtYY9fO,2,@user-sg2yh7ln5c i respect you,@user-sg2yh7ln5c我尊重你
22915,Ugy4QKtD9cbzrOoUVFd4AaABAg.92dymxS8pg192teQRhI_ns,2,"jongson ho the value that dogs give is different to a cow which we donโ€t measure by โ€usefulnessโ€, i canโ€t even imagine to be as unempathetic as someone who has this kind of thinking. the only creature in this world that can love you more than it loves itself is a dog, and because you like to put humans on a high pedestal, i think dogs deserves to sit on one beside us for their companionship. ok then, by your logic, if we canโ€t call this thing that kills 3000 of us each year (most probably by accident) a friend, then what about the 400,000 who die from murders every year by people? what can you do? iโ€m sure they donโ€t respect you either.",Jongson Ho狗给出的价值与我们无法通过“有用性”来衡量的母牛不同，我什至无法想象与具有这种思想的人一样无情。这个世界上唯一可以爱你的生物比自己喜欢的是一只狗，因为您喜欢将人类放在一个高的基座上，所以我认为狗应该坐在我们旁边的一个人身边进行陪伴。好吧，通过您的逻辑，如果我们不能称这件事每年杀死我们3000人（最有可能是偶然）的朋友，那么每年被人们谋杀而死于谋杀案的40万人呢？你能做什么？我敢肯定他们也不尊重你。
43344,UgxylvOA7yK-yug573R4AaABAg,2,"wonderful video you are a very diligent woman, all your products look delicious, i entrust all my respects to you.",精彩视频你是一个非常勤奋的女人，你所有的产品看起来都很美味，我把所有的敬意都委托给你。
48308,UgzuMcehyeQzM47vS094AaABAg,2,"her grandma hat is so cute! respect for you, really a hard worker! love your videos!",她奶奶的帽子真可爱！尊重您，真的是一个勤奋的人！爱你的视频！
48392,UgzWRYXgVqoDqwQ1CSx4AaABAg,2,"matep ..
i am chinese descent but not all of them i understand. this is miss again preparation for welcoming the chinese new year. the tradition of making cakes and snacks ahead of the chinese new year is super busy. yep ... all the culture of other parts of the world will also be busy if it is approaching or welcoming the day of the celebration according to their respective traditions.
specifically in this video, traditions and recipes are indeed innate from our ancestors. but of course not all we can make in my beloved indonesia, because not all the materials used in our ancestors are in the land of indonesia. so we replace it with local materials. and it turns out it doesn't feel like it is worse. and more importantly is the essence that is ...
in our country indonesia even has more variety of traditions and culture, our land also produces extraordinary variety of agricultural products. we can be proud as asian nations and of course especially indonesia.
i admit that miss li is very extraordinary to show the world how beautiful the country, tradition, culture, etc.
i really hope there is a figure like miss li in indonesia, so that the world will see the way we make rendang, chicken opor, bamboo lemang, etc. .. certainly will make the world amazed.
greetings from pekanbaru.","matep ..
我是中国血统，但我了解的不是所有人。这再次是为欢迎农历新年的准备。在农历新年之前制作蛋糕和小吃的传统非常忙。是的...如果根据各自的传统接近或欢迎庆祝活动的那一天，世界其他地区的所有文化也将很忙。
特别是在此视频中，传统和食谱确实是我们祖先的天生。但是，当然，我们在我心爱的印度尼西亚并不是所有的东西，因为并非祖先中使用的所有材料都在印度尼西亚之地。因此，我们用当地材料代替它。事实证明，它并没有更糟。更重要的是...的本质是...
在我国，印度尼西亚甚至拥有更多种类的传统和文化，我们的土地也生产出非凡的农产品。我们可以为亚洲国家，尤其是印度尼西亚而感到自豪。
我承认，李小姐非常非同寻常，向世界展示国家，传统，文化等多么美丽。
我真的希望有一个像印度尼西亚的李小姐这样的人物，这样世界将看到我们制作鸡，鸡肉，竹子莱蒙等的方式。肯定会让世界惊讶。
佩坎巴鲁的问候。"
26102,Ugxwn52QXnIJzCSmdOt4AaABAg,2,respect from bulgaria. you are amazing ๐’๐’๐’๐’,尊重保加利亚。你很棒
26335,Ugz4x9jZf79qtb1MNMB4AaABAg.8zkpfxZ3kEy935VP72yXYT,1,"iโ€m so sorry, but i laughed, i get it, at least this is what we can do to show her the respect right? lol",我很抱歉，但我笑了，我明白了，至少这是我们向她展示尊重的能力吗？哈哈
26445,Ugz4x9jZf79qtb1MNMB4AaABAg.8zkpfxZ3kEy984htLzr3W8,1,when i had depression the most difficult part of it all was cleaning my room. so big respect for that!!,当我沮丧的时候，最困难的部分是打扫我的房间。对此非常尊重！！
24148,Ugx_TZ7L9ZSeJcBAbId4AaABAg.91U9KIRGN8y92S7WHr62mE,1,"irritable little pink diss, rather than patriotism, do nโ€t say that people who are patriotic are small pink. i said that you will be happy if your traitors walk away from dogs? people and people do nโ€t understand basic respect. do you still want others to listen to you? there should also be patriotism that should not be scolded. if you have a country, you should not use chinese characters if you don't like your country. don't live in this land. if you have the ability, you can leave china in the whole family, learn more english, remove chinese characters, and be your slave sex.",暴躁小粉红diss 宁不爱国就不要说人家爱国的人是小粉红，我说你汉奸走狗你会开心吗？人和人基本尊重都不懂，你还想别人听你的话？还有爱国不应该被骂，有国才有家，你要是不喜欢你的国家就不要用中国字，不要在这片土地生活。有本事你就全家移民离开中国，多学英语，把中文字去掉，做你的奴性爱外国就可以了。
49505,UgxwchYl386UcKraHdt4AaABAg,1,"nature is like mother always loving,providing,forgiving all she wants back is love and respect. happy chinese new year. love this channel so much.love from the universe.",大自然就像母亲总是爱，提供，宽恕她想要的一切都是爱与尊重。农历新年快乐。非常喜欢这个频道。
27258,UgwoBK95SLTCe-m60uJ4AaABAg.8zKMCb-XwpB91ngYWv6reK,1,"""and even with the fly cams and papparazi, she still continues to create videos"" - geez, people can't just leave her alone? i would hate to see her stop doing videos because of these morons who don't respect her privacy.",“即使有了苍蝇摄像头和帕帕拉齐，她仍然继续制作视频” - 哎呀，人们不能只是让她一个人吗？我不愿看到她停止拍摄视频，因为这些白痴不尊重她的隐私。
29784,UgxN4R5bsoOD2G__EjZ4AaABAg.8xVDk1l9z8t8yQRmf8bUZ3,1,respect china from poland,尊重波兰的中国
30723,UgwkC3U2cPYuJWya2iB4AaABAg,1,you have a lovely grandmother god bless her and you i have love and respect for you2โฅ๏ธโฅ๏ธ,你有一个可爱的祖母上帝保佑她，而你我对你有爱和尊重2♥♥♥父
32059,UgwlrcsnlxBK_XQhCXd4AaABAg.8vztA6WkhKN8zafp5J5UZe,1,"it is her only living relative as far as i know. no wonder she would do anything for her, but in china or most of the asian countries, you are supposed to treat elders with respect and dedicate yourself for them because they lived longer than you and/or probably raised you or your parents up.",据我所知，这是她唯一的亲戚。难怪她会为她做任何事情，但是在中国或大多数亚洲国家，您应该尊重长者，并为他们奉献自己，因为他们的寿命比您更长和/或可能抚养您或您的父母。
51712,UgxYasu9FDqzWgUHqsl4AaABAg.8qlSxysCabu8qldX9LcOAC,1,"should call it lunar newyear, because early 1949 you can't call it chinese new year. but this festival existed more than 1000 years ago. like thank giving day of american, we call it thank giving day not ""american holiday"", it express respection and knowledge about culture.",应该称其为Lunar Newear，因为1949年初，您不能称其为农历新年。但是这个节日成立了1000年前。就像感谢美国人的日子一样，我们称其为感谢，而不是“美国假期”，它表达了对文化的敬意和知识。
34548,Ugw5s9z3MVHWUuAa_XR4AaABAg.8uztCsvLOer8vWdF_4SGpd,1,"sumdyude it's rude to assume that just because they're chinese,they'll eat the doggies and the lambs. they could bc it's just their culture (which you shouldn't disrespect) but they could also be loving them. ik that bc some people from my place eat them but i still don't bc i love them",Sumdyude认为仅仅因为他们是中国人，他们就会吃狗狗和羔羊。他们可以公元前这只是他们的文化（您不应该不尊重），但他们也可以爱他们。 ik卑诗省有些人从我家吃了他们，但我仍然不bc我爱他们
22985,UgxsdVLdbVYEPdXqgbl4AaABAg,1,"regardless of whether these videos are suspected of hype, the video does spread traditional chinese culture. the chinese do not need to admire yangmei. a country's own culture is the root. for a chestnut, taekwondo can become olympic sports. why can't chinese kung fu, why did china have only bruce lee and jackie chan, no succession? because the flow star vase is full of the current entertainment industry, is it that the inheritance has a fault in the inheritance? first of all, if you like the culture of others, you must first love your own culture. if a country ignores its own culture and vigorously promote foreign culture. this country, this nation will lose the soul, and will not get it in the future. the respect of others, too many excellent culture in china for 5,000 years is worthy of promoting. the thoughts in guang confucianism and taoism are enough for you to dig. china is actually unique.",不管这些视频是否有炒作嫌疑，但视频确确实实在传播中国传统文化，中国人不需要崇洋媚外，一个国家自己的文化才是根，邻国日本韩国确实比我们做的好，而且做到了文化输出，举个栗子，跆拳道可以成为奥运体育项目，为什么中国功夫不可以，为什么中国只出了李小龙和成龙，后继无人？因为流量明星花瓶充斥着现在的娱乐圈，是不是功夫在传承方面有迹象已经出现断层了？国内首先你喜欢别人的文化，你就要先爱自己的文化，一个国家如果连自己的文化都忽视，去大力弘扬外来的文化，这个国家，这个民族是失了魂的，将来也不会得到别人的尊重，中华上下五千年太多优秀的文化值得弘扬了，光儒释道里的思想就够你挖掘的了，中国其实是独一无二的.
35793,UgwSDbzoduI5_ylyTkt4AaABAg,1,such a nice video with little effort done so beautiful and great things. respect,如此漂亮的录像带，很少努力如此美丽而伟大的事情。尊重
38859,UgwRTb4glaE_MA7I_3B4AaABAg,1,respect frome morocco ๐ฒ๐ฆ๐ฒ๐ฆ๐ฒ๐ฆ๐‘๐‘๐‘๐‘,尊重摩洛哥弗罗姆
39731,Ugz7jZTGvnlkB_rhPq94AaABAg.8slSxGTrJb38sr4ZFLl_ny,1,"well, this is the project, the same commercial. smart people do. this is not a way of life now. everything is staged. but with such respect for the traditions, skills of ancestors and nature. well done and they themselves earn money and people are the pleasure of only every minute of viewing. well, you carefully look at every frame, everything is thought out both a bouquet and dogs and cleanliness from snow -white napkins for a simple stove ... but do not tear the eye .... charm. these are specially re -tinkers. i am also delighted with their work.",好吧，这是一个项目，同一广告。聪明的人做。这不是现在的生活方式。一切都上演了。但是，尊重祖先和自然的传统，技能。做得好，他们自己赚钱，人们只是每分钟观看的乐趣。好吧，您仔细查看每个框架，一切都被认为是一束花束和狗，以及雪 - 白色餐巾纸的清洁度，用于简单的炉子...但是不要撕开眼睛....魅力。这些是特别的调整器。我也对他们的工作感到高兴。
50861,Ugy8ps3yYM_3K2NI7_V4AaABAg,1,i am always soo hungry after watchng your video. you really talented. my respect from indonesia,观看您的视频后，我总是很饿。你真的很有才华。我对印度尼西亚的尊重
52932,UgwHTfgI2KDCfC3tHwV4AaABAg.8qlJWxRpsFj8qlQitV7SXO,1,"hello..i have been watching your videos from last year and each video is a masterpiece..i respect you,i love your channel..daily before going to bed i use to watch your videos so that i get a peaceful sleep..your videos had inspired me in many ways..as i am from india..i don't understand your language,so if you don't mind please add a subtitles in english...
can you or anyone translate her message in english..??","你好..我一直在看你去年的视频，每个视频都是杰作。我尊重你，我爱你的频道..每天睡觉前，我都用来观看你的视频，以便我宁静的睡眠。您的视频在许多方面都启发了我。
您或任何人都可以用英语翻译她的信息.. ??"
19774,UgzmQ-ENkjs0c6wmtyh4AaABAg.95Jnp0OjZJ095aruap7GmL,1,"@razorwu7369 very true. i think we've lost touch of where our food has come from. raising, killing, and eating animals and paying respects to the fact their life has now given you life is something to consider. i have many friends that are vegetarian and vegan. the understand this concept to a degree. i think it's the way people raise their livestock, quite literal, is very important.",@razorwu7369非常真实。我认为我们已经失去了食物的来源。养育，杀人和吃动物，并向他们的生命赋予您生活的事实表示敬意。我有很多素食主义者和素食主义者。在一定程度上了解这个概念。我认为这是人们举起牲畜的方式，非常重要。
22914,Ugy4QKtD9cbzrOoUVFd4AaABAg.92dymxS8pg192tbeS-0V6j,1,"@priscillayang499 of course, the people who eat dogs don't respect you too, and they don't care about what you mind. and, what can you do? 
you just love your human friends the dogs, but you hate your human of the same kind with you. is it a joke? 
your friend of the dogs bit more than 3000 people to die every year and hurt more than 50 million people. is this thing you call it your friends? 
btw, the cow helps humans do lots of farming work and provide the milk for humans, it's much better than dogs, why you don't censure the people eat beef? 
i think the kind of person of you are just a selfish person who cares about yourself feeling only.","@priscillayang499当然，吃狗的人也不尊重你，他们也不在乎你所介意的。而且，你能做什么？
您只是爱您的人类朋友狗，但您恨您的人类。这是个玩笑吗？
您的狗的朋友每年有超过3000人死亡，并伤害超过5000万人。这是您称之为您的朋友吗？
顺便说一句，牛帮助人类做很多农业工作，为人类提供牛奶，它比狗好得多，为什么您不谴责人们吃牛肉？
我认为，您的那种人只是一个自私的人，他们只关心自己。"
14974,UgwNoWhvO5cOgS7sial4AaABAg,1,her video quality and editing is just as perfect as her life. big respect and much,她的视频质量和编辑与她的生活一样完美。大尊重和很多
22599,UgzvMw8oHviheTkqdZR4AaABAg,1,hi i. gerasimenko lydia from. russia. the good mistress is so skillfully prepared just a super cook. what a beautiful video. i have a great respect for your nation. you and happiness in the new year.,嗨，我Gerasimenko Lydia来自。俄罗斯。好情妇是如此巧妙地准备了一个超级厨师。多么美丽的视频。我非常尊重你的国家。你和新年的幸福。
7451,UgzKvntQVN6Pb2w001B4AaABAg,1,"i am very pleased that the world still has a lot of positive energy. li ziqi ’s sincere sincere sharing has been the result and appreciation of the point of the world, and let the world undertame china 
i am very pleased that the world is still more positive. li ziyi sincerely shared the respect and appreciation of the people of the world, so that the world can understand the chinese cricket. you can only do it with history, you can only do it eastwardly)","I am very pleased that the world still has a lot of positive energy. Li Ziqi’s sincere sharing has won the respect and appreciation of the people of the world, and let the world understand China 
很欣慰世界还是正能量多，李子柒真诚的分享赢得世界人民的尊重和欣赏，让世界了解中国"
2833,UgwpOC_PbiZm7JmJEu14AaABAg,1,much respect to a person who knows the meaning of life is in the family and friends in your life not money not gold or silver but love,非常尊重一个知道生命意义的人在您一生中的家人和朋友而不是金钱或银色，而是爱
20340,Ugxt_RmYZFtGzBpyJGN4AaABAg,1,"when i feel bad at heart, i see how this girl is working, bewitching picture !!! it seems you get into paradise! respect and respect to the girl. what's the secret? like no scenery, special effects, nanotechnology, hollywood stars?",当我对自己的灵魂感到难过时，我看到这个女孩是如何工作的，迷惑了图片！！！看来您进入天堂！尊重和尊重女孩。什么是秘密？就像没有风景，特殊效果，纳米技术，好莱坞明星吗？
