,cid,votes,含respect,含respect中文翻译
32469,UgyIxvPyiC8eDoOzRfB4AaABAg,2300,this woman knows everything. huge respect for keeping nature close at hand. you are a beautiful being ๐’•,这个女人知道一切。对保持大自然的巨大尊重。你是一个美丽的人
32048,UgwlrcsnlxBK_XQhCXd4AaABAg,920,"i honestly love, how she treats her grandma with so much respect and how she does everything for her grandma. plus this video is so calming",我老实说，她如何以如此尊重的方式对待祖母，以及她如何为祖母做一切。加上这个视频是如此平静
16164,Ugz2Gjpul13TiuoJj9F4AaABAg,483,the fact that she makes so much money off of these videos but still decides to live this life style. respect.,她从这些视频中赚了很多钱，但仍然决定过这种生活方式。尊重。
17462,UgwjwUJ64AMEJt0Mruh4AaABAg,203,"see how they treat their parents ,grand parents...they respect them most.....what a beautiful country.....what a beautiful life........i love china 
i wish i would be a chinese guy .....love you guys ,.love your country, truly from the bottom of my heart....thank you","看看他们如何对待父母，祖父母...他们最尊重他们.....多么美丽的国家.....多么美好的生活........我爱中国
我希望我会成为一个中国人.....爱你们，爱你的国家，真的是我心底的。"
14198,Ugwshm7LLdVtz0RqS854AaABAg,91,beautiful..talented..respectful to her elders knows how to do everything..if the apocalypse ever happens i’m looking for her!,美丽的..致命..对她的长者的尊重知道如何做一切。
26746,Ugz5I2wyIkuo-1ZlD_N4AaABAg,73,"her grandmother, didn't disappoint her, bless up, much respect from ghana ๐ฌ๐ญ๐ฌ๐ญ๐ฌ๐ญ๐ฌ๐ญ๐ฌ๐ญ๐’๐’๐’",她的祖母，没有让她失望，祝福，加纳很尊重
27811,Ugw9caR8LBdIHDxANAJ4AaABAg,64,"i have insurmountable respect and admiration for this woman. not just from what i see in the videos, but the fact she's bringing back to new life an archaic way of doing things. because of her i've learned a lot about culture, process and reaction. also because of her, i've gained several new skills.",我对这个女人有无法克服的尊重和钦佩。不仅是从我在视频中看到的内容，而且她将新生活带回了新生活，这是一种古老的做事方式。由于她，我学到了很多关于文化，过程和反应的知识。另外，由于她，我获得了几种新技能。
52032,Ugzdk1HPTpfp3h7txhl4AaABAg,47,"know what i like most about her style of living? the only plastic products i see are her toothbrush and the bags. everyone is bitching and moaning how much plastic is polluting our environment, yet not a damn thing is done; except, this girl is living with minimal plastic. she got my utmost respect and love.",知道我最喜欢她的生活方式吗？我看到的唯一塑料产品是她的牙刷和袋子。每个人都在bit子和抱怨塑料多少污染我们的环境，但没有该死的事情。除此之外，这个女孩的塑料最小。她得到了我的最大尊重和爱。
34589,UgwsmwvcLDkPPQyKcIB4AaABAg.8uzOrtFqjkV8vDlfZ2ha6O,43,"shes so respectful tho, covering her grandma's ears instead of her own",她是如此的尊重，遮住了奶奶的耳朵，而不是自己
50636,UgxL-kG-pFDEm8qdyyt4AaABAg,39,"thanks to all videos that i have learned to live in different ways, understand nature, love it, respect it, and enjoy my silence moment. may the universe full of your blessings.
i am a work from bolivia -south america. i hope to share some photos of my place where i live with you.","感谢所有我学会以不同方式生活的视频，要了解自然，去爱它，尊重它，享受我的沉默时刻。愿宇宙充满你的祝福。 
我是来自玻利维亚 - 南美洲的作品，我希望与大家分享一些我住的地方的照片。"
33024,Ugz-dH10ndqLwWDFAtp4AaABAg,38,another example of asians knowing the secrets of life ๐๐ #respect,亚洲人知道生活的秘密
27224,UgwoBK95SLTCe-m60uJ4AaABAg.8zKMCb-XwpB8zvAelFBZOU,28,"during the hardest time in city, she even slept on street benches. what a hard life for a young girl! she deserves what she gets today! god bless her! bless all the people who are striving all their best to live in the hardest mode of life! big respect!",在城市最艰难的时期，她甚至睡在街头长凳上。对于一个年轻的女孩来说，这真是艰难的生活！她应该得到今天得到的！上帝保佑她！祝福所有尽力生活在最艰难的生活方式的人们！大尊重！
38588,UgyjGNSakITNOdMDrIx4AaABAg,22,"what a wonder to live there, all my respect for this girl is incredible !! ๐๐ท๐ท๐๐๐๐‘๐‘๐‘",住在那儿真是一个奇迹，我对这个女孩的所有尊重都是不可思议的！
35038,UgyoQ22FTE7CBFzC4qx4AaABAg.8ukF8x1n6m-8vFbEcqFkqA,22,"@gf6368 ? are u nuts. islam gives a women her full due respect. to be treated with respect and not as objects to desire and for men to ogle over. i, being a muslim allhumdolilla, am educated, a professional and a mother. islam never stopped me. i was supported by my father, brother and husband. however, you can get shitty men all over the world, be them with or without faith.",@gf6368？你疯了。伊斯兰教给妇女充分尊重。被尊重而不是作为欲望的对象和男人的对象。我是一个穆斯林allhumdolilla，受过教育，专业和母亲。伊斯兰从未阻止我。我得到了父亲，兄弟和丈夫的支持。但是，您可以在世界各地吸引卑鄙的人，无论有没有信仰，都可以成为他们。
49195,Ugx4vpZfBebd0lxVf5t4AaABAg,13,i love to see in you that will and energy with which you do things ... i love to see that respect for ancient things and how you fuse with current things ... i think everyone should rescue those comtumbres like you do them ... i love your videos!,我喜欢在你里面看到你做事的意志和精力……我喜欢看到对古老事物的尊重以及你如何与当前的事物融合在一起...我认为每个人都应该像您一样拯救那些像您一样的笨蛋。 。我喜欢你的视频！
22907,Ugy4QKtD9cbzrOoUVFd4AaABAg.92dymxS8pg192qr9YR6Bgs,12,"โ€ @wyattjia3202 not all the chinese eat dogs, but we should respect their personal choice, this is freedom social. don't press all the people has to be like you. you also eat the sheep, right?",@wyattjia3202并不是所有的中国吃狗，但我们应该尊重他们的个人选择，这是自由的社交。不要按所有的人必须像你一样。你也吃羊，对吗？
22909,Ugy4QKtD9cbzrOoUVFd4AaABAg.92dymxS8pg192qv0EXQQqC,12,"@wyattjia3202 in china, there is a sentence: if you wanna someone to respect you, you have to respect someone firstly.
so that, you should respect people's choices, if not, what is your difference from the autocrat? or, are you agree with all the nonvegetarian to press you to eat meat as what you want the human to be a vegan?","@wyattjia3202在中国有一个句子：如果您想尊重您，则必须先尊重某人。
因此，您应该尊重人们的选择，如果没有，您与独裁者有什么区别？或者，您是否同意所有非素食主义者将您作为您希望人类成为素食主义者的肉类吃肉的人？"
35040,UgyoQ22FTE7CBFzC4qx4AaABAg.8ukF8x1n6m-8vFmr4U8H7N,10,"all i know is i've been depressed all day long and i don't know why. i think too much. and then this video comes across and it has been popping up for a couple of weeks and i hadnt watched it... but today i did. i just observed and soaked in all the beauty of it....and it really just helped me to change my perspective. there's a lot we can learn from her videos. simplicity and beauty. also notice her priorities and how much it piece she is at. there is so much respect for the family and the animals, nature and all the bounty of the earth we can take whatever we want from this without over-thinking it.",我所知道的是，我整天都感到沮丧，我不知道为什么。我多虑了。然后播放了这个视频，它已经弹出了几个星期，但我没有看过...但是今天我做到了。我只是观察到了所有的美丽。...这确实帮助我改变了自己的观点。我们可以从她的视频中学到很多东西。简单和美丽。还要注意她的优先事项以及她的优先次数。人们对家庭和动物，自然以及地球上的所有赏金都有非常尊重，我们可以从中汲取一切，而无需过度思考。
28151,UgxV6wwjOWPppmiiUF54AaABAg.8ylbPgnyalM8zGQ-N5ibE5,9,china has a rich a beautiful culture which is evident in the many exquisite chinese dishes. i think chinese food is the most flavorful and unique experiences i've had. definitely have a lot of respect for chinese culture.,中国拥有丰富的美丽文化，在许多精美的中国菜肴中都很明显。我认为中国菜是我拥有的最美味和独特的体验。绝对对中国文化有很多尊重。
13715,Ugy86UOIMSstMsKOLNZ4AaABAg,8,"i love watching her cook. you can see when she is handling the food she puts love into it. also the clothes that is makes are inspiring. one of her greatest qualities is the respect and love that she shows her family , all of them. they must be very proud of her i know i would be",我喜欢看她做饭。您可以看到她何时要处理自己的爱。而且，制造的衣服也令人鼓舞。她最大的品质之一是她向家人展示的尊重和爱。他们一定为她感到骄傲，我知道我会
27243,UgwoBK95SLTCe-m60uJ4AaABAg.8zKMCb-XwpB9-42miArLcP,8,"this is from an media interview of her. i read the original interview transcript. unless we think that what she said during the interview was fake, she did deserve a better life and all the respect. i chose to believe her because i have done some of the things shown in her videos while i was young. i could tell that the way she did those jobs is natural and experienced, definitely not fake posing for filming. best wish to this talented, independent and beautiful girl",这是来自她的媒体采访。我读了原始的面试成绩单。除非我们认为她在采访中所说的是假的，否则她确实应该得到更好的生活和所有的尊重。我之所以相信她，是因为我年轻的时候做了她视频中显示的一些事情。我可以说她做这些工作是自然而有经验的方式，绝对不是假装拍摄的假装。祝这个才华横溢，独立和美丽的女孩
43359,UgyLOp9qjWnbL9lQVJZ4AaABAg,8,"such peacefulness, calmness, beauty-roanic corner. thank you, you showed us your world, especially i felt the warmth of your soul and how you respect your elderly relatives, so sweetly.",这样的宁静，平静，美人的角落。谢谢您，您向我们展示了您的世界，尤其是我的灵魂的温暖以及您如何尊重您的老年亲戚。
51794,UgwcXgy5_5V0z9yowoR4AaABAg,8,"you are awesome, wish i had a friend like you.
my respect from vietnam.","你很棒，希望我有一个像你这样的朋友。
我对越南的尊重。"
46647,UgznRayRv0aCLiZInI54AaABAg,7,"those who compare li ziqi and little brother in western yunnan (https://www.youtube.com/chaannel/ucqg_fzadcunbtv1kwjkfaqq/videos?dis? pyright? you must be kidding!
those who compare li ziyi and the little brother in western yunnan are fools. what do they say? copyright blablabla, you must be joking!
these beautiful, smart and hard-working ladies are not competing. they are just directly doing some love, and sharing the beaouth and lovely lighting u. s.
these two smart women are not competing. they are just doing what they like, meaningful things, and then share the beauty of nature and life with us.
we are gathered on the channels because we lovephul nature and wonderful food. some people alway them and say some disgusting words. my opinion is that hard-working peoples are resied everywhere, and those who do nothing and talking bad are the most annoying. (my english is not very good)
we gather on these channels because we love beautiful nature and wonderful food culture. some people always use them to compare them and speak some disgusted words. my point is that the hard -working workers are respected no matter where they are, and those who do nothing to do anything are the most annoying.","Those who compare Li ZiQi and 滇西小哥 (https://www.youtube.com/channel/UCQG_fzADCunBTV1KwjkfAQQ/videos?disable_polymer=1) are fools, copycat? copyright? You must be kidding！
那些把李子柒和滇西小哥进行比较的人都是傻瓜，还说什么模仿者，版权blablabla，你一定是在开玩笑！
These beautiful，smart and hard-working ladies are not competing. They are just doing something they love, and sharing the beauty of nature and lovely lifestyle with us.
这两位聪明能干的女性不是在搞竞争，她们都只是在用心地做着自己喜欢的，有意义的事情，然后和我们一起分享自然与生活的美好。
We are gathered on these channels because we love beautiful nature and Wonderful food culture。Some people always compare them and say some disgusting words. My opinion is that Hard-working peoples are respected everywhere, and those who do nothing and talking bad are the most annoying.（My English is not very good）
我们聚集在这些频道是因为我们爱美丽的自然和美妙的饮食文化，有些人总要把她们拿来比较并说一些让人反感的话语。我的观点是，辛勤劳动者无论在哪里都受人尊敬，无所事事还口吐恶言的人是最让人讨厌的。"
32105,UgxrynY7_Tx2sWQGmDh4AaABAg,7,"iโ€ve watch about 10 of her videos... what can she not do? amazing woman, respect.",我看了大约10个视频...她不能做什么？惊人的女人，尊重。
33867,UgxQ4obKp7Mzrv-Mbi54AaABAg.8vAAkm2tSd492acFTRhwh3,6,"justicefornichole 

i am a 66 year old chinese guy living now in california. i have done a lot of things li ziqi has been showing here when we were forced to go to rural areas during the cultural revolution between 1966 to 1976. 

only difference is that li ziqi does things so much better than us at similar age. 

i am deeply touched, inspired, and most importantly, i am quite motivated, realizing i could learn tremendously from a girl much younger than my child.

ziqi suffered so much in her life earlier and started this all by herself alone, in the beginning. 

and of course she has a team now and no longer working alone . she literally earned everything and deserves it. 

the great majority of the people here are showing respect, admiration and love. 

let us just be nice and kind to one another.","JusticeFornichole

我是一个66岁的中国人，现在住在加利福尼亚。当我们在1966年至1976年之间被迫去农村地区时，我做了很多李齐（Li Ziqi）在这里展出的事情。

唯一的区别是，李齐（Li Ziqi）在类似年龄的情况下做的事情比我们要好得多。

我深深地感动，受到启发，最重要的是，我很有动力，意识到我可以从一个比孩子年轻得多的女孩那里学到很多东西。

Ziqi在她的生活中遭受了很大的痛苦，一开始就独自一人开始。

当然，她现在有一个团队，并且不再独自工作。她从字面上赢得了一切并应得的。

这里的绝大多数人都表现出尊重，钦佩和爱。

让我们变得友善，彼此友善。"
9576,UgzNn8VaZkxE7dJka7R4AaABAg.9H4s9lfme1m9I5vpAJ1XzR,6,"@zeflute4586 when gordon travels he always shows respect for other cultures, that brash attitude is mainly for the us market because that's what sells in the states the shock factor.",@zeflute4586当戈登（Gordon）旅行时，他总是表现出对其他文化的尊重时，野蛮的态度主要针对美国市场，因为这是在州出售的震惊因素。
37457,UgzsUvG2PmI0e-okvcl4AaABAg,6,"it's real filial piety from chinese confucian principle, respect it.",这是中国儒家原则的真正孝顺，尊重它。
51234,UgwjZ1JkNulZFHS2BTd4AaABAg,5,"on earth, a person cannot be more perfect than life and activity in it !!!! a glorious girl, there is no limit to the knowledge of a person, if you really want it, to comprehend tirelessly !!! with a deep sense of respect and gratitude with chechnya.",在地球上，一个人不能比其中的生活和活动更完美！！！！一个光荣的女孩，如果您真的想要一个人的知识没有限制，那么不懈地理解！！！对车臣有深切的尊重和感激之情。
17617,UgzNv4azBWM4KY1hR414AaABAg.97m90yxmeTh983zUWghqzH,5,"heardistance i feel that i am talking about cows and pysteria and ducks. i feel that you don't understand what is the time of the years that many young people are yearning for many young people in china. you even lack some basic respect and education of foreign culture. what do you want to show here and what people want to show here to share the idyllic life. you talk to me here about me, japan and south korea ... does it have anything to do with me? is it related to this video?",heardistance 我感觉我在对牛谈琴 鸡同鸭讲 我感觉你根本就不懂什么叫意境 中国很多年轻人向往的岁月静好 你甚至缺乏一些基本的对外来文化的尊重和教养 还有这个姑娘在这里想表现什么和你想在这里表现什么 人家分享田园生活 你在这里跟我谈美国日本韩国...跟我有关系吗？跟这个视频有关系吗？
7566,UgxQOPLmIyi3IGy2-Fx4AaABAg,5,"a very beautiful and caring video... having the greatest respect for seniors within the family! talented beyond comparison to the west. unbelievable insight, and a deep empathy one can only vision in the east! 
i couldn't wait to subscribe to an artist able to see beyond today! 
i was blessed with my wife similar to her but, now senior... may she continue her life's dream!","一个非常美丽和关怀的视频...对家庭中的老年人表示最大的尊重！与西方相比，有才华。令人难以置信的见识，深刻的同理心只能在东方视而不见！
我迫不及待地想订阅一位能够看到今天以外的艺术家！
我很幸运，我的妻子与她相似，但是现在，大四...愿她继续生活的梦想！"
5766,UgxoCczcZ1pmul3vujF4AaABAg,5,"you are such an amazing young woman. i loved watching your videos. they are so inspiring. i just have so much respect for what you do, how you live and for the love you have and show your grandmother. i would love to spend time there. it's so beautiful. blessings to you and your family.",你真是个了不起的年轻女人。我喜欢看你的视频。他们是如此鼓舞人心。我只是对您的工作，生活方式和爱的爱以及向祖母展示的尊重。我很想在那里度过时光。这个很漂亮。祝福您和您的家人。
38937,UgyEv8IhzxnS3WaSH3x4AaABAg,5,"she is such a strong and inspiring woman..........
my respect for her is over the top now","她是一个坚强而鼓舞人心的女人..........
我对她的尊重现在已经超过了"
43564,UgyupX55LjEryDV29sx4AaABAg,4,1st time i watch your 2 vedio but both account are fake i think this one is real? i subscribe your channel love and respect from pakistan,我第一次看您的2个vedio，但两个帐户都是假的，我认为这是真实的？我从巴基斯坦订阅您的频道爱和尊重
37948,UgzDRgeKg_1veALBok14AaABAg,4,respect from saudi arabia ๐ธ๐ฆ โค๏ธ,尊重沙特阿拉伯
36120,UgwW3M4OGiY8vVG8u3x4AaABAg,4,"what a pretty woman .... what a beautiful place .... my admiration and respect.
i would like such a wife for me. blessings","多么漂亮的女人....真是一个美丽的地方。...我的钦佩和尊重。
我想要这样的妻子。祝福"
31276,UgysmF-NSAD-BAMa1dt4AaABAg,4,"*i donโ€t know why but 5:26 - the whole sequence with โ€โ€uncleโ€โ€ (iโ€m not sure itโ€s biological uncle since itโ€s common to refer to adults (weโ€re close to) -round our parentsโ€ age as โ€unclesโ€ or โ€auntsโ€ out of respect. 

the whole sequence just feels cute and magical - something so simple like gathering round to pop popcorn can be so warm and exciting. it really makes you feel that how you live your life and how you interact with the world and people can really influence the joy and happiness you can get from it.*","*我不知道为什么只有5:26-与'叔叔'的整个顺序（我不确定这是生物叔叔作为“叔叔”或“阿姨”出于尊重。

整个序列感觉很可爱和神奇 - 如此简单的事情，例如聚集到爆米花爆米花可能是如此热情和令人兴奋。这确实使您感到自己的生活以及与世界的互动方式，人们可以真正影响您可以从中获得的快乐和幸福。"
39606,UgwThFmMPsiP5y6QjsF4AaABAg,4,"as an american who is proud of his home, i say with all due respect, your home is gorgeous. to have access to all the fruit and nature. you are very lucky.",作为一个为自己的家而感到自豪的美国人，我以应有的尊重说，您的家很漂亮。能够获得所有的水果和自然。你很幸运。
12675,UgwT1gDAxj3u5Py3Xn14AaABAg.9Cu4gC8q40r9EHTIp9uRIe,4,even tho i watch chinese drama i don't like china because they don't respect the muslims.,即使是我看中国戏剧，我也不喜欢中国，因为他们不尊重穆斯林。
17426,Ugw5Ba080mqK5-1G4e54AaABAg,4,"this beautiful young woman is incredible in addition to being beautiful is a woman who makes everything very good.
the truth would be the ideal woman for any good man to value and respect her.
what a great admiration i feel for her.
i send you blessings","这个美丽的年轻女子除了美丽之外，还令人难以置信，这是一个使一切都很好的女人。
事实将是任何好男人重视和尊重她的理想女人。
我对她的钦佩真是太钦佩了。
我给你祝福"
32058,UgwlrcsnlxBK_XQhCXd4AaABAg.8vztA6WkhKN8wX4qAJLKQL,3,ms.joon guy mane at this point iโ€m not even surprised i found an army in the comments. but agreed she treats her grandma with so much respect it makes me smile.,此时，乔恩·盖伊·曼恩（Joon Guy Mane）女士什至不感到惊讶，我在评论中找到了一支军队。但是同意她对奶奶非常尊重，这让我微笑。
6054,UgxbTHAT3WGqmCFZm9R4AaABAg,3,my respect for this woman is an example to follow,我对这个女人的尊重就是跟随
6872,UgyreNtMVZQeXrquvRZ4AaABAg.9Kum6K17yQD9LD54kk46Zh,3,"@crabvakho please say with evidences instead of making assumptions. why is it so hard for you to show so,e respect and appreciate her work? it’s not that hard....",@crabvakho请用证据而不是做出假设。为什么您这么困难地表现出来，尊重和欣赏她的工作？并不难...
5129,Ugw9zY_rn7gqC-jQ-e94AaABAg,3,"thank you very much to the author for these films! amazing !!! .. all !!! what a beautiful girl, and what a clever man-master !!! i am delighted !!! .. i subscribe and watch all your films ... i get great pleasure from views and, of course, i discovered a lot for myself, spied on .. and this girl of happiness, a good husband and children ... my respect ...",非常感谢作者的这些电影！太棒了！！！！！电影...我从景色中得到了极大的荣幸，当然，我为自己发现了很多，窥视了。
