,cid,votes,time,含real,含real中文翻译
51713,UgxYasu9FDqzWgUHqsl4AaABAg.8qlSxysCabu8qldZ_Rk85a,2,4 years ago (edited),"@d3x5t4r you really are delusional. do some research yourself from accredited historians and not some vietnamese conspiracy websites. i've seen those vietnamese articles try to assert that the vietnamese are still ""pure blooded"" (no such thing exists with any people) and not culturally influenced by china at all. there is always pseudo historical nonsense among the ultranationalists. it's a pity too because there are plenty of nice vietnamese people in the comments of this video who aren't like you. it was impossible for the ancient chinese to eat corn because corn was domesticated in mexico. corn only spread to asia after european colonization of the americas. rice was domesticated in the pearl river delta but those people were not vietnamese or even biayue as they were a prehistoric people that had left the area before the chinese - or any civilization for that matter - had formed. but yeah, keep reading your kooky stories. how about you tell me one about sumerian spaceships next?",@d3x5t4r你真的很妄想。从认可的历史学家而不是一些越南阴谋网站中进行一些研究。我已经看到那些越南文章试图断言越南人仍然是“纯净的血液”（没有任何人存在这样的东西），而不是在文化上受到中国的影响。超民族主义者中总是有伪历史废话。这也是可惜的，因为在这段视频的评论中，有很多不错的越南人不喜欢您。古代中国人不可能吃玉米，因为玉米在墨西哥被驯化。玉米仅在美洲欧洲殖民之后传播到亚洲。赖斯在珍珠河三角洲被驯化，但这些人不是越南人甚至比亚耶，因为他们是一个史前的人，他们已经在中国人（或任何有关此事的文明）之前离开了该地区。但是，是的，继续阅读您的怪异故事。接下来，您告诉我一个关于苏美尔飞船的信息？
48392,UgzWRYXgVqoDqwQ1CSx4AaABAg,2,4 years ago,"matep ..
i am chinese descent but not all of them i understand. this is miss again preparation for welcoming the chinese new year. the tradition of making cakes and snacks ahead of the chinese new year is super busy. yep ... all the culture of other parts of the world will also be busy if it is approaching or welcoming the day of the celebration according to their respective traditions.
specifically in this video, traditions and recipes are indeed innate from our ancestors. but of course not all we can make in my beloved indonesia, because not all the materials used in our ancestors are in the land of indonesia. so we replace it with local materials. and it turns out it doesn't feel like it is worse. and more importantly is the essence that is ...
in our country indonesia even has more variety of traditions and culture, our land also produces extraordinary variety of agricultural products. we can be proud as asian nations and of course especially indonesia.
i admit that miss li is very extraordinary to show the world how beautiful the country, tradition, culture, etc.
i really hope there is a figure like miss li in indonesia, so that the world will see the way we make rendang, chicken opor, bamboo lemang, etc. .. certainly will make the world amazed.
greetings from pekanbaru.","matep ..
我是中国血统，但我了解的不是所有人。这再次是为欢迎农历新年的准备。在农历新年之前制作蛋糕和小吃的传统非常忙。是的...如果根据各自的传统接近或欢迎庆祝活动的那一天，世界其他地区的所有文化也将很忙。
特别是在此视频中，传统和食谱确实是我们祖先的天生。但是，当然，我们在我心爱的印度尼西亚并不是所有的东西，因为并非祖先中使用的所有材料都在印度尼西亚之地。因此，我们用当地材料代替它。事实证明，它并没有更糟。更重要的是...的本质是...
在我国，印度尼西亚甚至拥有更多种类的传统和文化，我们的土地也生产出非凡的农产品。我们可以为亚洲国家，尤其是印度尼西亚而感到自豪。
我承认，李小姐非常非同寻常，向世界展示国家，传统，文化等多么美丽。
我真的希望有一个像印度尼西亚的李小姐这样的人物，这样世界将看到我们制作鸡，鸡肉，竹子莱蒙等的方式。肯定会让世界惊讶。
佩坎巴鲁的问候。"
50257,UgwXL013Kmzm4OHjGMl4AaABAg,2,4 years ago,"i really want to spend the new year with you, it looks very rich",真想和你一起过年，看起来就非常的丰饶
50312,UgzVpKBvVpoGVwsuxOJ4AaABAg,2,4 years ago,your vidio is really well made,你的vidio真的做得很好
8744,UgzHptbh2LhJeCMzfJB4AaABAg.9IJ-gJwii_j9JcNz22zE0c,2,2 years ago,@jayphilippewu3371 this is so true & the reality... my parents were born and raised in their early childhood in the province and somehow privileged to experience the city life compared to their neighbors & friends. they told me that ways and life in provinces is truly harder and hard work. it is only convenient & pleasant to the people who have the means...,@jayphilippewu3371这是如此真实和现实……我的父母在该省的童年时期出生和长大，与邻居和朋友相比，有特权体验城市生活。他们告诉我，各省的方式和生活确实更加艰苦，辛勤工作。对于有能力的人来说，这只是方便而愉快的...
871,UgzUbBhuVy5emo55GfN4AaABAg,2,6 months ago,we miss your new videos. can you again start giving videos? your content are really worthy of appreciation. respect you for being soo hard working. such a talented soul i have ever came across in my life. words are not enough to praise your talents and creativity.,我们想念您的新视频。您可以再次开始给视频吗？您的内容真的值得赞赏。尊重您的努力工作。我一生中遇到过的一个才华横溢的灵魂。言语不足以赞美您的才能和创造力。
48308,UgzuMcehyeQzM47vS094AaABAg,2,4 years ago,"her grandma hat is so cute! respect for you, really a hard worker! love your videos!",她奶奶的帽子真可爱！尊重您，真的是一个勤奋的人！爱你的视频！
5667,UgzuMXRkJq3I41oX24t4AaABAg,2,2 years ago,is this all real? everything is so picture-perfect it almost seems unbelievable or a disney set in epcot. :),这是真的吗？一切都如此完美，几乎令人难以置信，或者是Epcot中的迪士尼。 :)
3319,UgzI10ctyjj6zRsGg9N4AaABAg,2,1 year ago,i really love this environment ❤️,我真的很喜欢这个环境❤️
51696,Ugxm7AIyAlDIspbsXu14AaABAg,2,4 years ago (edited),"thank you so much wonderful as always ,i will like it to have the chance to buy this products ,or to live 2 mouth with this quality of life,really congratulations!!",非常感谢您一如既往的美好，我希望它有机会购买这些产品，或者以这种生活质量生活2口，真的恭喜！
49193,UgzZ9oyj8LQwJQxAtGl4AaABAg,2,4 years ago,i really admire you you make wonderful videos colors incredibly you are very good thumbs up of greek,我真的很佩服您，您制作了精美的视频颜色，您非常拇指希腊
5867,UgyUHVC0rtxBPaf64TV4AaABAg,2,2 years ago,"dearest liziqi......really do enjoyed your u tube videos ....the recipes look so yummy, please is there any chance to translated the information from chinese into english-language, greatly appreciated your kindness....",亲爱的liziqi ......真的很喜欢您的U管视频。...食谱看起来很美味，请有机会将信息从中文翻译成英语，非常感谢您的好意。
28274,Ugxu6DcrUFybn_5UOJx4AaABAg,1,3 years ago,really good snacks,真的很好小吃
8652,Ugz5KJXi-6gzqCre9o54AaABAg.9IN2dP1wq3C9IRtJGigeWr,1,2 years ago,"the chinese and the koreans are really relatives, and the cyber hooligans are so similar. i believe most korean people are rational. and shame on you.",中国人和韩国人确实是亲戚，网络流氓是如此相似。我相信大多数韩国人都是理性的。对你感到羞耻。
40986,UgxftfaH-8UOcp_g4Ep4AaABAg,1,4 years ago (edited),"really precious ... beautiful work, beatiful people .... xoxo",真的很珍贵...美丽的工作，美丽的人....xoxo
28124,Ugx5zLcGq86pVB-Gz5l4AaABAg,1,3 years ago,"dats some different video on youtube ever, really appreciated ๐’•๐’•๐’•",DATS在YouTube上有些不同的视频，非常感谢
28097,UgwhO_ffdmxV8NHEbbR4AaABAg,1,3 years ago,i really admire her..๐๐๐,我真的很佩服她..
20568,UgxGrgRlrG1zo8LhNg14AaABAg,1,3 years ago,i'm really lost of words it's just amazing i will try my best to live like her because i want to,我真的失去了话，这真是太神奇了，我会尽力像她一样生活，因为我想
28260,Ugwt1qoixuCtXdMpWlp4AaABAg,1,3 years ago,she's really amazing ๐๐,她真的很棒
28204,UgwHynK4MN9bzRO1CRl4AaABAg,1,3 years ago,the real harvestmoon,真正的收获月
35531,UgwTLlE8U_kZgYsDvkl4AaABAg,1,4 years ago (edited),i am from india. real this girl is a super girl. i want to marry you. you will marry me .i will keep you very happy.,我来自印度。这个女孩是一个超级女孩。我想和你结婚。你会嫁给我。我会让你感到非常高兴。
20377,UgxJUsF-0I-P3PqnvsV4AaABAg,1,3 years ago,"d way she does each n everything, shows how much passion and patience she has:)cinderella in real --------lizqi:)",d她每次做所有事情，都表明了她拥有的热情和耐心：）真实的灰姑娘-----------------------------------------------------------------------------------
41087,Ugz2_p2KYvCYG_FRXYN4AaABAg,1,4 years ago,everything is great here so that work is really fun ❤,这里的一切都很棒，所以工作真的很有趣❤
20533,UgwR9egSk9R8F_toDxR4AaABAg,1,3 years ago,"damn this really feels like the time when i was still living in a province with my grandmother. we pretty much lived in a mountain and we also do have different types of fruits and vegetables. in fruits we have mangoes, bananas, star apple, star fruit, cashew, rambutan, guavas, jackfruits, soursop, avocado, java plum, grapefruit (pomelo), cocoa (to those who might not know, the seeds is what the chocolate is. it tastes sweet and sour but i guess it depends on the type of cacao fruit since there's this orange(?), light violet(? don't know what the color was called) and green ones tho they all became yellow when ripe. and many more i can't type it all here since probably no one's gonna read this. but if you want to know more about my childhood i can tell you more about it just ask request in the reply sections. btw i'm 20 now and im not living in my grandmother anymore but there's a lot of good memories i could share๐",该死的感觉真的像是我仍然和祖母一起住在一个省的时候。我们几乎生活在山上，我们也有不同类型的水果和蔬菜。在水果中，我们有芒果，香蕉，星苹果，星级，腰果，腰果，番茄，千斤顶，豆腐，酸味，鳄梨，鳄梨，爪哇李子，葡萄柚（Pomelo），可可（Pomelo），可可。它的味道甜而酸，但我想这取决于可可果的类型，因为有这种橙色（？），轻紫罗兰色（？不知道该颜色叫什么），而绿色的果实变成了黄色，当成熟时它们都变成黄色。还有更多我不能在这里键入所有内容，因为可能没有人会读这篇文章。但是，如果您想了解更多有关我的童年的信息，我可以告诉您更多有关它的信息。我不再住在祖母里，但是我可以分享很多美好的回忆
35623,Ugxq5AogYh16tQtSC-x4AaABAg.8ubk02XO75B8umk62ia4Y9,1,4 years ago,"it is really awesome. such a rural life is very attractive. hey, this is a bit like the japanese movie in japan, spring, summer, autumn and winter, but there is no explanation. you can produce movies.",确实很牛逼，这样的田园生活很吸引老外，哎，这个有点像日本的那个电影春夏秋冬，只是没有解说。可以出电影了。
35147,UgyoQ22FTE7CBFzC4qx4AaABAg.8ukF8x1n6m-92uACtyU4Mx,1,3 years ago (edited),"that's what the chinese pc wants you to think. they're trying hard to make china look good to the rest of the world. with those videos, you're tempted to believe that they somehow got things right in their country. absolutely no hard working farmer / country man looks like this in real life, it's a though job where you scratch - cut yourself - get injured every week and you most definitely have no time for make up & stuff like that... china is well aware that western people are feeling like shit because of various problems in our society and will exploit those weaknesses to their advantage. simply too good to be true this whole thing. sorry.",这就是中国电脑希望您想的。他们正在努力使中国对世界其他地区看起来不错。有了这些视频，您很想相信他们在自己的国家有些正确。绝对没有努力工作的农民 /乡村男人在现实生活中看起来像这样，这是一项工作，您从头开始 - 割伤自己 - 每周受伤，您绝对没有时间进行化妆和类似的东西...中国很好意识到，由于我们社会中的各种问题，西方人感觉就像是狗屎，并且会利用这些弱点来发挥自己的优势。太好了，无法成为整个事情。对不起。
40850,Ugw00rEJ2axgUaD46Yt4AaABAg,1,4 years ago,"if you guys like this kind of healing video, i recommend you to watch 'little forest' movie, it has korean and japan version. and i also recommend 'hyori's bed&breakfast(hyori's homestay)' it's a reality show where shot in jeju island. those two show is very calming and relaxing to watch",如果你们喜欢这种治愈视频，我建议您观看“小森林”电影，它具有韩文和日本版本。我还建议“ Hyori's Bed＆Breakfast（Hyori's Homestay）”这是一个真人秀节目，在Jeju Island拍摄。这两个节目非常平静和轻松观看
28061,UgxRCqNyAugB1eul1Np4AaABAg,1,3 years ago,"i envy ziqian's pastoral life is not only foreign friends, but i am also very envious of sichuan people like her. i also grew up in rural sichuan. she is mianyang, northeast of sichuan, and i am in southwestern sichuan. the green mountains and green water scenery are very good. although she is not as delicate and her lifestyle is not as traditional, it is naturally real. vegetables and some fruits (strawberries, apples, pears, plums ...) are really self -sufficient. essence nothing to live in my childhood life ~",羡慕子柒田园生活的不仅是各位外国朋友，和她一样同是四川人的我也非常羡慕。我也在四川农村长大，她是川东北绵阳，而我在川西南。青山绿水风景非常好，虽然吃的没有她精致，生活方式也没有她那么传统，但亲近自然是真的，蔬菜和部分水果（草莓、苹果、梨、李子...）真的能自给自足。怀恋一去不复返的童年生活了～
21693,UgwIjVPayugE7lKyjyp4AaABAg,1,3 years ago,dare to release the real rural areas?,敢把真实的农村放出来吗？
40297,UgzwZbpiIVcSeCpIiyp4AaABAg,1,4 years ago,really so beautiful.,真的很漂亮。
36229,UgxRTXDc_xsPQabRI5Z4AaABAg,1,4 years ago,this is really amazing! sheโ€s so enviable and all the things she made make me miss my hometown so much...,这真的很棒！她是如此令人羡慕，让她让我的所有事情都非常想念我的家乡...
27548,Ugwf9rN7LY_9jQ43BIF4AaABAg,1,3 years ago,a princess from the real world!,现实世界中的公主！
21450,UgzhDGpzpCSYuEn8xbB4AaABAg,1,3 years ago,"shows me how hard this life is.... soo beautiful, but really a mass of work and daily care for anything there. awesome to watch, my whole respect!",告诉我这一生有多艰难。我的尊重很棒！
21439,UgzaHFV8jvCeRHAImZx4AaABAg,1,3 years ago,i really like such a comfortable life,很喜欢这样的安逸的生活
21385,UgyfDnaFSANVHTSeeRx4AaABAg,1,3 years ago,what a beautiful life.. i really love this video so inspiring..i want to live a place like that where everything u need to have a simple yet contented life is there....,多么美好的生活..我真的很喜欢这个视频。
21374,UgxeSnMAEFWSOonTgSh4AaABAg,1,3 years ago (edited),"successful people have really worked hard, and the hardship behind it is not something that ordinary people can bear. those who ridicule you are not as good as villains, and they can't eat grapes and say grapes. i have been abroad for so many years, and i am very bitter. others say that i live well and have a good life. in fact, you know how i escape in my death. those people are only falling off the stones when you are not good. when you are good, you laughed at you",成功的人都是真的努力过的，那背后的艰辛不是一般人能承受的。那些嘲讽你黑你的人都是小人不如人，吃不到葡萄说葡萄酸。我在国外那么多年，很苦很苦，别人都说我活得好潇洒，有很好的生活，实际上你哪知道我是怎样的死里逃生。那些人只在你不好的时候落井下石，在你好的时候嘲笑你
21349,Ugy-GH1yYx1GnSZI9KZ4AaABAg,1,3 years ago,she really looks like iu,她真的看起来像IU
21296,UgysWojmq681xn7XVZx4AaABAg,1,3 years ago,oh! i really love this woman,哦！我真的爱这个女人
21284,Ugy3XCUgVit2hL0_J394AaABAg,1,3 years ago,"i really don't know what to say.

i saw almost all your movies.
when you work with a knife or a dangerous tool you always worry about hurting your hand, or when i see you doing hard work i tell myself i wish i was there and doing the hard work for you.

you are very diligent and hard working and i think you are very kind just like your grandmother.

may god bless you all the best.๐โค๐ท","我真的不知道该说些什么。

我看了几乎所有的电影。
当您使用刀子或危险工具工作时，您总是担心会伤害您的手，或者当我看到您做辛勤工作时，我告诉自己我希望我在那里并为您做艰苦的工作。

您非常勤奋和努力工作，我认为您就像您的祖母一样善良。

愿上帝保佑你们一切顺利。"
40452,UgzwBL-nrznMQkKiUIF4AaABAg,1,4 years ago,i really love your videos and i luff yu,我真的很喜欢你的视频，我会喜欢yu
27680,UgzS0thCEwODQLqMxmB4AaABAg,1,3 years ago,it will take whole day for me to cook all those items.. really she is great,我要花一整天的时间来煮所有这些物品。
27691,UgzV_xmsifTLNr08iit4AaABAg,1,3 years ago,the place where you live looks peaceful ... i really like,你住的地方看起来很宁静...我真的很喜欢
3120,UgzxDci0aA2kNIaqp7R4AaABAg,1,1 year ago,this is really so beautiful~,这真是太漂亮了〜
3109,UgxOmVcNjg5M7HVqgrZ4AaABAg.9Uj6vnQUDIe9Und7ETH_nW,1,1 year ago (edited),"perhaps because you are real (and genuine), and she is a high production fantasy. 

i hope you get more subs and views and i wish you the best.","也许是因为您是真实的（和真实的），而她是一个很高的生产幻想。

希望您能获得更多的潜艇和观点，并祝您一切顺利。"
27723,UgyAG1udVEnua8vuGl54AaABAg,1,3 years ago,"i want to, i really, i promise to work!",我真的想，我保证工作！
21138,Ugzsvbs9KqRxHBWJ_6p4AaABAg,1,3 years ago,i really love her puppies..so cute,我真的爱她的小狗..太可爱了
36096,UgxPyHYR9kQXAYuErnd4AaABAg,1,4 years ago,"the animals following her makes me sad bc thatโ€s what my kitty did and she died 2 weeks ago. i miss my kitty she was everything to me.


also is nobody going to talk about how big that mango was. again also that food she is making looks really really good.","跟随她的动物使我很伤心，这就是我的小猫所做的，她2周前去世。我想念我的小猫，她是我的一切。


也没有人会谈论芒果有多大。同样，她正在制作的食物看起来真的很好。"
27938,Ugz6WVtvdCE62hnbJ554AaABAg,1,3 years ago,this really makes u wanna get into cooking i just looks so relaxing and fun in a weird way,这真的让你想开始做饭，我看起来很放松和有趣
40653,UgxbDipI3PiU3cTBkd14AaABAg,1,4 years ago,really amazing,真的很棒
40704,UgwTKhSoH8S384SgOkl4AaABAg,1,4 years ago,awww!!.❤❤❤❤❤❤the lamb and the puppies grow so fast i really love your videos this is the best youtube video i ever see ❤❤❤,awww ！！。
27968,UgzkvQQRitAYTvSA-ZV4AaABAg,1,3 years ago,"really like the content ..
so miss the village
&te","真的很喜欢内容。
所以想念村庄
＆te"
20914,UgxbKRpBovS4jA6rNqJ4AaABAg.946AnDac2eu95Az35X9lJp,1,3 years ago (edited),"i hate living in the cities. both my parents grew up on the countryside and got to grown their own food. i'm tired of this fake, ultra-processed food and the constant noise and pollution (light pollution too). from the summers i spent in my grandmother's village, life was so simple and calm. we got to eat real food and spend time in nature. i wish i could move out to the countryside. i want to have my own garden and maybe some chickens. i'm too young and don't have much money now, but one day in the future i will. i've noticed many people my age wanting to reconnect with nature again. i hope this becomes a revolution for our generation",我讨厌住在城市。我的父母都在乡村长大，并自己种植了自己的食物。我厌倦了这种假的，超级加工的食物以及持续的噪音和污染（也是光污染）。从我在祖母的村庄度过的夏天，生活是如此简单和平静。我们必须吃真正的食物，并花时间在大自然中。我希望我可以搬到乡村。我想拥有自己的花园，也许还有一些鸡。我太年轻，现在没有太多钱，但是将来有一天我会。我注意到许多我这个年龄的人都想再次与自然重新建立联系。我希望这成为我们这一代的革命
35797,UgxUfVXdt_fiu0NPCbR4AaABAg,1,4 years ago,you really are amazing! i wish we had such festivals where iโ€m from,你真的很棒！我希望我们有这样的节日
20784,Ugzry8SB6CAl6cZkTvF4AaABAg,1,3 years ago,oh man this is the real harvest moon,哦，这是真正的收获月亮
20765,UgyYLX0_BnfaJtuqiTp4AaABAg,1,3 years ago,"i really like you, liziqi๐‘๐‘๐‘ฑ๐ปโ€โ€๏ธ",我真的很喜欢你，liziqi
20922,UgwOdtB-p7cee_-WUZN4AaABAg,1,3 years ago,"so rural life is really fascinating, more advanced than those of those tribal life.",如此田园生活确实令人神往，比那些部落类生活的视频高级多了
20118,Ugxy3pSHtyMA25o5Kep4AaABAg,1,3 years ago,i dont know u but i really love u god bless u,我不认识你，但我真的爱你上帝保佑你
28313,UgwsZoEIpqeSBC1zOyR4AaABAg,1,3 years ago,wow ... it's really good to use digimon bgeum like this,哇...使用Digimon Bgeum真的很好
35117,UgyoQ22FTE7CBFzC4qx4AaABAg.8ukF8x1n6m-8zsDD0TmP38,1,3 years ago,im pretty sure its a team effort by all the people involved in these videos. theres propably a film crew in this aswell. no human can do all of this on their own. she has some really supportive people with her. if i started taking videos in so many angles of myself people would think im full of myself or its too much effort so nope. not possible.,我很确定所有参与这些视频的人的团队努力。在这个同上，还有一个电影摄制组。没有人可以自己做所有这一切。她和她有一些非常支持的人。如果我开始以如此多的角度拍摄视频，那么人们会认为我充满了自己或太多的努力，所以不要。不可能。
29004,Ugy43wXUL6l4DXkd4gR4AaABAg,1,3 years ago,"i love watching your videos nd she rocks ,gorgeous,nd the way she handles everything ...like right from home to cooking nd garden are really amazing...",我喜欢看你的视频nd她摇滚，华丽，她的处理方式……就像从家到烹饪nd花园一样，真是太神奇了...
19465,Ugw-_VWea6iW3r_Jpp54AaABAg,1,3 years ago,"well done, you are a real talent !!! beautiful and you can do everything",做得好，你是一个真正的才华！！！美丽，你可以做一切
2616,Ugx9nf5BfEEXdBFr-Td4AaABAg,1,1 year ago,"i really like her, she is trying to do a good job for her family.",我真的很喜欢她，她正在努力为她的家庭做好工作 例子起
9864,UgxxSB5ZcheXq5f-U2h4AaABAg,1,2 years ago,"when i was in a bad mood, i always wanted to watch the videos of ziyi. it was really yearning. i hope that my elderly life can have a land. there is a rural house, all kinds of dishes every day, and make some small things. it ’s good to buy something you want occasionally! bleak",心情不好的时候总想看看子柒的视频，真的很让人感觉向往，希望自己老年的生活可以有块地，有个农村的房子，每天种种菜，捣搞一些小东西。拿着退休金偶尔买点自己想要的东西，真好！
47826,UgyWNSnUwnsbpmOVH0Z4AaABAg,1,4 years ago,it's really a rush to cook it,真的很着急做饭
19256,UgwZWJiVywojhkCXU6t4AaABAg,1,3 years ago,the music she uses always reminds me of studio ghibli and everything she does just radiates pureness and hardwork and its just really inspiring,她使用的音乐总是让我想起吉卜力工作室，而她所做的一切都散发出纯净和努力，而且它真的很鼓舞
19100,UgxyIW1LfE98uNuuREl4AaABAg.96EEVaT0NnJ97HhP56HgOy,1,3 years ago (edited),"that's right. real chinese snacks do that
at first, i started with it, and then adds it in various fruits.","是的。真正的中国小吃做到了
起初，我从它开始，然后将其添加到各种水果中。"
2482,UgwXRCONq-D_hNGWmzR4AaABAg,1,1 year ago,really missed liziqi videos hope she uploads soon in her channel,真的错过了Liziqi视频，希望她能尽快上传到频道
29214,UgxyZ1M3ykGeCjsaJxR4AaABAg,1,3 years ago,you are really hard working,你真的很努力
