,cid,votes,time,含real,含real中文翻译
271,Ugxhc0zsnq84uBN65hl4AaABAg.9ogX6fOy6ot9qvoaT9-YZi,0,2 days ago,beyond the imagination of people! you love you and grandma are very exciting! so attractive! it really feels so good!,超出人们的想像空间！柒爱的妳和奶奶活的很精彩！好有吸引力！很真实感觉真好喔！
237,UgwV17ZZNTI4g18Fk-N4AaABAg,0,1 month ago,"the first time i looked at her channel, i didn't expect everyone to like her so much. if i really miss her, i can buy her snail powder and try it",第一次看她的频道，没想到大家这么喜欢她，如果真的很想她，可以买她的螺蛳粉，尝尝
162,UgxGomBFQLIRCX70LQx4AaABAg,0,1 month ago,why this feel like a really life anime but way more clam,为什么这感觉像是一个真正的生活动画
1378,Ugxas-Y_r_4oosb6hgN4AaABAg,0,10 months ago,liziqi where are you? why you donโ€t upload your video? what happened? really i miss u and your video so much. please come back๐ฅบ,liziqi你在哪里？为什么不上传视频？发生了什么？真的，我非常想念您和您的视频。请回来
1431,UgwAcUXjjjd8xTG2RKZ4AaABAg,0,11 months ago (edited),"where are youe๏ธโน๏ธโน๏ธโน๏ธโน๏ธโน๏ธโน๏ธโน๏ธ
its ben a long long time.
are taking so much time to increase views on your previous vedios?
as i can see there are a lot of views on this one too.
i hope you are alricht.
please come back soon, do't keep your true admires wait this much long.
sometimes i wonder ๐ค” maybe you have blocked me becape i'm an indian. but this can't be true.
please come back soon, don't let you really admire for so long.
sometimes i want to know if you stop me because i am an indian. but this cannot be true.
please come back.
where are you.
it has been a long and long time.
do i need to spend a lot of time to increase the number of views of your previous videos?
as i see, there are many views on this.
i hope you are okay","Where are you
Its been a long long time.
Are taking so much time to increase views on your previous vedios?
As I can see there are a lot of views on this one too.
I hope you are alright.
Please come back soon,don't keep your true admirers wait this much long.
Sometimes I wonder 'm an Indian. But this can't be true.
Please come back请快点回来，不要让你真正的仰慕者等这么久。
有时我想知道你是否阻止了我，因为我是印度人。但这不可能是真的。
请回来.
你在哪。
它已经很久很久了。
是否需要花费大量时间来增加您之前视频的观看次数？
正如我所看到的，对此也有很多看法。
我希望你没事"
1466,UgyBprkqVpAeTu6cvkB4AaABAg,0,11 months ago,"watching this video more than a few dozen times, it is really very attractive to viewers and the unique dishes looking at us really want to try and throw our injuries to you back sooner and do it sooner and do it. the videos placed more iron wish your family a happy day",观看此视频超过几十次，它对观众和看着我们的独特菜肴确实非常有吸引力你的家人快乐的一天
1526,UgxC7poLzdseDQ2sac94AaABAg,0,11 months ago,i really want to know..which village is this...?,我真的想知道..这是哪个村庄...？
2854,UgxP4-KparSryoKS1Od4AaABAg,0,1 year ago,looking at you really feel at ease (its so soothing to watch you ...),看着你真让人安心 (Its so soothing to watch you..)
2848,Ugz5z6-ZcNCHqUMyd5p4AaABAg,0,1 year ago,but the way : little puppies was really cute,但是路：小幼犬真的很可爱
2784,UgygEZcd1MBMZVlcIX14AaABAg,0,1 year ago,wow really amazing,哇真的很棒
2775,Ugx_pgF2X9oB7NEissN4AaABAg,0,1 year ago,so - if you are not real... who is the older lady? is she an actress as well?,所以 - 如果您不是真实的...谁是老太太？她也是女演员吗？
2677,UgyKx4SseZvpX_9kied4AaABAg,0,1 year ago,"thiss video my most favorite one
when i saw dis first time
i'm just shocked how beautiful you r and your thoughts your work everything ❤️❤️❤️❤️❤️i just love your every videos
i hope you are doing well
i really misss youuu","这是我最喜欢的视频
当我第一次看到迪斯
我只是震惊了你的美好和你的想法，你的工作一切❤️❤️❤️❤早太郎
我希望你一切都好
我真的很想念你"
2676,Ugwwf63jCoYcm4MJLn94AaABAg,0,1 year ago,you are one strong woman. i hope you go really far in life,你是一个坚强的女人。我希望你在生活中走得很远
2570,UgxYqrjr9b8atOZff7d4AaABAg,0,1 year ago,i miss uuuuu so much plssss uplod u r videos.realy love uuu i m waitting ur videos,我非常想念uuuuu plssss uplod u r videos.realy love uuu u u ting ur videos
2533,UgweyAxyhiXlDELmjMx4AaABAg,0,1 year ago,really like,很喜欢
2510,Ugy_k-LKJvkYEalR9y54AaABAg,0,1 year ago,"wow she's amazing. she knows everything and also she's very nice and beautiful ,keep it up , i always watching your videos and i really love it",哇，她很棒。她知道一切，而且她非常友善和美丽，保持它，我总是看你的视频，我真的很喜欢它
2475,UgzQ-5T1AAeD59oS1414AaABAg,0,1 year ago,i really want to watch the li ziyi new year's album.,好想看李子柒新年专辑，特别有年味
2395,Ugy5M-bHY5sRlyenSsJ4AaABAg,0,1 year ago,"in real rural china, women are chained by their husbands and forced to give birth to eight children https://youtu.be/8h0mukksbck",在中国真正的农村地区，妇女被丈夫束缚，被迫生育八个孩子https://youtu.be/8h0mukksbck
2377,Ugy8trk23QyhmIaUB-d4AaABAg,0,1 year ago,this is the real traditional fried rice flower,这个才是真正的传统炸爆米花
2368,UgyoJwN1aBJ_z_8Eth14AaABAg,0,1 year ago,"i looked without reading the name, only by the end i realized that this is the season of workpieces in chinese. i did not understand only about pancakes, in the sense she removed them too? well, a big vessel - does it get a wok? only huge?",我看着没有读这个名字，只有到最后，我才意识到这是中文工件的季节。我不仅了解煎饼，从某种意义上说，她也将它们删除了吗？好吧，一艘大船 - 它会得到炒锅吗？只有巨大？
2244,UgxEkusGkI8bxIPTaMd4AaABAg,0,1 year ago,i really miss you so much. when do you come back?,我真的好想你。你什么时候回来？
2163,UgxM7wEgRmxfGtS8Zul4AaABAg,0,1 year ago,i really love her life .how she live.......,我真的很喜欢她的生活。她如何生活.......
2103,Ugz9CdNWnJIzgRacYsx4AaABAg,0,1 year ago,"perhaps because i grew up watching kyung -si and kung fu, i really like this kind of chinese video video ( *' *｀) i want to travel someday.",也许是因为我长大后看着Kyung -si和功夫，我真的很喜欢这种中文视频视频（ *' *｀），所以我想有一天旅行。
2101,UgzN6u1yGAv9fH9AsYJ4AaABAg,0,1 year ago,"i really can't make good sugar gourds, and the temperature of mastery of sugar is too difficult (because there is no thermometer) i also want get glittering candy gourd",我是真的做不好糖葫芦，掌握糖的温度太难了（因为没有温度计）我也想get亮晶晶的糖葫芦
2094,Ugw-Ue50cmSabJQfLqt4AaABAg,0,1 year ago,"do not from the sky. renewal (life of life, memory, time), objectized thinking (mirror opposite, ability to oppose, confrontation of mind, messenger and non -me), self -consciousness, is a trap. (no matter who sets the trap. no matter it is related to the second law of thermodynamics.) it is a robbery.
the diversity of life is complicated, so that ""the mirror is unchanged, and the phase variant is unchanged. so as a rosary."" i, i, i, ... "". is it inevitable? is it considered a progress or evolution, and there is no need for discussion. (even science is fans. fans from all walks of life can't offend)
with me, i lost my own (so -called me, my self -definition: i have it, there is no need to read me.)
freedom often, no need to find.
riding a donkey to find a donkey, looking for his head, anxiety, nervousness, and pain (to crazy). this should be a common sense and cannot be avoided. even if you do n’t go to the school to receive instilling (the ancient and modern chinese and foreign instills are paste, big witch and small witch, fifty steps and hundred steps, the same), and being named by the parents at the “niang gow”. essence
this may be the price that the so -called civilized progress (or the so -called prosperity development) must be paid.
the concept noun, according to ""a brief history of humanity"", is a powerful weapon for the wins of the homo sapiens.
it now appears that this is a double -edged sword.
human beings are about to (or have already) so crazy to destroy this world (this prison, this corner field, the fighter field)
anyway, each ownership (there are all kinds of promises. including nothingness, or even absurdity, each have their own fans.)
go to see marx, go to see the ancestors .......
the so -called conflict of civilization is not just the dispute between the conceptual dispute, the mixed geographical skin color and even the habit of dispute, etc.
there are unified thoughts, standardization, simplification, part -time, systematic, modern, and global blessings. these war machines cannot stop.
this may be a disaster that will usher in the evolution of life.
i got a hint from a great place many years ago. unexpectedly, it is so obvious now. (at least for me, it is obvious)
the effort to try to try with the mud has long failed, but now it has been verified that this is basically a car.
let's practice it. only practice.
xin zhai did not, the cliffs were scattered, and he fell into the darkness at all, admitting ignorance. (from a song from pu shu)
or can get new life. heaven and man are one, and the tao is not out of the foreigner. it is often sufficient. as a result, calmly, facing the ending of life and even the universe.
(but pay attention: unequal mind and easy to enter the magic.)

renewal: continuity. it was mainly inspired by the story of the knowledge of knowledge (good and evil differences) by the temptation of the snake.
some people say that adam's original sin originated from eve's lying. in fact, there is no snake, it is eve to seduce adam himself.
i wrote a short article to refute this absurd interpretation. (yi zhongtian believes that this snake is related to reproductive worship. it is more than this more than this.)
see ""adam's original sin (eve did not lie)"" 6park.com
""diamond sutra"": ""no one, no one, no one, no beings, no life.""
generally explained as equal treatment. not bad. but what is the ""life""?
some people say that it is a fake word of ""suffering"", and those who have no sufferings depends on the appearance of through the body. it is also easy to say, but it is not coherent with the context.
i think: the so -called life, regardless of longevity and shortevity, and those who have a life span. (not only beings, not life, but also life.)
the actual feiya is not moving, fang sheng fang died, fang dead fangsheng (zhuangzi) has a life span, which is the illusion or illusion that memory brings us (like visual retention) 6park.com
regarding memory phase and time, please see ""congenital first reason (background and source)"" 6park.com
regarding the trap of objectization thinking and self -consciousness, please see ""objective thinking (self -conscious trap)"" 6park.com
mirror opposite is a metaphor, which is more important. it can be said: everyone (even all perception sentient beings) is a bright mirror that is the same.
(the dimension is pushed. we are a two -dimensional plane in front of us. it is not three -dimensional. three -dimensional logic from our straight logic. what we see is illusion. we can't see the actual space. it's bent.)
including the body, it is just a mirror image.
where did this sensory mirror come from? no one knows.
at least i don't know, i can only guess. at present, my recommended conjecture is: energy conservation, energy first.
if you have energy, you must light up your consciousness, and even the so -called non -organism. it is definitely not self -conscious, or even if it is, it is extremely vague and extremely unstable. 6park.com
the metaphor of a rosary, like snakes, seduces selfish self -cultivation.
on one occasion, a netizen asked me: why did he feel that he had many previous lives and died in the same nanjing massacre.
i made an analogy. zhuangzi: fang sheng is dead, fang dead. for example, the mahjong card stacked together.
the difference is just stacked neatly. there is still the next life, and it still has to be empty and it is not worth pursuing. 6park.com
regarding the second law of thermodynamics, due to the lack of professional knowledge, it cannot be accurately judged. at present, it is considered that: uniform distribution is an orderly. the complexity and diverse life (each gene is different, including twins, including clones, there are somewhat places to copy wrong homework, and there is no mutation or evolution), which is disorderly.
therefore, there is no contradiction between the laws of thermodynamics and the evolution of species. it cannot be misleading because someone wrote this book or made a prophecy, thinking that the world should live like this, and it is better to destroy it. see the contradiction between the second law of thermodynamics and evolution? ""6park.com
if we face a disaster, we do not from heaven, the crazy from our own, and the cause is the self -loss that must be caused after self -awareness.
找不到真正的自己，必然要攀援（执着于镜中像，例如身体或金钱，笔杆子，刀把子，等等等等）或妄想（执着于对于镜的猜想，各种名词之争，以至于the so -called civilization conflict, at the expense of destroying this world, must also maintain your beliefs)
this may not be avoided. 6park.com
collective, it is mainly bad in the modernization of standardization industrialization.
the so -called civilization, the so -called cultural circle, has become a war machine that has become unified.
(western advocating personality is an illusion. actually, the family cannot standardize it into a screw, which is not conducive to industrialization. see ""another brick on the wall"")
this simple and orderly repeatting is a reactionaries that violate the heavens, not a variety of complicated life.
energy is conservative, life will not be cut off, and the big deal will change the form. the standardization of the systemic and the cold war machine will inevitably be destroyed.
i kept at the nuclear winter.
(genghis khan's war machine is also very ""modern"".
establish officers such as functions and so on. and the whole people can be equipped with a quota, without any troubles such as three crickets.
is the winner more advanced? ) 6park.com
(there is no determination to go to the end of the hundreds of millions of people, and there is no spirit of swallowing the ten directions in the lone peak, and talk about the real awakening.
even if it is a praying arm blocking the car, the wind is not shining anyway, try it again. .

personally, you can practice xinzhai's inaction and let the cliffs let it go.
dharma: foreign interest (let go of my persistence, like persistence), there is no breath in the heart (letting go of the law, the mirror persistence)
this is the mind, not in the external behavior, meditation or standing piles, running or sleeping, let alone practice unnecessary asceticism.
altar scriptures: there is no need for righteousness and evil. long extension lying on his feet.
one foot evil, that is, obsessed with foreign ministers, one foot is positive, that is, imagine the infinite perceptual body (it is too easy to enter the magic, because there is no difference between good and evil)
don't do the so -called good things, let alone do bad things (not chinese culture too much sauce cylinder, some people are dull by themselves)
the method of inaction is the principle of leverage, the alternative use of cathode and yang (see ""alternative application of leverage principles"")
be careful of all the so -called proofs, especially the sudden sensitivity, such as suffering from a sense of purity, sober, clear and clean ...
there is no need to do thousands of miles in life experience. this does not become a test, mainly depending on the inner and unequal (see ""equal equality and entering the magic"")","劫不从天外来。相续相（寿者相，记忆相，时间相）、对象化思维（镜像对立、能所对立、心物对立、我与非我的对立）、自我意识，是个陷阱。（无论是谁设的陷阱。无论与热力学第二定律有没有关系。）更是一个劫。
生命之多样复杂，以至于敏感到“像变镜不变，相变体不变。从而串起一条念珠。“我，我，我,.......”. 是不是演化的必然，算不算进步或进化，也没有讨论的必要。（连科学也是有粉丝的。各路粉丝都得罪不起）
有了个我，反而失去了本我（所谓本我，我的自我定义：本就有的，没必要念的我。）
自在常在，无须寻找。
骑驴找驴，迷头觅头，焦虑紧张烦恼痛苦（以至于疯狂），这应该是人之常情，也无法避免。即便不去学校接受灌输（古今中外灌输的都是浆糊，大巫小巫，五十步与百步，一样的），被父母指着“娘生褂”起个名字，就已经是迷失的开始了。
这也许是所谓文明进步（或所谓繁荣发展）必须付出的代价。
概念名词，据《人类简史》，是智人胜出的有力武器。
现在看来，这是柄双刃剑。
人类快要（或已经）疯到要不惜毁去这个世界（这个监狱，这个角斗场、斗兽场）
反正各有各的归属（各有各的应许之地。包括虚无，甚至荒诞，也各有各的粉丝。）
去见马克思，去见祖宗.......
所谓文明的冲突，不止于理念之争宗教之争，混杂了地域肤色甚至习惯之争等等等等
有统一思想、标准化、简单化、零件化、系统化、现代化、全球化的加持，这些战争机器是停不下来的。
这或许是生命演化出自我意识后，就必将迎来的一劫。
我很多年以前就从某位大能处得到暗示。没想到如今已如此明显。（至少对我来说已经很明显了）
试图和稀泥的努力早就失败，如今不过再次验证这基本上是螳臂当车。
还是实修吧。也只有实修了。
心斋无为，悬崖撒手，不惜坠入黑暗，承认无知。(出自朴树的一首歌）
或能获得新生。天人本一，道不外人，常在具足。从而自在从容，潇洒面对人生乃至宇宙的ending。
（但是要注意：心不平等易入魔。)

相续相：连续感。主要受夏娃被蛇诱惑吃了知识果（善恶分别果）的故事的启发。
有人说亚当的原罪源于夏娃的撒谎。其实没有蛇，是夏娃自己要诱惑亚当。
我曾写了篇短文反驳这种荒唐的解读。（易中天认为这蛇与生殖崇拜有关。也比这强了不止一点。）
参见《亚当的原罪（夏娃没有撒谎）》 6park.com
《金刚经》：“无我相，无人相，无众生相，无寿者相。”
一般解释为要平等对待。大抵不差。但何谓“寿者”？
有人说是“受”的通假字，无受者，就是说要看穿身体这个表相。也说得通，但与上下文不太连贯。
我认为：所谓寿者，不分长寿短寿，有寿命可计的都是寿者。（不仅是众生，非生命，也是寿者。）
而实际飞矢不动，方生方死，方死方生（庄子），有寿命可算，是记忆带给我们的错觉或幻象（好比视觉暂留） 6park.com
关于记忆相与时间相，请看《先天第一因（背景与源头）》 6park.com
关于对象化思维与自我意识陷阱，请看《对象化思维（自我意识陷阱）》 6park.com
镜像对立，是个比喻，比较重要。可以这么说：人人（乃至所有的知觉众生）都是一面同样圆满的明镜。
（维度是推想出来的。我们眼前是个二维的平面。不是立体的。三维来自我们笔直的逻辑。我们看到的是幻象。实际的空间我们看不到的。按物理学来说不是平直的是弯曲的。）
包括身体，都只是镜中像。
这个知觉镜到底从哪里来的，没人知道。
至少我不知道，只能猜。目前我比较推荐的猜想是：能量守恒，能量第一性。
有能量必然点亮知觉，连所谓的非生物也是一样。只是肯定没有自我意识，或即便有，也是极其模糊极其不稳定的。 6park.com
一串念珠这个比喻，和蛇一样，都是引诱人自私自利修来世的。
有一次，某位网友问我：为什么他觉得自己有很多前世，都是死于同一场南京大屠杀的。
我打了个比方。庄子：方生方死，方死方生。好比叠在一起的麻将牌。
区别只是叠得整齐不整齐。来世下面还有来世，还是要清空了重来，不值得追求。 6park.com
关于热力学第二定律，由于缺乏专业知识，无法准确判断。目前倾向于认为：均匀分布是一种有序。生命的复杂多样，（每个基因都不同，包括双胞胎，包括克隆，都多少有抄错作业的地方，没有变异就没有演化或进化），是一种无序。
因而，热力学定律与物种演化论并无矛盾。不能因为有人写了本书或做了个预言，就被误导，认为世人活该如此，毁灭了更好。参见《热力学第二定律与进化论矛盾吗？》 6park.com
如果我们面临一劫，不从天外来，来自我们自己的疯狂，究其因，就是自我意识产生后必然造成的自我迷失。
找不到真正的自己，必然要攀援（执着于镜中像，例如身体或金钱，笔杆子，刀把子，等等等等）或妄想（执着于对于镜的猜想，各种名词之争，以至于所谓文明的冲突，不惜毁了这个世界，也要维护自己的信念）
这未必不能避免。 6park.com
从集体来说，主要坏在标准化工业化现代化全球化，
所谓的文明，所谓的文化圈，已经各自成为统一了思想的战争机器。
（西方崇尚个性是个幻象，实际是家庭无法规范成一个个螺丝钉，不利于工业化。参见《墙上的另一块砖》）
这种简单有序的重复灌输才是违反天道的反动派，不是多样复杂的生命体。
能量守恒，生命不会断绝，大不了换个形态，标准化零件化体系化的热战或冷战机器必然覆灭。
自己不停就止于核冬天。
（成吉思汗的战争机器也很“现代化”，百夫长千夫长万夫长的连排制度，从各部落独立出人质建立近卫军，
以职能设立军官等等等等。而且全民皆兵，可以配给配额，没有三饷从哪里来之类的烦恼。
胜利者一定比较先进吗？） 6park.com
（没有虽亿万人吾往矣的决心，没有独居孤峰顶一口吞尽十方的气魄，奢谈真正的觉醒。
哪怕是螳臂挡车，反正风吹不动光，再试试吧。）

从个人来说，可以修习心斋无为，悬崖撒手。
达摩：外息诸缘（放开我执，像执），内心无喘（放下法执，镜执）
这是心法，不在于外在的行为，打坐还是站桩，跑步还是睡觉，更不要去修什么无谓的苦行。
坛经：正邪俱不用。长伸两脚卧。
一脚邪，即迷恋外相，一脚正，即想象无限大的觉性本体（过分了容易发狂入魔，因为本无大小善恶之分）
所谓好事都不要做，更不要说做坏事了（不是中国文化太酱缸，是有的人自己愚钝）
无为心法，是杠杆原理，阴极而阳的另类使用（参见《杠杆原理的另类应用》）
要小心一切所谓的证明，特别是突然过于敏感，例如突获清净感、清醒清晰干净......
人生历练不一定要行万里路。本不成为考验，主要看内心平等不平等（参见《心不平等易入魔》）"
2065,Ugy_DwwIRvTkzRAXmt94AaABAg,0,1 year ago,"this is a well-staged production, much like a movie. they have a recognized brand and make most of their money selling products related to their videos. in reality farm life is fairly difficult, with long hours and little pay.",这是一部精美的作品，就像一部电影。他们有一个公认的品牌，并赚取与视频相关的大部分资金出售产品。实际上，农场生活非常困难，长时间且工资很少。
1912,UgxFbMuJmFZhp7IUCRJ4AaABAg,0,1 year ago,"god bless this family .
peaceful ... what a beautiful harmony... 
far from a city and technology .
real life is maturely simple.","上帝保佑这个家庭。
和平...多么美丽的和谐...
远离城市和技术。
现实生活很简单。"
1873,UgyQ81XpSQd4P40-es94AaABAg,0,1 year ago,hi all! i really love to watch this girl. i would like to know more about her. maybe someone can tell you where you can find out about it. thanks to everyone,大家好！我真的很喜欢看这个女孩。我想进一步了解她。也许有人可以告诉您在哪里可以找到它。谢谢大家
1756,UgxswuMBXle4SZrowJZ4AaABAg,0,1 year ago,it turns out that taohuayuanji really exists,原来桃花源记真的存在
