,cid,votes,time,含real,含real中文翻译
35657,UgwRC4ADJQaSLbJMNVl4AaABAg,0,4 years ago,"the girl is very talented, i bet there is nothing she canโ€t do. but the vids are a little bit unrealistic . no one lives like that at a farm. everything is too clean, too tidy. besides there is no actual need to use fire every time you cook. wood-fired oven is better than electric one in many cases, but for frying and boiling you need to be super-expert to use open fire. thus for me it just seems like intentionally making your life harder while not adding any extra-value to the final result. and she never uses neither water lines nor washing machine in the video. this is just absurd: you just can not keep the house as clean without water lines. and animals are so tidy, i bet they are washed and brushed everyday. the vids are very good just as fairytales, but those comments saying about the ยซ real life ยป the girl lives are just killing me",这个女孩很有才华，我敢打赌，她无能为力。但是视频有点不现实。没有人像这样的农场生活。一切都太干净了，太整洁了。此外，每次您做饭时都无需使用火。在许多情况下，燃木烤箱比电动烤箱要好，但是要煎炸和煮沸，您需要超级专家才能使用开火。因此，对我来说，似乎有意使您的生活更加艰难，同时又不为最终结果添加任何额外价值。而且她从未在视频中使用水管也不使用洗衣机。这只是荒谬的：如果没有水管，您就无法保持房屋的干净。动物是如此整洁，我敢打赌它们每天都洗和刷。视频和童话一样很好，但是那些关于“现实生活”的评论是女孩的生活只是在杀死我
34349,UgypfQvC89oAizEc-BV4AaABAg,0,4 years ago,harvest moon in real life๐ป,现实生活中的收获月亮
35667,UgwrmX6WajHnVdjRnH54AaABAg,0,4 years ago,real life harvest moon with that basket ๐๐,现实生活在那个篮子
34274,Ugyx_DdaWq195grbdP94AaABAg,0,4 years ago,"wow, who is blessed to marry her is really blessed",哇⋯谁有福气能娶到她真的好福气了
34264,Ugzoi786uqhnbpM8x5N4AaABAg,0,4 years ago (edited),you're really good at cooking ๐‘ i didn't know how to go time,你真的很擅长做饭
34401,UgxVMKQEpioGv7W92O94AaABAg,0,4 years ago,i really want to do the popcorn that i do this time ~,好想次这么做的爆米花~
51529,UgzuBsgsADJxoH5s_8V4AaABAg,0,4 years ago,is there anything you cannot do? this video has put me in awe. i really love it. please make some more. i'm a big fan of your videos. happy chinese new years from san francisco.,有什么你不能做的吗？这个视频使我敬畏。我很喜欢。请做更多。我是您视频的忠实粉丝。从旧金山度过的农历新年快乐。
35730,UgyOn2CTzk-aoICSVDR4AaABAg,0,4 years ago,i really really enjoyed the video,我真的很喜欢视频
51525,UgxvCM5TES1_v-lbued4AaABAg,0,4 years ago,it's really similar to the paradise 外 外 外,真的很像世外桃源哦
35780,Ugz3B2W199xWnNy_Syh4AaABAg,0,4 years ago,real life anime. absolute and pure beauty.,现实生活动画。绝对和纯净的美丽。
34259,UgygBtS7uvP_YsX2ZDZ4AaABAg,0,4 years ago,"omg. i think i really want to live like this. like, if you want to eat you just go to the garden or smtn else and eat. it's a big effort but i like calm life. you know",我的天啊。我想我真的想这样生活。就像，如果您想吃饭，您只需去花园或SMTN吃饭。这是一项巨大的努力，但我喜欢平静的生活。你知道
35816,UgwgsnHyTiBUFPt82Q14AaABAg,0,4 years ago,i think you live in the real narnia. please send me a box of goodies,我认为您住在真正的纳尼亚。请给我一盒好东西
35880,UgxnCPj8VKUW0CRtGB54AaABAg,0,4 years ago,"ugh idk what this is but this is so wholesome and pure. it's like a live action farming game (like harvest moon), but this is really their lives. i wanna try her cooking so bad, wow! i wonder if her grandparents taught her :o",ugh idk这是什么，但这是如此有益健康和纯洁。这就像一个现场动作耕种游戏（如Harvest Moon），但这确实是他们的生活。我想尝试她做饭这么糟糕，哇！我想知道她的祖父母是否教她：o
34249,Ugyh8R3P64Ek8T-W7u54AaABAg,0,4 years ago,"im from indonesia
sorry if i can't speak english

but i really like videos on this channel","我来自印度尼西亚
对不起，如果我不能说英语

但是我真的很喜欢这个频道上的视频"
34240,UgwN0W_5lTYZ8Z3PEOR4AaABAg,0,4 years ago,is this even real...,这甚至是真实的...
35947,UgyNmUydMg3_Tiycgsx4AaABAg,0,4 years ago,itโ€s a real life studio ghibli movie,这是一部现实生活工作室吉卜力电影
34404,Ugw4JcXbSn4WFb2JoXR4AaABAg,0,4 years ago,the real harvest moon back to nature girl โฅ๏นโค,真正的收获月亮回到大自然的女孩≥﹏≤
35955,UgwK7XM6L5LnClEfBzJ4AaABAg,0,4 years ago,watching her videos really makes me appreciate people from all around the world have to offer and how much effort they put into what they can do,观看她的视频确实使我欣赏来自世界各地的人们必须提供的人，以及他们对自己可以做的事情的努力
34439,UgzyI5jl9L_2d7GIGn14AaABAg,0,4 years ago,really enjoy this channel too!,也很喜欢这个频道！
35972,UgzXBApkP0nzlsGQOLh4AaABAg,0,4 years ago,"i am very curious about the filming of all films? your hometown is too big, right? i really envy this kind of life, it is a paradise, admiring!",很好奇所有影片的拍摄场影都是子柒 家里的一部份吗？您的老家也未免太大了吧？真羡慕这种生活，完全是世外桃源，赞叹！
34440,UgzxEYrJEzVGi0_8nPN4AaABAg,0,4 years ago,watching this video really remind me of harvest moon n rune factory game. i miss both game so much q_q,观看此视频确实让我想起了Harvest Moon N Rune Factory游戏。我非常想念两个游戏Q_Q
36333,Ugwbw6GWN97VgWcjcEp4AaABAg,0,4 years ago,just unrealistic vidos,只是不切实际的vidos
52083,UgyQYpzfDNrHBH2pZ814AaABAg,0,4 years ago,dammnn i really want to visit her place and have food that she cook.. agree thumbs up..,Dammnn我真的很想去她的住所，吃她煮的食物..同意大拇指。
34451,UgyCa8pAMSeG-gkZiDJ4AaABAg,0,4 years ago,what a list is this video producer: sophisticated technical means and peasant bucolic theme and do it yourself ... all marketing for those who are really town.,这个视频制作人的清单是什么清单：精致的技术意义和农民田园主题，并自己动手……所有真正是城镇的人的营销。
36338,UgxsO9yb299ChwtqzB94AaABAg,0,4 years ago,"seeing your video today, i find that you are really a talented girl, and you should be from sichuan.",今天看到你视频，发觉你真的是个才女，听你说话应该是四川的。
52243,UgwkmVgjre2-mTJljO54AaABAg,0,4 years ago,"the best is, really like that one food,",最好的是，真的很喜欢那种食物
33813,UgxQ4obKp7Mzrv-Mbi54AaABAg.8vAAkm2tSd48y9HAFXlILT,0,3 years ago,i really agree with you,我真的同意你的看法
36591,UgzR2pqrLSV8wDumk-l4AaABAg,0,4 years ago,"i really love this video and food, she lives in wonderful place",我真的很喜欢这个视频和食物，她住在很棒的地方
36596,Ugz4ucYZI6N-r4WcsId4AaABAg,0,4 years ago,"why is all this food being prepared? it's beautifull, incredible to watch, makes you really wonder at all the work that went into feeding a family trhough winter before convenience stores and refrigerators, but still, is she prepararing all this food for her family, for video, for sale?",为什么准备所有这些食物？这是美丽的，令人难以置信的观看，让您真的很想知道在便利店和冰箱之前喂养一个家庭的所有工作，但是她是否还是为家人准备所有这些食物，以供视频出售？
52288,UgyxoX-m7uxD2CDKwSR4AaABAg,0,4 years ago,i'm really afraid that she's going to eat that little lamb:(,我真的很害怕她会吃那个小羔羊:(
51920,Ugw5L6nd_dynyLdnM614AaABAg,0,4 years ago,i regularly watching ur video. it's really interesting to watch. u r the most energetic girl ever i saw. ur pets are very cute.,我经常看你的视频。观看真的很有趣。我见过的最有活力的女孩。你的宠物很可爱。
36599,Ugy8_wv7GKyO1Gal94J4AaABAg,0,4 years ago,"you better nom some of that you work really hard.
also digimon song?? you guys are amazing.","最好提名其中一些您非常努力。
还有Digimon的歌？你们太棒了。"
36610,UgziONXyukEp_FD5dOB4AaABAg,0,4 years ago,i really like your video . i'm from indonesia,我真的很喜欢你的视频。我来自印度尼西亚
35174,UgyoQ22FTE7CBFzC4qx4AaABAg.8ukF8x1n6m-95Mji3fj49x,0,3 years ago,this girl is grate i really zealous of her can one pearson so talented,这个女孩是勇敢的，我真的很热心她能有才华的皮尔森
34535,UgzxGIPg46-ZM8xsvwp4AaABAg,0,4 years ago,is this the real life or just for videoshoot.. i really feel the reality.. oh gorgeous๐’–,这是现实生活还是仅仅是为了视频。我真的感觉到现实..哦，华丽
35171,UgyoQ22FTE7CBFzC4qx4AaABAg.8ukF8x1n6m-94VWecHUGvu,0,3 years ago,little red owl no sheโ€s a real person living a rural life,小红猫不，她是一个真正的人，过着乡村生活
51273,UgzFivl2Pvr8FGKjbXp4AaABAg,0,4 years ago,"really amazing i like your video's 
❤from","真是太神奇了，我喜欢你的视频
❤从"
51262,UgyJQRrMMFmpfS8zST54AaABAg,0,4 years ago,really creative like this ... if in indonesia there is a super youtuber like this ... the subcribe may not be that much,真的很有创造力...如果在印度尼西亚有这样的超级YouTuber ...
52295,UgyBW603Ou7WGDkqdQx4AaABAg,0,4 years ago,"过 this is the real chinese new year
i really want to go to your house as a guest! eat the snacks!","
好想去你家做客！把零食吃光！"
52312,UgxO6bnL_toesqk1WSZ4AaABAg.8qlNYmNovEv8sBWhyYLHXu,0,4 years ago,"ouch, you are inexplicable! real skin",哎哟，你这条莫名的有股英气！真的皮
36654,Ugxdx7sUUL4eoI0DlZR4AaABAg,0,4 years ago,i never realized i actually wanted to get married until this video,我从来没有意识到我实际上想结婚，直到这段视频
52351,UgzQqFcM3JTUkjmG-QN4AaABAg,0,4 years ago,watching her video is really relaxing for me. they showcase the beauty of living simply.,观看她的视频真的让我放松。他们展示了简单的生活之美。
52352,Ugx-n1hCXXSN2NpWQkx4AaABAg,0,4 years ago (edited),"i really love this video



❤philippines","我真的很喜欢这个视频



❤菲律宾"
34562,UgzxGIPg46-ZM8xsvwp4AaABAg.8uzbJb6eyk08v5bZ-V_Gpg,0,4 years ago,annie ratna puri this is her real life. people still live like this in africa philippines and anywhere that does not rely on machines and microwaves ๐๐๐คฃ๐คฃ๐๐๐คฃ๐๐,安妮·拉特纳·普里（Annie Ratna Puri）这是她的现实生活。人们仍然在非洲菲律宾和不依赖机器和微波炉的任何地方生活。
51154,UgxTM9XRZryfQaVpJkh4AaABAg,0,4 years ago,i can't understand chinese but is this preparation for chinese new year? i really love your video!!!,我听不懂中文，但是这是为农历新年做准备吗？我真的很喜欢你的视频！！！
33741,Ugx247col2MoHOB0Qeh4AaABAg,0,4 years ago,the team now is really amazing,现在的团队真是厉害
51119,Ugz0bjUONHpJqoCW4-F4AaABAg,0,4 years ago,"i just realized that this video has more five minutes times duration which is ten minutes, woww... and all the foods or the dessert are look so yumm.",我只是意识到该视频的持续时间五分钟，即十分钟，哇...而所有食物或甜点看起来都很好吃。
36684,UgylTM1tk7rRFvWtYkJ4AaABAg.8uRIOVFo2EQ8ucKqP5q0oG,0,4 years ago,tianxing yuan lol๏ผits just not real chinese rural๏ผbut it still have to work hard physicallyใ€the rich people you talk about are just dont want give up their rich life,tianxing yuan哈哈，它不是真正的中国农村，但它仍然必须在身体上努力工作。
35570,Ugzu4rbbMuw-eBZ6-H54AaABAg,0,4 years ago,"chinese hipsters are on a whole another level!

can't believe there are people who think this is real. there's a whole production army behind her - camera, lights, set designer, hair and make-up, editor...

and no, that's not her real grandmother:d","中国赶时髦的人是另一个层次！

不敢相信有些人认为这是真实的。她背后有一支整个生产军 - 相机，灯光，套装设计师，头发和化妆，编辑...

不，那不是她的真实祖母：D"
52438,UgxAcqM1YCzAdvrVjVd4AaABAg,0,4 years ago,really good,真的很好
36713,UgyKWn_dWFxmdG2JG8l4AaABAg,0,4 years ago,"the best, this self -reliance concept really appreciated from the heart",最好的，这个自我依赖的概念真的很感激
34573,UgzurQhlQhOp0-yV4GJ4AaABAg,0,4 years ago,this girls grind is unreal,这个女孩磨是不真实的
36745,UgyR_XGPTE_lRL_q6-V4AaABAg.8uPz7XlLf2B8uRzBFSKM2b,0,4 years ago,thats because these little animals are nearly babies and normaly needs their real nature mother!!! they taken them much to early.for which reason?,那是因为这些小动物几乎是婴儿，而普通人需要他们真正的天性母亲！！！他们把它们带到了很早的时候。出于哪个原因？
36755,UgxaY8Pq0jDqs7GP3kJ4AaABAg,0,4 years ago,i really want to life like her doing,我真的很想像她一样生活
35198,UgyoQ22FTE7CBFzC4qx4AaABAg.8ukF8x1n6m-982HfYc6khY,0,3 years ago,@therewasnochill8997 you are one hundred years behind the reality!,@thenwasnochill8997您落后于现实一百年！
33845,UgxQ4obKp7Mzrv-Mbi54AaABAg.8vAAkm2tSd49-oKTTtduFH,0,3 years ago,she doesn't really live like this. she's a famous reality youtube personality. her net worth is 8.7 million a year and they live in a big beautiful home that looks nothing like this. she is single and lives with grandma.,她并不是真的这样生活。她是著名的现实YouTube性格。她的净资产是每年870万，他们住在一个看起来不像这样的大型美丽家中。她是单身，与奶奶住在一起。
33847,UgxQ4obKp7Mzrv-Mbi54AaABAg.8vAAkm2tSd4906664YFNcd,0,3 years ago,"@syncmaster915n - hi, it just goes to show that we were moved. albeit in different directions at times. this is the first comment that i have ever left that i didn't think about before posting, i usually edit a half dozen times in my head and even more times before i pushed the button. i check back now and again to see what people write, but i didn't think about the ""likes"" until i was confronted by an angry person who i decided to ""call out"" for what she was accusing me of doing.
""like""(s) are something i hit on every video i watch, no matter what. so they really didn't mean much, well... that was until i was accused of writing what i did for ""likes"". lol.... i was accused of pushing people to suicide because i liked her""fake"" content and wrote the original comment. 
lol. ... i was going to erase this and not push send, but i thought what the hell.","@syncmaster915n-嗨，它只是表明我们被移动了。尽管有时会朝不同的方向发展。这是我留下的第一个评论，我在发布之前没有考虑过，我通常会在脑海中编辑六次，甚至在我按下按钮之前进行更多的次数。我会不时地检查人们写的内容，但是直到我面对一个愤怒的人，我决定“呼唤”她指责我做什么之前，我才想到“喜欢”。
无论如何，我在观看的每个视频中都打了“喜欢”（S）。因此，他们真的没有什么意思，好吧……那是直到我被指控写我为“喜欢”做的事情。大声笑....我被指控促使人们自杀，因为我喜欢她的“假”内容并写了原始评论。
哈哈。 ...我要删除这一点，而不是推动发送，但是我想到了什么。"
33897,UgxQ4obKp7Mzrv-Mbi54AaABAg.8vAAkm2tSd495yiz8Y5HsD,0,3 years ago,"toortiemie # thank you for this comment, really blows my mind",totriemie＃谢谢你的评论，真的让我震惊
51549,UgwzSBtr2F5v_8xES-54AaABAg,0,4 years ago,"i really like when she shouted on the mountain, quiet, no noise in the city",很喜欢她在山上往下喊的时候，恬静，没有城市的喧闹
36346,Ugw22bSW2TwoxhD3pbx4AaABAg,0,4 years ago,she's a real woman:),她是一个真正的女人:)
35354,UgyfW3HUO31M_vZJrLd4AaABAg,0,4 years ago,"i am so hungry now! everything she made looks so delicious and she made it look so easy even though she was doing a lot of work, it looked so enjoyable. some people are really set up for success. i just would like an opportunity to try everything she made just in this video.",我现在很饿！她制作的一切看起来都很美味，即使她在做很多工作，她也看起来很容易，看起来很有趣。有些人确实为成功做好了准备。我只是希望有机会尝试她在此视频中所做的一切。
36374,UgyfTfyf1Aq4ayWToiJ4AaABAg,0,4 years ago,i really want to live with you.... doing same stuff you are doing everyday...that's real peace,我真的很想和你一起生活。
36384,UgwRwH0iGtHw8Rr3k2t4AaABAg,0,4 years ago,"i want to pet those puppies and the little sheep really bad, they are sooooooo cute",我想宠爱那些小狗和小绵羊真的很糟糕，它们太可爱了
34021,UgxQ4obKp7Mzrv-Mbi54AaABAg.8vAAkm2tSd49KFjxVVCu0S,0,2 years ago,this is not real. i'm shocked. thanks for the positive.,这不是真实的。我感到震惊。感谢您的积极。
36411,UgwcXASF02dAqlMusrx4AaABAg,0,4 years ago,real life disney princess,现实生活中迪士尼公主
33971,UgxQ4obKp7Mzrv-Mbi54AaABAg.8vAAkm2tSd49CqB98VljwF,0,2 years ago,@kegu7133 people live and work and eat from the land..this is how its done..it is their livelihood and way of life..reality..jw.org,@kegu7133人们在土地上生活和工作和吃饭。
35276,Ugz_k7aVy8FMOO66kkt4AaABAg,0,4 years ago,"your mother -in -law really doesn't hurt you in vain. if you are old, you can take care of her. you can see that you are a good mushroom and like every work of you.",你婆婆真的没有白疼你，老了换你来照顾她，看得出，你是个好菇凉 很喜欢你的每一个作品
33941,UgxQ4obKp7Mzrv-Mbi54AaABAg.8vAAkm2tSd49A7Z86o4k1K,0,2 years ago,"sandra saba is not a real life, it is just filming",sandra saba 那不是真实生活，是拍片而已
33928,UgxQ4obKp7Mzrv-Mbi54AaABAg.8vAAkm2tSd498vIBxHfwQ-,0,3 years ago,"so true, only at our dead we will realize, how we have been just running and running and got nowhere, just being used by the system as robots nothing elses. i so much respect her for her courage to come out of this vicious circle of unending chase.",是如此，只有在我们的死者身上，我们才会意识到，我们如何只是跑步，奔跑而无处可去，只是被系统用作机器人什么都没有。我非常尊重她，因为她的勇气从这个无休止的追逐中出来。
51359,UgxcPcRlzbhE5x41piF4AaABAg,0,4 years ago,alright... now i really envy you,好吧...现在我真的很羡慕你
33923,UgxQ4obKp7Mzrv-Mbi54AaABAg.8vAAkm2tSd4986QDrbEPYP,0,3 years ago,"@ingestrauss3826 agreed. the wrong things matter to us too much. material wealth, looking good, being spotless, aiming for millionnaire status, cosmetic surgery to look more beautiful...yet, at the end of the day we all die. at the end of the day our money or looks really don't matter. the simple life is the easiest and most natural for us.",@ingestrauss3826同意。错误的事情对我们太重要了。物质财富，看起来不错，一尘不染，瞄准百万富翁地位，整容手术看起来更美丽……然而，在一天结束时，我们都死了。归根结底，我们的钱或看起来真的没关系。对我们来说，简单的生活是最简单，最自然的。
51337,UgzQiF15CKs-PeQCaLR4AaABAg,0,4 years ago,i really really want to try them,我真的很想尝试它们
36537,UgyY683XVhNCDLjdy6V4AaABAg,0,4 years ago,really great ๐ค—,真的很棒
51317,UgwKFBGX3nYCu82bd614AaABAg,0,4 years ago,"chestnuts are really given the best gifts to humans, fragrant, sweet and pink, so delicious",栗子真是自然赐给人类最好的礼物，又香又甜又粉，实在太美味了
35245,Ugx_Y5-yUdlWRsIajhZ4AaABAg,0,4 years ago,sheโ€s like a real disney princess!,她就像一个真正的迪士尼公主！
36433,UgzNk2P7ygnAYm9fHs14AaABAg,0,4 years ago,"wow, what a wonderful life she is living! kudos to her, including the one whoever handles the camera and editing! it is amazing how she does all these things! i don't knnow if she does it all by herself, but all this preparation must take a long time! love the little animals that surround her, she is a real life princess living the simple life!",哇，她过着多么美好的生活！对她的敬意，包括处理相机和编辑的人！她如何做所有这些事情真是太神奇了！如果她自己做所有的事情，我不会知道她的一切，但是所有这些准备都必须花很长时间！爱她周围的小动物，她是一个现实生活中的公主，过着简单的生活！
52093,Ugw00pZp0l-lDrHPJhp4AaABAg,0,4 years ago,i really like it. make a clip often.,我真的很喜欢。经常制作剪辑。
52177,UgxnXmZcjE992QzhMKR4AaABAg,0,4 years ago,"i really really love your videos. please keep on sharing 
from philippines with love.","我真的很喜欢你的视频。请继续分享
来自菲律宾有爱。"
52196,UgwNDR_ScV9tYHnp03x4AaABAg,0,4 years ago,"wow you preserved all foods it's really awesome....
you have so many offseasonals fruits.
i wish i could also have such a beautiful place like yours❤
love your videos.
lots of love from nepal","哇，你保存了所有食物，真是太棒了。
您有很多休赛期的水果。
我希望我也可以像你这样美丽的地方❤
爱你的视频。
来自尼泊尔的很多爱"
35230,UgyoQ22FTE7CBFzC4qx4AaABAg.8ukF8x1n6m-9MZFCnphpUP,0,2 years ago,"my village is like this, trust me sometimes reality are worse than expectations.",我的村庄就是这样，相信我有时候现实比期望还要糟糕。
51304,UgxTKdS3520i00crUT94AaABAg,0,4 years ago,i really admire and like your video,我真的很欣赏，喜欢你的视频
36519,Ugx0_4Bv93avrZcAFwt4AaABAg,0,4 years ago,where exactly is this place...really want to visit. seems like the most perfect place on earth,这个地方到底在哪里...真的想参观。似乎是地球上最完美的地方
36530,UgzdD3BJh4sJmwhWMP54AaABAg,0,4 years ago,"so much tranquility people!
sleep really live like this ..","这么宁静的人！
睡觉真的像这样。"
52224,UgyyWZJwcccOHb38JCF4AaABAg,0,4 years ago,"i really liked this video, congratulations!",我真的很喜欢这个视频，恭喜！
52226,UgzoezDrzCEUJ5AYqwh4AaABAg,0,4 years ago,"in recent years, i feel that i don't feel much chinese new year,
i don't know why i really feel that the new year is coming after watching ziqi's video, and i am looking forward to this new year this year","最近几年都觉得没什么过年的感觉，
不知道为什么看完子柒的影片后才真的觉得过年快到了，也很期待这次的过年"
51550,UgzU8xmYyVrYDQIyTWV4AaABAg,0,4 years ago,"i really like your videos, and these delicious foods that you make, with your own fruits, very interesting,",我真的很喜欢您的视频，以及您用自己的水果制作的这些美味的食物，非常有趣，
45973,UgxbCuaHshtnTsp5uzJ4AaABAg.8qz6NichbRL8r2BY9tX-Ce,0,4 years ago,"i dont think she really cares about copycats or people re-broadcasting her videos. with 3 to 4 million viewers, it doesnt really matters.",我不认为她真的在乎模仿者或人们重新播放视频。有3至400万观众，这并不重要。
49733,UgwfYuTjPG3t3nrJIz94AaABAg,0,4 years ago,i really liked this video⚘⚘⚘⚘⚘⚘⚘⚘⚘⚘⚘⚘⚘⚘⚘⚘⚘⚘⚘⚘⚘⚘⚘⚘,我真的很喜欢这个视频⚘⚘⚘⚘⚘⚘⚘⚘⚘⚘⚘⚘⚘⚘⚘⚘⚘⚘⚘⚘⚘⚘⚘⚘
37569,Ugzb8zkbZn73Hnj7qIp4AaABAg,0,4 years ago,"i hope you all know that this is a set and that everyone is an actor. i grew up on a real farm in the mountains. no farm is this clean, pretty and cute.",我希望大家都知道这是一套，每个人都是演员。我在山上的一个真正的农场里长大。没有这个干净，漂亮可爱的农场。
42959,Ugw3WZPwUtNzsuTaI7F4AaABAg,0,4 years ago,i really like him ...,好喜欢他……
47150,UgyKrdYyY8P_KzIpveV4AaABAg,0,4 years ago,"a big hello from india, though im truly vegan but i love watching your videos,love the details,the way things are shot, i mean its really very peaceful to watch, and good to know the ancient culture...thumbs up",来自印度的一个大招呼，尽管我确实是素食主义者，但我喜欢观看您的视频，喜欢细节，拍摄方式，我的意思是它真的很安静，很高兴知道古老的文化...
43234,UgxLe1kx71wH2ndLYo94AaABAg,0,4 years ago,"never commented, but considering this friend, you have to say that you are really good. see addict",从未发表评论，但是考虑到这个朋友，您必须说您真的很好。见瘾君子
43182,UgyBibSjmQmdZdLCYp14AaABAg,0,4 years ago,this really good video .. i love the food and music digimon,这个非常好的视频..我喜欢食物和音乐digimon
43141,Ugw30QoaN8jPNYMecjN4AaABAg,0,4 years ago,studio ghibli world in real life,现实生活中的吉卜力工作室世界
47174,UgyZ1eTjdS7iMhN3s2h4AaABAg,0,4 years ago,"this can't be real. nobodies life is that perfect! a very wonderful, well done high quality video!",这不是真实的。 Nobodies的生活就是如此完美！一个非常精彩的高质量视频！
43113,UgwyyLONsSzI4Iyw90h4AaABAg.8rRKab9BgbJ8rSra0riK0b,0,4 years ago,@ahee5527 it's so beautiful there i really wish i could live like this,@ahee5527在那里真漂亮，我真的希望我能这样生活
