,cid,votes,time,含kind,含kind中文翻译
3065,UgxK7tTx9vC9pt59mmJ4AaABAg,634,1 year ago (edited),"as we can see in the videos, the background of the forest, farms, yards, cooking stoves and utensils are real. in the past especially for the chinese people our ancestors work hard on every inch of lands they have. they make use of everything that nature provides to them. generation by generations the land grew flourish. this final generation from baby boomers era (like the grandma) likely the last of their kind, because due to the changes of modern and tech/gadjets world. not many still living up the life just like showed in the video because the generation x,y and z are working and living in cities to find income and mostly leaving the old man/woman at their village. in the end leaving the lands and farms unattended (because grandpa/grandma are already old to work and care the lands).
most end up selling their land and the money the new generation get were invested in businesses, building or renovating house in the cities or in another country, etc. 
as you saw in the video, you can see herbs, clean ponds and rivers, varieties of vegetations, animals like birds, chicken, duck, are well taken care of. these are their daily source of food because there are no supermarket nearby where you can buy from there. thus, why need to buy if you can get it fresh from your own farm? chinese are particular in what they eat (diets and healthy) so they grew herbs, vegetables and live stocks. that is how the baby boomers generation survived along the years away from town or cities. 
the beautiful lady is one of the most impressive grandchild in her family. not just beautiful but also hardworking, diligent, caring and humble because she still carry on her family's tradition and the lands. she learns all sorts of cooking, fermenting, recipes could be mostly from her grandparents which is oustanding. 
i too once lived like hers until i was 19 years old and i loves everything just like hers until my grandma passed away and the land was sold by my uncle that year. 
the memories i had never perish. i still remember the smell in the morning when i'm standing in the middle of the farm, the morning dewdrops on the leaves and grasses, the sounds of birds and water flowing in the small river, the bamboo forests in the evening like golden, chasing gooses, collecting the chicken eggs, collecting the sap from rubber trees, the soothing cold wind on the pepper farm hills, catching grasshoppers among the grasses, catching fireflies at night, the smell of firewood burning while boiling hot water, the food that my grandma used to cooked, my cousin shouting from afar teasing me while plucking potatoes from the ground, etc. i misses all that when i watched the video. 
i did went back to the village a few years ago but it wasnt the same anymore and the place changed alot and the farm wasnt like it used to be like. the peaceful life that i missed.","正如我们在视频中所看到的那样，森林，农场，院子，烹饪炉和餐具的背景是真实的。过去，尤其是对于中国人民，我们祖先在拥有的每一英寸土地上都在努力工作。他们利用自然界提供的一切。几代人的一代人的土地蓬勃发展。来自婴儿潮一代时代（像奶奶一样）的最后一代可能是同类的最后一代，因为由于现代和技术/gadjets世界的变化。 X，Y和Z一代在城市工作并居住在城市中，并大部分将老人/女人留在他们的村庄里，所以并没有多少人像视频中的生活那样过上生活。最后，离开土地和农场无人看管（因为爷爷/祖母已经在工作和照顾土地上已经老了）。
大多数人最终出售了他们的土地，以及新一代获得的资金投资于企业，在城市或另一个国家建造或翻新房屋等。
正如您在视频中看到的那样，您可以看到草药，干净的池塘和河流，各种植被，鸟类，鸡肉，鸭子等动物。这些是他们的日常食物来源，因为附近没有超市可以从那里购买。因此，如果您可以从自己的农场获得新鲜，为什么还需要购买呢？中国人在吃的东西（饮食和健康）中是特别的，因此他们种植了草药，蔬菜和活蛋。这就是婴儿潮一代在远离城镇或城市的几年中生存的方式。
美丽的女士是她家庭中最令人印象深刻的孙子之一。不仅美丽，而且勤奋，勤奋，关怀和谦虚，因为她仍然具有家人的传统和土地。她了解各种烹饪，发酵，食谱可能主要来自她的祖父母，这是罢工的。
我曾经像她一样像她一样生活，直到我19岁，我都喜欢像她这样的一切，直到我的祖母去世，那一年我的叔叔出售了这片土地。
我从未灭亡的记忆。我仍然记得早晨，当我站在农场中间时，早晨的气味，叶子和草地上的碎屑，小河中鸟类和水的声音，傍晚的竹林像金色一样，追逐鸡蛋，收集鸡蛋，从橡胶树中收集树液，在胡椒农场山上舒缓的冷风，在草中捕捉蚱hoppers，在晚上捕获萤火虫，柴火的气味在沸腾的热水时燃烧，食物，我是我的食物。奶奶曾经煮过，我的堂兄从远处大喊大叫，一边从地上摘下土豆，等等。
几年前，我确实回到了村庄，但不再一样，这个地方改变了很多，农场不像以前那样。我错过的和平生活。"
12355,UgyMVioOggs_pNfQW5R4AaABAg,230,3 years ago,"me: wants this kind of life

also me: lazy as hell","我：想要这种生活

也是我：懒惰"
17533,Ugz7qOySXHjdxny0QiZ4AaABAg,190,3 years ago,"i think this is what we call ""inner peace"" - all of us, literally, are desperately pursuing some kind of life like this. it is escapism but not 100 percent, as it is more positive. really really nice, heart-warming video. thank you.",我认为这就是我们所说的“内在和平” - 从字面上看，我们所有人都在拼命追求像这样的生活。它是逃避现实的，但不是100％，因为它更积极。真的很好，令人心动的视频。谢谢。
18791,Ugws-cr34RVZokUlHr14AaABAg,182,3 years ago,what kind of losers would dislike such video? cant figure out.,什么样的失败者会不喜欢这种视频？无法弄清楚。
19039,Ugxx0C0wczLWx2DIaoJ4AaABAg,159,3 years ago,"i just love asian food. last year i visited the philippines for 3 weeks. my next stop will definitely will be japan, china or korea. asian people are so friendly and kind.",我只是喜欢亚洲美食。去年，我访问了菲律宾3周。我的下一站肯定会是日本，中国或韩国。亚洲人是如此友好和友善。
15849,UgzXqMmiTZGBoG3lg7x4AaABAg,135,3 years ago,"as a european, i have never had the tangent with the specific food to the area you are from, what you cook, i call healthy food, all kinds of nutrients and vitamins etc, exactly what the body needs. i really like your lifestyle, even if you do not show it all, but seeing from the big perspective you lead a healthy life, we should take an example from you. greetings from romania :)",作为欧洲人，我从来没有与您来自该地区的特定食物，您烹饪的东西，我称之为健康食品，各种营养素和维生素等，这是身体所需的。我真的很喜欢您的生活方式，即使您不展示所有的生活方式，但是从大的角度来看，您过着健康的生活，我们应该以您的榜样为例。罗马尼亚的问候:)
31539,Ugzonvb4zsPJxUzVih54AaABAg,91,3 years ago,"hello 
i am from manipur,a north eastern state of india 
i would like to say that we have similar kind of lifestyle and food habits 
we also eat this kind of food
love from manipur,india","你好
我来自印度东北部的曼尼普尔
我想说我们有类似的生活方式和饮食习惯
我们也吃这种食物
来自印度曼尼普尔的爱"
2740,UgzEDsZzmYAPNawTzGh4AaABAg,62,1 year ago,"its so nice to watch this kind of videos, because this pandemic limits us to travel places, but because of your video i have the luxury to see your place in my own home and this makes me learn something from your beautiful culture!
and most specially thank you for inspiring me to create countryside life content, love from the philippine countryside ❤️","观看这种视频真是太好了，因为这个大流行使我们限制了旅行的地方，但是由于您的视频，我很奢侈地看到您在自己家中的位置，这使我从美丽的文化中学到了一些东西！
最特别感谢您激发我创造乡村生活内容，菲律宾乡村的爱情❤️"
13283,Ugw7mTzes4Bww0b6NbF4AaABAg,54,3 years ago,"she is so special ,this is the kind of dignity in labour that the early philosophers pontified about",她是如此的特殊
22172,Ugzt5VGHr6znPhq6-k14AaABAg,49,3 years ago,"the first time i saw this film was moved by ""a simple life is a kind of happiness"", thank you.
whenever you watch the films you take, you have an inexplicable sense of happiness.","第1次看到这部影片很感动〝简简单单的生活就是一种幸福〞，谢谢妳。
每每看妳拍的影片就有一种莫名的幸福感。"
14790,UgyX2fojD4McHy5R2l94AaABAg,46,3 years ago,"i miss this kind of life in our province.those kind of foods, the way she cooked thats how we cook our food before its a healthy living. this shows simple life in a province. peaceful and contented with what you have.",我想念我们各省的这种生活。这些食物，她烹饪的方式就是我们在健康生活之前烹饪的方式。这显示了一个省的简单生活。和平，满足于您所拥有的。
21758,Ugy9dqXp8LnX4nH-tM94AaABAg,38,3 years ago (edited),she has every kind of vegetables in her house..,她的房子里有各种蔬菜。
4365,UgyFlsWsHOhC2C22Pe94AaABAg,29,2 years ago (edited),"this is my first time watching her video, i love how they made this kinda content seriously, with great editing. this is the content we need. imagine if local content like this were made from all over the world, how beautiful it gonna be.",这是我第一次观看她的视频，我喜欢他们如何通过精彩的编辑来认真对待这种内容。这是我们需要的内容。想象一下，如果这样的本地内容是由世界各地制成的，那将是多么美丽。
8642,UgwEeceQBwUWUvvNu2p4AaABAg,26,2 years ago (edited),"i used to live at my grandma's house when i was kid, it is located in countryside. watching your video makes me recall my childhood memories. now that my family move to a city, i want to enjoy this kind of nature yet i cant",我小时候曾经住在祖母的房子里，它位于乡村。观看您的视频使我回想起童年的回忆。现在我的家人搬到了一个城市，我想享受这种性质，但是我不能
9131,Ugz2srM7s5meV--7YVl4AaABAg,24,2 years ago,"like this kind of lifestyle, peaceful and quiet.",像这种生活方式，和平与安静。
2783,UgyjokKB5kT-vLggUk54AaABAg.9RPpxXlXsf_9TGliqAjNSs,20,1 year ago (edited),"you would want to live this kinda life for maybe 2months at best then you start missing all the convenience we have today. nobody really wants to do backbreaking work on fields all day with insects and other stuff. raising lifestock is also smelly as heck. don't forget all the mosquitoes and flies.

its also not all that uncommon to get parasites in you.

country life is hard and there are no rainbows.","您希望充其量可以过2个月的生活，然后您开始错过我们今天拥有的所有便利。没有人真正愿意整天用昆虫和其他东西在田野上做艰难的工作。升起的生命力也像Heck一样臭。不要忘记所有的蚊子和苍蝇。

在您里面得到寄生虫并不是那么罕见。

乡村生活很艰难，没有彩虹。"
17850,UgyleL6uGY8mI9t3PUx4AaABAg,16,3 years ago,"the color tone of the film has a lot of credit. i do n’t want to do this kind of farm work under the real color: think about how poisonous the sun is under the cicada, there are a lot of mosquitoes in the ground, and the courtyard of the chickens will not be the yard. there will be animals' feces, and it will be more troublesome to burn the pot and brush the pot. but the artistic conception of the video is very beautiful and yearn for it.",影片色调调的好有很大功劳，真实色彩下这种农活我是一点不想去干的：想想蝉鸣下的阳光有多毒，地里的蚊虫有多多，鸡鸣鹅叫的院子会不会有动物的屎尿味儿，土炕烧锅刷锅多麻烦，算了还是窝在家里吹空调舒服。但是视频展现的意境很美好，向往之。
13354,UgyTPPiVkGNGZRNt4EB4AaABAg,14,3 years ago,"a mysterious video that you can watch for some reason
does human life say this kind of thing?","您可以出于某种原因可以观看的神秘视频
人类的生活说这种话吗？"
6155,UgzYBiokQtpqw0leO7Z4AaABAg,14,2 years ago,why does her videos reminds me of my childhood? the feeling is kinda weird ๐,为什么她的视频让我想起了我的童年？感觉很奇怪
18731,UgzQpRkzQ4SS1A4R3Wp4AaABAg,13,3 years ago,"1:14 this bamboo shoot is larger than my brain, ahaha ~ what kind of you are, what kind of you are",1:14 这个笋子比我脑壳还大，啊哈哈～ 你这个算啥子哦
10655,UgxqSpb3Gk81b3ZvGH54AaABAg.98VupjufjU7993jSt_c0nn,12,3 years ago,"below your comment, this guy @马xe, is one of those who doubt ziqi's videos' reality and firmly believe she has a large group of ppl who help her and train her do all those stuffs. he's one of those haters. i don't know why do they have to say words like this. maybe they are just so jealous. ziqi has pushed another video to explain how did she shot, edit videos and of course farm and cook nearly all by herself(https://www.youtube.com/watch?v=ovoslq-aep8). i just want to remind each ppl with kind heart who watch ziqi's videos. just don't believe every single word of those haters. i was a photographer, i know some techniques of shooting. i can notice some flaws in her video just as she mentioned in the link above, however i choose to ignore them because the entire video is soooo perfect. if she had a group of professional ppl who help her, those mistakes would never happen....definitely.",在您的评论下，这个家伙 @马XE是怀疑Ziqi视频的现实的人之一，坚信她有一大批PPL，可以帮助她并训练她做所有这些事情。他是那些仇恨者之一。我不知道为什么他们必须说这样的话。也许他们真嫉妒。 Ziqi推出了另一个视频，以解释她如何拍摄，编辑视频和当然的农场，并几乎独自烹饪（https://www.youtube.com/watch?v=ovoslq-aep8）。我只想提醒每个PPL，善良的心观看了Ziqi的视频。只是不要相信那些仇恨者的每个单词。我是摄影师，我知道一些射击技术。就像她在上面链接中提到的那样，我可以在她的视频中注意到一些缺陷，但是我选择忽略它们，因为整个视频非常完美。如果她有一群专业人士帮助她，那么这些错误就永远不会发生。
10106,UgzANMaAlqqhuhQW_AR4AaABAg,11,3 years ago,she is just proving genesis where god creates man and put him in a garden and tell man kind it will get all its needs,她只是证明了创世纪上帝创造人并将他放在花园里并告诉人类的创世纪，它将满足所有需求
19073,Ugxx0C0wczLWx2DIaoJ4AaABAg.928Ic4g69m392CulH9zLhK,10,3 years ago,"hi daisy, the absolute majority of them are friendly and kind. please also use common sense to keep yourself safe. good luck in asia.",嗨，黛西，他们中绝对多数是友好而友善的。还请使用常识来确保自己的安全。在亚洲祝你好运。
8071,UgxIa2BUK26ZkulsMjx4AaABAg,10,2 years ago (edited),"growing in a rural area, my hometown (iloilo philippines) i knew almost of the ingredients she uses and seen those in person. the method of how she prepares food is also not a surprise as we do the same thing in my hometown, it's just that the recipe is different. but i love how she promotes classic chinese cuisine๐’
i'm proud being raised in a rural area, being not an 'alien' to these kind of traditional life, tho now i'm working in the city and foreign country..","我的家乡（菲律宾伊洛伊洛）在农村地区生长，我几乎知道她使用的成分，并亲自见到了这些成分。她如何准备食物的方法也不令人惊讶，因为我们在我的家乡做同样的事情，这只是食谱不同。但是我喜欢她如何推广经典中国美食
我很荣幸在农村地区长大，不是这种传统生活的“外星人”，现在我在城市和国外工作。"
16951,UgyNC3YMRklZ5WgbaPZ4AaABAg,9,3 years ago (edited),this woman is amazing. she reminds me of my wife. my wife is korean. she's 54. her mother taught her how to ferment fruits and vegetables from the forest just like this woman does. we live in illinois. my wife loves this spring because we go out into the forest with baskets and collect berries and all kinds of fruits and vegetables. we go back home and my wife she sits on the kitchen for the patio out back and prepares all of the fruits and vegetables to ferment for a year. you haven't tried apple juice until you've had homemade apple juice from apples in the forest. or homemade pure grape juice from grapes in the forest. just one taste of this pure fruits and your body immediately responds to it. it is such a wonderful fresh flavor. it is amazing what fermentation does to plants.,这个女人很棒。她让我想起了我妻子。我的妻子是韩国人。她54岁。她的母亲教她如何像这个女人一样从森林中发酵水果和蔬菜。我们住在伊利诺伊州。我的妻子喜欢今年春天，因为我们带着篮子进入森林，收集浆果以及各种水果和蔬菜。我们回到家，我的妻子她坐在厨房里，将露台放回去，并准备所有的水果和蔬菜发酵一年。在森林中的苹果自制苹果汁之前，您还没有尝试过苹果汁。或来自森林中葡萄的自制纯葡萄汁。只有一种纯净的水果的味道，您的身体立即对其做出反应。这真是一种很棒的新鲜风味。发酵对植物的作用真是令人惊讶。
25824,Ugw9DO2HYEsxbdQXYMp4AaABAg,9,3 years ago,"game grumps sent me! i'm subbing, i love these kinds of videos.",游戏脾气使我寄给我！我正在招募，我喜欢这类视频。
31933,Ugz5SQzSVIB9U4-q1np4AaABAg.8yV2HUWJ-2e8yVXbrQDQOQ,9,3 years ago,"you look at her hands very rough. at first glance, it is the body of the work. i think this kind of often doing farm work. although it looks thin, the strength is definitely not small and the body is healthy.",你看她的手很粗糙，一看就是劳作的身体，我觉得这种经常做农活的，虽然看着瘦，但是力量绝对不小，身体也很健康。
9172,Ugztg3AWD6dCH_KutUp4AaABAg.9AMNSj7YvIf9BCWNiidmsC,8,2 years ago,"@yonglu5864 says this kind of words, who is ignorant?",@yonglu5864 说出这种话，谁才无知呢
33278,UgyNgzSfPXGIZudbv514AaABAg,8,3 years ago,"you are such a good person, your kindness to those old people is truely beautiful",你真是个好人，你对那些老人的好意真漂亮
10268,UgzRKZWNrShSMlevQKl4AaABAg,8,3 years ago,only people that living in provinces who can relate on this kind of life..!,只有生活在这种生活中的省份的人。
13197,UgzyEG-x5DvGQc6TjmB4AaABAg.95vgk7mV1I696HblQ90pZT,7,3 years ago,i think this big team work ! 1 or 2 person can't do this kind of production.,我认为这个大团队工作！ 1或2人不能做这种作品。
26877,UgyIms1hOLaWVF7KU-t4AaABAg,6,3 years ago (edited),"the western media often report that china is a terrible country. the government is very dictatorial, and always bully people, such as hong kong, xinjiang, and tibet. but china is very vast with 56 different nationalities, they also have a lot of social problems, but the government is working hard to solve it and narrow the gap between the rich and the poor, they try to make the chinese live better. i have lived in china for 35 years, the chinese are lovely and kind, they are peaceful, work hard and enjoy life, that's why the chinese love to cooking food so much!",西方媒体经常报告中国是一个可怕的国家。政府是独裁的，总是欺负人，例如香港，新疆和西藏。但是中国非常庞大，有56个不同的国籍，他们也有很多社会问题，但是政府正在努力解决这个问题，并缩小富人与穷人之间的差距，他们试图使中国人的生活变得更好。我在中国生活了35年，中国人既可爱又善良，他们宁静，努力工作并享受生活，这就是为什么中国人喜欢这么多烹饪食物的原因！
2385,Ugy9OSFGVlqSYNwMd0t4AaABAg,6,1 year ago,cant wait to go back to our hometown and have this kind of life too. i miss home!,不能等待回到我们的家乡，也有这种生活。我想念家！
17451,Ugwfj1qUkogV_c2cRmp4AaABAg,6,3 years ago,the advertisements kind of ruin the atmosphere. i wish there were no advertisements on these videos.,广告破坏了气氛。我希望这些视频上没有广告。
23409,UgxBVBYCMS7tNk1AeQh4AaABAg,5,3 years ago,i the kind of life you have... peaceful and bountiful... haaayyysss,我的生活……和平与富裕... haaayyysss
33723,UgyiCmqJ-Iy4o8MxYm94AaABAg,5,3 years ago,"i am always surprised how many different kinds of fresh foods you have on your land. it is great. 
thank you for making this lovely dish. also greetings to grandmother","我总是惊讶于您在土地上有多少种不同种类的新鲜食品。太好了。
感谢您制作这道可爱的菜。也向祖母问候"
33737,UgztOIkTepGJIhCTZqZ4AaABAg.8yUZ6-yKGlG8yUjW_qpUAc,5,3 years ago,she's a one of a kind woman. she deserves a one of a kind man.,她是一个善良的女人。她值得一个善良的人。
9437,Ugz1kYWQlRw1T-kH_nB4AaABAg,4,2 years ago,"iโ€m really hoping that she has a significant other that loves her and cherish her a lot. when i see someone that is as talented, kind, and overall a great person like her. i just want someone else to take care of her as she takes care of her grandma. maybe she is better off without the significant other. but for me, i just want that.",我真的希望她有一个重要的其他人爱她并珍惜她。当我看到一个有才华，善良且总体上像她这样的好人时。我只希望别人照顾她，因为她照顾奶奶。如果没有重要的另一个，也许她会更好。但是对我来说，我只想要那个。
13600,UgzL7SDZT3dRWnVUwKd4AaABAg,4,3 years ago,i don’t enjoy cooking shows and i don’t eat weird food (i’m more of a steak-and-potatoes-kind-a-guy) but that river snail soup does look damn good!!,我不喜欢烹饪表演，也不喜欢吃奇怪的食物（我更像是牛排和果仁奶酪 - 葡萄酒），但是那条河蜗牛汤看起来确实很好！
6411,UgyI9nz4i_lbbPOJ4YZ4AaABAg,4,2 years ago,the current society that is not named by the world is too abominable in this kind of life.,响往这种与世无争的生活 为名为利的现今社会太可憎了
28331,Ugy-UfRsD7_JQ46ukqx4AaABAg,4,3 years ago,"part of the reason why i enjoy watching these videos so much is that they remind me of how things used to be when i was little. granted, i am not a girl from china living on a vast farm like she does, but i did have a small place in kentucky where we took care of ourselves and harvested our own food like this. it's nice to see that there are some people out there who still take a moment to do things in a more old-fashioned kind of way.",我如此喜欢观看这些视频的部分原因是，它们使我想起了我小时候的情况。诚然，我不是一个像她那样生活在一个庞大的农场上的中国女孩，但是我确实在肯塔基州有一个很小的地方，我们在这里照顾自己并像这样收获了自己的食物。很高兴看到那里有些人仍然花点时间以一种更老式的方式做事。
