,cid,votes,time,含fresh,含fresh中文翻译
28432,Ugz7czQhlv9uFsXKmLF4AaABAg,0,3 years ago (edited),wow very amazing the fruits and vegetables are very fresh ...watching from philippines,哇，非常新鲜的水果和蔬菜很新鲜...从菲律宾观看
28006,UgwvjZ_mdJXrg2521AR4AaABAg,0,3 years ago,how could she cooked like that? still looking gorgeous and fresh! ๐,她怎么能这样做？仍然看起来华丽又新鲜！
26603,Ugz4x9jZf79qtb1MNMB4AaABAg.8zkpfxZ3kEy9J6UkLilop0,0,2 years ago (edited),"see the room clean and fresh, feel like reborn right? same feeling with u ๐ and yr simple change also inspired many other people. great job man! proud for u from china ๐จ๐ณ",看到房间干净整洁，感觉像重生对吗？您和您的简单变化也同样启发了许多其他人。好人！从中国为你感到骄傲
26572,Ugz4x9jZf79qtb1MNMB4AaABAg.8zkpfxZ3kEy9DpQmdUizzm,0,2 years ago,"makes me wonder who pays your bills? in my world you need to be fresh and ready for work, organized to get roof under your head and something in the fridge....",让我想知道谁支付您的账单？在我的世界中，您需要新鲜并准备好上班，并组织起来，以使屋顶在您的头部下方，并在冰箱里放东西。
25691,UgzFLeO5AgDXzPOM6Zp4AaABAg,0,3 years ago,it's such a nice feeling waking in a place like that where everything is fresh. her grandmother is so lucky to have her. โค๏ธ,在像一切新鲜的地方一样，这真是一种醒来的感觉。她的祖母很幸运能拥有她。 ❤️
24694,UgyJhRBSpSxgB_JaDg94AaABAg,0,3 years ago,"it literally heaven, its fresh fruit everywhere !!!! :o",它实际上是天堂，到处都是新鲜的水果！ ：o
24467,Ugwk9BZV_p0IVZMjww54AaABAg,0,3 years ago,very organic fresh life ๐ฅฐ,非常有机的新鲜生活
23170,UgwsVp3ji-_bbYi3t1x4AaABAg,0,3 years ago,wow i want to go here..all fresh....,哇，我想去这里..所有新鲜....
21657,UgwQUCFH8fgWkpPIyLt4AaABAg,0,3 years ago,watching first week of 2020 i love the way i see because full of relaxing and also they can refresh the stress .,看着2020年的第一周，我喜欢我的看法，因为充满了放松，他们也可以刷新压力。
20620,UgySZgti40b2dFva_Hh4AaABAg,0,3 years ago,she have so many delicious food. i feel refresh watching this video. so good to relieve stress.,她有很多美味的食物。我感到刷新观看此视频。很好地减轻压力。
20527,UgwOFxwlvSq1s_XQiTZ4AaABAg.94RXQDsetyV94chuEObqbf,0,3 years ago,"haha, like this in the countryside, just eat the freshest ones",哈哈，在乡村里都是这样呀，就吃最新鲜的
20525,UgzuzeNeoiLMLgrnGVV4AaABAg,0,3 years ago,chestnuts are the bomb and even better fresh,栗子是炸弹，甚至更好
20028,UgwKGZ95R36mV-Oye5p4AaABAg.95-oZca4Gvc95-ox1J6RDK,0,3 years ago,nature fresh meals๐,大自然新鲜餐
52891,UgyMTzz-9AnpUZwnTUN4AaABAg,0,4 years ago,always refreshing and mind blowing videos,总是令人耳目一新
