,cid,votes,time,含woman,含woman中文翻译
45756,Ugw99ATdOTpfSLjz_BB4AaABAg.8r0DpRagQy88r2qjpS-XVj,0,4 years ago,"@razerblade9508 oh give it a rest. there have been precedents to this. china won't be exactly surprising the world by posting propoganda videos, just go on google and watch them for yourselves. 
my query was just that, a query. not an accusation. to which you vociferously agreed btw. talk about hypocrisy. it will be very pleasant to me if these turn out to be just videos by a woman who is talented. but looking at the quality of the videos, i know there's a crew working for her. i don't know whether it's propoganda or not. but i hope it isn't. so think before you type.","@razerblade9508哦，休息一下。有先例。通过发布宣传视频，只需使用Google并亲自观看它们，中国就不会使世界完全奇怪。
我的查询就是一个查询。不是指控。您对此表示赞同。谈论虚伪。如果这些事实只是一个才华横溢的女人的视频，那对我来说会非常愉快。但是看着视频的质量，我知道有一个船员为她工作。我不知道是否是宣传。但是我希望不是。因此，在输入之前先三思。"
3071,Ugwjy0LTKiFynzNzcM94AaABAg,0,1 year ago,what is the stupid woman doing here?! only foolish guys follow suits here!,愚蠢的女人在这里做什么？只有愚蠢的家伙在这里效仿！
45500,UgxwpEkNCHxYHUUx34N4AaABAg,0,4 years ago,this woman worked in that video more than me in a whole year!,这个女人在整整一年都比我在那段视频中工作了！
45476,UgztJNUe99V93OwvQzJ4AaABAg,0,4 years ago,hard working woman... with nature.. love it.. so sweet.,努力工作的女人...与大自然..爱它..如此甜蜜。
45460,UgzLGZlYBysODFvwi_N4AaABAg,0,4 years ago,wow !!! its like 1 woman corporation - she can do it all <3 !!!!,哇 ！！！它就像1个女人公司 - 她可以做到这一切<3 !!!!
45455,UgzlFlzg_bhuO1y5B0F4AaABAg,0,4 years ago,that woman is an example to follow. release cell phones and work.,那个女人就是一个榜样。释放手机和工作。
45229,Ugz9OIbFjNt5cjpdYPJ4AaABAg,0,4 years ago,"this woman is really in the heavens, there is no world. it is also",此女子真乃天上有，人间无。是也
45011,Ugww4X3j0j2UiwgpWOV4AaABAg,0,4 years ago,"dude, is there anything this woman doesn't know how to do?",杜德，这个女人不知道该怎么做吗？
45008,Ugzk_gjwJOyQHZn3T7R4AaABAg,0,4 years ago,beautiful superwoman,美丽的超人
44940,UgymdRZu-pE8F1gqPg54AaABAg,0,4 years ago,"serious people are the most beautiful, let alone such a beautiful woman. the life of the original ecology is the possibility of being yearning for the current person to be so seriously enjoyed.",认真的人最美丽，更别说是这么一个美丽的女子。原生态的生活是现在代人所向往的可能做到如此程度，这么认真享受，，，，真心叹服
44918,Ugz-cx1WqrUPwDiEEIB4AaABAg,0,4 years ago,"assalam alaykoum, i'm so glad today sending you these words, i'm from an other culture, morocco, i like absolutely everything you do, you work too much, you live in an incredible environement, you're really a great woman..
big respect for you madam..
i'll be very glad if you contact me, and more happy if you decide someday to visit my country, you'll be my gest. thank you for everything.","Assalam Alaykoum，我很高兴今天向您发送这些话，我来自其他文化，摩洛哥，我绝对喜欢您所做的一切，您的工作太多了，您生活在一个令人难以置信的环境中，您真的是一个很棒的女人..
对你夫人的极大尊重..
如果您与我联系，我会非常高兴的，如果您有一天决定访问我的国家，您会很高兴，您将成为我的最新信息。谢谢你为我做的一切。"
44774,UgxPfJOhvEkWyI24FRF4AaABAg,0,4 years ago,this is not a woman! it's an angel,这不是女人！这是一个天使
44631,UgwysOJ0rHdwZS_DyUN4AaABAg,0,4 years ago,"helpful, beautiful, kind, work, a really admirable woman.",乐于助人，美丽，善良，工作，一个非常令人钦佩的女人。
3153,UgyTH5djRCCPEkwrPAF4AaABAg,0,1 year ago (edited),"i understand the appeal of her videos because they portray an idealized version of a life that stopped existing for most of us generations ago. especially in china where so many have moved from these settings to cities where the jobs are. i can appreciate it while also realizing she is a multimillionaire with a production team behind her to make these things. they are far too professional for a rural woman with an iphone. just because she isn't some simple country girl and this is all staged doesn't mean it isn't wonderful to watch as long as you can separate the fantasy from the reality. the reality of rural life isn't a lovely dream; it's a hard life that most of us wouldn't prefer if we had to live it on a daily basis. she shows an idealized version of the good parts, which is fine for what it is: a fantasy for the cameras. american media does this, too. we elected a fool for president because of a reality show that portrayed him as something he is not.",我了解她的视频的吸引力，因为他们描绘了一种理想化的生活，这在我们大多数人几代之前都停止了。特别是在中国，许多人已经从这些环境转移到工作所在的城市。我可以欣赏它，同时也意识到她是一名千万富翁，在她身后有一个制作团队来制作这些东西。对于拥有iPhone的农村妇女来说，他们太专业了。仅仅因为她不是一个简单的乡村女孩，这一切都在上演并不意味着只要您可以将幻想与现实区分开来，这并不是一件好事。乡村生活的现实不是一个可爱的梦。如果我们每天必须过上它，这是我们大多数人不喜欢的艰难生活。她展示了优质零件的理想化版本，这对它的本质很好：摄像机的幻想。美国媒体也这样做。我们当选为总统的傻瓜，因为真人秀将他描绘成他不是的东西。
44537,UgxPpjw-5xhSiWMKnjp4AaABAg,0,4 years ago,"i don't know what it is, but the woman is pretty
♡","我不知道那是什么，但是女人很漂亮
♡"
44478,Ugw9QmQauYms5Ig8xRB4AaABAg,0,4 years ago,there are this strange woman in the world,世上竟有此奇女子
44397,Ugz3z_hI3UV4vQGkZ-14AaABAg,0,4 years ago,she is a very hard-working woman.,她是一个非常勤奋的女人。
44243,UgyA-7I40KFXCEramTB4AaABAg,0,4 years ago,you are great chef. you are amazing woman.,你是伟大的厨师。你是很棒的女人。
44098,UgxAgPg2L9aJE42QA2B4AaABAg,0,4 years ago,"wow i'm in love with your skill i wish i had girlfriend like you
who would become a perfect woman","哇，我爱上了你的技能，我希望我有像你这样的女朋友
谁会成为一个完美的女人"
3228,UgwJK620mEqlq7lr2L54AaABAg,0,1 year ago,why is that woman ugly?,为什么那个女人很丑？
44010,Ugx6Wzah_zyXEA_H3Ut4AaABAg,0,4 years ago,"very skilled woman, i wish her all her life is doing well",非常熟练的女人，我希望她一生都过得很好
43963,UgyvKoorfoOBM6bxBz54AaABAg,0,4 years ago,"if i had a woman like this, we could rule the world!",如果我有这样的女人，我们可以统治世界！
3527,UgyoK24sHBBdG3WMjCt4AaABAg,0,1 year ago,you must be the happiest woman on earth,你一定是地球上最快乐的女人
43862,UgwSfT44Cquaq0r9TnV4AaABAg,0,4 years ago,i don't understand how anyone could not like this...love watching this woman cook,我不明白有人不喜欢这样...喜欢看着这个女人做饭
43837,Ugys83aD0ruCGcrac-V4AaABAg,0,4 years ago (edited),"almost all woman from east cooks food for husband and her family everyday.. sometime, it is very tired but.. happy when realizing our husband n children back to home and eat the foods together happily..",东部几乎所有女人每天都为丈夫和她的家人做饭。
9726,UgyocxsR202i9r_0kvJ4AaABAg.9GukARbN8zo9H5xSI9FRRr,0,2 years ago,"needlewoman pancakes ours, all hands of a craftswomanose",针刺薄煎饼，我们的手工艺都是手工艺的手
36462,UgzD-j-kdAMSLQgr1Ep4AaABAg,0,4 years ago,don't get me wrong but hey if i would ever dream of a woman from heavens it would be like you <3,不要误会我的意思，但是嘿，如果我梦想着一个来自天堂的女人，那就像你<3
37316,UgxgmCWxshhZDR1FVT14AaABAg,0,4 years ago,i have seen two channels so far that actually makes me wanna go make a home in a village and be a perfect woman like her! listen working in an office is cool n all until you see these videos t~t,到目前为止，我已经看到了两个频道，实际上我想在一个村庄里回家，成为一个像她这样的完美女人！在办公室里工作很酷，直到您看到这些视频T〜T
25582,Ugzo1GwMDFe0t6pI8XF4AaABAg,0,3 years ago,i love watching this woman. cook well. not much to say. the video quality is very good. not boring watching video videos. continued success.,我喜欢看这个女人。煮好。没什么可说的。视频质量非常好。观看视频视频不会无聊。继续成功。
27009,UgytoADga1YV3fmneu94AaABAg,0,3 years ago,"for a woman who did so much of tough works, her fingers are surprisingly soft and pretty. 
i am not saying the video itโ€s total fake, but it is definitely scripted, very well written each steps, and the camera shooting were above professional, i am not surprised if thereโ€s a professional team behind this video, and a much older experienced person to teach her how to do. and she probably had some experiences of her own and she learnt quick, she was pretty skillful in the video you can see. but the quality of the filming, the flow make it hard to believe that thereโ€s no golden production team behind its making","对于一个做很多艰苦工作的女人来说，她的手指令人惊讶地柔软而漂亮。
我并不是说视频是完全假的，但是它肯定是脚本的，每个步骤都写得很好，而且相机拍摄均高于专业，如果此视频背后有专业团队，我并不感到惊讶，还有一个老年经验丰富的人来教她怎么做。她可能有自己的经历，她学得很快，她在您可以看到的视频中非常熟练。但是拍摄的质量，流程使很难相信其制作背后没有黄金制作团队"
27000,Ugxqh1-sb87Ecaxcf5N4AaABAg,0,3 years ago,what an amazing woman!!,多么了不起的女人！
26957,UgxESoWe4o--oblzpyl4AaABAg,0,3 years ago,just idial woman who likes,只是喜欢的女性
26813,UgxNE_HRbgh4R09HRY54AaABAg,0,3 years ago,needlewoman,针女
16122,Ugyupu-waFK7-YB79i54AaABAg,0,3 years ago (edited),this woman is amazing. she just goes goes goes... never stopping. is there anything she can't do. totally inspiring. ❤️,这个女人很棒。她只是走了...永不停止。有什么她不能做的吗？完全鼓舞人心。 ❤️
16124,UgyvmThG3EofIla3I9l4AaABAg,0,3 years ago,the old woman is there to do anything hahahaha xdddddd,老妇人在那里做任何事情哈哈哈xdddddd
25961,UgwQamd1--BO3ncK3zF4AaABAg,0,3 years ago,how does one woman do so much wok and cook in a day?,一个女人一天如何做这么多的炒锅和做饭？
25955,UgyZTWK0pRkWj9kLHft4AaABAg,0,3 years ago,i love you and the woman of the dream.,我爱你和梦的女人。
16272,Ugw8ygialT5WkXvb-CR4AaABAg,0,3 years ago,she is very hardworking woman,她是非常勤奋的女人
25896,UgyYCFlFqe609TGbwoF4AaABAg,0,3 years ago (edited),is a very good woman i really like it. i really like it and fall in love.,是一个很好的女人我真的很喜欢。我真的很喜欢它，坠入爱河。
25857,UgxmZ6Gi8I4dAYhAsgV4AaABAg,0,3 years ago,"she is the strongest woman,nothing can defeat her.",她是最坚强的女人，没有什么能打败她的。
16291,UgxifAndneMr0BKfdcR4AaABAg,0,3 years ago,amazing woman.is there something she cnt do?:),令人惊叹的女人。她在那里做什么？:)
25589,UgxlM-owbMjZvMJBlv94AaABAg,0,3 years ago,amazing woman. them bars with fruit looked good.,了不起的女人。他们的水果棒看起来不错。
25577,UgzXWvvVtZaoxWIh-DB4AaABAg,0,3 years ago,is this the same super woman who built her own house from scratch ? the setting and that oven looks familiar .,这是从头开始建造自己的房子的那个超级女人吗？设置和烤箱看起来很熟悉。
28621,UgzJTLeXPEi2LgOpHZ54AaABAg,0,3 years ago,she is a noble woman her husband is so bless,她是一个高贵的女人，她的丈夫是如此的祝福
16645,Ugz-K-ue4R34ZMFuiEh4AaABAg,0,3 years ago (edited),what does i relax to see her collect that .. what picked up all this? ... what is this the type of woman that one would heal i get married if i definitely get married with her xd,看到她收集到什么，我放松一下。。。。。。。。。。。
25512,Ugwd6TAyw6rcUNVzQ-p4AaABAg,0,3 years ago,amazing woman. she has goodies that will last a lifetime. no need to go grocery. yummy ๐๐๐,了不起的女人。她的好东西可以持续一生。无需去杂货。美味
25439,UgxbaYXoBnq7Qj2Eopl4AaABAg,0,3 years ago,"wow, don't have to buy. this woman is so good.",哇，不必买。这个女人真好。
16901,Ugz8GR2tq2UnOrRmm7J4AaABAg,0,3 years ago,this woman doesn't even give food to the dogs,这个女人甚至没有给狗的食物
25104,UgzHxn_zQEtdEZFrmdV4AaABAg,0,3 years ago,"beautifool hause, nice subjekt everywehere, wonderfool wood pots, i like it... this woman is very very handsome, and precise,much much much chili, .. this is too irriteted the stumach, it is?",Beautifool Hause，Nice Subjekt Everywehere，Wonderfool Wood Pots，我喜欢...这个女人非常漂亮，非常精确，很多辣椒。
25100,Ugxfzb6CoSbvZu6Lsx14AaABAg,0,3 years ago,super woman,超级女人
17055,UgxXeDzQoVTY7AV_lPR4AaABAg,0,3 years ago,"you realize, she’s like a barbie doll version of a woman from the bible. she’s a propaganda version of what men want. i mean someone had to teach her all that stuff. it’s really a nice short film about a wholesome girl that just great, clean, pretty, can cook anything and never looks tired.",您意识到，她就像圣经中的女人的芭比娃娃版本。她是男人想要的宣传版本。我的意思是有人必须教她所有这些东西。这确实是一部很好的短片，讲述了一个有益健康的女孩，这个女孩很棒，干净，漂亮，可以做任何东西，而且永远不会疲倦。
17087,UgxLXfrDRRNVxjsaiaV4AaABAg,0,3 years ago,what a woman and this jesus.,那个女人和这个耶稣。
24975,UgzAf7gB4LpTBTXYrpt4AaABAg,0,3 years ago,"pretty
it's pretty
want to have
everyday life, not play
too coveted woman
who is living with these women?
pour out","漂亮的
好漂亮啊
想要有
日常生活，不玩
太垂涎的女人
谁和这些女人一起生活？
倒出来"
24901,UgzKA-a5Y47rMWU-N8x4AaABAg,0,3 years ago,"what a powerful woman, god bless you",多么强大的女人，上帝保佑你
17174,Ugy0eelmI9pzks9Dkcd4AaABAg,0,3 years ago,"this is the one you call wonder woman. the woman who can cook n make delicious dish, food decoration, know about technology, simple and strong. i wan to to visit her, when i go to china",这是你称之为《神力女超人》的人。可以做饭的女人做美味的菜肴，食物装饰，了解技术，简单而强壮。当我去中国时，我想去拜访她
24801,Ugxmy0KGd-pzdLPXveZ4AaABAg,0,3 years ago,"bitch is not a woman, but a dream !!!",bit子不是女人，而是一个梦想！！！
24761,Ugy_4rEaA9oDnj9-fEV4AaABAg,0,3 years ago,where do this woman watched her word๐,这个女人在哪里看她的话
27056,UgxMUF8tecDdhUx1m2Z4AaABAg,0,3 years ago,you just look at a sweet hat from the old woman!))),您只看老妇的甜帽子！））））
16013,UgwAtUIdnEhNCE2qgg54AaABAg.99-uElEI0N89A7PBjrA4RJ,0,2 years ago,a proverbs 31 woman,谚语31女人
27152,Ugy_ahs4wqqDriMYyLl4AaABAg,0,3 years ago,"cinderella. how much work is it necessary to create such a garden and garden, a beautiful and hardworking woman โฅ",灰姑娘。创建这样的花园和花园，一个美丽而勤奋的女人需要多少工作♥
27176,UgwddFADA1pjV_XQW_F4AaABAg,0,3 years ago,i like the woman who cooks. i love you.,我喜欢做饭的女人。我爱你。
28602,UgwvlmBEZVybrDm7ujx4AaABAg,0,3 years ago,"this woman knows how to do just anything and everything. she knows how to forage, cook and preserve food, she knows how to make beautiful furnitures from bamboos, she knows embroidery, she knows how to sew and dye a dress, she knows how to make strings from her sheep's wool and i've only watched like 3 of her videos??? most of us go to universities to learn only one of those skills??? what????",这个女人知道如何做任何事情。她知道如何觅食，做饭和保存食物，她知道如何用竹子制作美丽的家具，她知道刺绣，她知道如何缝制和染色，她知道如何用绵羊的羊毛制作弦看着她的3个视频？？？我们大多数人都去大学学习其中一种技能？？？什么？？？？
14400,UgyHzJ_hrf1mba2eNPN4AaABAg,0,2 years ago,this is a woman,这是一个女人
28449,Ugz4SmxedyIOi2Giv0F4AaABAg,0,3 years ago,"the most beautiful woman
sound of spatulating grinding
the puppy's coquettish voice","最美的女人
锅铲磨差的声音
小狗撒娇的声音"
14571,UgwaUjU20DCtzppAHnZ4AaABAg,0,2 years ago,thats a total wife material woman right there,多数民众赞成在那一位妻子的材料女人就在那里
28337,UgzAzcNVSm4F4RDXSdB4AaABAg,0,3 years ago,"she beautiful, this is a woman in good dream. i love girl.",她美丽，这是一个梦dream以求的女人。我爱女孩。
14649,UgyyADTK_2uPDL8Aw6t4AaABAg,0,2 years ago,a professional chef in the field deserves the prize for the best woman thank you and god bless you,该领域的专业厨师值得获得最好的女人的奖项，谢谢你，上帝保佑你
14772,Ugx2KwwN4_4_ARSxloh4AaABAg,0,2 years ago,i love this woman.,我爱这个女人。
28111,UgzAGWtyNQ2ZVWvVk8d4AaABAg,0,3 years ago,"everything was so pretty, until i hit the! puppy! ๐  that was not pretty until that young woman's delicate arrived """,一切都很漂亮，直到我击中！
14859,UgzFTMB3L7nqTvbumAx4AaABAg,0,2 years ago,you are too woman bless you god,你太女人祝福你上帝
28062,Ugxp2QPv_RhQMAQC2Ux4AaABAg,0,3 years ago,"nice to meet you ๐€

i am japanese.

this person is addicted to seeing a video that breaks bamboo and watching it.

how old is this woman? i'm curious.

i registered the channel ๐€","很高兴认识你

我是日本人。

这个人沉迷于看一段视频打破竹子并观看它。

这个女人多大了？我很好奇。

我注册了频道"
28056,Ugy2Y22Rt_9mKnScx7Z4AaABAg,0,3 years ago,liziqi please marry me! you are the woman i have always dreamt of. the life you live i finally realize is the life i long for.,liziqi请嫁给我！你是我一直梦dream以求的女人。我终于意识到的生活是我渴望的生活。
28029,Ugyeo5AefwRKJHXP85l4AaABAg,0,3 years ago,god! what a tireless woman !!! makes everything!!!!,上帝！多么不懈的女人！！！做一切！！！
27986,UgxlR5-zEMoJ2_jVeSV4AaABAg,0,3 years ago,a truly hardworking woman,一个真正勤奋的女人
27920,UgzfNply7Bnh9QT90Sx4AaABAg,0,3 years ago,"this.... can't be real, right? i mean, it's beautiful and super enjoyable, don't get me wrong, but there's no way one woman can do all this and film it/edit it so beautifully?",这个....不能真实，对吗？我的意思是，它很漂亮，超级愉快，不要误会我的意思，但是一个女人无法做所有这些并将其拍摄/编辑如此精美吗？
14927,UgyoKqd49pIY8x0f6zB4AaABAg,0,2 years ago,woman i was looking for,我在寻找的女人
27870,UgzwQag6kQtH2fRF4YN4AaABAg,0,3 years ago,hi..!..i like to watching your stories so much and you are a beautiful and very smart woman.๐๐๐‘๐‘๐‘๐‘๐‘๐น๐น๐น๐น๐น๐‘๐‘๐‘๐‘,嗨..！..我喜欢看你的故事，你是一个美丽而又非常聪明的女人。
14998,UgzzBvluW2W7z55ecB14AaABAg,0,2 years ago,i wish i had a wife like this woman.,我希望我有一个像这个女人这样的妻子。
15310,Ugx-rAhdMLCKNe3R9o54AaABAg,0,3 years ago,as a woman who must have a family,作为一个必须有家庭的女人
27696,Ugy5lOWZA_1upz7iMQJ4AaABAg,0,3 years ago,my god is a woman prepares some food delights makes everything this beautiful woman ..,我的上帝是一个女人准备一些食物的美食，这使这个美丽的女人的一切。
15508,Ugxk2LAm3th7llmen1F4AaABAg.99WYoclmxVE99WtIzerT9d,0,3 years ago,"awesome, she seems can do anything by her self , from cooking, gardening, farming, raising animal, makes handcraft, even editing video can be done by her self too. such a talented woman",太棒了，她似乎可以自己做任何事情，从烹饪，园艺，耕种，养育动物，制作手工艺，甚至编辑视频也可以由自己完成。如此才华横溢的女人
15520,UgzUMRiGqevOp5EdXK94AaABAg,0,3 years ago,beautiful woman,好美的女人
15589,Ugz6Crq1rQZ_uHYCX094AaABAg.99RvttOnJ2p9AXXe8en0iO,0,2 years ago,"lindsey rubenstein actually it’s just her, the camera man, and one other woman. she only added them a year ago, her videos were made completely by her before that. sure, some of it is stages, but the majority is just her life",林赛·鲁本斯坦（Lindsey Rubenstein）实际上只是她，摄影师和另一个女人。她仅在一年前添加了它们，她的视频是完全由她制作的。当然，有些是阶段，但大多数只是她的生活
27555,UgzUUJ34N5Rwr926mm94AaABAg,0,3 years ago,"it is a very talented, happy woman and a man who marries you.",是一个非常有才华，快乐的女人和嫁给你的男人。
27539,UgwOqvBZhfTRX1hRsLd4AaABAg,0,3 years ago,"no, no, mashallah in the country, the most hardworking woman i have seen in her life, ๐‘ we are, but let's eat and drink and take a selfie :)",不，不，马沙拉（Mashallah），我一生中见过的最勤奋的女人，
27391,UgwoBK95SLTCe-m60uJ4AaABAg.8zKMCb-XwpB96-jdPFYYdP,0,3 years ago,"she would be hard not to fall in love with, she is truly a woman of proverbs 31.",她很难不爱上，她确实是一个谚语的女人31。
15637,Ugz2QytR4LNECPnf0Kh4AaABAg,0,3 years ago (edited),my god what a beautiful young woman.,我的上帝多么美丽的年轻女人。
15937,UgypeJ3NP-ZQxytiRNN4AaABAg,0,3 years ago (edited),"you are so desirable
you always seem to be correct to my stomach. i really want to have a woman like you, not a woman like you, i would rather be exactly","你是如此可取
你似乎总是对我的胃是正确的，我确实希望有一个像你这样的女人，而不是像你这样的女人，我宁愿你完全"
24701,UgxmTK9LDpVFByAahrN4AaABAg,0,3 years ago,i love you very much i am algerian woman ๐‘ฉ,我非常爱你，我是阿尔及利亚女人
17190,Ugy0eelmI9pzks9Dkcd4AaABAg.986t1CB_VLa987juBsaHI5,0,3 years ago,"sorry dear, a wonder woman is the one who takes care of the kids, does have time for her spouse, goes to work, makes time for her friends and maybe even volunteers a bit. this girl is hypnotic and these videos r mind-blowing but lets get some proportions:):)",对不起，亲爱的，一个神奇女侠是照顾孩子的那个人，确实有时间去找她的配偶，去上班，为她的朋友们甚至志愿者提供时间。这个女孩是催眠的，这些视频令人震惊，但让我们得到一些比例:) :)
24533,Ugyf1tpR3qh-DNKK6dx4AaABAg,0,3 years ago,"this woman shows, what is life about. please appoint me as your assistant or adopt meโฅ๏ธโฅ๏ธโฅ๏ธ",这个女人表明生活是什么。请任命我为您的助手或收养我♥♥♥资址♥♥♥
21781,UgzCl3KZ0_dcze1RUjZ4AaABAg,0,3 years ago,what beauty of a woman that is efficient is to everything is a great cook it is seen that everything that affirms it with pleasure and love i loved for my wife ๐๐๐๐๐๐๐๐๐๐ค—๐ค—๐ค—๐ค—,一个高效的女人的美丽是一切都是一个很棒的厨师，看到一切都以我喜欢我妻子的愉悦和爱肯定它的一切
18499,UgxinmyMHfJXPmkfBc14AaABAg,0,3 years ago,this woman knows more than me! i would like to visit her,这个女人比我了解更多！我想拜访她
21698,Ugy4Emq5j4dTQIpIBJJ4AaABAg,0,3 years ago,she is small but she is really strong woman,她很小，但她真的很坚强
18545,UgzMUdFbll8HVIrINIJ4AaABAg,0,3 years ago,this is superwoman right here !,这是超级女子！
21658,UgzvI0zo_ny0Wjhp9H54AaABAg,0,3 years ago,i am so confused?!?!?!?! who is this woman???,我感到很困惑？！？！？！？！这个女人是谁？？？
18660,UgwbLfWuPUWHN9ThEv94AaABAg,0,3 years ago,"really fucking disgusting, this also adds advertising, disgusting woman.",真的很令人作呕，这也增加了广告，令人恶心的女人。
18680,UgzT0fMekAKAHZblfp94AaABAg,0,3 years ago,"who are the damn 21,000 who did not enjoy a pacific life and pure energy of this super woman chinese.","谁是该死的21,000人，他们不享受这个超级女性中国人的太平洋生活和纯粹的能量。"
21307,UgxW2SDl80SIQu0muAN4AaABAg,0,3 years ago,i won't ever marry unless it's a woman who is capable of this life ๐คท๐พโ€โ๏ธ,我永远不会结婚，除非是一个有能力终身的女人
18778,UgydA5_GxGiaSQ0GHq94AaABAg,0,3 years ago,who is russian + in hp this is a like woman,谁是俄罗斯 +惠普（HP）
