,cid,votes,time,含heaven,含heaven中文翻译
9643,UgwsFV9cxgvP5uRBXmZ4AaABAg.99mkur8G6R69BZHVjRVlCH,0,2 years ago,"yes, sichuan (ๅๅท๏ผhas the nickname of heaven, and its literal meaning is four rivers because si(ๅ๏ผis four and chuan(ๅท๏ผis river. liziqi and i share the same hometown, which is mianyang (็ปต้ณ๏ผand it means south of milan mountain because yang is south and yin is north.",是的，四川（（四川）有天堂的昵称，其字面意义是四河，因为Si（（四）是四河，而Chuan（川）是河流。Liziqi和我共享同一家乡意味着米兰山以南，因为杨在南方，Yin向北。
14543,UgzFdYpgLVdbKRgBWmR4AaABAg,0,3 years ago,"incredible! having unknown vegetables, extraordinary cooking tools, images and extraordinary quality music: everything is beautiful! heaven can ...
incroyable! une sorte de monde merveilleux avec des légumes inconus, des instruments de cuisine extraordinaires, des images + musique d'une qualité remar quable: tout est beau! le paradis peut être ...","难以置信！拥有未知蔬菜，非凡烹饪工具，图像和非凡品质的音乐的美好世界：一切都美好！天堂可以...
Incroyable! Une sorte de monde merveilleux avec des légumes inconnus, des instruments de cuisine extraordinaires, des images + musique d'une qualité remarquable: tout est beau! Le Paradis peut être..."
24854,Ugz1BmcEnXhr-sypoFF4AaABAg,0,3 years ago,its heaven ...love this type of life..metrocity life is soo boring.,它的天堂...喜欢这种生活。。。。。。。。。。。。。。。。。。。。。。。。。。。。。
14129,Ugx3I3xz180q6TkGGKh4AaABAg,0,3 years ago,"with so many comments, what is the people of the great power of the heavenly dynasty?",这么多评论，我天朝大国之人何在
14033,UgxgP_PLQ-8jS2L_uDB4AaABAg,0,3 years ago,what a wonderful place to live with someone you love.. its like heaven.. you nid not to worry about what is happening in this world.,与您所爱的人一起生活的好地方。它就像天堂..您不必担心这个世界上正在发生的事情。
9833,UgywT_GMo0uQfbsNRT94AaABAg,0,3 years ago,is she living in heaven ๐,她住在天堂
13796,Ugz0Y2p06AeIsRovFCN4AaABAg,0,3 years ago,knya do the village sy masaanax..how to do it and the heaven almost sma good bgt definitely x ..,Knya做村庄Sy Masaanax ..如何做，天堂几乎是SMA好BGT肯定X ..
13712,UgzLTd1HMpwAs2y8SdJ4AaABAg,0,3 years ago,i live in heaven.,我住在天堂。
13639,UgwsNVP764HIV7YQg6F4AaABAg,0,3 years ago,your life is heaven,你的生活是天堂
13339,Ugw4uciVL3ahmMOqtlF4AaABAg,0,3 years ago (edited),"with that lady ! foods seemed to be like heaven . growth your own vegetable , raised your own livestock, cooked your food from your garden and farm. 
beautiful living .","和那个女士！食物似乎就像天堂。生长自己的蔬菜，饲养自己的牲畜，从花园和农场里煮食物。
美丽的生活。"
10267,Ugz1CApkJ8V-yhR2sJR4AaABAg,0,3 years ago,"my dear nymph lives in heaven, we ask you to shoot a video to explain how to make a stove.",我亲爱的若虫，住在天堂，我们请您拍摄一个视频，说明如何制作炉灶。
10863,UgzGEJhD_japRZSsbcd4AaABAg,0,3 years ago,sighit'slikeyouralreadylivinginheaven,sighit'slikeyouraldreadlivinginheaven
16230,UgzAaAML9y3kP2s-h5J4AaABAg,0,3 years ago,"what have i discovered, a crazy new place called hell on earth, really meaning heaven on earth.



this ladie, really knows how to live her life and take care of her grandma, dang bruh, these kids'l kill a bitch rather than taking some god damn, fucking leaves.



this ladie, is just so fucking dope bruh, i'm smacked, i've been smacked all day. ""ay bruh, what more can a man ask for"", you feel me.







but man, rip [juice wrld] - bruh, i wish u were still here, i was tryna hangout wit u, one day cuz ,'




nah, yeah, nd rip [xxxtentacion] - i hope hes doing good up in heaven, . they all died way too young and way before their time. some doing things that could've just been prevented.




but yeah bruh, i'm smacked, and i hope you have a good night.","我发现了什么，这个疯狂的新地方叫做地狱，确实意味着地球上的天堂。



这位女士，真的知道如何过上她的生活，并照顾她的祖母，Dang Bruh，这些孩子杀死了一个bit子，而不是拿起该死的神，他妈的叶子。



这个女士，真是太他妈的涂料了，我被打了，我整天都被打了。 “嗯，一个人还能要求什么”，你感觉到我。







但是，伙计，rip [juice wrld] - 布鲁，我希望你还在这里，我是tryna gotnagout wit u，有一天，因为




不，是的，nd rip [xxxtentacion] - 我希望他在天堂做得好。他们都死了太年轻，而且在他们的时间之前。有些人在做可以预防的事情。




但是，是的，布鲁，我被打了，希望你过夜。"
9635,UgwsFV9cxgvP5uRBXmZ4AaABAg.99mkur8G6R69AJntl2ITBc,0,2 years ago,tita vaughns no itโ€s not thing like that. we call there โ€heavenโ€ since ancient time just like someone said montreal is little paris,泰塔·沃恩斯（Tita Vaughns）不，不是那样的事情。我们称那里为“天堂”，因为远古时代就像有人说蒙特利尔是小巴黎
16402,Ugzh1lJ1iaoKvh0xrj94AaABAg.92voVh6WAp292wgF2aL99e,0,3 years ago,"brother taiwan hates the heavenly dynasty, so he hates everything in the dynasty, so his eyes are blinded, and you turn a blind eye to see beautiful things. don't you think it's sad to live in hatred?",兄台你痛恨天朝，所以痛恨天朝的一切，于是双眼被蒙蔽，对美好的事物视而不见。你不觉得一直活在憎恨中很可悲？
16571,UgxGikxEsSfdvAnnAXd4AaABAg,0,3 years ago,earth is the heaven that we overlooked.,地球是我们忽视的天堂。
24408,UgxWyDPCqqaNZu1AAPp4AaABAg,0,3 years ago,"really heaven of the earth your home town 
i also want to live this life","真的是地球上的天堂，您的家乡
我也想过这辈子"
24355,UgxiG_jsAaxiJW32hot4AaABAg,0,3 years ago,what is this right to heaven,天堂的权利是什么
24044,UgxG58v9EZs0pXbGrS54AaABAg,0,3 years ago,is she living in heaven garden....?where she can find all her cooking needs..... i jst luv.... and jst dream of living in that garden.... with fresh...... air...... food....,她住在天堂花园....？她在哪里可以找到她所有的烹饪需求.....我jst luv ....而JST梦想着住在那个花园里....新鲜.....空气...食物...
8674,Ugy30w5mEPwXmcgwWgV4AaABAg,0,2 years ago,"what a life, no degree race no job prob, no traffic issue, no late home coming tension, no cinema tickets queue, no zinger no big mack, no fries no artificial life, no tv no politics tensions, no satanic culture, just pure simple and tension free heaven's life. ahhh i can just imagine for me",多么多的生活，没有学位的没有工作概率，没有交通问题，没有晚期的紧张局势，没有电影票队列，没有Zinger没有大麦克，没有薯条，没有人造生活，没有电视政治紧张局势，没有撒旦文化，只是纯粹简单无力的天堂的生活。啊，我可以想象我
8829,UgzK4JmTmPFPTr8vPAF4AaABAg,0,2 years ago,heaven ! ! !,天堂！呢呢
23334,Ugy89zxW2gvVmN6Ispx4AaABAg.8zlq1w5JXOH8zpIxM70Z95,0,3 years ago,"so am i, feel like a heavenly art.",我也是，感觉就像是天上的艺术。
23094,UgyKFp7AQ7uqJ_3DcFR4AaABAg,0,3 years ago,this is heaven on earth.,这是地球上的天堂。
23081,UgwdMOfTAJ5rhpI10Vl4AaABAg,0,3 years ago,she does it again - sharing a window into heaven. what are we doing wasting our lives in the rat race - for nothing?,她再次做 - 分享进入天堂的窗户。我们在浪费我们的生活中的生活是什么 - 一无所有？
23007,Ugw3jbhmQHpou7dCCnB4AaABAg,0,3 years ago,where does she live? heaven?? it looks so beautiful and everything is around her,她住在哪里？天堂？？看起来很漂亮，一切都在她身边
22102,UgwD3WXsyODi5CIufm94AaABAg,0,3 years ago,you bring a heavenly feeling to the dining table...thank you for inspiring specially me!,您为餐桌带来了一种天堂般的感觉...谢谢您特别激发了我的启发！
21158,UgxF5RhAOKV2TqSjtVZ4AaABAg,0,3 years ago,amazing. so fantastic .like a heaven all u need's have,惊人的。太棒了。就像天堂一样，你需要的是
20645,Ugz0HdTG-Kc9Bd9JOFZ4AaABAg.90frsqbFNBE91BEHNZnsrE,0,3 years ago,"she is a fairy in heaven, no one is worthy of her",她是天上的仙女，没有哪个配得上她
19443,UgwfnCXYc9samOmZPpp4AaABAg,0,3 years ago,girls who are good at heaven,擅长天堂的女孩
8941,UgxS27vk1fiRbSzBU5N4AaABAg,0,2 years ago,truly heaven,真正的天堂
17910,UgwlMcPAIEKRT2Oygxp4AaABAg,0,3 years ago,that woman is a spiritual guide from heavens,那个女人是天上的精神向导
17853,UgykALmftToD6r-CuiB4AaABAg,0,3 years ago,how come this heavenly video got more than 10k dislike?! i mean... i believe even alien species would appreciate seeing a video contains so much nature inside.,这个天上的视频怎么会超过10k的不喜欢？我的意思是...我相信即使是外星物种也会喜欢看到一个视频中包含很多自然。
1312,Ugz02Qr92gHJ7F0eQAV4AaABAg,0,1 year ago,my god in heaven you are absolutely gorgeous,我在天堂的上帝，你绝对是华丽的
17346,UgxFJjCXk_uCv4Wzn3F4AaABAg,0,3 years ago,"chinese cuisine is a bridge between heaven and humans, and the world is alone.",中国美食，是上天与人类沟通的桥梁，独步天下。
9364,UgyXINFFtQb_wIUno-t4AaABAg.9AE0SQlMR7S9Aok08K2iWO,0,2 years ago,"this is exactly what i said too, she's รฎn heaven, but some weirdos say she's living in a drama like place..i see no drama, just beauty and rich habitat with everything one can wish for !",这正是我所说的，她是天堂，但是有些怪异的人说她生活在戏剧中。我看不到戏剧，只有美女和丰富的栖息地，拥有人们想要的一切！
1121,UgxtsWmEdOOFTX-XrQl4AaABAg,0,1 year ago,"https://youtu.be/yzeuh4zgkfi
frequency and subscribe to my youtube channel heaven taste","https://youtu.be/YzEUh4ZgkFI
频并订阅我的 youtube 频道天堂品味"
