,cid,votes,time,含heaven,含heaven中文翻译
18265,Ugz0HSm7t2DGvsE_jfR4AaABAg,434,3 years ago,no cooking channel or modern chefs are as good as she. she's an angel from heaven.,没有烹饪渠道或现代厨师和她一样好。她是天堂的天使。
23351,Ugz9HI_zDPTo0uC3k5J4AaABAg,252,3 years ago,"when heaven showered beauty and talents, she caught them all!",当天堂淋浴美丽和才华时，她抓住了所有人！
9620,UgwsFV9cxgvP5uRBXmZ4AaABAg,184,3 years ago,"i now understand why sichuan (where liziqi lives) is also called ""heaven (ๅคฉๅบ tianfu)"" in chinese.",我现在明白了为什么四川（Liziqi居住的地方）也被称为“天堂（天府田富）”。
15249,UgywEsMS8N-cs2bqxTN4AaABAg,117,3 years ago,who ever marry this lady will find heaven on earth,曾经嫁给这位女士会在地球上找到天堂
16282,UgzGo8lfYU11R34rFF54AaABAg,103,3 years ago,she's in heaven ?,她在天堂吗？
13964,Ugzx14y_FjkeN_Nyv7R4AaABAg,47,3 years ago (edited),a 7 year-old boy told me: liziqi is the gift from heaven.,一个7岁的男孩告诉我：利兹奇是天堂的礼物。
9342,UgyXINFFtQb_wIUno-t4AaABAg,45,2 years ago,her channel just started coming up for me i'm loving this young lady she's in heaven โค๏ธ๐,她的频道刚刚开始为我出现，我爱这个小姐她在天堂❤️
16893,Ugx4K_sgIyFjgU699ZF4AaABAg,24,3 years ago,this is what i imagined heaven would look like. this is heavenly!,这就是我想象的天堂。这是天堂！
33124,UgxU8sHB2LekqzQgAud4AaABAg,17,3 years ago,heaven is a place on earth right where you live!. i admire your beautiful lifestyle filled with nature's abundance! always making full use of the resources. thank you for all the videos that brightened our life!,天堂是您居住的地球上的一个地方！我欣赏您充满大自然的美丽生活方式！始终充分利用资源。感谢您的所有启发我们生活的视频！
23572,UgxX1MKDT7B0IWzMaf14AaABAg.8zfpS_f3W7x8zrs-LPVWMR,16,3 years ago,"to clear up your confusion, i will tell you that it’s sent directly from the edge of heaven. i hope that explains everything.",为了消除您的困惑，我会告诉您，它直接从天堂的边缘发送。我希望这可以解释一切。
9157,Ugzles7utrIYwnyB4RN4AaABAg,15,2 years ago,"i now understand why sichuan (where liziqi lives) is also called ""heaven (ๅคฉๅบ tianfu)"" in chinese.",我现在明白了为什么四川（Liziqi居住的地方）也被称为“天堂（天府田富）”。
9135,UgxfZGWrlWvdO6E-l814AaABAg.9APD1y8AgAS9AojaTdWDgj,13,2 years ago,"drama ? it looks like heaven to me, everything รฎs natural and green all around her, what more one can wish for, beautiful nature, rich habitat...",戏剧 ？在我看来，它看起来像天堂，周围的一切都自然而绿色，一个人想要的东西，美丽的大自然，丰富的栖息地...
6488,Ugz6Mm7W8BC9ohgB4p94AaABAg,11,2 years ago (edited),i love the infinity water running thru the bamboo tubes. it's sound so heavenly! i wanna have my spa there with all the herbs and the flowers as my scents and massaged with honeycomb or essential oils from the flowers. then have a sip of my cup of hot rose or ginseng tea. ๐๐,我喜欢通过竹管运行的无限水。听起来很天堂！我想将我的水疗中心与所有草药和花朵一起放在那里，并用蜂窝或花生的精油按摩。然后喝一杯我的热玫瑰或人参茶。
15860,UgySX8Icw77rxDQt0iV4AaABAg,8,3 years ago,"my grandfather had lands like this, not as heavenly looking, but the times i spent there were the best of my life. i miss passing by the days gathering fruits and seeds. it was so magical.",我的祖父有这样的土地，而不是天上的看，但是我在那里度过的时代是我一生中最好的。我想念那天聚集水果和种子的日子。太神奇了。
3771,Ugw2r0Qx2SiZT9TCTvp4AaABAg,7,2 years ago,"the god of kissing the earth. the hostess decorates and complements this heavenly land. like a bee working from dawn to dawn, clever, beautiful. live long. the project is wonderful.",亲吻大地的上帝。女主人装饰并补充了这片天堂般的土地。就像从黎明到黎明工作的蜜蜂，聪明，美丽。长命。该项目很棒。
17681,UgxC0EF_6wnpzQ5G7YF4AaABAg,6,3 years ago,where is this paradise? looks absolutely heavenly.,这个天堂在哪里？看起来绝对是天堂。
33306,Ugx5gjMlXyAci7wZBmR4AaABAg.8yUctLSaRRC8yUo9y9p2Qu,5,3 years ago,she belongs in heaven.,她属于天堂。
12705,UgwCEfUryNnDSFbjS4B4AaABAg,4,3 years ago,"she cooks like an angel, and the house she lives in is a real heaven",她像天使一样做饭，她住的房子是一个真正的天堂
33674,UgxCxoNZS4muJdxzohR4AaABAg,4,3 years ago,the way you live is amazing! it's like being in heaven! i am also struck by the quality of the shooting and the audio! congratulations from italy!,您的生活方式真是太神奇了！就像在天堂一样！射击和音频的质量也让我感到震惊！恭喜意大利！
27199,UgzyK0rw1VxjXSpxtz94AaABAg,3,3 years ago,her mountain land really has all kinds of wonderful edibles and plants. heaven on earth !,她的山地确实有各种各样的美食和植物。天上人间 ！
14566,UgzGJkA1_05JZiiafKl4AaABAg.947wSBzYSTb94kaOedeLvu,3,3 years ago,"tala taptap for you, that's your heaven. your heaven isn't the same heaven for everyone else.",Tala Taptap给您，那是您的天堂。您的天堂对其他所有人来说都不一样。
34187,Ugw9BEF1PyJR8qA2BCd4AaABAg,3,3 years ago,heaven i don't no but this girl living in this area that is called heaven confirm .,天堂，我不是没有，但是这个生活在这个被称为天堂的女孩确认。
7810,Ugxc-VcKN6lFYlrU5BZ4AaABAg,3,2 years ago (edited),she is living in heaven.i just wanna live with her..will you merry me liziqi.๐๐๐๐,她住在天堂。我只是想和她住在一起。
24966,UgyWJyuYDdLJPtXSW0V4AaABAg,2,3 years ago,"this is an angle, living in heaven. amazing....",这是一个生活在天堂的角度。惊人的....
26713,UgxD8jmQXsF7LdYpsE54AaABAg,2,3 years ago,it is healing! i think i came to heaven ^^ i feel stable,它正在治愈！我想我来到天堂^^我感到稳定
27413,Ugyp98V4ewmct70GbYR4AaABAg,2,3 years ago,"so fresh..
after work all day..then our wives cook like this..heaven..","好新鲜..
整天下班后..然后我们的妻子这样做。"
6121,UgxHh-p4TX8Fm2KQ9OF4AaABAg,2,2 years ago,"her life is like heaven
i wish i could have a part like that","她的生活就像天堂
我希望我能像这样"
30041,UgxQ4_Cmi-G_yz0HkYp4AaABAg,2,3 years ago,those heavenly dreamy lotus flowers ....!!!,那些天上梦幻的莲花花.... !!!
14567,UgzGJkA1_05JZiiafKl4AaABAg.947wSBzYSTb94l2R97Lp6y,2,3 years ago,"tala taptap i humbly appreciate you giving your time explaining your perspective of heaven, so thank you (: however that is not the case for others. while you strongly believe about your ""heaven"" i believe its only fair to respect others beliefs, whatever it may be. everyone goes through different types of unfortunate circumstances, and everyone goes through depression differently. while it may have worked on you, may not work on others.",tala tappap我谦虚地感谢您给您的时间解释您对天堂的看法，所以谢谢（：但是，对别人而言并非如此。虽然您坚信自己的“天堂”，但我相信尊重他人信仰的唯一公平可能是。每个人都经历了不同类型的不幸情况，每个人都以不同的方式经历抑郁症。尽管它可能对您有用，但可能对他人不起作用。
12372,UgygGphu6PgOX7YaItl4AaABAg.96jNsXWiWzz97M_lXurOMB,1,3 years ago,poptart io seriously what kind of a sick person would dislike this grace from heaven!,Poptart io认真地说，有什么样的病人会不喜欢天堂的恩典！
25119,Ugyu100yc_UWXEErAhV4AaABAg.8z81w0-jNYd8zIJZY3Y5pc,1,3 years ago,"mixture of smoke pork bamboo shoot n a lil fermented beans...
feels heaven","烟猪竹子的混合物n lil发酵豆...
感觉到天堂"
25840,UgzH8-q6b8HFI5Htdb94AaABAg,1,3 years ago,how did the camera person manage to get the permission film heaven?,相机人如何设法获得允许电影天堂？
25992,UgxfmBrhnJ6Hp8XGbTt4AaABAg,1,3 years ago,"ii'm sorry i can't speak english. 
material 
of the video 
much 
with skills 
much 
with food 
much 
with charm 
the place 
beautiful 
life 
that is happy 
like heaven on earth.","我很抱歉，我不会说英语。
材料
视频
很多
有技能
很多
带着食物
很多
有魅力
这个地方
美丽的
生活
那很高兴
像地球上的天堂。"
30624,Ugy2WEfcS4nGHGoH1dF4AaABAg,1,3 years ago,yr place is heaven....,您的地方是天堂。
35032,Ugytbgx1xts4CkpNV3V4AaABAg,1,3 years ago,so... the heaven is real!,所以...天堂是真实的！
6384,Ugw13z31ZkXrWP2V6Tl4AaABAg,1,2 years ago,"frankly, i wished that i lived this life between nature, healthy food and simplicity, god willing, in heaven, lord",坦率地说，我希望我在自然，健康食品和简单性之间过这种生活，上帝愿意在天堂，主
9641,UgwsFV9cxgvP5uRBXmZ4AaABAg.99mkur8G6R69B5WXajCWpR,1,2 years ago,"โ€ @titavaughns7698 in china, sichuan is called tianfu because of its fertile land, rich products and pleasant climate

in history, the ""land of abundance"" mainly refers to the sichuan basin, not including the present western sichuan plateau and southwest sichuan mountains. the sichuan basin is rich in land, mild climate and abundant rainfall. especially after the dujiangyan water conservancy project was built in the qin dynasty, the chengdu plain became the ""land of heaven"" in which ""water and drought follow people's will, and they don't know the famine"". therefore, chengdu plain has become a very developed area of agriculture and handicraft industry in chinese history, and has become the main food supply base and the main source of taxation in the central dynasty ""tianfu""","@titavaughns7698在中国，四川之所以被称为田富

在历史上，“丰富的土地”主要指的是四川盆地，不包括现在的西川高原和西南四川山。四川盆地富含土地，温和的气候和丰富的降雨量。尤其是在杜吉安（Dujiangyan）的水保护协会项目建于秦朝之后，成都平原成为“天堂之地”，“水和干旱遵循人们的意志，他们不知道饥荒”。因此，成都平原已成为中国历史上农业和手工业的一个非常发达的领域，并已成为中央王朝“天富”的主要食品供应基础和主要税收来源"
11456,UgykhYqeX1RFmQqsCEB4AaABAg,0,3 years ago,heaven,天堂
27306,UgweIpJIJRNVLzgSEed4AaABAg,0,3 years ago,she is living in the heaven,她住在天堂
28997,UgxCpRiDGzrwuzVOfl94AaABAg.8yY6-41Td1g9Fxg0pf1GQR,0,2 years ago,heaven,天堂
28669,UgxCpRiDGzrwuzVOfl94AaABAg.8yY6-41Td1g92ghYHhACni,0,3 years ago,"she enjoys the heaven of nature everyday,one thing only she has to do is producing videos.and she is rich enough to buy anything.
you i and the others have to work hard everyday ,your boss blames you everyday.and when we go to the market for something ,the prices scare us and let us forget those.","她每天都喜欢大自然的天堂，只有她要做的一件事就是制作视频。
您和其他人每天都必须努力工作，您的老板每天都会责怪您。"
28293,Ugw0ng88auBqj2KZ3dt4AaABAg,0,3 years ago,"you too need to cover up a little bit more. and please just don't eat pork. it is forbidden meat.. like a forbidden fruit... when you take it, you will be out from the heaven.",您也需要掩盖更多。而且请不要吃猪肉。它是禁忌的肉..就像禁止的果实...当您拿走它时，您将从天堂出来。
28175,UgzA4ERF7z3I61LsKAF4AaABAg,0,3 years ago,who sub z heaven,谁亚Z天堂
28054,UgxLNeFlCHIJv-12MvV4AaABAg,0,3 years ago,heaven,天堂
27593,UgznvxtzrBsGczr25_94AaABAg,0,3 years ago,"wow, this must be what heaven looks like.... #sweetserenity",哇，这一定是天堂的样子.... #sweetserenity
27591,UgxhOLD3xLClZlX6pJV4AaABAg,0,3 years ago,this is my heaven,这是我的天堂
6306,UgyFdhbWHCZe1PyLh2V4AaABAg.9Eu8AizLBF89F0Odp_YK1Z,0,2 years ago,"@dropperknot yeah i forgot to post a video on those people who are faithful going to the church and participating in the holy communion , surely they will inherit a long and lasting life in heaven, god bless ๐‘",@dropperknot是的，我忘了发布一段视频，介绍那些忠于去教堂并参加圣餐的人，他们肯定会继承天堂的漫长而持久的生活，上帝保佑
27229,UgwS8uNe437fDZPMu4J4AaABAg,0,3 years ago,bamboo shoot+pork=heaven,竹芽+猪肉=天堂
29735,UgxdtOHd7v1ZRzWOIPt4AaABAg,0,3 years ago,this must be heaven on earth ...such beauty ..your so very fortunate to be able to live as you do,这一定是地球上的天堂...这样的美丽..您非常幸运能够像您一样生活
27226,UgwU4N8oDnyzTey6pbF4AaABAg,0,3 years ago,you live like in heaven,你像天堂一样生活
6371,Ugzt25Jvd4kL3HqXfll4AaABAg,0,2 years ago,nature is real heaven โค๏ธ,大自然是真正的天堂❤️
27076,UgxcMWphGp_AxLAvbed4AaABAg,0,3 years ago,enjoy while eating food in a lush garden and heaven,在郁郁葱葱的花园和天堂吃食物时享受
26976,Ugwq_jgdyG-yFma-t7x4AaABAg,0,3 years ago,that is so good. this is a god of heaven.,太好了。这是天堂的神。
26370,Ugyw03U9T_5-CRk36pp4AaABAg,0,3 years ago,you are from heavens for sure,您肯定来自天堂
6398,UgyD87_9HBdg4Z4agC94AaABAg,0,2 years ago,"feels like you are living in the heaven.. you are a product of film industry, your job is a natural actress.. sick of the same movies picking up veggies and fruits all over the world.. same movies every year..",感觉就像您住在天堂中。.您是电影业的产物，您的工作是一位天生的女演员。.厌倦了全世界的蔬菜和水果的相同电影。每年相同的电影。
7109,UgynPJSJ_uJds5u3RTV4AaABAg,0,2 years ago,is she living in heaven?,她住在天堂吗？
25237,UgzGPSOuIzOrpY2tu-Z4AaABAg,0,3 years ago,heaven.....,天堂.....
7140,UgyFH9oQHKiepRsMr_N4AaABAg,0,2 years ago,"it was really moved after watching it. i thought that when i was a child, i went to the home of the country โ€s grandmother. relatives took us to the mountains and water to grab ingredients to pick the fish and pick the field snails. intersection
grandma has long been in heaven, and relatives have also moved to the city to make a living, oh! continue to be a cities township!","看了真是感动，想到小时侯去乡下外婆家，亲戚带我们上山下水采食材抓鱼捡田螺，回家料理一番，大伙大吃一顿，晚上在虫鸣蛙叫下睡了香香的！
外婆早就上天堂，亲戚们也都搬到都市谋生，唉！继续当个城市乡巴佬！"
29204,Ugxn96NF0uo_zo3h-dN4AaABAg,0,3 years ago,are you life in heaven?,你在天堂里生活吗？
29904,Ugx0DX1JKD6PtRIk2fl4AaABAg,0,3 years ago,hi lizi.. new subscriber here. . ... finding your channel was like finding heaven on earth.. sending you all love! ♥️,HI Lizi ..这里的新订户。 。 ...找到您的频道就像在地球上找到天堂。 ♥谢
8020,UgyOZF-6cwP_96BKNJh4AaABAg,0,2 years ago,heaven is here,天堂在这里
2759,UgxOwOaZrkaxBvx-1KB4AaABAg,0,1 year ago,"a heaven, divinity comes down in dews from these plants, and this life....",天堂，神性落在这些植物的露水中，这一生。
35022,UgzaCjszgg-6zJmQODV4AaABAg,0,3 years ago,queen of heaven,天堂女王
34377,UgwBw1LCNQ99OaOq6bt4AaABAg,0,3 years ago,is the place heaven?or is she an angel?,是天堂吗？还是她是天使？
1645,UgxwmUBRb5tn0vfvRHR4AaABAg,0,1 year ago,"don't be afraid of physical darkness, you must be afraid of spiritual darkness. you must prepare for the spiritual darkness right now.

- yeshua coming -

this world is a material world. it is a visible world. but there is an invisible world. it is the spiritual world.

god created the visible physical world and the invisible spiritual world.

the physical biological eye and the spiritual eye are different.

in this world there is light and darkness. even in the spiritual world, there is light and darkness.

physical darkness in this world simply requires turning on the light, but spiritual darkness must turn on the spiritual light. it is an invisible light, there is no way to know what this spiritual light is. yeshua is light and life.

god has shown me many visions for a long time. when communism progresses, christians are the first to get rid of. the first thing to be removed is yeshua god.

god has long given me the message that spiritual darkness is coming. a great persecution of christians is coming. global persecution is coming.

that is why the brides of yeshua who truly believe in yeshua must always keep the spirit of martyrdom very firmly.

believing in yeshua is not free. belief in yeshua includes suffering, persecution, and even martyrdom because of believing in yeshua.

from now on, you must prepare yourself for spiritual darkness.

now is not the time to depend on a large church and depend on the pastors, elders, deacons, priests, prophets, and missionaries. salvation is a one-on-one and consistent relationship with god, and by the grace of god, you can go to heaven, far out of the universe.

no matter what title you have in this world, that title is absolutely not a ticket to heaven. no one on this earth knows where they are going under god's judgment until they see each other with their eyes in heaven.

i recommend that you have a one-on-one private conversation with god. now is the time to have more one-on-one personal conversation with god.

our bodies are holy temples. your body is the holy temple, holy, clean, pure, with righteous acts, love, faith, and true repentance, daily to be covered, washed, anointed and covered with the blood of yeshua.

when the persecution of christians begins, the world will soon be arrested even if you say ""yeshua"" on the phone.

you must be very spiritually awake right now. this is a time when you must be very tense spiritually.

when christian persecution comes, no one in this world can depend on anyone, anywhere in the world. when spiritual darkness comes, the fear is all over the air. that is why you will not be able to read the word, worship, or pray in the name of yeshua any more.

you must prepare for the spiritual darkness now. you must become spiritually strong now and become a powerful rooster. you must now prepare and have the faith to keep your faith in yeshua in any situation and environment.

weak faith does not even count as faith. you need to be a strong rooster. you should read the bible now. from genesis to revelation, it is 85 hours long and you can read it all. if you don't understand the part, just skip it after reading it, and you don't have to understand 100% of the bible.

only when the word of god is filled with you, no body can be deceived you in this world.

those who deceive are attacked by quoting only a very small part of the bible very cleverly.

i recommend that you read the entire book of holy bible from genesis to revelation.

you must download all the necessary videos from yeshua coming channel if you need, and hide them together with the bible. above all else, it is most important to keep it hidden in your heart.

because if you hide it in your heart, no one in this world can dig it out.

prepare for spiritual darkness now. become a powerful rooster right now.

only yeshua!","不要害怕身体上的黑暗，您必须害怕精神上的黑暗。您现在必须为精神上的黑暗做准备。

-Yeshua来了 - 

这个世界是一个物质世界。这是一个可见的世界。但是有一个看不见的世界。这是精神世界。

上帝创造了可见的物理世界和无形的精神世界。

物理生物学和精神眼睛是不同的。

在这个世界上，有光明与黑暗。即使在精神世界中，也有光明与黑暗。

这个世界上的身体黑暗仅需要打开光线，但是精神上的黑暗必须打开精神光。这是一个看不见的光，无法知道这种精神光是什么。耶稣是光明和生命。

上帝已经向我展示了很多愿景。当共产主义进步时，基督徒是第一个摆脱的人。要删除的第一件事是耶稣神。

长期以来，上帝给了我这样一个信息，即精神上的黑暗即将到来。对基督徒的迫害即将到来。全球迫害即将到来。

这就是为什么真正相信Yeshua的Yeshua的新娘必须始终坚定地保持难度的精神。

相信Yeshua不是免费的。由于相信Yeshua，对Yeshua的信念包括痛苦，迫害甚至难。

从现在开始，您必须为精神上的黑暗做好准备。

现在不是时候依靠大型教会，依靠牧师，长老，执事，牧师，先知和传教士。救赎是与上帝的一对一关系，而是靠上帝的恩典，您可以去天堂，远离宇宙。

无论您在这个世界上拥有什么头衔，这个标题绝对不是天堂的门票。地球上没有人知道他们在上帝的审判下要去哪里，直到他们用眼睛在天堂看到对方。

我建议您与上帝进行一对一的私人对话。现在是时候与上帝进行更多一对一的个人对话了。

我们的身体是圣殿。您的身体是圣殿，圣殿，圣洁，清洁，纯洁，具有正义的行为，爱，信仰和真实的悔改，每天被覆盖，洗净，膏抹，并被耶稣的血覆盖。

当迫害基督徒开始时，即使您在电话上说“ Yeshua”，世界也很快就会被捕。

您现在必须在精神上很清醒。这是您在精神上必须非常紧张的时候。

当基督教迫害来临时，这个世界上没有人可以依靠世界上任何地方的任何人。当精神上的黑暗来临时，恐惧无处不在。这就是为什么您将无法再以Yeshua的名义阅读单词，崇拜或祈祷的原因。

您必须为现在的精神黑暗做准备。您现在必须在精神上变得强大并成为强大的公鸡。现在，您必须准备并有信心在任何情况和环境中保持对耶稣的信心。

虚弱的信仰甚至不算作信仰。您需要成为一个强大的公鸡。您现在应该阅读圣经。从创世纪到启示，它长85小时，您可以阅读全部。如果您不了解该部分，请在阅读后跳过它，而不必了解圣经的100％。

只有当上帝的圣言充满你时，在这个世界上，任何人都不会被你欺骗。

那些欺骗的人只能非常巧妙地引用圣经的一小部分来攻击。

我建议您阅读整本《圣经》从创世纪到启示的书。

如果需要，您必须从Yeshua Coman Channel下载所有必要的视频，并将它们与圣经一起隐藏。最重要的是，将其隐藏在您的心中是最重要的。

因为如果您将其隐藏在您的心中，那么这个世界上没有人可以将其挖掘出来。

现在为精神黑暗做准备。现在成为一个强大的公鸡。

只有Yeshua！"
34170,UgwCRgvCCW4MEzKtS2Z4AaABAg,0,3 years ago,"everytime i watch your videos, i was like ""ugh! heaven!""",每当我观看您的视频时，我都会像“嗯！天堂！”
34080,Ugw4iYvvMf8zRCGkZml4AaABAg,0,3 years ago,i absolutely love bamboo! that bamboo forest is like heaven!,我绝对喜欢竹子！那个竹林就像天堂！
1791,UgxUWyA0kwyDTjjO6Yp4AaABAg,0,1 year ago,my dream is to live in those heavenly made places.,我的梦想是生活在那些天上的地方。
33619,UgyrXTT43AYJxyn34GV4AaABAg,0,3 years ago,"the knife is crispy in the earth, and the heavens are operating!
good -natured circulating clothing and food warm, you can report it!","刀下音脆在地情,天造万物人经营!
善性循环衣食暖,有情自可报天恩!"
33580,UgxsCuB6EkjYCeVsJxp4AaABAg,0,3 years ago,she is a angel who came from heaven,她是一个来自天堂的天使
