,cid,votes,含fruit,含fruit中文翻译
4589,UgwvTSx2InKXqlHYop54AaABAg,1,"brazilian cuisine is the result of a mixture of european, indigenous and african ingredients. many of the components of the recipes and preparation techniques are of indigenous origin, having undergone modifications by the portuguese and slaves from africa. these made adaptations of their typical dishes replacing the missing ingredients with local correspondents. the brazilian feijoada, a typical dish of the country, is an example of this. the slaves brought to brazil since the middle of the 16th century added elements such as palm oil and couscous to national cuisine. and the waves of immigrants received by the country between the 19th and 20th centuries, coming in large numbers from europe, brought some novelties to the national menu and concomitantly strengthened the consumption of various ingredients.

daily food, made in three meals, involves the consumption of coffee with milk, bread, fruits, cakes and sweets for breakfast, beans and rice for lunch - the brazilian's basic meal, to which are sometimes added pasta , meat, salad and potatoes - and, for dinner, soups and also the various regional foods.

distilled beverages were brought by the portuguese or, like cachaça, made on the land. wine is also widely consumed, sometimes added to water and sugar, in the well-known sangria. beer in turn began to be consumed in the late 18th century and is today one of the most common alcoholic drinks.

the most visible regional cuisines belong to the states of minas gerais and bahia, with minas gerais cuisine marked by european influence in delicacies and dairy products such as tropeiro beans (also a dish from são paulo cuisine), cheese bread (which is equivalent to paraguayan chipa, differing in format) and the cheese from minas frescal, and bahian cuisine due to the presence of african delicacies such as acarajé, abará and vatapá. pernambuco's cuisine stands out for its so-called ""pernambuco sweets"", that is, the sweets developed during the colonial and imperial periods in its sugar mills such as the bolo de bolo, souza leão cake and top hat, and also for drinks and savory delicacies discovered or probably originated in the state, such as cachaça, beiju and feijoada à brasileira.","巴西美食是欧洲，土著和非洲成分混合的结果。食谱和制备技术的许多组成部分都是土著起源，对葡萄牙人进行了修改和非洲的奴隶进行了修改。这些对其典型的菜肴进行了改编，用当地的记者代替了缺失的成分。巴西Feijoada是该国典型的菜肴，就是一个例子。自16世纪中叶以来，这些奴隶带到了巴西，增加了棕榈油和国家美食等蒸粗麦的元素。该国在19至20世纪收到的移民浪潮，来自欧洲的数量很大，为国家菜单带来了一些新颖性，并加强了各种成分的消费。

每日食物，三顿饭，涉及牛奶，面包，水果，蛋糕和糖果的咖啡，午餐的豆类和米饭 - 巴西的基本餐，有时会添加意大利面，肉，沙拉，沙拉和土豆 - 而且，晚餐，汤以及各种区域性食品。

蒸馏饮料是由葡萄牙人或像Cachaça一样在土地上制成的。葡萄酒也被广泛消耗，有时在著名的桑格利亚汽酒中添加到水和糖中。反过来，啤酒在18世纪后期开始消耗掉，如今已成为最常见的酒精饮料之一。

最明显的区域美食属于Minas Gerais和Bahia的州，Minas Gerais美食在美味佳肴和乳制品（例如Tropeiro Beans）（也是Tropeiro Beans）（也是圣保罗菜的菜肴），奶酪面包（与Paraguayan相当于Paraguayan ance of Paraguayan breads of tropeiro beans and Dish菜肴）。 Chipa，格式不同）和来自Minas Frescal的奶酪，以及由于存在Acarajé，Abará和Vatapá等非洲美食而导致的Bahian Cuisine。 Pernambuco的美食以其所谓的“ Pernambuco Sweets”而脱颖而出，也就是说，在其糖厂的殖民时期和帝国时期开发的糖果，例如Bolo de Bolo，SouzaLeão蛋糕和顶级帽子，也用于饮料，饮料，咸味发现或可能起源于该州的美味佳肴，例如Cachaça，Beiju和FeijoadaàBrasileira。"
33052,Ugwbq6sJ-mAR2gbcvIl4AaABAg,1,"wow, liziqi i love that recipe, thanks!
you know what we also have that here in the pilippines which we call tabagwang in the bicol region.
but in tagalog it's called susò.
we normally cook it with coconut milk and other green leaves (could be ferns, and many others which are compatible with coconut milk.)
raw jackfruit, green papaya, and string beans. hope you try these ones and let us know how much you enjoyed it. :)
be blessed!","哇，liziqi我喜欢那个食谱，谢谢！
您知道我们在Pilippines的这里也有什么，我们称之为BICOL地区的Tabagwang。
但是在他加禄语中，这就是苏苏。
通常，我们用椰奶和其他绿叶（可能是蕨类植物，还有许多与椰奶兼容的其他叶子。）
生菠萝蜜，绿色木瓜和血豆。希望您尝试这些，并让我们知道您有多喜欢。 :)
祝福！"
24236,UgxUQ3JBrdK5FGmKlYl4AaABAg,0,wow .... her farm full of fruit n plant...,哇....她的农场里到处都是水果n植物...
22696,UgwcajtoDMpROjIF1Jh4AaABAg,0,"thats a lot of food fir an tiny gurl and grandma
god bless their garden!! they have all kind of vegetables and fruits there","多数民众赞成在很多食物中，小家伙和奶奶...
上帝保佑他们的花园！他们那里有各种蔬菜和水果"
22321,UgxpXV4BEcvLf2ZDipJ4AaABAg,0,"i think i want to live a life like her, healthy and delicious foods, an organic way of planting fruits and vegetables, peaceful place, beautiful views and fresh air",我想我想像她一样生活，健康可口的食物，一种种植水果和蔬菜的有机方式，宁静的地方，美丽的景色和新鲜空气
472,UgzPF09v63eVl8eNhIZ4AaABAg,0,i'm jealous to liziqi because all the fruits ang vegetables are already there.,我嫉妒利兹奇，因为所有水果ang蔬菜已经在那里。
27776,Ugw5J1vSnwC70CCDwD54AaABAg,0,"the place near your house, the garden, vegetable plants, fruits all are awesome .... feel like to visit the place....",您家附近的地方，花园，蔬菜植物，水果都很棒。
26023,UgyyK86aAC05CRB-Pqx4AaABAg,0,"she is surrounded by a massive garden with a nice variety of fruits and vegetables, very organic.",她被一个庞大的花园包围，有各种各样的水果和蔬菜，非常有机。
31525,UgzA7XhtwNxtKgj79394AaABAg,0,when i was about 7 i used to live in the mountain where my grandma sister was a farmer and it was just like that fruitful of everything.,当我7岁左右的时候，我曾经住在祖母姐姐是农民的山上，就像一切富有成果一样。
34049,UgzMyL0UzaOjA7ejzkp4AaABAg,0,"so i am a huge fan of super-woman li ziqi, i've managed to get my parents addicted, also. this episode, again so beautiful, and i'm watching as i'm eating a slightly burned hotdog that started a small fire in my toaster oven tonight. so. that. every episode i am so fixated on the pummelo tree right by the house. where i live these are imported and was only get them in the winter, only a couple stores carry them, do it's just hard to find them, and often they are old, and dried out, or they were picked too soon and just don't ripen the way i like best. at best i might get 6 or so in a year. and they are no where near as big as the ones growing outside the front door. i hope no one is standing there if one falls, it looks like it would knock you out, cold. are there others that like this fruit and have a hard time finding them?",因此，我是超级女性Li Ziqi的忠实拥护者，我也设法使我的父母上瘾了。这一集又是如此美丽，我正在看着我吃了一个有点燃烧的热狗，今晚在我的烤箱里开始了小火。所以。那。我的每一集都被固定在房子的Pummelo树上。我住的地方是进口的，只有在冬天才能将它们拿到，只有几家商店携带它们，很难找到它们，而且常常是老的，又干了，或者被挑选得太早了，只是不穿' T以我最喜欢的方式成熟。充其量我可能会在一年内得到6个左右。而且，它们的大小不像前门外面的那样大。我希望没有人站在那儿，如果一个人跌倒，看起来它会把你撞倒，冷。还有其他喜欢这种水果并且很难找到它们吗？
33811,UgxApkQNIDqvkdsVnZF4AaABAg,0,"after so many videos i have seen on her gathering and cooking, i am still impressed each time of her garden that grows so many kinds of vegetable, fruits, herbs and gather nearby so many other fresh produce. simply amazing.",在她的聚会和烹饪上看到了这么多视频之后，每次在她的花园里，我仍然给我留下了深刻的印象，它们种植了许多种类的蔬菜，水果，草药，并在附近收集了许多其他新鲜农产品。简直太神奇了。
32640,UgzT52bypdyvocjZIbV4AaABAg,0,"lizi you have all the vegetables,fruits, flowers etc..
great job...
may god bless you","lizi你有所有的蔬菜，水果，鲜花等。
做得好...
愿上帝保佑你"
32637,Ugy5j0GNNxijYqzjy9p4AaABAg,0,"i really want to eat oh oh woohoo, snail powder and oil and fruit perfection ~",好想吃呜呜呜呜螺蛳粉 加上油果完美～
32301,Ugxou_WT8SwZAWd3CK94AaABAg,0,"full of good taste, fast mid -autumn festival, is the next film a grapefruit and moon cake?",满满的好味道，快中秋了，下一部影片是柚子与月饼吗？
31782,UgwU4pkcLEeX9EK9uyN4AaABAg,0,very nice... i love the vegetables... i love to watch ur videos very relaxing easy cooking... easy picking veg. and fruits.. i love it i love u... i feel hungry always u watching u❤️❤️❤️❤️,非常好...我爱蔬菜...我喜欢看您的视频非常轻松的烹饪...轻松挑选蔬菜。和水果..我爱它，我爱你...我总是饿了，你总是看着u❤️❤️❤️❤️
31271,UgyEdoz273awfyrbekd4AaABAg,0,i wonder how many veggie and fruits you plant in your garden?,我想知道您在花园里种了多少种蔬菜和水果？
26366,Ugw6MEvF8yebJrrFM7F4AaABAg,0,"which little girl is this ~ how can i steal other people’s farm work everywhere, fruits ~",这是哪家小姑娘~怎么到处偷采别人的农作，水果~
30180,UgwsF6ozUV0ug0Dq7wJ4AaABAg,0,i want to join her for just one day. what she does seems like a lot of work at times but it has got to be that much more satisfying to enjoy the fruits of your labor at the end of the day.,我想加入她的一天。她所做的有时似乎是很多工作，但是在一天结束时享受劳动的成果一定要令人满意。
28373,UgxNZMVNjDKDdcK_h2x4AaABAg,0,your garden is like a paradise all the fruits and vegetables are delicious,您的花园就像天堂一样，所有的水果和蔬菜都很美味
28293,Ugw0ng88auBqj2KZ3dt4AaABAg,0,"you too need to cover up a little bit more. and please just don't eat pork. it is forbidden meat.. like a forbidden fruit... when you take it, you will be out from the heaven.",您也需要掩盖更多。而且请不要吃猪肉。它是禁忌的肉..就像禁止的果实...当您拿走它时，您将从天堂出来。
21869,Ugwkvkt9d_wNW0fDHvx4AaABAg,0,i envy you for having a house that has a vegetable and fruit garden:)),我羡慕你有一所植物和水果花园的房子:)）
26773,UgyU8HhkCaN4bTTVV294AaABAg,0,the sub fruit is heartwarming :))),亚果令人心动:)）））
26708,UgwTdYlTOfHvuwYMBUx4AaABAg,0,"it's like a pretty countryside, but the dishes are fashionable. i always harvest vegetables and fruits, but there are no videos to plant. many crops are planted on a vast site. who earns cash income and buy these seedlings and fertilizers? the more you watch the video, the deeper the question.",这就像一个漂亮的乡村，但是菜很时尚。我总是收获蔬菜和水果，但是没有播放视频。许多农作物被种植在庞大的地点。谁赚取现金收入并购买这些幼苗和肥料？您观看视频的越多，问题就越深。
22170,UgxJYIeLxjOWw9KdOHt4AaABAg,0,"i love all your videos! ❤❤❤ i watch every video few times and i can't stop. you inspire me to do more, to prepare for winter. even if i have to buy some products, i went for farmer market and bought my fav vegetables and fruits and prepared my fav jams and other preserves and i will continue to do that. it's autumn right now in my country, time for pumpkins, apples, pears, nuts, carrots, potatoes and orher delicious food",我喜欢你所有的视频！ ❤❤❤我看了几次视频，我无法停止。您激励我做更多的事情，为冬天做准备。即使我必须购买一些产品，我也去了农贸市场，买了我最喜欢的蔬菜和水果，并准备了我最喜欢的果酱和其他果酱，我将继续这样做。现在是秋天在我的国家，是南瓜，苹果，梨，坚果，胡萝卜，土豆和Orher美味的食物的时间
17909,UgxfmMcczJF6IJMQAXl4AaABAg,0,"zi yan, hello, your movie is so good, especially your plant planting plants, all of which are beautiful, but there is one thing to ask you, you can use lotus root, bamboo shoots, as long as you step out of your home, all kinds of fruits you have picked up , it's all of your family, or it grows naturally. i think i feel that living there is so happy, and i also wish you a good success (from taiwan fans)",子柒妳好，妳的影片好好看，尤其是妳种的植物，都好漂亮，但有一事想请问你，妳采得莲藕，竹笋，只要是踏出妳的家园，妳所采的各种水果，都是妳家种的，还是自然生长的，我看ㄌ觉得住在那里好幸福喔，同时也祝福妳幸福成功，(来自台湾粉丝)
21846,UgxVXXZg-Tq1APo6eQ14AaABAg,0,what is the fruit,我知道什么是水果
4934,Ugyv3M-TjXHxpDdAgzR4AaABAg,0,cool farm ang fruit and your sweet grama,凉爽的农场果实和您的甜美grama
8140,Ugzu1ax0cm43g4jBZmB4AaABAg.9C3B1EaGOCo9C4ScdVoBar,0,@yunissilviana5612 spice sm ky use young jackfruit? bamboo shoots there is a bad smell,@yunissilviana5612香料sm ky使用年轻的菠萝蜜吗？竹芽有​​不好的气味
8138,Ugzu1ax0cm43g4jBZmB4AaABAg.9C3B1EaGOCo9C3j9y17DDV,0,@yunissilviana5612 megono instead of using young jackfruit,@yunissilviana5612兆诺，而不是使用年轻的菠萝蜜
6877,Ugzch0LX_vCRrAYXhoB4AaABAg,0,"a place that full of fruits, vegetables and smarty people is called liziqi's place ๐",一个充满水果，蔬菜和聪明人的地方被称为Liziqi的地方
6398,UgyD87_9HBdg4Z4agC94AaABAg,0,"feels like you are living in the heaven.. you are a product of film industry, your job is a natural actress.. sick of the same movies picking up veggies and fruits all over the world.. same movies every year..",感觉就像您住在天堂中。.您是电影业的产物，您的工作是一位天生的女演员。.厌倦了全世界的蔬菜和水果的相同电影。每年相同的电影。
6286,UgxVDnGz960f_NWmkKN4AaABAg,0,all fruits and vegetables are there in her garden,所有水果和蔬菜都在她的花园里
5129,UgyfMgBBr5vfj1FzjjZ4AaABAg,0,"11 benefits of bamboo shoots which turned out to have an extraordinary impact on health

bamboo shoots, in latin, are called dendrocalamus asper, are one of the food ingredients that we often encounter in indonesian cuisine. besides being made vegetables, bamboo shoots are also often made stuffing spring rolls.
hard bamboo shoots on the outside and soft, rather sweet and crisp inside. for centuries the asian people have processed it into various preparations.
according to research, bamboo shoots contain antioxidants, vitamins, minerals, fiber, protein, and low fat content.
fresh bamboo shoots have a large amount of vitamins a, b6, c, and e and calcium, potassium, niacin, iron, folate, copper, zinc, selenium, manganese, magnesium, phosphorus, and thiamine.
bamboo shoots also contain phytochemicals such as lignans and phenolic acids which have anti-cancer, anti-bacterial and anti-inflammatory effects.
bamboo shoots can be added to soup, dumplings, stir -fry, stews, and salads. bamboo shoots can be boiled and used in various dishes, can be served as a vegetable ingredient. we can also consume delicious pickles made from bamboo shoots.

this plant was not only delicious but also rich in benefits as summarized from the health line and digest;

1. low sugar
the amount of sugar found in bamboo shoots is about 2.5 grams per 100 grams. the amount is lower than the sugar content found in fruits and vegetables. thus bamboo shoots are good for diabetics.

2. source of protein
a thousand grams of bamboo shoots have about 2 to 2.5 grams of protein. the protein found in bamboo shoots consists of seventeen essential amino acids and two semi-essential amino acids.
protein is good for repairing cells and building, as well as maintaining body tissues. the amount of protein absorbed by the body for maintenance, depends on health conditions.
for example, people are undergoing recovery after surgery and accidents, requires higher protein intake than ordinary people. in addition, greater amounts of protein are also needed when sick, as well as for pregnant and breastfeeding women.

3. rich in vitamins and minerals
who would have thought if bamboo shoots turned out to be rich in vitamins and minerals you know. bamboo shoots contain vitamins such as vitamin a, vitamin b6, vitamin e, thiamine, riboflavin, niacin, folic acid and pantothenic acid.
then the minerals found in bamboo shoots include calcium, magnesium, phosphorus, potassium, sodium, zinc, copper, manganese, selenium and iron.

4. high fiber
bamboo shoots are also rich in fiber. the amount of food fiber contained in bamboo shoots is around 6-8 grams per 100 grams.
eating bamboo shoots can help improve the quality of intestinal movements that are healthier, so that we keep us protected from intestinal problems.

5. stimulates food lust
cellulose high bamboo shoots that can stimulate appetite. the taste and texture of bamboo shoots also makes it can be an appetizer.

6. control cholesterol
research conducted by washington state university shows that bamboo shoots have a beneficial effect on cholesterol, lipids and intestinal function.

7. strengthening the immune system
vitamins and minerals found in bamboo shoots can help improve the immune system.

8. regulates high blood pressure
because of its high level of potassium, bamboo shoots can help reduce blood pressure levels.
the study also found that potassium in bamboo shoots can strengthen our heartbeat, thereby improving heart health. a portion of bamboo shoots can give us one fifth of the recommended daily amount of potassium.
bamboo shoots contain lots of potassium. potassium can act as an electrolyte, and is also very good for lowering and maintaining blood pressure.

9. contains anticancer properties
this plant contains pitosterol which has effective anti-cancer properties that are effective against gastric cancer, lung cancer, breast cancer, and ovarian cancer.
flavones, chlorophyll, and amylase found in bamboo shoots are called phytosterols. in addition, bamboo shoots can also reduce the risk of colon or colorectal cancer.
this is according to a research paper published by vivek sharma and nirmala chongtham.
bamboo shoots also have antioxidant phenolic compounds that are preventive of cancer.

10. helps treat menstrual / menstrual problems
regular bamboo shoots can help various reproductive health problems in women.
this can help treat irregular menstrual cycles, infertility problems, and reduce labor pain and prevent too much blood loss after childbirth.

11. prevent respiratory problems
to use it in cases of respiratory disorders, we need to make bamboo shoots by boiling it twice.
the first stew for 5 minutes is followed by a second boil for about 10 minutes. for the best results, drink this water with honey.","11竹芽的好处，结果对健康产生了极大的影响

拉丁语中的竹芽被称为树突状阿斯伯，是我们在印尼美食中经常遇到的食品成分之一。除了制作蔬菜外，还经常制作梳子。
外面的硬竹芽，内部柔软，柔软，甜美而脆。几个世纪以来，亚洲人民将其处理为各种准备。
根据研究，竹芽含有抗氧化剂，维生素，矿物质，纤维，蛋白质和低脂肪含量。
新鲜的竹芽具有大量的维生素A，B6，C和E和钙，钾，烟酸，铁，叶酸，铜，锌，硒，硒，锰，镁，磷，磷和硫胺素。
竹芽还含有具有抗癌，抗细菌和抗炎作用的木糖和酚酸等植物化学物质。
可以将竹芽添加到汤，饺子，搅拌，炖菜和沙拉中。可以将竹芽煮沸并在各种菜肴中使用，可以用作蔬菜成分。我们还可以食用用竹芽制成的美味泡菜。

正如从健康线和消化中总结的那样，这种植物不仅很美味，而且还富裕。

1.低糖
竹芽中发现的糖量约为每100克2.5克。该量低于水果和蔬菜中发现的糖含量。因此，竹芽对糖尿病患者有益。

2.蛋白质来源
一千克的竹芽有大约2至2.5克蛋白质。竹芽中发现的蛋白质由十七个必需氨基酸和两个半必需氨基酸组成。
蛋白质非常适合修复细胞和建筑物以及维持身体组织。人体吸收的蛋白质量取决于健康状况。
例如，在手术和事故发生后，人们正在接受康复，需要比普通百姓更高的蛋白质摄入量。此外，生病以及孕妇和母乳喂养的妇女还需要更多的蛋白质。

3.富含维生素和矿物质
谁会想到竹芽是否富含您知道的维生素和矿物质。竹芽含有维生素A，例如维生素A，维生素B6，维生素E，硫胺素，核黄素，烟酸，叶酸和泛酸。
然后在竹芽中发现的矿物质包括钙，镁，磷，钾，钠，锌，铜，锰，硒和铁。

4.高纤维
竹芽也富含纤维。竹芽中含有的食物纤维量约为每100克6-8克。
吃竹芽可以帮助提高更健康的肠道运动的质量，从而使我们免受肠道问题的保护。

5.刺激食物欲望
纤维素高竹芽可以刺激食欲。竹芽的味道和质地也使它成为开胃菜。

6.控制胆固醇
华盛顿州立大学进行的研究表明，竹芽对胆固醇，脂质和肠功能具有有益的作用。

7.增强免疫系统
在竹芽中发现的维生素和矿物质可以帮助改善免疫系统。

8.调节高血压
由于其高水平的钾芽可以帮助降低血压水平。
该研究还发现，竹芽中的钾可以增强我们的心跳，从而改善心脏健康。一部分竹芽可以为我们提供建议的每日钾含量的五分之一。
竹芽中含有大量钾。钾可以充当电解质，也非常适合降低和维持血压。

9.包含抗癌特性
该植物中含有硫醇，具有有效的抗癌特性，可有效抗胃癌，肺癌，乳腺癌和卵巢癌。
在竹芽中发现的黄酮，叶绿素和淀粉酶称为植物固醇。此外，竹芽还可以降低结肠癌或结肠直肠癌的风险。
根据Vivek Sharma和Nirmala Chongtham发表的研究论文。
竹芽还具有预防癌症的抗氧化剂酚类化合物。

10.有助于治疗月经 /月经问题
定期的竹芽可以帮助女性的各种生殖健康问题。
这可以帮助治疗不规则的月经周期，不育问题，减轻劳动疼痛，并防止分娩后过多失血。

11.预防呼吸系统问题
要在呼吸系统疾病的情况下使用它，我们需要通过将其煮沸两次来进行竹芽。
第一次炖煮5分钟，然后再煮沸约10分钟。为了获得最佳效果，请与蜂蜜一起喝这种水。"
4647,UgwvASkrUS6aHl3t9_x4AaABAg,0,what kind of fruit is that in the last shot?,最后一镜头是什么样的水果？
8917,UgwerG-amTCFYYj-RMt4AaABAg,0,"you are the champion of the vegetable plant, teach them vegetables, the leaves are better than the fruit.",您是蔬菜植物的拥护者，教他们蔬菜，叶子比水果更好。
